;date;header;summary;link;protocol;domain;path;query;fragment;host_name;ip_address;Type;AdditionalData;CountryCode;CountryName;State;City;Longitude;Latitude;IpAddress;header_context_true;summary_context_true
0;2020-08-04;Global Real Estate Market Outlook 2020 Midyear ... - CBRE;Aug 4, 2020 — SURPRISING RESILIENCE, BUT WEAKER DEMAND FORECAST ... sectors such as financial services, technology and software development. ... Additionally, limits on the viability of work-from-home initiatives due to a ... for younger workers—will lessen the impact of remote working on office space take-up.;https://www.cbre.us/research-and-reports/Global-Real-Estate-Market-Outlook-2020-Office;https;www.cbre.us;/research-and-reports/Global-Real-Estate-Market-Outlook-2020-Office;;;cbre;104.18.16.113;geolocation;{};US;United States;California;San Jose;-121.83822631835938;37.330528259277344;104.18.16.113;Global Real Estate Market Outlook 2020 Midyear ... - CBRE;Aug 4, 2020 — SURPRISING RESILIENCE, BUT WEAKER DEMAND FORECAST ... sectors such as financial services, technology and software development. ... Additionally, limits on the viability of work-from-home initiatives due to a ... for younger workers—will lessen the impact of remote working on office space take-up.
1;2020-08-04;Take-Two Interactive (TTWO) Q1 2021 Earnings Call Transcript;Aug 4, 2020 — Good afternoon. Karl, I think you and I have talked about this in the past, but I want to revisit the software development cost balance and reconcile ...;https://www.fool.com/earnings/call-transcripts/2020/08/04/take-two-interactive-ttwo-q1-2021-earnings-call-tr.aspx;https;www.fool.com;/earnings/call-transcripts/2020/08/04/take-two-interactive-ttwo-q1-2021-earnings-call-tr.aspx;;;fool;151.101.1.143;geolocation;{};US;United States;California;San Francisco;-122.39286041259766;37.76784896850586;151.101.1.143;Take-Two Interactive (TTWO) Q1 2021 Earnings Call Transcript;Aug 4, 2020 — Good afternoon. Karl, I think you and I have talked about this in the past, but I want to revisit the software development cost balance and reconcile ...
2;2020-08-04;Veeam reports biggest second quarter in company history;Aug 5, 2020 — “As employees are transitioning to the new 'work from home' environment, data protection and availability are now more important than ever,” ...;https://itbrief.co.nz/story/veeam-reports-biggest-second-quarter-in-company-history;https;itbrief.co.nz;/story/veeam-reports-biggest-second-quarter-in-company-history;;;co;113.21.226.180;geolocation;{};NZ;New Zealand;Auckland;Auckland;174.6802978515625;-36.78810119628906;113.21.226.180;Veeam reports biggest second quarter in company history;Aug 5, 2020 — “As employees are transitioning to the new 'work from home' environment, data protection and availability are now more important than ever,” ...
3;2020-08-04;Veeam reports biggest second quarter in company history;Aug 5, 2020 — “As employees are transitioning to the new 'work from home' environment, data protection and availability are now more important than ever,” ...;https://itbrief.co.nz/story/veeam-reports-biggest-second-quarter-in-company-history;https;itbrief.co.nz;/story/veeam-reports-biggest-second-quarter-in-company-history;;;co;113.21.226.180;geolocation;{};NZ;New Zealand;Auckland;Auckland;174.6802978515625;-36.78810119628906;113.21.226.180;Veeam reports biggest second quarter in company history;Aug 5, 2020 — “As employees are transitioning to the new 'work from home' environment, data protection and availability are now more important than ever,” ...
4;2020-08-04;Veeam reports biggest second quarter in company history;Aug 5, 2020 — “As employees are transitioning to the new 'work from home' environment, data protection and availability are now more important than ever,” ...;https://itbrief.co.nz/story/veeam-reports-biggest-second-quarter-in-company-history;https;itbrief.co.nz;/story/veeam-reports-biggest-second-quarter-in-company-history;;;co;113.21.226.180;geolocation;{};NZ;New Zealand;Auckland;Auckland;174.6802978515625;-36.78810119628906;113.21.226.180;Veeam reports biggest second quarter in company history;Aug 5, 2020 — “As employees are transitioning to the new 'work from home' environment, data protection and availability are now more important than ever,” ...
5;2020-08-04;Operations Analyst at Crimson Education - DailyRemote;... skills Superior written and oral communication skills Resilience when working independently under pressure If this sounds like you, please apply asap! Please ...;https://dailyremote.com/remote-job/operations-analyst-62123;https;dailyremote.com;/remote-job/operations-analyst-62123;;;dailyremote;104.27.186.8;geolocation;{};US;United States;California;San Jose;-121.83822631835938;37.330528259277344;104.27.186.8;Operations Analyst at Crimson Education - DailyRemote;... skills Superior written and oral communication skills Resilience when working independently under pressure If this sounds like you, please apply asap! Please ...
6;2020-08-04;panel packet - Employment Training Panel - CA.gov;Aug 5, 2020 — their company. The company has made a shift to remote working to abide by the shelter in place ... Hospital Disaster Preparedness Training (1 hour). • Hourly Round for ... o Software Development Security o Testing Security ...;https://etp.ca.gov/wp-content/uploads/sites/70/2020/07/July-2020-Panel-PacketWeb.pdf;https;etp.ca.gov;/wp-content/uploads/sites/70/2020/07/July-2020-Panel-PacketWeb.pdf;;;ca;151.101.66.159;geolocation;{};US;United States;California;San Francisco;-122.39286041259766;37.76784896850586;151.101.66.159;panel packet - Employment Training Panel - CA.gov;Aug 5, 2020 — their company. The company has made a shift to remote working to abide by the shelter in place ... Hospital Disaster Preparedness Training (1 hour). • Hourly Round for ... o Software Development Security o Testing Security ...
7;2020-08-04;Cloud and Datacenter Architect | Indianapolis, Indiana | The ...;... at their Indianapolis, Indiana. Details: Architect Cloud services using Identity, Storage, Compute, Automation, Disaster Recovery, and Networking features.;https://jobsearcher.com/j/cloud-and-datacenter-architect-at-the-aes-corporation-in-indianapolis-indiana-Be1VdX;https;jobsearcher.com;/j/cloud-and-datacenter-architect-at-the-aes-corporation-in-indianapolis-indiana-Be1VdX;;;jobsearcher;52.21.160.98;geolocation;{};US;United States;Virginia;Ashburn;-77.47419738769531;39.043701171875;52.21.160.98;Cloud and Datacenter Architect | Indianapolis, Indiana | The ...;... at their Indianapolis, Indiana. Details: Architect Cloud services using Identity, Storage, Compute, Automation, Disaster Recovery, and Networking features.
8;2020-08-04;Mental wellbeing in academia – Jonathan's Voice;The COVID-19 pandemic has resulted in abrupt changes to routine, and the swift adoption of remote working. These changes present unique challenges for ...;https://jonathansvoice.org.uk/mental-wellbeing-in-academia;https;jonathansvoice.org.uk;/mental-wellbeing-in-academia;;;org;217.160.0.95;geolocation;{};DE;Germany;Rheinland-Pfalz;Montabaur;7.8331499099731445;50.43619155883789;217.160.0.95;Mental wellbeing in academia – Jonathan's Voice;The COVID-19 pandemic has resulted in abrupt changes to routine, and the swift adoption of remote working. These changes present unique challenges for ...
9;2020-08-04;Qual Analyst - Assoc, Prodigo job in Cranberry at UPMC | Lensa;Aug 5, 2020 — Provide support as required by Prodigo's Disaster Recovery Plan. ... understanding to make practical contributions to software development work. ... Pittsburgh, Camp Hill PA or can also be 100% Work From Home Remote.;https://lensa.com/qual-analyst-assoc-prodigo-jobs/cranberry/jd/0105c6fa0d4b12ab528a4ec6d3182957;https;lensa.com;/qual-analyst-assoc-prodigo-jobs/cranberry/jd/0105c6fa0d4b12ab528a4ec6d3182957;;;lensa;23.21.215.1;geolocation;{};US;United States;Virginia;Ashburn;-77.47419738769531;39.043701171875;23.21.215.1;Qual Analyst - Assoc, Prodigo job in Cranberry at UPMC | Lensa;Aug 5, 2020 — Provide support as required by Prodigo's Disaster Recovery Plan. ... understanding to make practical contributions to software development work. ... Pittsburgh, Camp Hill PA or can also be 100% Work From Home Remote.
10;2020-08-04;Video: 10 Minute IT Jams - Who is Milestone Systems?;PagerDuty was born from the idea that software development and operations ... Accurics, a cloud cyber ...;https://itbrief.com.au/story/video-10-minute-it-jams-who-is-milestone-systems;https;itbrief.com.au;/story/video-10-minute-it-jams-who-is-milestone-systems;;;com;113.21.226.180;geolocation;{};NZ;New Zealand;Auckland;Auckland;174.6802978515625;-36.78810119628906;113.21.226.180;Video: 10 Minute IT Jams - Who is Milestone Systems?;PagerDuty was born from the idea that software development and operations ... Accurics, a cloud cyber ...
11;2020-08-04;Video: 10 Minute IT Jams - Who is Milestone Systems?;PagerDuty was born from the idea that software development and operations ... Accurics, a cloud cyber ...;https://itbrief.com.au/story/video-10-minute-it-jams-who-is-milestone-systems;https;itbrief.com.au;/story/video-10-minute-it-jams-who-is-milestone-systems;;;com;113.21.226.180;geolocation;{};NZ;New Zealand;Auckland;Auckland;174.6802978515625;-36.78810119628906;113.21.226.180;Video: 10 Minute IT Jams - Who is Milestone Systems?;PagerDuty was born from the idea that software development and operations ... Accurics, a cloud cyber ...
12;2020-08-04;Video: 10 Minute IT Jams - Who is Milestone Systems?;PagerDuty was born from the idea that software development and operations ... Accurics, a cloud cyber ...;https://itbrief.com.au/story/video-10-minute-it-jams-who-is-milestone-systems;https;itbrief.com.au;/story/video-10-minute-it-jams-who-is-milestone-systems;;;com;113.21.226.180;geolocation;{};NZ;New Zealand;Auckland;Auckland;174.6802978515625;-36.78810119628906;113.21.226.180;Video: 10 Minute IT Jams - Who is Milestone Systems?;PagerDuty was born from the idea that software development and operations ... Accurics, a cloud cyber ...
13;2020-08-04;Annual Report 2019-20 - Tata Communications;Aug 4, 2020 — remote working. We were able to ... amounts of agility, resilience and tenacity during this time of ... with the tools and infrastructure to work from home and keep ... Tata Communications supported 'One Tata for Disaster Response' by contributing funds for relief ... CEPH, Software Development, Web Design.;https://www.tatacommunications.com/wp-content/uploads/2020/08/Tata-AR-2019-20.pdf;https;www.tatacommunications.com;/wp-content/uploads/2020/08/Tata-AR-2019-20.pdf;;;tatacommunications;64.185.181.238;geolocation;{};US;United States;California;Burlingame;-122.36945343017578;37.56782913208008;64.185.181.238;Annual Report 2019-20 - Tata Communications;Aug 4, 2020 — remote working. We were able to ... amounts of agility, resilience and tenacity during this time of ... with the tools and infrastructure to work from home and keep ... Tata Communications supported 'One Tata for Disaster Response' by contributing funds for relief ... CEPH, Software Development, Web Design.
14;2020-08-04;Put the left foot in, shake it all about | ITWeb;Aug 5, 2020 — The world has been forced into collaborative and remote working styles that ... Social media giants Twitter and Facebook have said that the new work from home normal will remain in place ... but it also highlighted that many organisations lacked resilience and agility ... Software Development and Testing.;https://www.itweb.co.za/content/KA3WwMdDjJwMrydZ;https;www.itweb.co.za;/content/KA3WwMdDjJwMrydZ;;;co;35.190.40.240;geolocation;{};US;United States;Kansas;Prairie Village;-94.53961181640625;39.10771179199219;35.190.40.240;Put the left foot in, shake it all about | ITWeb;Aug 5, 2020 — The world has been forced into collaborative and remote working styles that ... Social media giants Twitter and Facebook have said that the new work from home normal will remain in place ... but it also highlighted that many organisations lacked resilience and agility ... Software Development and Testing.
15;2020-08-04;Senior Web Developer Javascript - Hays - Recruiting Experts ...;Find ways to improve system robustness, resilience and stability ... extensive exposure to Agile software development and working in SCRUM teams. ... latest tech and tools in a fully cloud environment where hybrid/remote working is offered.;https://m.hays.co.uk/Job/Detail/senior-web-developer-javascript-swindon-en-GB_3834934;https;m.hays.co.uk;/Job/Detail/senior-web-developer-javascript-swindon-en-GB_3834934;;;co;45.60.31.111;geolocation;{};US;United States;Virginia;Ashburn;-77.47419738769531;39.043701171875;45.60.31.111;Senior Web Developer Javascript - Hays - Recruiting Experts ...;Find ways to improve system robustness, resilience and stability ... extensive exposure to Agile software development and working in SCRUM teams. ... latest tech and tools in a fully cloud environment where hybrid/remote working is offered.
16;2020-08-04;Manager - Health Data Exchange (HDX) Practice New York, NY;Gevity's hours are flexible with a minimum of 40 hours per week and all our consultants work from home as a default. Your actual work schedule will vary based ...;https://ejob.bz/ATS/PortalViewRequirement.do?reqGK=27409924;https;ejob.bz;/ATS/PortalViewRequirement.do;reqGK=27409924;;ejob;54.208.53.214;geolocation;{};US;United States;Virginia;Ashburn;-77.47419738769531;39.043701171875;54.208.53.214;Manager - Health Data Exchange (HDX) Practice New York, NY;Gevity's hours are flexible with a minimum of 40 hours per week and all our consultants work from home as a default. Your actual work schedule will vary based ...
17;2020-08-04;ISR RECRUITMENT LIMITED hiring IT Security Project ...;Aug 5, 2020 — ... with our client and it is expected that remote working will remain in place for the foreseeable future. ... Group Operational Risk & Resilience Director ... Software Development Engineer, High Performance Computing (79148) ...;https://uk.linkedin.com/jobs/view/it-security-project-manager-pharma-life-sciences-at-isr-recruitment-limited-1980977581;https;uk.linkedin.com;/jobs/view/it-security-project-manager-pharma-life-sciences-at-isr-recruitment-limited-1980977581;;;linkedin;108.174.10.14;geolocation;{};US;United States;California;Sunnyvale;-122.01677703857422;37.38859939575195;108.174.10.14;ISR RECRUITMENT LIMITED hiring IT Security Project ...;Aug 5, 2020 — ... with our client and it is expected that remote working will remain in place for the foreseeable future. ... Group Operational Risk & Resilience Director ... Software Development Engineer, High Performance Computing (79148) ...
18;2020-08-04;Professional Services Recruitment - Accountancy Jobs | Marks ...;... Cyber Security · Software Development · Business & Technology Leadership ... network capabilities as well as controls across user access, disaster recovery, ... testing to ensure remote working does not compromise the risk appetite of the ...;https://www.markssattin.co.uk/professional-services-recruitment;https;www.markssattin.co.uk;/professional-services-recruitment;;;co;51.132.20.205;geolocation;{};GB;United Kingdom;England;Blackheath;-0.12620000541210175;51.50019836425781;51.132.20.205;Professional Services Recruitment - Accountancy Jobs | Marks ...;... Cyber Security · Software Development · Business & Technology Leadership ... network capabilities as well as controls across user access, disaster recovery, ... testing to ensure remote working does not compromise the risk appetite of the ...
19;2020-08-04;Schneider Electric shares sustainability statistics;Aug 4, 2020 — PagerDuty was born from the idea that software development and ... of calling setup, remote working capability, and significant cost savings.;https://itbrief.com.au/story/schneider-electric-shares-sustainability-statistics;https;itbrief.com.au;/story/schneider-electric-shares-sustainability-statistics;;;com;113.21.226.180;geolocation;{};NZ;New Zealand;Auckland;Auckland;174.6802978515625;-36.78810119628906;113.21.226.180;Schneider Electric shares sustainability statistics;Aug 4, 2020 — PagerDuty was born from the idea that software development and ... of calling setup, remote working capability, and significant cost savings.
20;2020-08-04;Schneider Electric shares sustainability statistics;Aug 4, 2020 — PagerDuty was born from the idea that software development and ... of calling setup, remote working capability, and significant cost savings.;https://itbrief.com.au/story/schneider-electric-shares-sustainability-statistics;https;itbrief.com.au;/story/schneider-electric-shares-sustainability-statistics;;;com;113.21.226.180;geolocation;{};NZ;New Zealand;Auckland;Auckland;174.6802978515625;-36.78810119628906;113.21.226.180;Schneider Electric shares sustainability statistics;Aug 4, 2020 — PagerDuty was born from the idea that software development and ... of calling setup, remote working capability, and significant cost savings.
21;2020-08-04;Schneider Electric shares sustainability statistics;Aug 4, 2020 — PagerDuty was born from the idea that software development and ... of calling setup, remote working capability, and significant cost savings.;https://itbrief.com.au/story/schneider-electric-shares-sustainability-statistics;https;itbrief.com.au;/story/schneider-electric-shares-sustainability-statistics;;;com;113.21.226.180;geolocation;{};NZ;New Zealand;Auckland;Auckland;174.6802978515625;-36.78810119628906;113.21.226.180;Schneider Electric shares sustainability statistics;Aug 4, 2020 — PagerDuty was born from the idea that software development and ... of calling setup, remote working capability, and significant cost savings.
22;2020-08-04;Year Up New York New Jersey - Class 27 Graduation ...;... means something that's all resilience confidence and brilliants and all of our ... or software development ...;https://www.facebook.com/yearup.newyork/videos/class-27-graduation/514017592712618/;https;www.facebook.com;/yearup.newyork/videos/class-27-graduation/514017592712618/;;;facebook;157.240.2.35;geolocation;{};US;United States;California;Menlo Park;-122.1860580444336;37.45903015136719;157.240.2.35;Year Up New York New Jersey - Class 27 Graduation ...;... means something that's all resilience confidence and brilliants and all of our ... or software development ...
23;2020-08-04;Force Yourself to Stay Curious and to be a Learner - PM Tips;Aug 5, 2020 — So my first job was doing software development and within the ... help build resilience and those challenges kind of build our ability to take other ones on. ... is this idea to still be productive and yet work from home you know.;https://pmtips.net/interview/force-yourself-to-stay-curious-and-to-be-a-learner;https;pmtips.net;/interview/force-yourself-to-stay-curious-and-to-be-a-learner;;;pmtips;195.189.207.113;geolocation;{};MK;Macedonia;Grad Skopje;Skopje;21.43168067932129;41.99610900878906;195.189.207.113;Force Yourself to Stay Curious and to be a Learner - PM Tips;Aug 5, 2020 — So my first job was doing software development and within the ... help build resilience and those challenges kind of build our ability to take other ones on. ... is this idea to still be productive and yet work from home you know.
24;2020-08-04;This Week in Jobs DMV: We're Hear For You Edition ...;Aug 4, 2020 — If you're looking for a collegial workplace with a startup feel, this is the place for you. The “cyber resilience” company Redjack, in Silver Spring, ...;https://technical.ly/dc/2020/08/04/this-week-in-jobs-hear-for-you-edition-tech-hiring-dmv-region/;https;technical.ly;/dc/2020/08/04/this-week-in-jobs-hear-for-you-edition-tech-hiring-dmv-region/;;;technical;104.197.25.64;geolocation;{};US;United States;Iowa;Council Bluffs;-95.87735748291016;41.23295974731445;104.197.25.64;This Week in Jobs DMV: We're Hear For You Edition ...;Aug 4, 2020 — If you're looking for a collegial workplace with a startup feel, this is the place for you. The “cyber resilience” company Redjack, in Silver Spring, ...
25;2020-08-04;Global Real Estate Market Outlook 2020 Midyear ... - CBRE;Aug 4, 2020 — SURPRISING RESILIENCE, BUT WEAKER DEMAND FORECAST ... sectors such as financial services, technology and software development. ... Additionally, limits on the viability of work-from-home initiatives due to a ... for younger workers—will lessen the impact of remote working on office space take-up.;https://www.cbre.com/research-and-reports/Global-Real-Estate-Market-Outlook-2020-Office;https;www.cbre.com;/research-and-reports/Global-Real-Estate-Market-Outlook-2020-Office;;;cbre;104.18.13.141;geolocation;{};US;United States;California;San Jose;-121.83822631835938;37.330528259277344;104.18.13.141;Global Real Estate Market Outlook 2020 Midyear ... - CBRE;Aug 4, 2020 — SURPRISING RESILIENCE, BUT WEAKER DEMAND FORECAST ... sectors such as financial services, technology and software development. ... Additionally, limits on the viability of work-from-home initiatives due to a ... for younger workers—will lessen the impact of remote working on office space take-up.
26;2020-08-04;Synopsys: Why Security-Minded Companies Are ...;Aug 5, 2020 — But as DevSecOps continues to gain momentum over application security, organizations realize that adopting security in software development ...;https://www.darkreading.com/application-security/synopsys-why-security-minded-companies-are-transitioning-to-devsecops/d/d-id/1338551;https;www.darkreading.com;/application-security/synopsys-why-security-minded-companies-are-transitioning-to-devsecops/d/d-id/1338551;;;darkreading;104.17.117.99;geolocation;{};US;United States;California;San Jose;-121.83822631835938;37.330528259277344;104.17.117.99;Synopsys: Why Security-Minded Companies Are ...;Aug 5, 2020 — But as DevSecOps continues to gain momentum over application security, organizations realize that adopting security in software development ...
27;2020-08-04;4 ways HR agility can revolutionize ways of working in ...;Aug 5, 2020 — While agile methodologies – often used in software development – are helpful ... Working flexibly often gets confused with remote working but it can ... agile HR practices that build in resilience and help organizations succeed, ...;https://www.sagepeople.com/about-us/news-hub/4-ways-hr-agility/;https;www.sagepeople.com;/about-us/news-hub/4-ways-hr-agility/;;;sagepeople;104.16.137.234;geolocation;{};US;United States;California;San Jose;-121.83822631835938;37.330528259277344;104.16.137.234;4 ways HR agility can revolutionize ways of working in ...;Aug 5, 2020 — While agile methodologies – often used in software development – are helpful ... Working flexibly often gets confused with remote working but it can ... agile HR practices that build in resilience and help organizations succeed, ...
28;2020-08-04;Gremlin Announces General Availability of Status Checks - InfoQ;Aug 4, 2020 — Chaos and Resilience Engineering: Mental Models, Tools and ... most software development teams are now distributed, working from home.;http://www.infoq.com/news/2020/08/gremlin-status-checks/?topicPageSponsorship=799461dc-20ea-4b70-b039-323c89677256;http;www.infoq.com;/news/2020/08/gremlin-status-checks/;topicPageSponsorship=799461dc-20ea-4b70-b039-323c89677256;;infoq;199.119.126.68;geolocation;{};US;United States;Missouri;Clayton;-90.1923828125;38.631370544433594;199.119.126.68;Gremlin Announces General Availability of Status Checks - InfoQ;Aug 4, 2020 — Chaos and Resilience Engineering: Mental Models, Tools and ... most software development teams are now distributed, working from home.
29;2020-08-04;How to prepare for returning to the office after Covid;Aug 5, 2020 — ... OUTSOURCED IT · SOFTWARE DEVELOPMENT · IT SUPPORT ... Until now, the guidelines have been to work from home where possible, and to ... Unlike in March, when businesses had to transition to remote working in a very short ... It is also really important to focus on your disaster recovery plan.;https://www.tmcs.co.uk/2020/08/05/returning-to-the-office/;https;www.tmcs.co.uk;/2020/08/05/returning-to-the-office/;;;co;5.134.12.203;geolocation;{};GB;United Kingdom;England;Berkhamsted;-0.5040000081062317;51.79499816894531;5.134.12.203;How to prepare for returning to the office after Covid;Aug 5, 2020 — ... OUTSOURCED IT · SOFTWARE DEVELOPMENT · IT SUPPORT ... Until now, the guidelines have been to work from home where possible, and to ... Unlike in March, when businesses had to transition to remote working in a very short ... It is also really important to focus on your disaster recovery plan.
30;2020-08-04;Automating the fight against large scale cyber-threats during ...;Aug 5, 2020 — But in third place is the sudden surge in remote working leading to ... As big data continues to grow, resilience threats escalate, and AI/ML is ...;https://uktechnews.co.uk/2020/08/05/automating-the-fight-against-large-scale-cyber-threats-during-and-post-pandemic/;https;uktechnews.co.uk;/2020/08/05/automating-the-fight-against-large-scale-cyber-threats-during-and-post-pandemic/;;;co;172.67.159.16;geolocation;{};US;United States;California;San Francisco;-122.39286041259766;37.76784896850586;172.67.159.16;Automating the fight against large scale cyber-threats during ...;Aug 5, 2020 — But in third place is the sudden surge in remote working leading to ... As big data continues to grow, resilience threats escalate, and AI/ML is ...
