;date;header;summary;link;protocol;domain;path;query;fragment;host_name;ip_address;Type;AdditionalData;CountryCode;CountryName;State;City;Longitude;Latitude;IpAddress;header_context_true;summary_context_true
0;2019-12-12;Muktesh Mishra - Senior Software Engineer (Architecture ...;Software Development Engineer, Speaker, Open Source Advocate and Contributor ... resilience and minimal downtime using AWS, Docker and Kubernetes.;https://www.linkedin.com/in/mukteshkrmishra;https;www.linkedin.com;/in/mukteshkrmishra;;;linkedin;13.107.42.14;geolocation;{};US;United States;Washington;Cottage Lake;-122.12094116210938;47.68050003051758;13.107.42.14;Muktesh Mishra - Senior Software Engineer (Architecture ...;Software Development Engineer, Speaker, Open Source Advocate and Contributor ... resilience and minimal downtime using AWS, Docker and Kubernetes.
1;2019-12-12;Muktesh Mishra - Senior Software Engineer (Architecture ...;Software Development Engineer, Speaker, Open Source Advocate and Contributor ... resilience and minimal downtime using AWS, Docker and Kubernetes.;https://www.linkedin.com/in/mukteshkrmishra;https;www.linkedin.com;/in/mukteshkrmishra;;;linkedin;13.107.42.14;geolocation;{};US;United States;Washington;Cottage Lake;-122.12094116210938;47.68050003051758;13.107.42.14;Muktesh Mishra - Senior Software Engineer (Architecture ...;Software Development Engineer, Speaker, Open Source Advocate and Contributor ... resilience and minimal downtime using AWS, Docker and Kubernetes.
2;2019-12-12;Robinhood lets you invest as little as 1 cent in any stock ...;Dec 12, 2019 — ... AgentSync, AgFunder, Aggregate IQ, AggregateIQ, agile software development ... Disabilities, disability, disaster, disaster recovery, disaster response, disclosure ... remote working, remote year, Ren Zhengfei, renaissance capital ... work, work from anywhere, Work From Home, work from home gear, work ...;https://www.what-is-new.info/2019/12/12/robinhood-lets-you-invest-as-little-as-1-cent-in-any-stock/;https;www.what-is-new.info;/2019/12/12/robinhood-lets-you-invest-as-little-as-1-cent-in-any-stock/;;;what-is-new;87.106.18.184;geolocation;{};DE;Germany;Berlin;Berlin;13.406100273132324;52.51919937133789;87.106.18.184;Robinhood lets you invest as little as 1 cent in any stock ...;Dec 12, 2019 — ... AgentSync, AgFunder, Aggregate IQ, AggregateIQ, agile software development ... Disabilities, disability, disaster, disaster recovery, disaster response, disclosure ... remote working, remote year, Ren Zhengfei, renaissance capital ... work, work from anywhere, Work From Home, work from home gear, work ...
3;2019-12-12;3i InfotecH - BSE;Dec 12, 2019 — The modules assess the resilience of an institution's liquidity profile ... software engineers and freshers to interact with clients on various projects. ... the 3i Infotech office atmosphere has always given me the work-from-home like feel,. ... Revenue from software development and related services have been ...;https://www.bseindia.com/bseplus/AnnualReport/532628/5326280319.pdf;https;www.bseindia.com;/bseplus/AnnualReport/532628/5326280319.pdf;;;bseindia;192.229.211.185;geolocation;{};US;United States;New York;Manhattan;-73.97901916503906;40.7589111328125;192.229.211.185;3i InfotecH - BSE;Dec 12, 2019 — The modules assess the resilience of an institution's liquidity profile ... software engineers and freshers to interact with clients on various projects. ... the 3i Infotech office atmosphere has always given me the work-from-home like feel,. ... Revenue from software development and related services have been ...
4;2019-12-12;21.The Next Global Stage-Kenichi Ohmae - Jack, Life ...;Dec 12, 2019 — in India was a long-standing disaster, the source of numerous horror stories. Rather than ... from Their Traditional Software Development to BPO. Major Indian BPO ... of leased lines, it is possible for them to work from home for.;https://www.resourceforyoursource.com/21.The%20Next%20Global%20Stage-Kenichi%20Ohmae-309p.pdf;https;www.resourceforyoursource.com;/21.The%20Next%20Global%20Stage-Kenichi%20Ohmae-309p.pdf;;;resourceforyoursource;104.17.26.109;geolocation;{};US;United States;California;San Jose;-121.83822631835938;37.330528259277344;104.17.26.109;21.The Next Global Stage-Kenichi Ohmae - Jack, Life ...;Dec 12, 2019 — in India was a long-standing disaster, the source of numerous horror stories. Rather than ... from Their Traditional Software Development to BPO. Major Indian BPO ... of leased lines, it is possible for them to work from home for.
5;2019-12-12;Vol. 14 :: No. 4 :: Oct – Dec 2019 Message from the Chairman;Dec 13, 2019 — Lukose Kuriakose from the Kerala State Disaster Management ... build resilience especially adversity quotient to turn obstacles into opportunities. ... method of software development, it has grown increasingly popular over the last two ... office emails, work from home options, work-on-commute options etc.;https://site.ieee.org/indiacouncil/files/2019/12/icnl-19q4.pdf;https;site.ieee.org;/indiacouncil/files/2019/12/icnl-19q4.pdf;;;ieee;35.231.9.82;geolocation;{};US;United States;South Carolina;North Charleston;-80.0589370727539;32.890079498291016;35.231.9.82;Vol. 14 :: No. 4 :: Oct – Dec 2019 Message from the Chairman;Dec 13, 2019 — Lukose Kuriakose from the Kerala State Disaster Management ... build resilience especially adversity quotient to turn obstacles into opportunities. ... method of software development, it has grown increasingly popular over the last two ... office emails, work from home options, work-on-commute options etc.
6;2019-12-12;The Rise and Development of FinTech - KI-medarbetare;Dec 12, 2019 — birth to a software development movement called agile software development, commonly ... work from home if they need to or to not be able to browse any website they see ... operational costs, disaster recovery costs, etc.;https://medarbetare.ki.se/sites/default/files/2020/02/9781351183611.pdf;https;medarbetare.ki.se;/sites/default/files/2020/02/9781351183611.pdf;;;ki;193.10.17.14;geolocation;{};SE;Sweden;Stockholm;Stockholm;18.051319122314453;59.315120697021484;193.10.17.14;The Rise and Development of FinTech - KI-medarbetare;Dec 12, 2019 — birth to a software development movement called agile software development, commonly ... work from home if they need to or to not be able to browse any website they see ... operational costs, disaster recovery costs, etc.
7;2019-12-12;5 Technology Disruptors for 2020 - CIOL;Dec 13, 2019 — ... IntelligencewomenWomen in TechWomen's Daywork from homeWorkforceWorkforce ManagementWorkKeyWorkplaceWorld CupWorld Data ...;https://www.ciol.com/technology-disruptors-2020/;https;www.ciol.com;/technology-disruptors-2020/;;;ciol;192.124.249.158;geolocation;{};US;United States;California;Menifee;-117.1891098022461;33.65753173828125;192.124.249.158;5 Technology Disruptors for 2020 - CIOL;Dec 13, 2019 — ... IntelligencewomenWomen in TechWomen's Daywork from homeWorkforceWorkforce ManagementWorkKeyWorkplaceWorld CupWorld Data ...
8;2019-12-12;GetYourGuide widens its horizons, will expand its Originals ...;Dec 12, 2019 — ... Aastha Bhatnagar work from home, Aastha Bhatnagar wunderman thompson, Aastha ... AggregateIQ, aggregation theory, Agile, agile software development, agility ... automated disaster recovery, automated driving, automated flight ... remote workforce trends, remote working, remote year, remotely shot ...;https://www.smarthostingplans.com/business/getyourguide-widens-its-horizons-will-expand-its-originals-short-tours-into-day-trips-and-more/;https;www.smarthostingplans.com;/business/getyourguide-widens-its-horizons-will-expand-its-originals-short-tours-into-day-trips-and-more/;;;smarthostingplans;208.109.175.158;geolocation;{};US;United States;Arizona;Scottsdale;-111.89010620117188;33.610958099365234;208.109.175.158;GetYourGuide widens its horizons, will expand its Originals ...;Dec 12, 2019 — ... Aastha Bhatnagar work from home, Aastha Bhatnagar wunderman thompson, Aastha ... AggregateIQ, aggregation theory, Agile, agile software development, agility ... automated disaster recovery, automated driving, automated flight ... remote workforce trends, remote working, remote year, remotely shot ...
9;2019-12-12;GetYourGuide widens its horizons, will expand its Originals ...;Dec 12, 2019 — ... Aastha Bhatnagar work from home, Aastha Bhatnagar wunderman thompson, Aastha ... AggregateIQ, aggregation theory, Agile, agile software development, agility ... automated disaster recovery, automated driving, automated flight ... remote workforce trends, remote working, remote year, remotely shot ...;https://www.smarthostingplans.com/business/getyourguide-widens-its-horizons-will-expand-its-originals-short-tours-into-day-trips-and-more/;https;www.smarthostingplans.com;/business/getyourguide-widens-its-horizons-will-expand-its-originals-short-tours-into-day-trips-and-more/;;;smarthostingplans;208.109.175.158;geolocation;{};US;United States;Arizona;Scottsdale;-111.89010620117188;33.610958099365234;208.109.175.158;GetYourGuide widens its horizons, will expand its Originals ...;Dec 12, 2019 — ... Aastha Bhatnagar work from home, Aastha Bhatnagar wunderman thompson, Aastha ... AggregateIQ, aggregation theory, Agile, agile software development, agility ... automated disaster recovery, automated driving, automated flight ... remote workforce trends, remote working, remote year, remotely shot ...
10;2019-12-12;Klarna CEO says “maybe” of taking public Europe's most ...;Dec 12, 2019 — ... Aastha Bhatnagar work from home, Aastha Bhatnagar wunderman thompson, Aastha ... AggregateIQ, aggregation theory, Agile, agile software development, agility ... automated disaster recovery, automated driving, automated flight ... remote workforce trends, remote working, remote year, remotely shot ...;https://www.smarthostingplans.com/ecommerce/klarna-ceo-says-maybe-of-taking-public-europes-most-valuable-fintech-next-year-but-hes-not-ruling-out-another-round-either/;https;www.smarthostingplans.com;/ecommerce/klarna-ceo-says-maybe-of-taking-public-europes-most-valuable-fintech-next-year-but-hes-not-ruling-out-another-round-either/;;;smarthostingplans;208.109.175.158;geolocation;{};US;United States;Arizona;Scottsdale;-111.89010620117188;33.610958099365234;208.109.175.158;Klarna CEO says “maybe” of taking public Europe's most ...;Dec 12, 2019 — ... Aastha Bhatnagar work from home, Aastha Bhatnagar wunderman thompson, Aastha ... AggregateIQ, aggregation theory, Agile, agile software development, agility ... automated disaster recovery, automated driving, automated flight ... remote workforce trends, remote working, remote year, remotely shot ...
11;2019-12-12;Klarna CEO says “maybe” of taking public Europe's most ...;Dec 12, 2019 — ... Aastha Bhatnagar work from home, Aastha Bhatnagar wunderman thompson, Aastha ... AggregateIQ, aggregation theory, Agile, agile software development, agility ... automated disaster recovery, automated driving, automated flight ... remote workforce trends, remote working, remote year, remotely shot ...;https://www.smarthostingplans.com/ecommerce/klarna-ceo-says-maybe-of-taking-public-europes-most-valuable-fintech-next-year-but-hes-not-ruling-out-another-round-either/;https;www.smarthostingplans.com;/ecommerce/klarna-ceo-says-maybe-of-taking-public-europes-most-valuable-fintech-next-year-but-hes-not-ruling-out-another-round-either/;;;smarthostingplans;208.109.175.158;geolocation;{};US;United States;Arizona;Scottsdale;-111.89010620117188;33.610958099365234;208.109.175.158;Klarna CEO says “maybe” of taking public Europe's most ...;Dec 12, 2019 — ... Aastha Bhatnagar work from home, Aastha Bhatnagar wunderman thompson, Aastha ... AggregateIQ, aggregation theory, Agile, agile software development, agility ... automated disaster recovery, automated driving, automated flight ... remote workforce trends, remote working, remote year, remotely shot ...
12;2019-12-12;Eggnog, the holiday season's most divisive drink, explained ...;Dec 13, 2019 — ... Aggregate IQ, agile software development, Agora.io, agribusiness, Agric investors ... Disabilities, Disability, disaster recovery, disaster relief, discharged, discord ... remote work, Remote workers, remote working, Removable media ... Work, Work & careers, work from anywhere, Work From Home, work visa ...;https://publicnewsupdate.com/eggnog-the-holiday-seasons-most-divisive-drink-explained/;https;publicnewsupdate.com;/eggnog-the-holiday-seasons-most-divisive-drink-explained/;;;publicnewsupdate;34.248.68.200;geolocation;{};IE;Ireland;Leinster;Dublin;-6.243330001831055;53.35388946533203;34.248.68.200;Eggnog, the holiday season's most divisive drink, explained ...;Dec 13, 2019 — ... Aggregate IQ, agile software development, Agora.io, agribusiness, Agric investors ... Disabilities, Disability, disaster recovery, disaster relief, discharged, discord ... remote work, Remote workers, remote working, Removable media ... Work, Work & careers, work from anywhere, Work From Home, work visa ...
13;2019-12-12;The rise and development of FinTech - econstor;Dec 12, 2019 — birth to a software development movement called agile software development, commonly ... work from home if they need to or to not be able to browse any website they see ... operational costs, disaster recovery costs, etc.;https://www.econstor.eu/bitstream/10419/181978/1/9781351183628.pdf;https;www.econstor.eu;/bitstream/10419/181978/1/9781351183628.pdf;;;econstor;134.245.92.42;geolocation;{};DE;Germany;Schleswig-Holstein;Kiel;10.12279987335205;54.323299407958984;134.245.92.42;The rise and development of FinTech - econstor;Dec 12, 2019 — birth to a software development movement called agile software development, commonly ... work from home if they need to or to not be able to browse any website they see ... operational costs, disaster recovery costs, etc.
14;2019-12-12;Harry Styles Launches Pop-ups in L.A. and N.Y., New Merch;"Dec 13, 2019 — Despite a shift to work from home, the office market will recover ... In addition to a continued decrease in the number of software engineers and related ... The transition has been a disaster,"" said Jeffrey Engel, senior adviser to ...";https://finance.yahoo.com/news/harry-styles-launches-pop-ups-174828947.html;https;finance.yahoo.com;/news/harry-styles-launches-pop-ups-174828947.html;;;yahoo;69.147.64.33;geolocation;{};US;United States;New York;Manhattan;-73.9884033203125;40.73139190673828;69.147.64.33;Harry Styles Launches Pop-ups in L.A. and N.Y., New Merch;"Dec 13, 2019 — Despite a shift to work from home, the office market will recover ... In addition to a continued decrease in the number of software engineers and related ... The transition has been a disaster,"" said Jeffrey Engel, senior adviser to ..."
15;2019-12-12;New: Helm Charts for deploying TimescaleDB on Kubernetes ...;Dec 12, 2019 — ... monolithic stacks (bare metal, VM, container), down to the deployment and resilience of the applications core components (microservices).;https://slacker.ro/2019/12/12/new-helm-charts-for-deploying-timescaledb-on-kubernetes/;https;slacker.ro;/2019/12/12/new-helm-charts-for-deploying-timescaledb-on-kubernetes/;;;slacker;172.67.132.112;geolocation;{};US;United States;California;San Francisco;-122.39286041259766;37.76784896850586;172.67.132.112;New: Helm Charts for deploying TimescaleDB on Kubernetes ...;Dec 12, 2019 — ... monolithic stacks (bare metal, VM, container), down to the deployment and resilience of the applications core components (microservices).
16;2019-12-12;Diversus (@Diversus_Aust) | Twitter;"Can we draw parallels between software development and #Lego? ... in online security; together we've got you covered with #secure work from home ... Working in project teams requires resilience and never more so than in these times with ...";https://twitter.com/diversus_aust?lang=en;https;twitter.com;/diversus_aust;lang=en;;twitter;104.244.42.1;geolocation;{};US;United States;California;San Francisco;-122.41291809082031;37.7755012512207;104.244.42.1;Diversus (@Diversus_Aust) | Twitter;"Can we draw parallels between software development and #Lego? ... in online security; together we've got you covered with #secure work from home ... Working in project teams requires resilience and never more so than in these times with ..."
17;2019-12-12;Former Bartender Kristin Cripps Goes from Counting Quarters ...;Dec 13, 2019 — ... Digital Identity (1), Digital Marketing (2), Digital Signage (1), Disaster Recovery (1) ... Remote Working (8), Repair (1), Research (5), Resilience ... SME (1), SMS (1), Social Media (6), Software (9), Software Development (3) ...;https://www.itbusinessnet.com/2019/12/former-bartender-kristin-cripps-goes-from-counting-quarters-to-multi-millionaire-real-estate-investor/;https;www.itbusinessnet.com;/2019/12/former-bartender-kristin-cripps-goes-from-counting-quarters-to-multi-millionaire-real-estate-investor/;;;itbusinessnet;104.31.86.205;geolocation;{};US;United States;California;San Jose;-121.83822631835938;37.330528259277344;104.31.86.205;Former Bartender Kristin Cripps Goes from Counting Quarters ...;Dec 13, 2019 — ... Digital Identity (1), Digital Marketing (2), Digital Signage (1), Disaster Recovery (1) ... Remote Working (8), Repair (1), Research (5), Resilience ... SME (1), SMS (1), Social Media (6), Software (9), Software Development (3) ...
18;2019-12-12;Former Bartender Kristin Cripps Goes from Counting Quarters ...;Dec 13, 2019 — ... Digital Identity (1), Digital Marketing (2), Digital Signage (1), Disaster Recovery (1) ... Remote Working (8), Repair (1), Research (5), Resilience ... SME (1), SMS (1), Social Media (6), Software (9), Software Development (3) ...;https://www.itbusinessnet.com/2019/12/former-bartender-kristin-cripps-goes-from-counting-quarters-to-multi-millionaire-real-estate-investor/;https;www.itbusinessnet.com;/2019/12/former-bartender-kristin-cripps-goes-from-counting-quarters-to-multi-millionaire-real-estate-investor/;;;itbusinessnet;104.31.86.205;geolocation;{};US;United States;California;San Jose;-121.83822631835938;37.330528259277344;104.31.86.205;Former Bartender Kristin Cripps Goes from Counting Quarters ...;Dec 13, 2019 — ... Digital Identity (1), Digital Marketing (2), Digital Signage (1), Disaster Recovery (1) ... Remote Working (8), Repair (1), Research (5), Resilience ... SME (1), SMS (1), Social Media (6), Software (9), Software Development (3) ...
19;2019-12-12;Hindustan Olympiad Admit Card 2019 Exam Date;Dec 12, 2019 — ... Ministry · Directorate of Purchase and Stores DPSDAE · Disaster Management ... Sofa Agreement · Softech · Software · Software Development Course ... Vocational teachers · Vodafone Latest · Vodafone Work From Home ...;https://www.sscbankgk.in/2018/11/hindustan-olympiad-admit-card.html;https;www.sscbankgk.in;/2018/11/hindustan-olympiad-admit-card.html;;;sscbankgk;172.217.214.121;geolocation;{};US;United States;California;Mountain View;-122.07540893554688;37.419158935546875;172.217.214.121;Hindustan Olympiad Admit Card 2019 Exam Date;Dec 12, 2019 — ... Ministry · Directorate of Purchase and Stores DPSDAE · Disaster Management ... Sofa Agreement · Softech · Software · Software Development Course ... Vocational teachers · Vodafone Latest · Vodafone Work From Home ...
20;2019-12-12;Know Someone Starting a Business? Here's How You Can Help;... Programming (6), Project Management (1), Project Profile (1), Quality Control (1), Remote Working (8), Repair (1), Research (5), Resilience Technologies (1) ...;https://www.itbusinessnet.com/2019/12/know-someone-starting-a-business-heres-how-you-can-help/;https;www.itbusinessnet.com;/2019/12/know-someone-starting-a-business-heres-how-you-can-help/;;;itbusinessnet;104.31.86.205;geolocation;{};US;United States;California;San Jose;-121.83822631835938;37.330528259277344;104.31.86.205;Know Someone Starting a Business? Here's How You Can Help;... Programming (6), Project Management (1), Project Profile (1), Quality Control (1), Remote Working (8), Repair (1), Research (5), Resilience Technologies (1) ...
21;2019-12-12;Know Someone Starting a Business? Here's How You Can Help;... Programming (6), Project Management (1), Project Profile (1), Quality Control (1), Remote Working (8), Repair (1), Research (5), Resilience Technologies (1) ...;https://www.itbusinessnet.com/2019/12/know-someone-starting-a-business-heres-how-you-can-help/;https;www.itbusinessnet.com;/2019/12/know-someone-starting-a-business-heres-how-you-can-help/;;;itbusinessnet;104.31.86.205;geolocation;{};US;United States;California;San Jose;-121.83822631835938;37.330528259277344;104.31.86.205;Know Someone Starting a Business? Here's How You Can Help;... Programming (6), Project Management (1), Project Profile (1), Quality Control (1), Remote Working (8), Repair (1), Research (5), Resilience Technologies (1) ...
22;2019-12-12;CW Europe: Deutsche Bank creates innovation division;... Datacentre cooling infrastructure · Disaster recovery/security · Green IT · Performance, ... systems · SOA · Software development · Software licensing · Virtualisation · Web software ... A work-from-home reimbursement policy for network tech.;https://www.computerweekly.com/ezine/CW-Europe/CW-Europe-Deutsche-Bank-creates-innovation-division;https;www.computerweekly.com;/ezine/CW-Europe/CW-Europe-Deutsche-Bank-creates-innovation-division;;;computerweekly;206.19.49.153;geolocation;{};US;United States;Louisiana;Reddell;-92.42642211914062;30.675010681152344;206.19.49.153;CW Europe: Deutsche Bank creates innovation division;... Datacentre cooling infrastructure · Disaster recovery/security · Green IT · Performance, ... systems · SOA · Software development · Software licensing · Virtualisation · Web software ... A work-from-home reimbursement policy for network tech.
23;2019-12-12;CW Europe: Deutsche Bank creates innovation division;... Datacentre cooling infrastructure · Disaster recovery/security · Green IT · Performance, ... systems · SOA · Software development · Software licensing · Virtualisation · Web software ... A work-from-home reimbursement policy for network tech.;https://www.computerweekly.com/ezine/CW-Europe/CW-Europe-Deutsche-Bank-creates-innovation-division;https;www.computerweekly.com;/ezine/CW-Europe/CW-Europe-Deutsche-Bank-creates-innovation-division;;;computerweekly;206.19.49.153;geolocation;{};US;United States;Louisiana;Reddell;-92.42642211914062;30.675010681152344;206.19.49.153;CW Europe: Deutsche Bank creates innovation division;... Datacentre cooling infrastructure · Disaster recovery/security · Green IT · Performance, ... systems · SOA · Software development · Software licensing · Virtualisation · Web software ... A work-from-home reimbursement policy for network tech.
24;2019-12-12;CW Europe: Deutsche Bank creates innovation division;... Datacentre cooling infrastructure · Disaster recovery/security · Green IT · Performance, ... systems · SOA · Software development · Software licensing · Virtualisation · Web software ... A work-from-home reimbursement policy for network tech.;https://www.computerweekly.com/ezine/CW-Europe/CW-Europe-Deutsche-Bank-creates-innovation-division;https;www.computerweekly.com;/ezine/CW-Europe/CW-Europe-Deutsche-Bank-creates-innovation-division;;;computerweekly;206.19.49.153;geolocation;{};US;United States;Louisiana;Reddell;-92.42642211914062;30.675010681152344;206.19.49.153;CW Europe: Deutsche Bank creates innovation division;... Datacentre cooling infrastructure · Disaster recovery/security · Green IT · Performance, ... systems · SOA · Software development · Software licensing · Virtualisation · Web software ... A work-from-home reimbursement policy for network tech.
25;2019-12-12;Cross-Industry Maritime Team Design & Build Fast Prototype ...;Dec 13, 2019 — Gain massive scalability and no-compromise resilience with validated building blocks. ... Empower your employees to work from home. ... with self-encrypting drives, built-in disaster avoidance and snapshots in each array. ... 8West, a software development and consultancy company with a focus on ...;https://blog.dellemc.com/en-us/cross-industry-maritime-team-design-build-fast-prototype-75-ft-boat-equipped-with-iot-rugged-it-technology/;https;blog.dellemc.com;/en-us/cross-industry-maritime-team-design-build-fast-prototype-75-ft-boat-equipped-with-iot-rugged-it-technology/;;;dellemc;104.20.38.161;geolocation;{};US;United States;California;San Jose;-121.83822631835938;37.330528259277344;104.20.38.161;Cross-Industry Maritime Team Design & Build Fast Prototype ...;Dec 13, 2019 — Gain massive scalability and no-compromise resilience with validated building blocks. ... Empower your employees to work from home. ... with self-encrypting drives, built-in disaster avoidance and snapshots in each array. ... 8West, a software development and consultancy company with a focus on ...
26;2019-12-12;GP Bullhound unmasks top tech trend predictions for 2020 -;Dec 13, 2019 — ... DevOps, Digital Transformation, Disaster Recovery and Business Continuity ... R&D, Rapid App Development, Remote Working, Research, Retail Tech ... SEO, Smart Cities, Software, Software Development, Software News ...;https://uktechnews.co.uk/2019/12/13/gp-bullhound-unmasks-top-tech-trend-predictions-for-2020/;https;uktechnews.co.uk;/2019/12/13/gp-bullhound-unmasks-top-tech-trend-predictions-for-2020/;;;co;172.67.159.16;geolocation;{};US;United States;California;San Francisco;-122.39286041259766;37.76784896850586;172.67.159.16;GP Bullhound unmasks top tech trend predictions for 2020 -;Dec 13, 2019 — ... DevOps, Digital Transformation, Disaster Recovery and Business Continuity ... R&D, Rapid App Development, Remote Working, Research, Retail Tech ... SEO, Smart Cities, Software, Software Development, Software News ...
