;date;header;summary;link;protocol;domain;path;query;fragment;host_name;ip_address;Type;AdditionalData;CountryCode;CountryName;State;City;Longitude;Latitude;IpAddress;header_context_true;summary_context_true
31;2020-01-30;Microsoft Computer Science Professor's Assistant Salaries ...;Jan 30, 2020 — Work From Home (87 comments) ... of: Bellevue Bravern Entrance Microsoft photo of: Our software development centers are located all over the ...;https://www.glassdoor.co.in/Salary/Microsoft-Computer-Science-Salaries-E1651_D_KO10,26.htm;https;www.glassdoor.co.in;/Salary/Microsoft-Computer-Science-Salaries-E1651_D_KO10,26.htm;;;co;104.16.118.102;geolocation;{};US;United States;California;San Jose;-121.83822631835938;37.330528259277344;104.16.118.102;Microsoft Computer Science Professor's Assistant Salaries ...;Jan 30, 2020 — Work From Home (87 comments) ... of: Bellevue Bravern Entrance Microsoft photo of: Our software development centers are located all over the ...
32;2020-01-30;Intel board elects new chairman & new director;Jan 31, 2020 — Accurics, a cloud cyber resilience company specialising in cloud native ... Juniper Networks expands security offering for remote working. Juniper Networks has launched new solutions to enhance work from home security.More ... PagerDuty was born from the idea that software development and operations ...;https://diversitywatch.com.au/story/intel-board-elects-new-chairman-new-director;https;diversitywatch.com.au;/story/intel-board-elects-new-chairman-new-director;;;com;113.21.226.180;geolocation;{};NZ;New Zealand;Auckland;Auckland;174.6802978515625;-36.78810119628906;113.21.226.180;Intel board elects new chairman & new director;Jan 31, 2020 — Accurics, a cloud cyber resilience company specialising in cloud native ... Juniper Networks expands security offering for remote working. Juniper Networks has launched new solutions to enhance work from home security.More ... PagerDuty was born from the idea that software development and operations ...
33;2020-01-30;Intel board elects new chairman & new director;Jan 31, 2020 — Accurics, a cloud cyber resilience company specialising in cloud native ... Juniper Networks expands security offering for remote working. Juniper Networks has launched new solutions to enhance work from home security.More ... PagerDuty was born from the idea that software development and operations ...;https://diversitywatch.com.au/story/intel-board-elects-new-chairman-new-director;https;diversitywatch.com.au;/story/intel-board-elects-new-chairman-new-director;;;com;113.21.226.180;geolocation;{};NZ;New Zealand;Auckland;Auckland;174.6802978515625;-36.78810119628906;113.21.226.180;Intel board elects new chairman & new director;Jan 31, 2020 — Accurics, a cloud cyber resilience company specialising in cloud native ... Juniper Networks expands security offering for remote working. Juniper Networks has launched new solutions to enhance work from home security.More ... PagerDuty was born from the idea that software development and operations ...
34;2020-01-30;NZ needs fintech to tackle big 2020 problems - IT Brief;Jan 31, 2020 — PagerDuty was born from the idea that software development and operations ... Secureworks: Remote working exposes new security vulnerabilities ... The importance of data resilience in the current cybersecurity climate.;https://itbrief.co.nz/story/nz-needs-fintech-to-tackle-big-2020-problems;https;itbrief.co.nz;/story/nz-needs-fintech-to-tackle-big-2020-problems;;;co;113.21.226.180;geolocation;{};NZ;New Zealand;Auckland;Auckland;174.6802978515625;-36.78810119628906;113.21.226.180;NZ needs fintech to tackle big 2020 problems - IT Brief;Jan 31, 2020 — PagerDuty was born from the idea that software development and operations ... Secureworks: Remote working exposes new security vulnerabilities ... The importance of data resilience in the current cybersecurity climate.
35;2020-01-30;NZ needs fintech to tackle big 2020 problems - IT Brief;Jan 31, 2020 — PagerDuty was born from the idea that software development and operations ... Secureworks: Remote working exposes new security vulnerabilities ... The importance of data resilience in the current cybersecurity climate.;https://itbrief.co.nz/story/nz-needs-fintech-to-tackle-big-2020-problems;https;itbrief.co.nz;/story/nz-needs-fintech-to-tackle-big-2020-problems;;;co;113.21.226.180;geolocation;{};NZ;New Zealand;Auckland;Auckland;174.6802978515625;-36.78810119628906;113.21.226.180;NZ needs fintech to tackle big 2020 problems - IT Brief;Jan 31, 2020 — PagerDuty was born from the idea that software development and operations ... Secureworks: Remote working exposes new security vulnerabilities ... The importance of data resilience in the current cybersecurity climate.
36;2020-01-30;IT 101 - Types of Wireless Network Attacks - 2WTech : 2WTech;Jan 31, 2020 — ... Azure VMs, Azure VPN Gateway, BaaS, Backup, Backup and Disaster Recovery ... continuity, Digital Manufacturing, Digital Manufacturing Trends, digital resilience ... Software Deployment, software development, Software integration ... Work from home policy, Work From Home Policy Checklist, workflows ...;https://2wtech.com/it-101-types-of-wireless-network-attacks/;https;2wtech.com;/it-101-types-of-wireless-network-attacks/;;;2wtech;151.101.66.159;geolocation;{};US;United States;California;San Francisco;-122.39286041259766;37.76784896850586;151.101.66.159;IT 101 - Types of Wireless Network Attacks - 2WTech : 2WTech;Jan 31, 2020 — ... Azure VMs, Azure VPN Gateway, BaaS, Backup, Backup and Disaster Recovery ... continuity, Digital Manufacturing, Digital Manufacturing Trends, digital resilience ... Software Deployment, software development, Software integration ... Work from home policy, Work From Home Policy Checklist, workflows ...
37;2020-01-30;cybersecurity maturity model certification (cmmc) - OUSD A&S;Jan 30, 2020 — software development techniques, and ... practices that both promote operational resilience and provide improved protection of sensitive ... organizations have mobile staff who work from home or travel as part of their job. This ... from a cyber-event or physical disaster that may impact your organization.;https://www.acq.osd.mil/cmmc/docs/CMMC_Model_Appendices_20200203.pdf;https;www.acq.osd.mil;/cmmc/docs/CMMC_Model_Appendices_20200203.pdf;;;osd;214.23.34.160;geolocation;{};US;United States;Texas;Dallas;-96.8142318725586;32.8054313659668;214.23.34.160;cybersecurity maturity model certification (cmmc) - OUSD A&S;Jan 30, 2020 — software development techniques, and ... practices that both promote operational resilience and provide improved protection of sensitive ... organizations have mobile staff who work from home or travel as part of their job. This ... from a cyber-event or physical disaster that may impact your organization.
38;2020-01-30;What's the reason for the shortage of engineers in the UK ...;Whether this is managing change, innovating to overcome problems of remote working or just maintaining the right mindset in a changing work environment.;https://www.jonlee.co.uk/blog/2020/01/whats-the-reason-behind-the-shortage-of-engineers-in-uk;https;www.jonlee.co.uk;/blog/2020/01/whats-the-reason-behind-the-shortage-of-engineers-in-uk;;;co;99.84.251.48;geolocation;{};US;United States;Illinois;Chicago;-87.67124938964844;41.84885025024414;99.84.251.48;What's the reason for the shortage of engineers in the UK ...;Whether this is managing change, innovating to overcome problems of remote working or just maintaining the right mindset in a changing work environment.
39;2020-01-30;UP Jal Nigam JE Recruitment 2020 556 Junior Engineer, AE ...;Jan 31, 2020 — ... Directorate of Purchase and Stores DPSDAE · Disaster Management ... Software Development Course · Software Engineer · Solapur Jobs · Solar ... Vocational teachers · Vodafone Latest · Vodafone Work From Home Plan ...;https://www.sscbankgk.in/2016/06/up-jal-nigam-je-recruitment-2016-upjn.html;https;www.sscbankgk.in;/2016/06/up-jal-nigam-je-recruitment-2016-upjn.html;;;sscbankgk;172.217.214.121;geolocation;{};US;United States;California;Mountain View;-122.07540893554688;37.419158935546875;172.217.214.121;UP Jal Nigam JE Recruitment 2020 556 Junior Engineer, AE ...;Jan 31, 2020 — ... Directorate of Purchase and Stores DPSDAE · Disaster Management ... Software Development Course · Software Engineer · Solapur Jobs · Solar ... Vocational teachers · Vodafone Latest · Vodafone Work From Home Plan ...
