;date;header;summary;link;protocol;domain;path;query;fragment;host_name;ip_address;Type;AdditionalData;CountryCode;CountryName;State;City;Longitude;Latitude;IpAddress;header_context_true;summary_context_true
28;2020-08-26;Nio Inc. Prospectus 424B5 - SEC.report;Aug 27, 2020 — Some of our systems are not fully redundant, and our disaster recovery ... among others, remote working arrangements for our employees. ... and software development teams) attributable to our continuous cost control efforts.;https://sec.report/Document/0001104659-20-099693/;https;sec.report;/Document/0001104659-20-099693/;;;sec;104.22.66.107;geolocation;{};US;United States;California;San Jose;-121.83822631835938;37.330528259277344;104.22.66.107;Nio Inc. Prospectus 424B5 - SEC.report;Aug 27, 2020 — Some of our systems are not fully redundant, and our disaster recovery ... among others, remote working arrangements for our employees. ... and software development teams) attributable to our continuous cost control efforts.
29;2020-08-26;Nio Inc. Prospectus 424B5 - SEC.report;Aug 27, 2020 — Some of our systems are not fully redundant, and our disaster recovery ... among others, remote working arrangements for our employees. ... and software development teams) attributable to our continuous cost control efforts.;https://sec.report/Document/0001104659-20-099693/;https;sec.report;/Document/0001104659-20-099693/;;;sec;104.22.66.107;geolocation;{};US;United States;California;San Jose;-121.83822631835938;37.330528259277344;104.22.66.107;Nio Inc. Prospectus 424B5 - SEC.report;Aug 27, 2020 — Some of our systems are not fully redundant, and our disaster recovery ... among others, remote working arrangements for our employees. ... and software development teams) attributable to our continuous cost control efforts.
30;2020-08-26;Luna Display adds a teleprompter mode - Internet ...;Aug 26, 2020 — Now it's bringing functionality specifically for the work-from-home crowd looking to MacGyver together solutions until they can get back to their ...;https://www.smarthostingplans.com/hardware/luna-display-adds-a-teleprompter-mode/;https;www.smarthostingplans.com;/hardware/luna-display-adds-a-teleprompter-mode/;;;smarthostingplans;208.109.175.158;geolocation;{};US;United States;Arizona;Scottsdale;-111.89010620117188;33.610958099365234;208.109.175.158;Luna Display adds a teleprompter mode - Internet ...;Aug 26, 2020 — Now it's bringing functionality specifically for the work-from-home crowd looking to MacGyver together solutions until they can get back to their ...
31;2020-08-26;Python | Carles Mateo;Aug 26, 2020 — VPN solutions for Remote Working are being implemented in those places that ... Python, Software development and tagged Docker, docker-compose, ... resilience of the services, and speed and independence deploying.;https://blog.carlesmateo.com/tag/python/;https;blog.carlesmateo.com;/tag/python/;;;carlesmateo;50.19.100.221;geolocation;{};US;United States;Virginia;Ashburn;-77.47419738769531;39.043701171875;50.19.100.221;Python | Carles Mateo;Aug 26, 2020 — VPN solutions for Remote Working are being implemented in those places that ... Python, Software development and tagged Docker, docker-compose, ... resilience of the services, and speed and independence deploying.
32;2020-08-26;National Professional Volunteer - Resilience Specialist at ...;Aug 27, 2020 — Voluntary Service Overseas (VSO) is the world's leading independent international development organisation that works through volunteers to ...;https://jobsinnigeria.careers/jobs/national-professional-volunteer-resilience-specialist-voluntary-service-overseas-vso/;https;jobsinnigeria.careers;/jobs/national-professional-volunteer-resilience-specialist-voluntary-service-overseas-vso/;;;jobsinnigeria;172.67.146.60;geolocation;{};US;United States;California;San Francisco;-122.39286041259766;37.76784896850586;172.67.146.60;National Professional Volunteer - Resilience Specialist at ...;Aug 27, 2020 — Voluntary Service Overseas (VSO) is the world's leading independent international development organisation that works through volunteers to ...
33;2020-08-26;PDF Download - Macmahon Holdings;Aug 26, 2020 — the resilience of the strategy and business offering. ... enable their employees to work from home. 49 ... Capitalised software development expenditure is measured at cost less accumulated amortisation and impairment losses.;https://macmahon.com.au/images/downloads/pdfs/annual-reports/Macmahon-Annual-Report-2020.pdf;https;macmahon.com.au;/images/downloads/pdfs/annual-reports/Macmahon-Annual-Report-2020.pdf;;;com;103.250.23.21;geolocation;{};AU;Australia;New South Wales;Sydney;151.2071075439453;-33.86714172363281;103.250.23.21;PDF Download - Macmahon Holdings;Aug 26, 2020 — the resilience of the strategy and business offering. ... enable their employees to work from home. 49 ... Capitalised software development expenditure is measured at cost less accumulated amortisation and impairment losses.
34;2020-08-26;National Housing Bank Assistant Manager 2020, Qualification ...;Aug 26, 2020 — ... Ministry · Directorate of Purchase and Stores DPSDAE · Disaster Management ... Sofa Agreement · Softech · Software · Software Development Course ... Vocational teachers · Vodafone Latest · Vodafone Work From Home ...;https://www.sscbankgk.in/2020/08/national-housing-bank-assistant-manager.html;https;www.sscbankgk.in;/2020/08/national-housing-bank-assistant-manager.html;;;sscbankgk;173.194.74.121;geolocation;{};US;United States;California;Mountain View;-122.07540893554688;37.419158935546875;173.194.74.121;National Housing Bank Assistant Manager 2020, Qualification ...;Aug 26, 2020 — ... Ministry · Directorate of Purchase and Stores DPSDAE · Disaster Management ... Sofa Agreement · Softech · Software · Software Development Course ... Vocational teachers · Vodafone Latest · Vodafone Work From Home ...
35;2020-08-26;National Housing Bank Assistant Manager 2020, Qualification ...;Aug 26, 2020 — ... Ministry · Directorate of Purchase and Stores DPSDAE · Disaster Management ... Sofa Agreement · Softech · Software · Software Development Course ... Vocational teachers · Vodafone Latest · Vodafone Work From Home ...;https://www.sscbankgk.in/2020/08/national-housing-bank-assistant-manager.html;https;www.sscbankgk.in;/2020/08/national-housing-bank-assistant-manager.html;;;sscbankgk;173.194.74.121;geolocation;{};US;United States;California;Mountain View;-122.07540893554688;37.419158935546875;173.194.74.121;National Housing Bank Assistant Manager 2020, Qualification ...;Aug 26, 2020 — ... Ministry · Directorate of Purchase and Stores DPSDAE · Disaster Management ... Sofa Agreement · Softech · Software · Software Development Course ... Vocational teachers · Vodafone Latest · Vodafone Work From Home ...
36;2020-08-26;CURRENT EDUCATION JOBS IN GHANA 2020 - See Jobweb ...;Duties • Performs duties of a Progammer Analyst in a hybrid software development environment • Works with senior programmer analysts, business analyst and ...;https://jobwebghana.com/job-category/education-jobs-in-ghana/page/3/;https;jobwebghana.com;/job-category/education-jobs-in-ghana/page/3/;;;jobwebghana;104.28.21.30;geolocation;{};SG;Singapore;;Singapore;103.8198013305664;1.3200000524520874;104.28.21.30;CURRENT EDUCATION JOBS IN GHANA 2020 - See Jobweb ...;Duties • Performs duties of a Progammer Analyst in a hybrid software development environment • Works with senior programmer analysts, business analyst and ...
37;2020-08-26;Faeroe Miraexpedition;New financial disaster on that dinosaur was just my body language. ... Moss was a disaster that draft is saved automatically so you start out doing poorly in ... Resilience to health wealth right now! ... More discussion in modern software development? radiomedial Nostalgia or racism? ... Display remote working directory.;http://faeroe.miraexpedition.cl/;http;faeroe.miraexpedition.cl;/;;;miraexpedition;135.181.36.208;geolocation;{};FI;Finland;Uusimaa;Helsinki;24.934999465942383;60.165000915527344;135.181.36.208;Faeroe Miraexpedition;New financial disaster on that dinosaur was just my body language. ... Moss was a disaster that draft is saved automatically so you start out doing poorly in ... Resilience to health wealth right now! ... More discussion in modern software development? radiomedial Nostalgia or racism? ... Display remote working directory.
38;2020-08-26;Gambia Ts6 6466020619;See after the theatrical run disaster. Quiet is the mode? Excessive consumption may significantly reduce the loss must be shipped out today! Theo came ready to ...;http://gambia.ts6.com/6466020619;http;gambia.ts6.com;/6466020619;;;ts6;95.217.188.140;geolocation;{};FI;Finland;Uusimaa;Tuusula;25.011320114135742;60.42641830444336;95.217.188.140;Gambia Ts6 6466020619;See after the theatrical run disaster. Quiet is the mode? Excessive consumption may significantly reduce the loss must be shipped out today! Theo came ready to ...
39;2020-08-26;Beauty Archives — Restaurants, Dentists, Bars, Beauty Salons ...;43 Results — ... pain nj, back pain specialist nyc, backup and disaster recovery qatar, backyard ... custom software development, custom tracksuits, custom vinyl windows nj ... wordpress website monitoring, work from home, workerscompensation ...;https://ezworldlist.com/categories/beauty-spa/;https;ezworldlist.com;/categories/beauty-spa/;;;ezworldlist;198.54.120.215;geolocation;{};US;United States;California;Los Angeles;-118.42788696289062;34.037078857421875;198.54.120.215;Beauty Archives — Restaurants, Dentists, Bars, Beauty Salons ...;43 Results — ... pain nj, back pain specialist nyc, backup and disaster recovery qatar, backyard ... custom software development, custom tracksuits, custom vinyl windows nj ... wordpress website monitoring, work from home, workerscompensation ...
40;2020-08-26;The Morning After: Sony will directly invite some gamers to pre ...;Aug 27, 2020 — ... after math, after school, aftermath, agent, agile software development, aging, agreement ... disability, disappearing tweets, disaster, disaster relief, disaster response ... remote working, remove, removed, remuneration, rename studio ... work, work from anywhere, Work From Home, work hub, Work-Bench ...;https://www.wilsonsmedia.com/the-morning-after-sony-will-directly-invite-some-gamers-to-pre-order-the-ps5/;https;www.wilsonsmedia.com;/the-morning-after-sony-will-directly-invite-some-gamers-to-pre-order-the-ps5/;;;wilsonsmedia;144.217.146.128;geolocation;{};IE;Ireland;;;-8.0;53.0;144.217.146.128;The Morning After: Sony will directly invite some gamers to pre ...;Aug 27, 2020 — ... after math, after school, aftermath, agent, agile software development, aging, agreement ... disability, disappearing tweets, disaster, disaster relief, disaster response ... remote working, remove, removed, remuneration, rename studio ... work, work from anywhere, Work From Home, work hub, Work-Bench ...
41;2020-08-26;The Morning After: Sony will directly invite some gamers to pre ...;Aug 27, 2020 — ... after math, after school, aftermath, agent, agile software development, aging, agreement ... disability, disappearing tweets, disaster, disaster relief, disaster response ... remote working, remove, removed, remuneration, rename studio ... work, work from anywhere, Work From Home, work hub, Work-Bench ...;https://www.wilsonsmedia.com/the-morning-after-sony-will-directly-invite-some-gamers-to-pre-order-the-ps5/;https;www.wilsonsmedia.com;/the-morning-after-sony-will-directly-invite-some-gamers-to-pre-order-the-ps5/;;;wilsonsmedia;144.217.146.128;geolocation;{};IE;Ireland;;;-8.0;53.0;144.217.146.128;The Morning After: Sony will directly invite some gamers to pre ...;Aug 27, 2020 — ... after math, after school, aftermath, agent, agile software development, aging, agreement ... disability, disappearing tweets, disaster, disaster relief, disaster response ... remote working, remove, removed, remuneration, rename studio ... work, work from anywhere, Work From Home, work hub, Work-Bench ...
42;2020-08-26;How to watch Gamescom Opening Night Live 2020 How to ...;Aug 27, 2020 — ... after math, after school, aftermath, agent, agile software development, aging, agreement ... disability, disappearing tweets, disaster, disaster relief, disaster response ... remote working, remove, removed, remuneration, rename studio ... work, work from anywhere, Work From Home, work hub, Work-Bench ...;https://www.wilsonsmedia.com/how-to-watch-gamescom-opening-night-live-2020-how-to-watch-gamescom-opening-night-live-2020/;https;www.wilsonsmedia.com;/how-to-watch-gamescom-opening-night-live-2020-how-to-watch-gamescom-opening-night-live-2020/;;;wilsonsmedia;144.217.146.128;geolocation;{};IE;Ireland;;;-8.0;53.0;144.217.146.128;How to watch Gamescom Opening Night Live 2020 How to ...;Aug 27, 2020 — ... after math, after school, aftermath, agent, agile software development, aging, agreement ... disability, disappearing tweets, disaster, disaster relief, disaster response ... remote working, remove, removed, remuneration, rename studio ... work, work from anywhere, Work From Home, work hub, Work-Bench ...
43;2020-08-26;How to watch Gamescom Opening Night Live 2020 How to ...;Aug 27, 2020 — ... after math, after school, aftermath, agent, agile software development, aging, agreement ... disability, disappearing tweets, disaster, disaster relief, disaster response ... remote working, remove, removed, remuneration, rename studio ... work, work from anywhere, Work From Home, work hub, Work-Bench ...;https://www.wilsonsmedia.com/how-to-watch-gamescom-opening-night-live-2020-how-to-watch-gamescom-opening-night-live-2020/;https;www.wilsonsmedia.com;/how-to-watch-gamescom-opening-night-live-2020-how-to-watch-gamescom-opening-night-live-2020/;;;wilsonsmedia;144.217.146.128;geolocation;{};IE;Ireland;;;-8.0;53.0;144.217.146.128;How to watch Gamescom Opening Night Live 2020 How to ...;Aug 27, 2020 — ... after math, after school, aftermath, agent, agile software development, aging, agreement ... disability, disappearing tweets, disaster, disaster relief, disaster response ... remote working, remove, removed, remuneration, rename studio ... work, work from anywhere, Work From Home, work hub, Work-Bench ...
44;2020-08-26;passion to perform - Bursa Malaysia;Aug 26, 2020 — work from home. ... loyalty and resilience in facing the challenges of our business head on ... The Group has also established a Disaster Recovery Plan (DRP) ... Software development in progress represent development ...;https://disclosure.bursamalaysia.com/FileAccess/apbursaweb/download?id=202591&name=EA_DS_ATTACHMENTS;https;disclosure.bursamalaysia.com;/FileAccess/apbursaweb/download;id=202591&name=EA_DS_ATTACHMENTS;;bursamalaysia;104.17.193.189;geolocation;{};US;United States;California;San Jose;-121.83822631835938;37.330528259277344;104.17.193.189;passion to perform - Bursa Malaysia;Aug 26, 2020 — work from home. ... loyalty and resilience in facing the challenges of our business head on ... The Group has also established a Disaster Recovery Plan (DRP) ... Software development in progress represent development ...
45;2020-08-26;Shelf Registration in the Philipppines of Fixed-Rate Bonds of ...;Aug 27, 2020 — Some tenants might reduce or in worst case, pre-terminate space to adopt a work-from-home scheme or other flexible working arrangements.;https://www.filinvestland.com/sites/default/files/pdf_files/Project%20Forthright_Prospectus_Draft%2008%2027%202020%20%28clean%29%20%28for%20filing%29.pdf;https;www.filinvestland.com;/sites/default/files/pdf_files/Project%20Forthright_Prospectus_Draft%2008%2027%202020%20%28clean%29%20%28for%20filing%29.pdf;;;filinvestland;139.162.14.198;geolocation;{};SG;Singapore;;Singapore;103.8198013305664;1.3200000524520874;139.162.14.198;Shelf Registration in the Philipppines of Fixed-Rate Bonds of ...;Aug 27, 2020 — Some tenants might reduce or in worst case, pre-terminate space to adopt a work-from-home scheme or other flexible working arrangements.
46;2020-08-26;the hut group limited - FCA Publication;Aug 27, 2020 — THG may experience difficulties with software development that ... to manage data security risks (including disaster recovery systems, ... The vast majority of the workforce have moved to a remote working model, ... resilience of the Group to be able to continue to operate successfully in this environment.;https://data.fca.org.uk/artefacts/NSM/Portal/NI-000010274.pdf;https;data.fca.org.uk;/artefacts/NSM/Portal/NI-000010274.pdf;;;org;13.249.43.105;geolocation;{};US;United States;Washington;Shaw;-77.02839660644531;38.906898498535156;13.249.43.105;the hut group limited - FCA Publication;Aug 27, 2020 — THG may experience difficulties with software development that ... to manage data security risks (including disaster recovery systems, ... The vast majority of the workforce have moved to a remote working model, ... resilience of the Group to be able to continue to operate successfully in this environment.
47;2020-08-26;The Relation between Despotic Leadership and ...;We can see that in a software development teams, employees working on a same project when ... self-acceptance, optimism and resilience) are as important for the psychological well-being of ... Due to work from home the targeted ... tecting the psychological wellbeing of staff exposed to disaster or emergency at work: A ...;https://thesis.cust.edu.pk/UploadedFiles/MPM183015.pdf;https;thesis.cust.edu.pk;/UploadedFiles/MPM183015.pdf;;;edu;116.71.132.55;geolocation;{};PK;Pakistan;Punjab;Lahore;74.3133316040039;31.563329696655273;116.71.132.55;The Relation between Despotic Leadership and ...;We can see that in a software development teams, employees working on a same project when ... self-acceptance, optimism and resilience) are as important for the psychological well-being of ... Due to work from home the targeted ... tecting the psychological wellbeing of staff exposed to disaster or emergency at work: A ...
48;2020-08-26;Hardware Troubleshooting – Webb3D Technology & Media;The nonprofit /dev/color, an organization of Black software engineers, is seeking ... had yet to become a mainstay of work-from-home employees forced out of the ...;https://webb3dtechmedia.com/category/hardware-troubleshooting/;https;webb3dtechmedia.com;/category/hardware-troubleshooting/;;;webb3dtechmedia;192.0.78.24;geolocation;{};US;United States;California;Santa Monica;-118.44526672363281;33.97785186767578;192.0.78.24;Hardware Troubleshooting – Webb3D Technology & Media;The nonprofit /dev/color, an organization of Black software engineers, is seeking ... had yet to become a mainstay of work-from-home employees forced out of the ...
49;2020-08-26;Jobs in Sussex | Latest Career;91 jobs — This is an urgent requirement so if this Remote working Developer Role is of ... including: deployment, performance, resilience and information security ...;https://latestcareer.com/states/jobs-in-sussex/;https;latestcareer.com;/states/jobs-in-sussex/;;;latestcareer;198.54.115.149;geolocation;{};US;United States;California;Los Angeles;-118.42788696289062;34.037078857421875;198.54.115.149;Jobs in Sussex | Latest Career;91 jobs — This is an urgent requirement so if this Remote working Developer Role is of ... including: deployment, performance, resilience and information security ...
50;2020-08-26;UI/UX Designer Halifax Job in Holbeck | Jobilize;... tech and business strategy, software development and product management to address ... we love - but bear in mind it also demands focus, patience and resilience. ... Coordinator Location: • Remote working initially and flexibility afterwards.;https://www.jobilize.com/job/ui-ux-designer-halifax-leeds-holbeck-ls11-5wd-digital-united-kingdom;https;www.jobilize.com;/job/ui-ux-designer-halifax-leeds-holbeck-ls11-5wd-digital-united-kingdom;;;jobilize;207.38.87.179;geolocation;{};US;United States;Arizona;Scottsdale;-111.89010620117188;33.610958099365234;207.38.87.179;UI/UX Designer Halifax Job in Holbeck | Jobilize;... tech and business strategy, software development and product management to address ... we love - but bear in mind it also demands focus, patience and resilience. ... Coordinator Location: • Remote working initially and flexibility afterwards.
51;2020-08-26;Download - HotCopper;Aug 27, 2020 — work from home to mitigate the risks of contracting the ... resilience, and developed a Global ... Software development is core to the Company's.;https://hotcopper.com.au/documentdownload?id=uOMxKKzFkiWRTLKhOROKAxjvSTYP5wa%2BwRiZoedtke92GA%3D%3D;https;hotcopper.com.au;/documentdownload;id=uOMxKKzFkiWRTLKhOROKAxjvSTYP5wa%2BwRiZoedtke92GA%3D%3D;;com;104.20.28.108;geolocation;{};US;United States;California;San Jose;-121.83822631835938;37.330528259277344;104.20.28.108;Download - HotCopper;Aug 27, 2020 — work from home to mitigate the risks of contracting the ... resilience, and developed a Global ... Software development is core to the Company's.
52;2020-08-26;CRC Pest Control - Suffolk Business Directory;"We work from home so are always contactable during the day 7 days a week. ... services; WordPress web design and bespoke/custom software development. ... it a natural disaster, or any number of situations that can occur – you'll have me ...";https://www.suffolkbusinessdirectory.com/item/crc-pest-control/;https;www.suffolkbusinessdirectory.com;/item/crc-pest-control/;;;suffolkbusinessdirectory;35.214.80.134;geolocation;{};GB;United Kingdom;England;Acton;-0.22777999937534332;51.49610900878906;35.214.80.134;CRC Pest Control - Suffolk Business Directory;"We work from home so are always contactable during the day 7 days a week. ... services; WordPress web design and bespoke/custom software development. ... it a natural disaster, or any number of situations that can occur – you'll have me ..."
53;2020-08-26;BRAVURA SOLUTIONS ANNUAL REPORT 2020;Aug 26, 2020 — transition to remote working smoothly. ... in trading volumes in FY20 demonstrating scalability and resilience ... its disaster recovery and business continuity management ... Payments for capitalised software development. 15.;https://investors.bravurasolutions.com/FormBuilder/_Resource/_module/Cf_B6PmQfU2OEdtNStxY6g/docs/reports/Bravura-Solutions-Limited-Annual-Report-2020.pdf;https;investors.bravurasolutions.com;/FormBuilder/_Resource/_module/Cf_B6PmQfU2OEdtNStxY6g/docs/reports/Bravura-Solutions-Limited-Annual-Report-2020.pdf;;;bravurasolutions;203.41.57.175;geolocation;{};AU;Australia;Queensland;Brisbane;153.02789306640625;-27.467580795288086;203.41.57.175;BRAVURA SOLUTIONS ANNUAL REPORT 2020;Aug 26, 2020 — transition to remote working smoothly. ... in trading volumes in FY20 demonstrating scalability and resilience ... its disaster recovery and business continuity management ... Payments for capitalised software development. 15.
54;2020-08-26;BRAVURA SOLUTIONS ANNUAL REPORT 2020;Aug 26, 2020 — transition to remote working smoothly. ... in trading volumes in FY20 demonstrating scalability and resilience ... its disaster recovery and business continuity management ... Payments for capitalised software development. 15.;https://investors.bravurasolutions.com/FormBuilder/_Resource/_module/Cf_B6PmQfU2OEdtNStxY6g/docs/reports/Bravura-Solutions-Limited-Annual-Report-2020.pdf;https;investors.bravurasolutions.com;/FormBuilder/_Resource/_module/Cf_B6PmQfU2OEdtNStxY6g/docs/reports/Bravura-Solutions-Limited-Annual-Report-2020.pdf;;;bravurasolutions;203.41.57.175;geolocation;{};AU;Australia;Queensland;Brisbane;153.02789306640625;-27.467580795288086;203.41.57.175;BRAVURA SOLUTIONS ANNUAL REPORT 2020;Aug 26, 2020 — transition to remote working smoothly. ... in trading volumes in FY20 demonstrating scalability and resilience ... its disaster recovery and business continuity management ... Payments for capitalised software development. 15.
55;2020-08-26;BRAVURA SOLUTIONS ANNUAL REPORT 2020;Aug 26, 2020 — transition to remote working smoothly. ... in trading volumes in FY20 demonstrating scalability and resilience ... its disaster recovery and business continuity management ... Payments for capitalised software development. 15.;https://investors.bravurasolutions.com/FormBuilder/_Resource/_module/Cf_B6PmQfU2OEdtNStxY6g/docs/reports/Bravura-Solutions-Limited-Annual-Report-2020.pdf;https;investors.bravurasolutions.com;/FormBuilder/_Resource/_module/Cf_B6PmQfU2OEdtNStxY6g/docs/reports/Bravura-Solutions-Limited-Annual-Report-2020.pdf;;;bravurasolutions;203.41.57.175;geolocation;{};AU;Australia;Queensland;Brisbane;153.02789306640625;-27.467580795288086;203.41.57.175;BRAVURA SOLUTIONS ANNUAL REPORT 2020;Aug 26, 2020 — transition to remote working smoothly. ... in trading volumes in FY20 demonstrating scalability and resilience ... its disaster recovery and business continuity management ... Payments for capitalised software development. 15.
56;2020-08-26;2020 Nedbank Group Interim Results Booklet;Aug 26, 2020 — Primary focus in H1 2020 has been on resilience: ▫ health & safety ... well as leveraging successful work-from-home experiences as a result of ...;https://www.nedbank.co.za/content/dam/nedbank/site-assets/AboutUs/Information%20Hub/Financial%20Results/Interim%20Results/2020/2020%20Nedbank%20Group%20Interim%20Results%20Booklet%20(single%20page).pdf;https;www.nedbank.co.za;/content/dam/nedbank/site-assets/AboutUs/Information%20Hub/Financial%20Results/Interim%20Results/2020/2020%20Nedbank%20Group%20Interim%20Results%20Booklet%20(single%20page).pdf;;;co;168.142.204.15;geolocation;{};ZA;South Africa;Gauteng;Johannesburg;28.0563907623291;-26.199169158935547;168.142.204.15;2020 Nedbank Group Interim Results Booklet;Aug 26, 2020 — Primary focus in H1 2020 has been on resilience: ▫ health & safety ... well as leveraging successful work-from-home experiences as a result of ...
