;date;header;summary;link;protocol;domain;path;query;fragment;host_name;ip_address;Type;AdditionalData;CountryCode;CountryName;State;City;Longitude;Latitude;IpAddress;header_context_true;summary_context_true
0;2020-06-20;DevSecOps In Government: Enabling Secure Productivity ...;Jun 21, 2020 — Their actions show remarkable resilience on a short timeline. ... (NIST) recently released the Secure Software Development Framework with an ...;https://coder.com/blog/devsecops-in-government-enabling-secure-productivity-during-a-pandemic;https;coder.com;/blog/devsecops-in-government-enabling-secure-productivity-during-a-pandemic;;;coder;104.26.1.18;geolocation;{};US;United States;Virginia;Ashburn;-77.47419738769531;39.043701171875;104.26.1.18;DevSecOps In Government: Enabling Secure Productivity ...;Jun 21, 2020 — Their actions show remarkable resilience on a short timeline. ... (NIST) recently released the Secure Software Development Framework with an ...
1;2020-06-20;Ask HN: Who is hiring? (June 2020) | Hacker News;Jun 20, 2020 — We're looking for full-stack software engineers at all levels, as well as an Engineering ... of security, storage, data protection, and disaster recovery protocols. ... The role is fully remote, working roughly eastern time, with the option of ... The position consists of full-stack software development initially with ...;https://news.ycombinator.com/item?id=23379196&p=2;https;news.ycombinator.com;/item;id=23379196&p=2;;ycombinator;209.216.230.240;geolocation;{};US;United States;California;San Diego;-117.09176635742188;32.81998062133789;209.216.230.240;Ask HN: Who is hiring? (June 2020) | Hacker News;Jun 20, 2020 — We're looking for full-stack software engineers at all levels, as well as an Engineering ... of security, storage, data protection, and disaster recovery protocols. ... The role is fully remote, working roughly eastern time, with the option of ... The position consists of full-stack software development initially with ...
2;2020-06-20;InspiredResearch - Department of Computer Science ...;remote working mode. I wouldn't describe the ... Scientists and Software Engineers after an ... not only contribute to building cyber-resilience for the countries ...;http://www.cs.ox.ac.uk/inspiredresearch/InspiredResearch-summer2020.pdf;http;www.cs.ox.ac.uk;/inspiredresearch/InspiredResearch-summer2020.pdf;;;ac;129.67.151.1;geolocation;{};GB;United Kingdom;England;Oxford;-1.2755600214004517;51.75;129.67.151.1;InspiredResearch - Department of Computer Science ...;remote working mode. I wouldn't describe the ... Scientists and Software Engineers after an ... not only contribute to building cyber-resilience for the countries ...
3;2020-06-20;Los Angeles County Reports 1,784 New Coronavirus Cases ...;Jun 21, 2020 — There are 1,426 people currently hospitalized, 29% of whom are in intensive care and 21% are on ventilators.;https://patch.com/california/los-angeles/los-angeles-county-reports-1-784-new-coronavirus-cases-11-deaths;https;patch.com;/california/los-angeles/los-angeles-county-reports-1-784-new-coronavirus-cases-11-deaths;;;patch;151.101.65.177;geolocation;{};US;United States;California;San Francisco;-122.39286041259766;37.76784896850586;151.101.65.177;Los Angeles County Reports 1,784 New Coronavirus Cases ...;Jun 21, 2020 — There are 1,426 people currently hospitalized, 29% of whom are in intensive care and 21% are on ventilators.
4;2020-06-20;Exalogic Administrator - Exadata Server (2-30 yrs),Bangalore ...;Jun 21, 2020 — Manage routine Database Backup procedures and disaster recovery procedures. ... Amazon - Software Development Engineer II - Backend ...;https://www.hirist.com/j/exalogic-administrator-exadata-server-2-30-yrs-606407.html?ref=rl;https;www.hirist.com;/j/exalogic-administrator-exadata-server-2-30-yrs-606407.html;ref=rl;;hirist;13.233.235.167;geolocation;{};IN;India;Maharashtra;Powai;72.87770080566406;19.076000213623047;13.233.235.167;Exalogic Administrator - Exadata Server (2-30 yrs),Bangalore ...;Jun 21, 2020 — Manage routine Database Backup procedures and disaster recovery procedures. ... Amazon - Software Development Engineer II - Backend ...
5;2020-06-20;Vidatec announces John Barclay as brand ambassador for ...;Jun 20, 2020 — “For me, mental resilience is key to delivering a winning performance, as it can affect your physical and emotional wellbeing. I look forward to ...;https://uktechnews.co.uk/2020/06/20/vidatec-announces-john-barclay-as-brand-ambassador-for-employee-and-wellbeing-engagement-app-engage4/;https;uktechnews.co.uk;/2020/06/20/vidatec-announces-john-barclay-as-brand-ambassador-for-employee-and-wellbeing-engagement-app-engage4/;;;co;104.18.57.251;geolocation;{};US;United States;California;San Jose;-121.83822631835938;37.330528259277344;104.18.57.251;Vidatec announces John Barclay as brand ambassador for ...;Jun 20, 2020 — “For me, mental resilience is key to delivering a winning performance, as it can affect your physical and emotional wellbeing. I look forward to ...
6;2020-06-20;Vidatec announces John Barclay as brand ambassador for ...;Jun 20, 2020 — “For me, mental resilience is key to delivering a winning performance, as it can affect your physical and emotional wellbeing. I look forward to ...;https://uktechnews.co.uk/2020/06/20/vidatec-announces-john-barclay-as-brand-ambassador-for-employee-and-wellbeing-engagement-app-engage4/;https;uktechnews.co.uk;/2020/06/20/vidatec-announces-john-barclay-as-brand-ambassador-for-employee-and-wellbeing-engagement-app-engage4/;;;co;104.18.57.251;geolocation;{};US;United States;California;San Jose;-121.83822631835938;37.330528259277344;104.18.57.251;Vidatec announces John Barclay as brand ambassador for ...;Jun 20, 2020 — “For me, mental resilience is key to delivering a winning performance, as it can affect your physical and emotional wellbeing. I look forward to ...
7;2020-06-20;Genpact offers free learning program for all | TJinsite;Jun 21, 2020 — We aim to enable professional resilience and accelerate the adoption of the most critical professional skills and competencies required to ...;https://content.timesjobs.com/genpact-offers-free-learning-program-for-all/articleshow/76497472.cms;https;content.timesjobs.com;/genpact-offers-free-learning-program-for-all/articleshow/76497472.cms;;;timesjobs;23.79.223.218;geolocation;{};US;United States;Illinois;Chicago;-87.67124938964844;41.84885025024414;23.79.223.218;Genpact offers free learning program for all | TJinsite;Jun 21, 2020 — We aim to enable professional resilience and accelerate the adoption of the most critical professional skills and competencies required to ...
8;2020-06-20;Social distancing technology introduced to protect children on ...;Jun 20, 2020 — School transport specialist Kura has updated its award-winning vehicle tracking and safeguarding technology, creating a tailored solution to ...;https://uktechnews.co.uk/2020/06/20/social-distancing-technology-introduced-to-protect-children-on-the-school-run/;https;uktechnews.co.uk;/2020/06/20/social-distancing-technology-introduced-to-protect-children-on-the-school-run/;;;co;104.18.57.251;geolocation;{};US;United States;California;San Jose;-121.83822631835938;37.330528259277344;104.18.57.251;Social distancing technology introduced to protect children on ...;Jun 20, 2020 — School transport specialist Kura has updated its award-winning vehicle tracking and safeguarding technology, creating a tailored solution to ...
9;2020-06-20;Social distancing technology introduced to protect children on ...;Jun 20, 2020 — School transport specialist Kura has updated its award-winning vehicle tracking and safeguarding technology, creating a tailored solution to ...;https://uktechnews.co.uk/2020/06/20/social-distancing-technology-introduced-to-protect-children-on-the-school-run/;https;uktechnews.co.uk;/2020/06/20/social-distancing-technology-introduced-to-protect-children-on-the-school-run/;;;co;104.18.57.251;geolocation;{};US;United States;California;San Jose;-121.83822631835938;37.330528259277344;104.18.57.251;Social distancing technology introduced to protect children on ...;Jun 20, 2020 — School transport specialist Kura has updated its award-winning vehicle tracking and safeguarding technology, creating a tailored solution to ...
10;2020-06-20;KPMG Reset - assets.kpmg;Jun 21, 2020 — resilience in the event of future pandemics. Our approach to ... as people have been forced to work from home, and we have had to find new ...;https://assets.kpmg/content/dam/kpmg/nz/pdf/2020/06/reset/kpmg_reset.pdf;https;assets.kpmg;/content/dam/kpmg/nz/pdf/2020/06/reset/kpmg_reset.pdf;;;assets;104.114.79.9;geolocation;{};US;United States;Illinois;Chicago;-87.67124938964844;41.84885025024414;104.114.79.9;KPMG Reset - assets.kpmg;Jun 21, 2020 — resilience in the event of future pandemics. Our approach to ... as people have been forced to work from home, and we have had to find new ...
11;2020-06-20;COVID-19 is also a reallocation shock - Brookings Institution;Jun 21, 2020 — estimates implied by an empirical model of disaster effects that Baker, Bloom and Terry (2020) fit to ... Inc.'s Google and Amazon.com Inc. are pursuing software engineers, data ... asked “What percentage of your full-time employees will work from home after the coronavirus ... “Disaster Resilience and Asset.;https://www.brookings.edu/wp-content/uploads/2020/06/Barrero-et-al-conference-draft-1.pdf;https;www.brookings.edu;/wp-content/uploads/2020/06/Barrero-et-al-conference-draft-1.pdf;;;brookings;192.0.66.2;geolocation;{};US;United States;California;Santa Monica;-118.44526672363281;33.97785186767578;192.0.66.2;COVID-19 is also a reallocation shock - Brookings Institution;Jun 21, 2020 — estimates implied by an empirical model of disaster effects that Baker, Bloom and Terry (2020) fit to ... Inc.'s Google and Amazon.com Inc. are pursuing software engineers, data ... asked “What percentage of your full-time employees will work from home after the coronavirus ... “Disaster Resilience and Asset.
12;2020-06-20;How to Adapt Business Strategy in COVID-19 Pandemic ...;None of us saw the year 2020 to turn out as a complete disaster. ... For instance, if the worker is in the vulnerable areas and will work from home, how is the ...;http://www.tronologix.com/uncategorized/how-to-adapt-business-strategy-in-covid-19-pandemic/;http;www.tronologix.com;/uncategorized/how-to-adapt-business-strategy-in-covid-19-pandemic/;;;tronologix;107.180.51.41;geolocation;{};US;United States;Arizona;Scottsdale;-111.89010620117188;33.610958099365234;107.180.51.41;How to Adapt Business Strategy in COVID-19 Pandemic ...;None of us saw the year 2020 to turn out as a complete disaster. ... For instance, if the worker is in the vulnerable areas and will work from home, how is the ...
13;2020-06-20;C/C++ Developer | Oviedo, Florida | Latitude, Inc.;... system integration, troubleshooting, system testing/evaluations and documentation support and reviews as defined by the 10 Software Development Process.;https://jobsearcher.com/j/cc-developer-at-latitude-inc-in-oviedo-florida-b93oM0;https;jobsearcher.com;/j/cc-developer-at-latitude-inc-in-oviedo-florida-b93oM0;;;jobsearcher;54.81.32.42;geolocation;{};US;United States;Virginia;Ashburn;-77.47419738769531;39.043701171875;54.81.32.42;C/C++ Developer | Oviedo, Florida | Latitude, Inc.;... system integration, troubleshooting, system testing/evaluations and documentation support and reviews as defined by the 10 Software Development Process.
14;2020-06-20;C/C++ Developer | Oviedo, Florida | Latitude, Inc.;... system integration, troubleshooting, system testing/evaluations and documentation support and reviews as defined by the 10 Software Development Process.;https://jobsearcher.com/j/cc-developer-at-latitude-inc-in-oviedo-florida-b93oM0;https;jobsearcher.com;/j/cc-developer-at-latitude-inc-in-oviedo-florida-b93oM0;;;jobsearcher;54.81.32.42;geolocation;{};US;United States;Virginia;Ashburn;-77.47419738769531;39.043701171875;54.81.32.42;C/C++ Developer | Oviedo, Florida | Latitude, Inc.;... system integration, troubleshooting, system testing/evaluations and documentation support and reviews as defined by the 10 Software Development Process.
15;2020-06-20;Computer Science Instructor - Fall 2019 (Remote, $20/hr+) ...;JobotVan Buren, AR 100 Work from Home Front End Developer Role with Well ... WEXFort Smith, AR If you have experience in Software Development and are ...;https://jobsearcher.com/j/computer-science-instructor-fall-2019-remote-20hr-at-juni-learning-in-null-null-gPMljL;https;jobsearcher.com;/j/computer-science-instructor-fall-2019-remote-20hr-at-juni-learning-in-null-null-gPMljL;;;jobsearcher;54.81.32.42;geolocation;{};US;United States;Virginia;Ashburn;-77.47419738769531;39.043701171875;54.81.32.42;Computer Science Instructor - Fall 2019 (Remote, $20/hr+) ...;JobotVan Buren, AR 100 Work from Home Front End Developer Role with Well ... WEXFort Smith, AR If you have experience in Software Development and are ...
16;2020-06-20;Computer Science Instructor - Fall 2019 (Remote, $20/hr+) ...;JobotVan Buren, AR 100 Work from Home Front End Developer Role with Well ... WEXFort Smith, AR If you have experience in Software Development and are ...;https://jobsearcher.com/j/computer-science-instructor-fall-2019-remote-20hr-at-juni-learning-in-null-null-gPMljL;https;jobsearcher.com;/j/computer-science-instructor-fall-2019-remote-20hr-at-juni-learning-in-null-null-gPMljL;;;jobsearcher;54.81.32.42;geolocation;{};US;United States;Virginia;Ashburn;-77.47419738769531;39.043701171875;54.81.32.42;Computer Science Instructor - Fall 2019 (Remote, $20/hr+) ...;JobotVan Buren, AR 100 Work from Home Front End Developer Role with Well ... WEXFort Smith, AR If you have experience in Software Development and are ...
17;2020-06-20;DevOps Dojo Provides Online, Interactive DevOps Training;Jun 21, 2020 — ... DevOps Training. DevOps · Discover QCon Plus by InfoQ: A Virtual Conference for Senior Software Engineers and Architects (Nov 4-18) ...;https://www.infoq.com/news/2020/06/devops-dojo/;https;www.infoq.com;/news/2020/06/devops-dojo/;;;infoq;199.119.126.68;geolocation;{};US;United States;Missouri;Clayton;-90.1923828125;38.631370544433594;199.119.126.68;DevOps Dojo Provides Online, Interactive DevOps Training;Jun 21, 2020 — ... DevOps Training. DevOps · Discover QCon Plus by InfoQ: A Virtual Conference for Senior Software Engineers and Architects (Nov 4-18) ...
18;2020-06-20;Covid-19 Update - NetExperts;Becoming Disaster Proof. Becoming disaster-proof can allow your business to survive and thrive in difficult times. But can it be done in these challenging times?;http://www.netexperts.com.au/covid19.php;http;www.netexperts.com.au;/covid19.php;;;com;108.61.22.90;geolocation;{};US;United States;New Jersey;South Plainfield;-74.46468353271484;40.551761627197266;108.61.22.90;Covid-19 Update - NetExperts;Becoming Disaster Proof. Becoming disaster-proof can allow your business to survive and thrive in difficult times. But can it be done in these challenging times?
19;2020-06-20;COVID impact research study - VIATechnik;How AECO Firms Adapted. The transitioning period and the role digital tools played in a work from home environment. Perspectives on the New Normal.;https://www.viatechnik.com/post-covid-white-paper;https;www.viatechnik.com;/post-covid-white-paper;;;viatechnik;172.67.197.237;geolocation;{};US;United States;California;San Francisco;-122.39286041259766;37.76784896850586;172.67.197.237;COVID impact research study - VIATechnik;How AECO Firms Adapted. The transitioning period and the role digital tools played in a work from home environment. Perspectives on the New Normal.
20;2020-06-20;Proceedings of the EMC 2020 - TFZR;Jun 20, 2020 — 19 in Resilience and Risk - Methods and Application in Environment, ... If the given criteria are met, a weather disaster is determining. ... (1) Traditional SOA methodologies do not support the agile software development process. ... remote working to maximize productivity and make the collaboration easier.;http://www.tfzr.uns.ac.rs/emc/documents/Proceedings_EMC2020.pdf;http;www.tfzr.uns.ac.rs;/emc/documents/Proceedings_EMC2020.pdf;;;ac;147.91.177.98;geolocation;{};RS;Serbia;Central Serbia;Belgrade;20.465599060058594;44.802398681640625;147.91.177.98;Proceedings of the EMC 2020 - TFZR;Jun 20, 2020 — 19 in Resilience and Risk - Methods and Application in Environment, ... If the given criteria are met, a weather disaster is determining. ... (1) Traditional SOA methodologies do not support the agile software development process. ... remote working to maximize productivity and make the collaboration easier.
21;2020-06-20;Integrated Annual Report 2019-20 - HDFC Bank;Jun 20, 2020 — Resilience. Our prudent credit ... through secure Work from Home. • Adapting and ... corporations and disaster management verticals across. 15+ states in the ... Expenditure on software development eligible for capitalisation ...;https://www.hdfcbank.com/content/api/contentstream-id/723fb80a-2dde-42a3-9793-7ae1be57c87f/1bcf4f2c-17cc-4759-9081-dcc0f5beeb60?;https;www.hdfcbank.com;/content/api/contentstream-id/723fb80a-2dde-42a3-9793-7ae1be57c87f/1bcf4f2c-17cc-4759-9081-dcc0f5beeb60;;;hdfcbank;104.16.108.25;geolocation;{};US;United States;New Jersey;Newark;-74.19452667236328;40.738731384277344;104.16.108.25;Integrated Annual Report 2019-20 - HDFC Bank;Jun 20, 2020 — Resilience. Our prudent credit ... through secure Work from Home. • Adapting and ... corporations and disaster management verticals across. 15+ states in the ... Expenditure on software development eligible for capitalisation ...
