;date;header;summary;link;protocol;domain;path;query;fragment;host_name;ip_address;Type;AdditionalData;CountryCode;CountryName;State;City;Longitude;Latitude;IpAddress;header_context_true;summary_context_true
57;2020-08-26;FY20 Annual Report - Mortgage Choice;Aug 26, 2020 — the resilience and resolve of all Australians and. I would like to echo the ... included the successful transition of all staff to work from home, setting up ... Mortgage Choice moved to a remote working environment across all its ... Computer software development costs recognised as assets are amortised over ...;https://www.mortgagechoice.com.au/media/4482773/moc-2020-annual-report.pdf;https;www.mortgagechoice.com.au;/media/4482773/moc-2020-annual-report.pdf;;;com;49.255.186.188;geolocation;{};AU;Australia;New South Wales;Sydney;151.2071075439453;-33.86714172363281;49.255.186.188;FY20 Annual Report - Mortgage Choice;Aug 26, 2020 — the resilience and resolve of all Australians and. I would like to echo the ... included the successful transition of all staff to work from home, setting up ... Mortgage Choice moved to a remote working environment across all its ... Computer software development costs recognised as assets are amortised over ...
58;2020-08-26;Facebook removes 'Kenosha Guard' militia account after ...;Aug 27, 2020 — ... Aggregate IQ, agile software development, Agora.io, agribusiness, Agric investors ... Disabilities, Disability, disaster recovery, disaster relief, discharged, discord ... remote work, Remote workers, remote working, Removable media ... Work, Work & careers, work from anywhere, Work From Home, work visa ...;https://publicnewsupdate.com/facebook-removes-kenosha-guard-militia-account-after-shooter-kills-two-at-protest/;https;publicnewsupdate.com;/facebook-removes-kenosha-guard-militia-account-after-shooter-kills-two-at-protest/;;;publicnewsupdate;34.248.68.200;geolocation;{};IE;Ireland;Leinster;Dublin;-6.243330001831055;53.35388946533203;34.248.68.200;Facebook removes 'Kenosha Guard' militia account after ...;Aug 27, 2020 — ... Aggregate IQ, agile software development, Agora.io, agribusiness, Agric investors ... Disabilities, Disability, disaster recovery, disaster relief, discharged, discord ... remote work, Remote workers, remote working, Removable media ... Work, Work & careers, work from anywhere, Work From Home, work visa ...
59;2020-08-26;InShot Video Editor ~ Infoniworld;Aug 27, 2020 — Remote working could put an end to the office as we know it The ongoing pandemic has brought about the world's largest remote working ...;https://infonicworld.blogspot.com/2020/08/inshot-video-editor.html;https;infonicworld.blogspot.com;/2020/08/inshot-video-editor.html;;;blogspot;209.85.200.132;geolocation;{};US;United States;California;Mountain View;-122.07540893554688;37.419158935546875;209.85.200.132;InShot Video Editor ~ Infoniworld;Aug 27, 2020 — Remote working could put an end to the office as we know it The ongoing pandemic has brought about the world's largest remote working ...
60;2020-08-26;Committee Reports - South Island Prosperity Partnership;Aug 27, 2020 — resilience and has highlighted the urgent need for diversification. ... spent in the local economy and raise the economic resilience of all sectors. ... workers throughout the region will continue to work from home even after the ... These include remote working, online services, digital tools development and e-.;https://southislandprosperity.ca/wp-content/uploads/2020/08/RETF-Committee-Reports-Final-Aug-27th-.pdf;https;southislandprosperity.ca;/wp-content/uploads/2020/08/RETF-Committee-Reports-Final-Aug-27th-.pdf;;;southislandprosperity;35.192.84.134;geolocation;{};US;United States;Iowa;Council Bluffs;-95.87735748291016;41.23295974731445;35.192.84.134;Committee Reports - South Island Prosperity Partnership;Aug 27, 2020 — resilience and has highlighted the urgent need for diversification. ... spent in the local economy and raise the economic resilience of all sectors. ... workers throughout the region will continue to work from home even after the ... These include remote working, online services, digital tools development and e-.
61;2020-08-26;75000000 American Depositary Shares NIO Inc. - Investor ...;Aug 27, 2020 — talent in areas such as software development. ... fully redundant, and our disaster recovery planning cannot account for all ... to the outbreak, including, among others, remote working arrangements for our employees. We have.;https://ir.nio.com/static-files/1fbd0757-1dfa-48ed-8dae-cde9df26f3b1;https;ir.nio.com;/static-files/1fbd0757-1dfa-48ed-8dae-cde9df26f3b1;;;nio;23.35.71.187;geolocation;{};US;United States;Illinois;Chicago;-87.67124938964844;41.84885025024414;23.35.71.187;75000000 American Depositary Shares NIO Inc. - Investor ...;Aug 27, 2020 — talent in areas such as software development. ... fully redundant, and our disaster recovery planning cannot account for all ... to the outbreak, including, among others, remote working arrangements for our employees. We have.
62;2020-08-26;Microsoft Program Manager Salaries | Glassdoor;Aug 26, 2020 — Work From Home (8 comments) ... of: Bellevue Bravern Entrance Microsoft photo of: Our software development centers are located all over the ...;https://www.glassdoor.sg/Salary/Microsoft-Program-Manager-Salaries-E1651_D_KO10,25.htm;https;www.glassdoor.sg;/Salary/Microsoft-Program-Manager-Salaries-E1651_D_KO10,25.htm;;;glassdoor;104.16.95.86;geolocation;{};US;United States;Virginia;Ashburn;-77.47419738769531;39.043701171875;104.16.95.86;Microsoft Program Manager Salaries | Glassdoor;Aug 26, 2020 — Work From Home (8 comments) ... of: Bellevue Bravern Entrance Microsoft photo of: Our software development centers are located all over the ...
63;2020-08-26;Risk Management Solutions Reviews | Glassdoor;Aug 27, 2020 — May 5, 2020 — Senior Software Development Engineer. Recommend ... Equity plan doesn't exist. Good hours now that we all work from home.;https://www.glassdoor.com/Reviews/Risk-Management-Solutions-Reviews-E137869.htm;https;www.glassdoor.com;/Reviews/Risk-Management-Solutions-Reviews-E137869.htm;;;glassdoor;104.17.91.51;geolocation;{};US;United States;Florida;Flagami;-80.31195831298828;25.762859344482422;104.17.91.51;Risk Management Solutions Reviews | Glassdoor;Aug 27, 2020 — May 5, 2020 — Senior Software Development Engineer. Recommend ... Equity plan doesn't exist. Good hours now that we all work from home.
64;2020-08-26;Fastly Stock Jumps With $775M Acquisition Of Signal Sciences;Aug 27, 2020 — The platform is programmable and supports agile software development. ... as network traffic has surged as more people work from home.;https://www.crn.com/news/cloud/fastly-stock-jumps-with-775m-acquisition-of-signal-sciences;https;www.crn.com;/news/cloud/fastly-stock-jumps-with-775m-acquisition-of-signal-sciences;;;crn;99.84.110.12;geolocation;{};US;United States;Washington;Shaw;-77.02839660644531;38.906898498535156;99.84.110.12;Fastly Stock Jumps With $775M Acquisition Of Signal Sciences;Aug 27, 2020 — The platform is programmable and supports agile software development. ... as network traffic has surged as more people work from home.
65;2020-08-26;Ensuring Software Quality at eBay Denmark - InfoQ;Aug 27, 2020 — Quality is not only about not releasing bugs to production, it is much more than that. Quality is a product that is user-friendly, easy to access and ...;https://www.infoq.com/news/2020/08/software-quality-ebay-denmark/;https;www.infoq.com;/news/2020/08/software-quality-ebay-denmark/;;;infoq;199.119.126.68;geolocation;{};US;United States;Missouri;Clayton;-90.1923828125;38.631370544433594;199.119.126.68;Ensuring Software Quality at eBay Denmark - InfoQ;Aug 27, 2020 — Quality is not only about not releasing bugs to production, it is much more than that. Quality is a product that is user-friendly, easy to access and ...
66;2020-08-26;Northrop Grumman increases collaboration with Space and ...;Aug 27, 2020 — Even as employees have had to work from home during the COVID-19 pandemic, the program has been able to hold virtual sprint reviews that ...;https://www.globalmilitarycommunications.com/post/2020/08/27/northrop-grumman-increases-collaboration-with-space-and-missile-systems-center-by-impleme;https;www.globalmilitarycommunications.com;/post/2020/08/27/northrop-grumman-increases-collaboration-with-space-and-missile-systems-center-by-impleme;;;globalmilitarycommunications;185.230.60.102;geolocation;{};US;United States;Virginia;Ashburn;-77.47419738769531;39.043701171875;185.230.60.102;Northrop Grumman increases collaboration with Space and ...;Aug 27, 2020 — Even as employees have had to work from home during the COVID-19 pandemic, the program has been able to hold virtual sprint reviews that ...
67;2020-08-26;Amdocs Salaries - Zippia;Aug 27, 2020 — Amdocs Jobs. Job Title. Clear. Job Title. 0 selections. Clear. Apply. Apply. Location. Clear. Location. 0 selections. Work From Home. Clear. Apply.;https://www.zippia.com/amdocs-careers-506/salary/;https;www.zippia.com;/amdocs-careers-506/salary/;;;zippia;35.185.237.72;geolocation;{};US;United States;Oregon;The Dalles;-121.18699645996094;45.55424880981445;35.185.237.72;Amdocs Salaries - Zippia;Aug 27, 2020 — Amdocs Jobs. Job Title. Clear. Job Title. 0 selections. Clear. Apply. Apply. Location. Clear. Location. 0 selections. Work From Home. Clear. Apply.
68;2020-08-26;How IT Support Can Help During the Pandemic - SAM ...;Aug 27, 2020 — Several companies are now implementing work-from-home schemes, increasing the need for IT support and management. Fortunately, SAM ...;https://www.samsoftware.com/how-it-support-can-help-during-the-pandemic/;https;www.samsoftware.com;/how-it-support-can-help-during-the-pandemic/;;;samsoftware;104.18.47.39;geolocation;{};SG;Singapore;;Singapore;103.8198013305664;1.3200000524520874;104.18.47.39;How IT Support Can Help During the Pandemic - SAM ...;Aug 27, 2020 — Several companies are now implementing work-from-home schemes, increasing the need for IT support and management. Fortunately, SAM ...
69;2020-08-26;SysOps Administrator at Pixalate - DailyRemote;"This is a Full-Time position, must be able to proficiently work from home with a ... patching kernels and errata patching; managing the disaster recovery and data ...";https://dailyremote.com/remote-job/sys-ops-administrator-74203;https;dailyremote.com;/remote-job/sys-ops-administrator-74203;;;dailyremote;104.27.187.8;geolocation;{};US;United States;New Jersey;Newark;-74.19452667236328;40.738731384277344;104.27.187.8;SysOps Administrator at Pixalate - DailyRemote;"This is a Full-Time position, must be able to proficiently work from home with a ... patching kernels and errata patching; managing the disaster recovery and data ..."
70;2020-08-26;Accountancy – Precept IT;Remote Working · Bitdefender GravityZone · Vade Secure for Microsoft 365 · Vade ... Solutions – Backup · Solutions – Mailbox · Cloud Backup + Disaster Recovery ... Cisco Support · Software Development · Database Support · Linux & Unix ...;https://precept.it/accountancy/;https;precept.it;/accountancy/;;;precept;80.95.186.241;geolocation;{};GB;United Kingdom;Northern Ireland;Belfast;-5.917500019073486;54.59611129760742;80.95.186.241;Accountancy – Precept IT;Remote Working · Bitdefender GravityZone · Vade Secure for Microsoft 365 · Vade ... Solutions – Backup · Solutions – Mailbox · Cloud Backup + Disaster Recovery ... Cisco Support · Software Development · Database Support · Linux & Unix ...
71;2020-08-26;Accountancy – Precept IT;Remote Working · Bitdefender GravityZone · Vade Secure for Microsoft 365 · Vade ... Solutions – Backup · Solutions – Mailbox · Cloud Backup + Disaster Recovery ... Cisco Support · Software Development · Database Support · Linux & Unix ...;https://precept.it/accountancy/;https;precept.it;/accountancy/;;;precept;80.95.186.241;geolocation;{};GB;United Kingdom;Northern Ireland;Belfast;-5.917500019073486;54.59611129760742;80.95.186.241;Accountancy – Precept IT;Remote Working · Bitdefender GravityZone · Vade Secure for Microsoft 365 · Vade ... Solutions – Backup · Solutions – Mailbox · Cloud Backup + Disaster Recovery ... Cisco Support · Software Development · Database Support · Linux & Unix ...
72;2020-08-26;Retail – Precept IT;Remote Working · Bitdefender GravityZone · Vade Secure for Microsoft 365 · Vade ... Solutions – Backup · Solutions – Mailbox · Cloud Backup + Disaster Recovery ... Cisco Support · Software Development · Database Support · Linux & Unix ...;https://precept.it/retail/;https;precept.it;/retail/;;;precept;80.95.186.241;geolocation;{};GB;United Kingdom;Northern Ireland;Belfast;-5.917500019073486;54.59611129760742;80.95.186.241;Retail – Precept IT;Remote Working · Bitdefender GravityZone · Vade Secure for Microsoft 365 · Vade ... Solutions – Backup · Solutions – Mailbox · Cloud Backup + Disaster Recovery ... Cisco Support · Software Development · Database Support · Linux & Unix ...
73;2020-08-26;Retail – Precept IT;Remote Working · Bitdefender GravityZone · Vade Secure for Microsoft 365 · Vade ... Solutions – Backup · Solutions – Mailbox · Cloud Backup + Disaster Recovery ... Cisco Support · Software Development · Database Support · Linux & Unix ...;https://precept.it/retail/;https;precept.it;/retail/;;;precept;80.95.186.241;geolocation;{};GB;United Kingdom;Northern Ireland;Belfast;-5.917500019073486;54.59611129760742;80.95.186.241;Retail – Precept IT;Remote Working · Bitdefender GravityZone · Vade Secure for Microsoft 365 · Vade ... Solutions – Backup · Solutions – Mailbox · Cloud Backup + Disaster Recovery ... Cisco Support · Software Development · Database Support · Linux & Unix ...
74;2020-08-26;9 Industries See Remote Jobs Spike Amid the Pandemic;Aug 26, 2020 — Welcome to our “Work From Home Q&A” series. ... like customer service, sales, software development, education and training, accounting and ...;https://www.moneytalksnews.com/industries-with-remote-jobs-spike-amid-the-pandemic/;https;www.moneytalksnews.com;/industries-with-remote-jobs-spike-amid-the-pandemic/;;;moneytalksnews;104.22.52.153;geolocation;{};US;United States;California;San Jose;-121.83822631835938;37.330528259277344;104.22.52.153;9 Industries See Remote Jobs Spike Amid the Pandemic;Aug 26, 2020 — Welcome to our “Work From Home Q&A” series. ... like customer service, sales, software development, education and training, accounting and ...
75;2020-08-26;Cloud Certifications: Microsoft Azure AZ-303 and AZ-304 ...;Aug 27, 2020 — An understanding of software development patterns and ... Architect Migration, Business Continuity, and Disaster Recovery in Azure ... Cloud, with its ability to provide greater mobility, remote working, and working from home, ...;https://www.pluralsight.com/guides/cloud-certifications:-microsoft-azure-az-303-and-az-304-exam-requirement-changes;https;www.pluralsight.com;/guides/cloud-certifications:-microsoft-azure-az-303-and-az-304-exam-requirement-changes;;;pluralsight;104.19.162.127;geolocation;{};US;United States;California;San Jose;-121.83822631835938;37.330528259277344;104.19.162.127;Cloud Certifications: Microsoft Azure AZ-303 and AZ-304 ...;Aug 27, 2020 — An understanding of software development patterns and ... Architect Migration, Business Continuity, and Disaster Recovery in Azure ... Cloud, with its ability to provide greater mobility, remote working, and working from home, ...
76;2020-08-26;FAQ — Virtual not Distant;... results (not to be confused with Agile software development frameworks). ... is a world of difference between tolerating and accommodating remote working, and ... of a coaching mindset to help people develop resilience and problem solving ...;https://www.virtualnotdistant.com/faq;https;www.virtualnotdistant.com;/faq;;;virtualnotdistant;198.185.159.144;geolocation;{};US;United States;New York;Manhattan;-74.0101089477539;40.73432922363281;198.185.159.144;FAQ — Virtual not Distant;... results (not to be confused with Agile software development frameworks). ... is a world of difference between tolerating and accommodating remote working, and ... of a coaching mindset to help people develop resilience and problem solving ...
77;2020-08-26;Remote IT Support Services Company - Resolute Technology ...;Empowers 'Work From Home' models. Give your remote employees the same level of support as office workers. Remote Support is Scalable. As your company ...;https://www.resolutets.com/remote-it-support/;https;www.resolutets.com;/remote-it-support/;;;resolutets;107.23.202.187;geolocation;{};US;United States;Virginia;Ashburn;-77.47419738769531;39.043701171875;107.23.202.187;Remote IT Support Services Company - Resolute Technology ...;Empowers 'Work From Home' models. Give your remote employees the same level of support as office workers. Remote Support is Scalable. As your company ...
78;2020-08-26;Financial services business leaders and CIOs disagree on IT ...;Aug 27, 2020 — Gartner said CIOs were quick to respond to the initial challenges of the pandemic, such as enabling remote working, but Sturgill said they must ...;https://www.computerweekly.com/news/252488227/Financial-services-business-leaders-and-CIOs-disagree-on-IT-infrastructure;https;www.computerweekly.com;/news/252488227/Financial-services-business-leaders-and-CIOs-disagree-on-IT-infrastructure;;;computerweekly;206.19.49.153;geolocation;{};US;United States;Louisiana;Reddell;-92.42642211914062;30.675010681152344;206.19.49.153;Financial services business leaders and CIOs disagree on IT ...;Aug 27, 2020 — Gartner said CIOs were quick to respond to the initial challenges of the pandemic, such as enabling remote working, but Sturgill said they must ...
79;2020-08-26;Microsoft Senior Software Development Engineer Salaries in ...;Aug 26, 2020 — At first, it sounded like a disaster. Walter Sun, whose job was to make sure Bing gave users the most up-to-the-minute information about current ...;https://www.glassdoor.co.in/Salary/Microsoft-Senior-Software-Development-Engineer-Seattle-Salaries-EJI_IE1651.0,9_KO10,46_IL.47,54_IM781.htm;https;www.glassdoor.co.in;/Salary/Microsoft-Senior-Software-Development-Engineer-Seattle-Salaries-EJI_IE1651.0,9_KO10,46_IL.47,54_IM781.htm;;;co;104.16.117.102;geolocation;{};US;United States;Florida;Flagami;-80.31195831298828;25.762859344482422;104.16.117.102;Microsoft Senior Software Development Engineer Salaries in ...;Aug 26, 2020 — At first, it sounded like a disaster. Walter Sun, whose job was to make sure Bing gave users the most up-to-the-minute information about current ...
80;2020-08-26;Senior Software Development Engineer - Growth | Phoenix ...;GoDaddy employs Senior Software Development Engineer - Growth at their Phoenix ... Posted 3 days ago Senior Developer - NodeJS/React - Work From Home ...;https://jobsearcher.com/j/senior-software-development-engineer-growth-at-godaddy-in-phoenix-arizona-dqan71L;https;jobsearcher.com;/j/senior-software-development-engineer-growth-at-godaddy-in-phoenix-arizona-dqan71L;;;jobsearcher;52.21.160.98;geolocation;{};US;United States;Virginia;Ashburn;-77.47419738769531;39.043701171875;52.21.160.98;Senior Software Development Engineer - Growth | Phoenix ...;GoDaddy employs Senior Software Development Engineer - Growth at their Phoenix ... Posted 3 days ago Senior Developer - NodeJS/React - Work From Home ...
81;2020-08-26;Council Post: The Need For Speed In The Age Of Covid-19;Aug 27, 2020 — Agility will be key in this new normal. Organizations will need to adapt quickly in real time and pivot appropriately in order to avoid disaster, ...;https://www.forbes.com/sites/forbestechcouncil/2020/08/27/the-need-for-speed-in-the-age-of-covid-19/;https;www.forbes.com;/sites/forbestechcouncil/2020/08/27/the-need-for-speed-in-the-age-of-covid-19/;;;forbes;151.101.2.49;geolocation;{};US;United States;California;San Francisco;-122.39286041259766;37.76784896850586;151.101.2.49;Council Post: The Need For Speed In The Age Of Covid-19;Aug 27, 2020 — Agility will be key in this new normal. Organizations will need to adapt quickly in real time and pivot appropriately in order to avoid disaster, ...
82;2020-08-26;Council Post: The Need For Speed In The Age Of Covid-19;Aug 27, 2020 — Agility will be key in this new normal. Organizations will need to adapt quickly in real time and pivot appropriately in order to avoid disaster, ...;https://www.forbes.com/sites/forbestechcouncil/2020/08/27/the-need-for-speed-in-the-age-of-covid-19/;https;www.forbes.com;/sites/forbestechcouncil/2020/08/27/the-need-for-speed-in-the-age-of-covid-19/;;;forbes;151.101.2.49;geolocation;{};US;United States;California;San Francisco;-122.39286041259766;37.76784896850586;151.101.2.49;Council Post: The Need For Speed In The Age Of Covid-19;Aug 27, 2020 — Agility will be key in this new normal. Organizations will need to adapt quickly in real time and pivot appropriately in order to avoid disaster, ...
83;2020-08-26;Here's When Major Companies Plan To Go Back To The Office;Aug 27, 2020 — Atlassian TEAM +8.7% : Software development and project management firm Atlassian will let employees choose to work from home indefinitely, ...;https://www.forbes.com/sites/rachelsandler/2020/08/27/heres-when-major-companies-plan-to-go-back-to-the-office/;https;www.forbes.com;/sites/rachelsandler/2020/08/27/heres-when-major-companies-plan-to-go-back-to-the-office/;;;forbes;151.101.2.49;geolocation;{};US;United States;California;San Francisco;-122.39286041259766;37.76784896850586;151.101.2.49;Here's When Major Companies Plan To Go Back To The Office;Aug 27, 2020 — Atlassian TEAM +8.7% : Software development and project management firm Atlassian will let employees choose to work from home indefinitely, ...
84;2020-08-26;Here's When Major Companies Plan To Go Back To The Office;Aug 27, 2020 — Atlassian TEAM +8.7% : Software development and project management firm Atlassian will let employees choose to work from home indefinitely, ...;https://www.forbes.com/sites/rachelsandler/2020/08/27/heres-when-major-companies-plan-to-go-back-to-the-office/;https;www.forbes.com;/sites/rachelsandler/2020/08/27/heres-when-major-companies-plan-to-go-back-to-the-office/;;;forbes;151.101.2.49;geolocation;{};US;United States;California;San Francisco;-122.39286041259766;37.76784896850586;151.101.2.49;Here's When Major Companies Plan To Go Back To The Office;Aug 27, 2020 — Atlassian TEAM +8.7% : Software development and project management firm Atlassian will let employees choose to work from home indefinitely, ...
85;2020-08-26;Vertikal6 Blog | IT Tips & Technology Tricks for Business;Aug 27, 2020 — Remote Working Tips For Everyday Tech Struggles. Still Struggling to Find Your WFH Flow? From virtual meetings to countless shared ...;https://blog.vertikal6.com/blog;https;blog.vertikal6.com;/blog;;;vertikal6;199.60.103.254;geolocation;{};US;United States;Massachusetts;Cambridge;-71.08074951171875;42.37015914916992;199.60.103.254;Vertikal6 Blog | IT Tips & Technology Tricks for Business;Aug 27, 2020 — Remote Working Tips For Everyday Tech Struggles. Still Struggling to Find Your WFH Flow? From virtual meetings to countless shared ...
86;2020-08-26;Disaster Recovery vs. Cloud Backup. What is the difference? -;Aug 27, 2020 — Any downtime can disrupt customer interactions, employee productivity, destroy data and freeze business processes. What is backup and ...;https://uktechnews.co.uk/2020/08/27/disaster-recovery-vs-cloud-backup-what-is-the-difference/;https;uktechnews.co.uk;/2020/08/27/disaster-recovery-vs-cloud-backup-what-is-the-difference/;;;co;104.18.57.251;geolocation;{};US;United States;California;San Jose;-121.83822631835938;37.330528259277344;104.18.57.251;Disaster Recovery vs. Cloud Backup. What is the difference? -;Aug 27, 2020 — Any downtime can disrupt customer interactions, employee productivity, destroy data and freeze business processes. What is backup and ...
87;2020-08-26;UBS contracts with GitLab to speed up software development;Aug 27, 2020 — The deal with GitLab is expected to increase quality and decrease time-to-market as software engineers collaborate to build applications in the ...;https://www.finextra.com/newsarticle/36474/ubs-contracts-with-gitlab-to-speed-up-software-development;https;www.finextra.com;/newsarticle/36474/ubs-contracts-with-gitlab-to-speed-up-software-development;;;finextra;89.234.26.98;geolocation;{};GB;United Kingdom;England;City of Westminster;-0.19916999340057373;51.49555969238281;89.234.26.98;UBS contracts with GitLab to speed up software development;Aug 27, 2020 — The deal with GitLab is expected to increase quality and decrease time-to-market as software engineers collaborate to build applications in the ...
88;2020-08-26;The importance of cloud communications to business ...;Aug 26, 2020 — Why? Because, as an OECD report notes, remote working improves satisfaction and productivity –but this is only the case if the communications ...;https://www.cio.com/article/3572936/the-importance-of-cloud-communications-to-business-continuity-and-a-strategic-future.html;https;www.cio.com;/article/3572936/the-importance-of-cloud-communications-to-business-continuity-and-a-strategic-future.html;;;cio;151.101.2.165;geolocation;{};US;United States;California;San Francisco;-122.39286041259766;37.76784896850586;151.101.2.165;The importance of cloud communications to business ...;Aug 26, 2020 — Why? Because, as an OECD report notes, remote working improves satisfaction and productivity –but this is only the case if the communications ...
