;date;header;summary;link;protocol;domain;path;query;fragment;host_name;ip_address;CountryCode;CountryName;State;City;Longitude;Latitude;Asn;edges;Type;AdditionalData;IpAddress;header_context_true;summary_context_true
0;2020-11-27;Job Application for Senior Backend Engineer SRE ...;... science grounding - backed by significant commercial software development ... eventing/messaging frameworks such as JMS and Kafka, Chaos/Resilience ...;https://boards.greenhouse.io/workatbackbase/jobs/2464157;https;boards.greenhouse.io;/workatbackbase/jobs/2464157;;;greenhouse.io;3.210.195.28;US;United States;Virginia;Ashburn;-77.47419738769531;39.043701171875;14618;set();geolocation;{};3.210.195.28;Job Application for Senior Backend Engineer SRE ...;... science grounding - backed by significant commercial software development ... eventing/messaging frameworks such as JMS and Kafka, Chaos/Resilience ...
1;2020-11-27;Revealing the hidden costs of in-house payroll | theHRD;Nov 27, 2020 — ... a vendor will invest in on-going payroll software development, offering a rich ... on key personnel or lack sufficient back-up and disaster recovery. ... Investing in fully managed payroll is the sustainable way to build resilience into your business processes, ... Remote working – the pros, the cons and the law ...;https://www.thehrdirector.com/features/outsourcing/revealing-hidden-costs-house-payroll/;https;www.thehrdirector.com;/features/outsourcing/revealing-hidden-costs-house-payroll/;;;thehrdirector.com;68.183.39.38;GB;United Kingdom;England;Hampton;-0.3741700053215027;51.435279846191406;14061;set();geolocation;{};68.183.39.38;Revealing the hidden costs of in-house payroll | theHRD;Nov 27, 2020 — ... a vendor will invest in on-going payroll software development, offering a rich ... on key personnel or lack sufficient back-up and disaster recovery. ... Investing in fully managed payroll is the sustainable way to build resilience into your business processes, ... Remote working – the pros, the cons and the law ...
2;2020-11-27;Allvotec appoints new Chief Sales Officer to further accelerate ...;Nov 27, 2020 — ... Digital Transformation, Disaster Recovery and Business Continuity ... R&D, Rapid App Development, Remote Working, Research, Retail, Retail Tech ... Software Development, Software News, Space, Speech Recognition ...;https://uktechnews.co.uk/2020/11/27/allvotec-appoints-new-chief-sales-officer-to-further-accelerate-growth/;https;uktechnews.co.uk;/2020/11/27/allvotec-appoints-new-chief-sales-officer-to-further-accelerate-growth/;;;uktechnews.co.uk;104.21.41.24;BR;Brazil;São Paulo;São Paulo;-46.633140563964844;-23.5515193939209;13335;set();geolocation;{};104.21.41.24;Allvotec appoints new Chief Sales Officer to further accelerate ...;Nov 27, 2020 — ... Digital Transformation, Disaster Recovery and Business Continuity ... R&D, Rapid App Development, Remote Working, Research, Retail, Retail Tech ... Software Development, Software News, Space, Speech Recognition ...
4;2020-11-27;Is outsourcing IT the right move for your business?;Nov 27, 2020 — ... telecommunications (Inc. VoIP), application/software development, ... whilst others include potential issues with data privacy and disaster ...;https://businesscomputingworld.co.uk/is-outsourcing-it-the-right-move-for-your-business/;https;businesscomputingworld.co.uk;/is-outsourcing-it-the-right-move-for-your-business/;;;businesscomputingworld.co.uk;144.126.194.63;US;United States;Maryland;Baltimore;-76.63540649414062;39.35694885253906;14061;set();geolocation;{};144.126.194.63;Is outsourcing IT the right move for your business?;Nov 27, 2020 — ... telecommunications (Inc. VoIP), application/software development, ... whilst others include potential issues with data privacy and disaster ...
5;2020-11-27;Web Development Internship Jobs in Laxmi Nagar, Delhi ...;244 Web Development Internship jobs available in Laxmi Nagar, Delhi, Delhi on Indeed.com. Web Developer, Development Intern, Software Development ...;https://in.indeed.com/Web-Development-Internship-jobs-in-Laxmi-Nagar,-Delhi,-Delhi;https;in.indeed.com;/Web-Development-Internship-jobs-in-Laxmi-Nagar,-Delhi,-Delhi;;;indeed.com;169.45.207.192;US;United States;Washington;Shaw;-77.02839660644531;38.906898498535156;36351;set();geolocation;{};169.45.207.192;Web Development Internship Jobs in Laxmi Nagar, Delhi ...;244 Web Development Internship jobs available in Laxmi Nagar, Delhi, Delhi on Indeed.com. Web Developer, Development Intern, Software Development ...
6;2020-11-27;Aruba, the largest Italian Cloud provider, formalizes its GAIA-X ...;"Nov 27, 2020 — Benenden Health cuts down disaster recovery time with Node4 cloud services May 29, 2020 In ""Case Studies"". Leaseweb Global Launches ...";https://uktechnews.co.uk/2020/11/27/aruba-the-largest-italian-cloud-provider-formalizes-its-gaia-x-status-as-a-day-1-member/;https;uktechnews.co.uk;/2020/11/27/aruba-the-largest-italian-cloud-provider-formalizes-its-gaia-x-status-as-a-day-1-member/;;;uktechnews.co.uk;104.21.41.24;BR;Brazil;São Paulo;São Paulo;-46.633140563964844;-23.5515193939209;13335;set();geolocation;{};104.21.41.24;Aruba, the largest Italian Cloud provider, formalizes its GAIA-X ...;"Nov 27, 2020 — Benenden Health cuts down disaster recovery time with Node4 cloud services May 29, 2020 In ""Case Studies"". Leaseweb Global Launches ..."
8;2020-11-27;Sustainability information 2020 - Digital Asset Management;Nov 27, 2020 — remote working in good time. Thanks to our ... For colleagues who cannot work from home, such as factory ... ment and agile software development, to name just two ... sustainable economy, and increasing our resilience.;https://assets.new.siemens.com/siemens/assets/api/uuid:13f56263-0d96-421c-a6a4-9c10bb9b9d28/sustainability2020-en.pdf;https;assets.new.siemens.com;/siemens/assets/api/uuid:13f56263-0d96-421c-a6a4-9c10bb9b9d28/sustainability2020-en.pdf;;;siemens.com;13.226.15.17;US;United States;Illinois;Chicago;-87.67124938964844;41.84885025024414;16509;set();geolocation;{};13.226.15.17;Sustainability information 2020 - Digital Asset Management;Nov 27, 2020 — remote working in good time. Thanks to our ... For colleagues who cannot work from home, such as factory ... ment and agile software development, to name just two ... sustainable economy, and increasing our resilience.
9;2020-11-27;A Person-Environment Fit Model for Virtual Organizations ...;Nov 28, 2020 — Yet, with the spread of COVID-19, many employees are mandated to work from home as opposed to selecting themselves into such autonomous ...;https://www.researchgate.net/publication/251511739_A_Person-Environment_Fit_Model_for_Virtual_Organizations;https;www.researchgate.net;/publication/251511739_A_Person-Environment_Fit_Model_for_Virtual_Organizations;;;researchgate.net;104.17.33.105;US;United States;California;San Jose;-121.83822631835938;37.330528259277344;13335;set();geolocation;{};104.17.33.105;A Person-Environment Fit Model for Virtual Organizations ...;Nov 28, 2020 — Yet, with the spread of COVID-19, many employees are mandated to work from home as opposed to selecting themselves into such autonomous ...
10;2020-11-27;News - Cloudy IT;What's your organisation's Cyber Resilience Score? ... was engineered this summer as an unprecedented silver lining of “new normal” remote working. ... a new strategic partnership with Dutch software development house Epona Legal. […].;https://www.cloudyit.co.uk/news/;https;www.cloudyit.co.uk;/news/;;;cloudyit.co.uk;172.67.133.180;US;United States;California;San Francisco;-122.39286041259766;37.76784896850586;13335;set();geolocation;{};172.67.133.180;News - Cloudy IT;What's your organisation's Cyber Resilience Score? ... was engineered this summer as an unprecedented silver lining of “new normal” remote working. ... a new strategic partnership with Dutch software development house Epona Legal. […].
11;2020-11-27;FRIEDRICH ENGELS IN THE AGE OF DIGITAL CAPITALISM ...;Nov 28, 2020 — Freedom, Distribution and Work from Home: Rereading Engels in the Time of the ... racy of software engineers at Google, online freelance workers, platform ... same day when 301 coal miners lost their lives in Turkey due to a mine disaster that ... One reason is that software development accelerates.;https://www.triple-c.at/index.php/tripleC/article/view/1233/1416;https;www.triple-c.at;/index.php/tripleC/article/view/1233/1416;;;triple-c.at;85.13.150.203;DE;Germany;Saxony;Löbau;14.562000274658203;51.025001525878906;34788;set();geolocation;{};85.13.150.203;FRIEDRICH ENGELS IN THE AGE OF DIGITAL CAPITALISM ...;Nov 28, 2020 — Freedom, Distribution and Work from Home: Rereading Engels in the Time of the ... racy of software engineers at Google, online freelance workers, platform ... same day when 301 coal miners lost their lives in Turkey due to a mine disaster that ... One reason is that software development accelerates.
12;2020-11-27;How Atlassian Sets Remote Teams Up for Success: MURAL ...;Nov 28, 2020 — Shift to remote working, whether it was around like February, March, ... This is resilience, on teams, like those are the skills that, that we're trying ...;https://www.mural.co/blog/atlassian-remote-work;https;www.mural.co;/blog/atlassian-remote-work;;;mural.co;35.153.248.116;US;United States;Virginia;Ashburn;-77.47419738769531;39.043701171875;14618;set();geolocation;{};35.153.248.116;How Atlassian Sets Remote Teams Up for Success: MURAL ...;Nov 28, 2020 — Shift to remote working, whether it was around like February, March, ... This is resilience, on teams, like those are the skills that, that we're trying ...
13;2020-11-27;Language Hubs for Assisted Learning – The KGP Chronicle;Nov 28, 2020 — ... Sharma Director Director IIT Kharagpur Disaster Disaster Informatics Disaster ... remote healthcare remote monitoring remote working renewable renewable ... Park research scholar research scholars Resilience respiratory reunion ... women shoppers work from home workshop World Environment Day ...;https://kgpchronicle.iitkgp.ac.in/language-hubs-for-assisted-learning/;https;kgpchronicle.iitkgp.ac.in;/language-hubs-for-assisted-learning/;;;iitkgp.ac.in;203.110.242.133;IN;India;West Bengal;Kharagpur;87.31809997558594;22.330400466918945;55847;set();geolocation;{};203.110.242.133;Language Hubs for Assisted Learning – The KGP Chronicle;Nov 28, 2020 — ... Sharma Director Director IIT Kharagpur Disaster Disaster Informatics Disaster ... remote healthcare remote monitoring remote working renewable renewable ... Park research scholar research scholars Resilience respiratory reunion ... women shoppers work from home workshop World Environment Day ...
14;2020-11-27;RFP Specialist job in Tempe at Embry Health | Lensa;Nov 27, 2020 — ... standards, system security, change control, disaster recovery, etc. ... We are looking for a Work from home Contract Coordinator to work M-F 7 ...;https://lensa.com/rfp-specialist-jobs/tempe/jd/82022223a0ec74e0ed4c3cce088a8a1a;https;lensa.com;/rfp-specialist-jobs/tempe/jd/82022223a0ec74e0ed4c3cce088a8a1a;;;lensa.com;34.233.31.121;US;United States;Virginia;Ashburn;-77.47419738769531;39.043701171875;14618;set();geolocation;{};34.233.31.121;RFP Specialist job in Tempe at Embry Health | Lensa;Nov 27, 2020 — ... standards, system security, change control, disaster recovery, etc. ... We are looking for a Work from home Contract Coordinator to work M-F 7 ...
15;2020-11-27;MOLDOVA CYBER WEEK 2020 ONLINE CONFERENCE ...;Nov 27, 2020 — becoming online, work from home culture taking precedence and cybersecurity encoun- tering new challenges in a fast paced changing cyber ...;https://moldovacyberweek.md/files/moldova_cyber_week_2020_-final.pdf;https;moldovacyberweek.md;/files/moldova_cyber_week_2020_-final.pdf;;;moldovacyberweek.md;136.243.143.126;DE;Germany;Bavaria;Gunzenhausen;10.753399848937988;49.11594009399414;24940;set();geolocation;{};136.243.143.126;MOLDOVA CYBER WEEK 2020 ONLINE CONFERENCE ...;Nov 27, 2020 — becoming online, work from home culture taking precedence and cybersecurity encoun- tering new challenges in a fast paced changing cyber ...
16;2020-11-27;My Thoughts on San Francisco's “Exodus,” the Social-Life ...;Nov 27, 2020 — The shell game of work from home…..soon this work will be sent to other countries ... They started this teleworking back in 2000, and it was a complete disaster. ... Is it all engineering, software development, and social media?;https://wolfstreet.com/2020/11/27/my-thoughts-on-san-franciscos-exodus-social-life-cost-cutting-aspects-of-work-from-home-and-truly-bizarre-split-in-the-real-estate-market/;https;wolfstreet.com;/2020/11/27/my-thoughts-on-san-franciscos-exodus-social-life-cost-cutting-aspects-of-work-from-home-and-truly-bizarre-split-in-the-real-estate-market/;;;wolfstreet.com;64.131.77.113;US;United States;Virginia;Buckhall;-77.53645324707031;38.7936897277832;30633;set();geolocation;{};64.131.77.113;My Thoughts on San Francisco's “Exodus,” the Social-Life ...;Nov 27, 2020 — The shell game of work from home…..soon this work will be sent to other countries ... They started this teleworking back in 2000, and it was a complete disaster. ... Is it all engineering, software development, and social media?
17;2020-11-27;Dataplan wins Global Payroll Outstanding Award;Nov 27, 2020 — ... and in 2020 our skills and resilience really have been put to the test with the ... there was little time to ensure an efficient transition to remote working for our ... including IT, software development, operations and marketing.;https://www.dataplanpayroll.co.uk/payrollblog/awards/global-payroll-awards-winners-2020;https;www.dataplanpayroll.co.uk;/payrollblog/awards/global-payroll-awards-winners-2020;;;dataplanpayroll.co.uk;185.150.144.234;GB;United Kingdom;England;Grimsby;-0.09777999669313431;53.55332946777344;202907;set();geolocation;{};185.150.144.234;Dataplan wins Global Payroll Outstanding Award;Nov 27, 2020 — ... and in 2020 our skills and resilience really have been put to the test with the ... there was little time to ensure an efficient transition to remote working for our ... including IT, software development, operations and marketing.
18;2020-11-27;Tech Decision Making: The Rise of the Developer ...;Nov 27, 2020 — Throughout this digitization tidal wave, effective and efficient software development has become mission-critical for businesses. It also deeply ...;https://www.informationweek.com/devops/tech-decision-making-the-rise-of-the-developer-/a/d-id/1339478?;https;www.informationweek.com;/devops/tech-decision-making-the-rise-of-the-developer-/a/d-id/1339478;;;informationweek.com;104.17.84.154;US;United States;Florida;Flagami;-80.31195831298828;25.762859344482422;13335;set();geolocation;{};104.17.84.154;Tech Decision Making: The Rise of the Developer ...;Nov 27, 2020 — Throughout this digitization tidal wave, effective and efficient software development has become mission-critical for businesses. It also deeply ...
19;2020-11-27;What is Next for CMMC? - 2WTech : 2WTech;Nov 27, 2020 — ... Azure VMs, Azure VPN Gateway, BaaS, Backup, Backup and Disaster Recovery ... continuity, Digital Manufacturing, Digital Manufacturing Trends, digital resilience ... Software Deployment, software development, Software integration ... Work from home policy, Work From Home Policy Checklist, workflows ...;https://2wtech.com/what-is-next-for-cmmc/;https;2wtech.com;/what-is-next-for-cmmc/;;;2wtech.com;151.101.66.159;US;United States;California;San Francisco;-122.39286041259766;37.76784896850586;54113;set();geolocation;{};151.101.66.159;What is Next for CMMC? - 2WTech : 2WTech;Nov 27, 2020 — ... Azure VMs, Azure VPN Gateway, BaaS, Backup, Backup and Disaster Recovery ... continuity, Digital Manufacturing, Digital Manufacturing Trends, digital resilience ... Software Deployment, software development, Software integration ... Work from home policy, Work From Home Policy Checklist, workflows ...
20;2020-11-27;A SMALL BUSINESS SURGE IN DIGITAL TRADE - Global ...;Nov 28, 2020 — Three Tips to Break the Ice between Your Software Development Team and Product Backlog ... our participants to learn [how to work from home],” said Celia Boyd, ... Technologies utilizes a large network of software engineers to create ... YEAR MERITS DIFFERENT LISTS, BUT RESILIENCE HOLDS TRUE ...;https://www.globaltrademag.com/a-small-business-surge-in-digital-trade/;https;www.globaltrademag.com;/a-small-business-surge-in-digital-trade/;;;globaltrademag.com;192.124.249.165;US;United States;California;Menifee;-117.1891098022461;33.65753173828125;30148;set();geolocation;{};192.124.249.165;A SMALL BUSINESS SURGE IN DIGITAL TRADE - Global ...;Nov 28, 2020 — Three Tips to Break the Ice between Your Software Development Team and Product Backlog ... our participants to learn [how to work from home],” said Celia Boyd, ... Technologies utilizes a large network of software engineers to create ... YEAR MERITS DIFFERENT LISTS, BUT RESILIENCE HOLDS TRUE ...
21;2020-11-27;This Christmas, Covid-19 heightens retail security risks for ...;Nov 27, 2020 — ... during the holidays? You're dead wrong. This year, the Covid-19 pandemic and the shift to remote working has thrown a spanner in the works.;https://www.computerweekly.com/feature/This-Christmas-Covid-19-heightens-retail-security-risks-for-everyone;https;www.computerweekly.com;/feature/This-Christmas-Covid-19-heightens-retail-security-risks-for-everyone;;;computerweekly.com;206.19.49.153;US;United States;Louisiana;Reddell;-92.42642211914062;30.675010681152344;7018;set();geolocation;{};206.19.49.153;This Christmas, Covid-19 heightens retail security risks for ...;Nov 27, 2020 — ... during the holidays? You're dead wrong. This year, the Covid-19 pandemic and the shift to remote working has thrown a spanner in the works.
22;2020-11-27;Mutable vs Immutable Infrastructure Comprehensive Guide in ...;Nov 27, 2020 — You can also reproduce scenarios and perform disaster recovery automatically with immutable infrastructure. As more businesses continue to ...;https://www.bridge-global.com/blog/mutable-vs-immutable-infrastructure/;https;www.bridge-global.com;/blog/mutable-vs-immutable-infrastructure/;;;bridge-global.com;13.235.106.36;IN;India;Maharashtra;Powai;72.87770080566406;19.076000213623047;16509;set();geolocation;{};13.235.106.36;Mutable vs Immutable Infrastructure Comprehensive Guide in ...;Nov 27, 2020 — You can also reproduce scenarios and perform disaster recovery automatically with immutable infrastructure. As more businesses continue to ...
23;2020-11-27;Impact of Covid 19 on real estate | Acuity Knowledge Partners;Nov 27, 2020 — Work from home will buoy the residential market, with people looking ... been relatively healthy, anchored by the resilience in medical supply, ...;https://www.acuitykp.com/blog/impact-of-covid-19-on-real-estate/;https;www.acuitykp.com;/blog/impact-of-covid-19-on-real-estate/;;;acuitykp.com;98.129.229.113;US;United States;Arizona;Alhambra;-112.08255004882812;33.50938034057617;53824;set();geolocation;{};98.129.229.113;Impact of Covid 19 on real estate | Acuity Knowledge Partners;Nov 27, 2020 — Work from home will buoy the residential market, with people looking ... been relatively healthy, anchored by the resilience in medical supply, ...
24;2020-11-27;Cyber readiness: The state of play in technology, media and ...;Nov 27, 2020 — However, the relationship between spending and resilience isn't always ... Remote working can make businesses more vulnerable than ever to ...;https://www.hiscox.co.uk/business-blog/cyber-readiness-state-play-technology-media-and-telecommunications;https;www.hiscox.co.uk;/business-blog/cyber-readiness-state-play-technology-media-and-telecommunications;;;hiscox.co.uk;104.17.133.9;US;United States;California;San Jose;-121.83822631835938;37.330528259277344;13335;set();geolocation;{};104.17.133.9;Cyber readiness: The state of play in technology, media and ...;Nov 27, 2020 — However, the relationship between spending and resilience isn't always ... Remote working can make businesses more vulnerable than ever to ...
25;2020-11-27;DevOps Engineer (Bristol, UK) | remote.io;... Engineer to support a growing distributed team of exceptional software engineers. ... for Surevine as well as our software development projects, and our customers. ... ISO27001 compliance and change management, situation / disaster analysis ... Remote.io 2.0 - Discover the best remote jobs to work from home | Product.;https://www.remote.io/remote-devops-sysadmin-jobs/devops-engineer-bristol-uk-10;https;www.remote.io;/remote-devops-sysadmin-jobs/devops-engineer-bristol-uk-10;;;remote.io;104.26.15.99;US;United States;Virginia;Ashburn;-77.47419738769531;39.043701171875;13335;set();geolocation;{};104.26.15.99;DevOps Engineer (Bristol, UK) | remote.io;... Engineer to support a growing distributed team of exceptional software engineers. ... for Surevine as well as our software development projects, and our customers. ... ISO27001 compliance and change management, situation / disaster analysis ... Remote.io 2.0 - Discover the best remote jobs to work from home | Product.
26;2020-11-27;49ers may need temporary home because of new COVID-19 ...;Nov 28, 2020 — Increase testing for people unable to work from home and students, urges London mayor. 5 minutes ago. The Canadian Press ...;https://ca.movies.yahoo.com/49ers-may-temporary-home-because-220317494.html;https;ca.movies.yahoo.com;/49ers-may-temporary-home-because-220317494.html;;;yahoo.com;74.6.231.14;US;United States;New York;Manhattan;-73.9884033203125;40.73139190673828;36646;set();geolocation;{};74.6.231.14;49ers may need temporary home because of new COVID-19 ...;Nov 28, 2020 — Increase testing for people unable to work from home and students, urges London mayor. 5 minutes ago. The Canadian Press ...
27;2020-11-27;Level 2 IT Support Technician | Hubkin - Hubkin | Find A Job;Nov 27, 2020 — Our clients operate in a wide range of industries, including: finance, software development, digital media, real estate, fmanufacturing, ...;https://ca.hubkin.com/job/81187073488233158/level-2-it-support-technician;https;ca.hubkin.com;/job/81187073488233158/level-2-it-support-technician;;;hubkin.com;151.101.1.195;US;United States;California;San Francisco;-122.39286041259766;37.76784896850586;54113;set();geolocation;{};151.101.1.195;Level 2 IT Support Technician | Hubkin - Hubkin | Find A Job;Nov 27, 2020 — Our clients operate in a wide range of industries, including: finance, software development, digital media, real estate, fmanufacturing, ...
