;date;header;summary;link;protocol;domain;path;query;fragment;host_name;ip_address;Type;AdditionalData;CountryCode;CountryName;State;City;Longitude;Latitude;IpAddress;header_context_true;summary_context_true
89;2020-10-07;Why zero trust remote networking is key to thriving in the 'new ...;Oct 7, 2020 — ... both company managed devices and unmanaged personal devices. At the same time, top security considerations for remote working include: ...;https://itbrief.com.au/story/why-zero-trust-remote-networking-is-key-to-thriving-in-the-new-normal-business-world;https;itbrief.com.au;/story/why-zero-trust-remote-networking-is-key-to-thriving-in-the-new-normal-business-world;;;com;113.21.226.180;geolocation;{};NZ;New Zealand;Auckland;Auckland;174.6802978515625;-36.78810119628906;113.21.226.180;Why zero trust remote networking is key to thriving in the 'new ...;Oct 7, 2020 — ... both company managed devices and unmanaged personal devices. At the same time, top security considerations for remote working include: ...
90;2020-10-07;Why zero trust remote networking is key to thriving in the 'new ...;Oct 7, 2020 — ... both company managed devices and unmanaged personal devices. At the same time, top security considerations for remote working include: ...;https://itbrief.com.au/story/why-zero-trust-remote-networking-is-key-to-thriving-in-the-new-normal-business-world;https;itbrief.com.au;/story/why-zero-trust-remote-networking-is-key-to-thriving-in-the-new-normal-business-world;;;com;113.21.226.180;geolocation;{};NZ;New Zealand;Auckland;Auckland;174.6802978515625;-36.78810119628906;113.21.226.180;Why zero trust remote networking is key to thriving in the 'new ...;Oct 7, 2020 — ... both company managed devices and unmanaged personal devices. At the same time, top security considerations for remote working include: ...
91;2020-10-07;Why zero trust remote networking is key to thriving in the 'new ...;Oct 7, 2020 — ... both company managed devices and unmanaged personal devices. At the same time, top security considerations for remote working include: ...;https://itbrief.com.au/story/why-zero-trust-remote-networking-is-key-to-thriving-in-the-new-normal-business-world;https;itbrief.com.au;/story/why-zero-trust-remote-networking-is-key-to-thriving-in-the-new-normal-business-world;;;com;113.21.226.180;geolocation;{};NZ;New Zealand;Auckland;Auckland;174.6802978515625;-36.78810119628906;113.21.226.180;Why zero trust remote networking is key to thriving in the 'new ...;Oct 7, 2020 — ... both company managed devices and unmanaged personal devices. At the same time, top security considerations for remote working include: ...
92;2020-10-07;Project Manager-Global Enterprise IT Group with ref. PR ...;Oct 7, 2020 — ... firm part of a global technology enterprise group -Remote Working Option ... range of services, from major projects, Cloud and Disaster Recovery, ... for an experienced Project Manager for a Software Development team, ...;https://www.oscar-tech.com/job/project-manager-global-enterprise-it-group/;https;www.oscar-tech.com;/job/project-manager-global-enterprise-it-group/;;;oscar-tech;34.241.64.5;geolocation;{};IE;Ireland;Leinster;Dublin;-6.243330001831055;53.35388946533203;34.241.64.5;Project Manager-Global Enterprise IT Group with ref. PR ...;Oct 7, 2020 — ... firm part of a global technology enterprise group -Remote Working Option ... range of services, from major projects, Cloud and Disaster Recovery, ... for an experienced Project Manager for a Software Development team, ...
93;2020-10-07;Sr. Software Architect, Innovation Lab (work from home) - Zippia;Oct 7, 2020 — Sr. Software Architect, Innovation Lab (work from home) ... assistance, disaster relief, and disaster preparedness education in the United States.;https://www.zippia.com/raleigh-nc-jobs/senior-software-architect-dlp/?9dc99c5ba53ce753848dc434ba83d6f6b035fd0f;https;www.zippia.com;/raleigh-nc-jobs/senior-software-architect-dlp/;9dc99c5ba53ce753848dc434ba83d6f6b035fd0f;;zippia;35.185.237.72;geolocation;{};US;United States;Oregon;The Dalles;-121.18699645996094;45.55424880981445;35.185.237.72;Sr. Software Architect, Innovation Lab (work from home) - Zippia;Oct 7, 2020 — Sr. Software Architect, Innovation Lab (work from home) ... assistance, disaster relief, and disaster preparedness education in the United States.
94;2020-10-07;Preparing for Disruption With Resilient Services - Los ... - IMAD;Oct 7, 2020 — When companies shifted to remote working in response to the ... to services, companies can improve their performance and resilience by ...;https://imad.edu.es/business-school/preparing-for-disruption-with-resilient-services/;https;imad.edu.es;/business-school/preparing-for-disruption-with-resilient-services/;;;edu;185.37.226.35;geolocation;{};ES;Spain;Madrid;Alcobendas;-3.6497199535369873;40.516151428222656;185.37.226.35;Preparing for Disruption With Resilient Services - Los ... - IMAD;Oct 7, 2020 — When companies shifted to remote working in response to the ... to services, companies can improve their performance and resilience by ...
95;2020-10-07;Scaling at speed - KPMG Global - KPMG International;Oct 8, 2020 — Almost overnight, organizations deployed new remote working models that ... trust in organizations is becoming increasingly tied to their digital resilience. ... How do we embed security seamlessly in software development ...;https://home.kpmg/xx/en/blogs/home/posts/2020/09/scaling-at-speed.html;https;home.kpmg;/xx/en/blogs/home/posts/2020/09/scaling-at-speed.html;;;home;23.10.248.34;geolocation;{};US;United States;Texas;Dallas;-96.8142318725586;32.8054313659668;23.10.248.34;Scaling at speed - KPMG Global - KPMG International;Oct 8, 2020 — Almost overnight, organizations deployed new remote working models that ... trust in organizations is becoming increasingly tied to their digital resilience. ... How do we embed security seamlessly in software development ...
96;2020-10-07;IT Security Policy | iCIMS;Disaster Recovery Plan, A documented process or set of procedures to recover and protect a business IT infrastructure in the event of a disaster. ... risks to protected information from mobile computing and remote working environments. ... 10 coding vulnerabilities in software development processes, including the following:.;https://www.icims.com/gc/IT-Security-Policy/;https;www.icims.com;/gc/IT-Security-Policy/;;;icims;52.0.205.233;geolocation;{};US;United States;Virginia;Ashburn;-77.47419738769531;39.043701171875;52.0.205.233;IT Security Policy | iCIMS;Disaster Recovery Plan, A documented process or set of procedures to recover and protect a business IT infrastructure in the event of a disaster. ... risks to protected information from mobile computing and remote working environments. ... 10 coding vulnerabilities in software development processes, including the following:.
97;2020-10-07;More than four-fifths of global workforce rule out return to office ...;Oct 7, 2020 — The new normal of increased remote working has emerged into a ... effective in enabling their employees to work from home at the start of the ...;https://www.computerweekly.com/news/252490165/More-than-four-fifths-of-global-workforce-rule-out-return-to-office-full-time;https;www.computerweekly.com;/news/252490165/More-than-four-fifths-of-global-workforce-rule-out-return-to-office-full-time;;;computerweekly;206.19.49.153;geolocation;{};US;United States;Louisiana;Reddell;-92.42642211914062;30.675010681152344;206.19.49.153;More than four-fifths of global workforce rule out return to office ...;Oct 7, 2020 — The new normal of increased remote working has emerged into a ... effective in enabling their employees to work from home at the start of the ...
98;2020-10-07;Tech and Emotional Support for a Distributed Workforce: An IT ...;Oct 7, 2020 — So we have a crew that's been doing quite a bit of critical work from home for quite a few years. Was such a shift part of your disaster planning?;https://www.cio.com/article/3584838/tech-and-emotional-support-for-a-distributed-workforce-an-it-leader-s-perspective.html;https;www.cio.com;/article/3584838/tech-and-emotional-support-for-a-distributed-workforce-an-it-leader-s-perspective.html;;;cio;151.101.2.165;geolocation;{};US;United States;California;San Francisco;-122.39286041259766;37.76784896850586;151.101.2.165;Tech and Emotional Support for a Distributed Workforce: An IT ...;Oct 7, 2020 — So we have a crew that's been doing quite a bit of critical work from home for quite a few years. Was such a shift part of your disaster planning?
99;2020-10-07;Cohesis Appointed TFG Group's Virtual CIO - Cohesis - IT ...;... Software Development​ · Business Continuity & Disaster Recovery​ ... staff are being asked to work from home creating what will be a paradigm shift.;https://www.cohesis.com.au/cio/cohesis-appointed-tfg-groups-virtual-cio/;https;www.cohesis.com.au;/cio/cohesis-appointed-tfg-groups-virtual-cio/;;;com;103.20.200.153;geolocation;{};AU;Australia;New South Wales;Sydney;151.2071075439453;-33.86714172363281;103.20.200.153;Cohesis Appointed TFG Group's Virtual CIO - Cohesis - IT ...;... Software Development​ · Business Continuity & Disaster Recovery​ ... staff are being asked to work from home creating what will be a paradigm shift.
100;2020-10-07;New 'HEH' Botnet Targets Exposed Telnet Services – Kizz ...;Oct 8, 2020 — Most contemporary possibility is one in a rising list of malware developed within the Hotfoot programming language. A doubtlessly destructive ...;https://kkhacklabs.com/new-heh-botnet-targets-exposed-telnet-services/;https;kkhacklabs.com;/new-heh-botnet-targets-exposed-telnet-services/;;;kkhacklabs;3.12.124.129;geolocation;{};US;United States;Ohio;Columbus;-82.99945831298828;39.99557876586914;3.12.124.129;New 'HEH' Botnet Targets Exposed Telnet Services – Kizz ...;Oct 8, 2020 — Most contemporary possibility is one in a rising list of malware developed within the Hotfoot programming language. A doubtlessly destructive ...
101;2020-10-07;Civil service transformers: adapting to a changing world ...;Oct 7, 2020 — Global resilience has taken a hit – these countries will bear the brunt. The global economy has suffered its biggest shock since the Second ...;https://www.globalgovernmentforum.com/civil-service-transformers-adapting-to-a-changing-world/;https;www.globalgovernmentforum.com;/civil-service-transformers-adapting-to-a-changing-world/;;;globalgovernmentforum;172.67.70.64;geolocation;{};US;United States;California;San Francisco;-122.39286041259766;37.76784896850586;172.67.70.64;Civil service transformers: adapting to a changing world ...;Oct 7, 2020 — Global resilience has taken a hit – these countries will bear the brunt. The global economy has suffered its biggest shock since the Second ...
102;2020-10-07;Equinix Unveils Bare-Metal Infrastructure Service ...;Oct 7, 2020 — Colocation company leverages technology from Packet acquisition to bring more cloud capabilities to data centers. By Jeffrey Burt. Equinix is ...;https://channelnomics.com/2020/10/07/equinix-unveils-bare-metal-infrastructure-service/;https;channelnomics.com;/2020/10/07/equinix-unveils-bare-metal-infrastructure-service/;;;channelnomics;104.28.9.61;geolocation;{};SG;Singapore;;Singapore;103.8198013305664;1.3200000524520874;104.28.9.61;Equinix Unveils Bare-Metal Infrastructure Service ...;Oct 7, 2020 — Colocation company leverages technology from Packet acquisition to bring more cloud capabilities to data centers. By Jeffrey Burt. Equinix is ...
103;2020-10-07;Cathy Gilmartin | HCS - HCS Business Solutions;Oct 7, 2020 — Cyber Security is critical especially during recent times when cyber criminals have exploited the current remote working environment to gain ...;https://www.hcs.ie/author/cgilmartin;https;www.hcs.ie;/author/cgilmartin;;;hcs;91.210.235.135;geolocation;{};IE;Ireland;Munster;Waterford;-7.107500076293945;52.25556182861328;91.210.235.135;Cathy Gilmartin | HCS - HCS Business Solutions;Oct 7, 2020 — Cyber Security is critical especially during recent times when cyber criminals have exploited the current remote working environment to gain ...
104;2020-10-07;2020 HMG Live! Detroit CIO Executive Leadership Summit;Oct 8, 2020 — Prior to this role, Jason built and led a software development capability ... With six months of remote working in the books and no foreseeable end in ... single IT Resilience Platform, Zerto is changing the way disaster recovery, ...;https://hmgstrategy.com/events/past-summits/2020/10/08/default-calendar/2020-detroit-cio-executive-leadership-summit;https;hmgstrategy.com;/events/past-summits/2020/10/08/default-calendar/2020-detroit-cio-executive-leadership-summit;;;hmgstrategy;40.71.199.117;geolocation;{};US;United States;Virginia;Washington;-78.15899658203125;38.7130012512207;40.71.199.117;2020 HMG Live! Detroit CIO Executive Leadership Summit;Oct 8, 2020 — Prior to this role, Jason built and led a software development capability ... With six months of remote working in the books and no foreseeable end in ... single IT Resilience Platform, Zerto is changing the way disaster recovery, ...
105;2020-10-07;twenty bold ideas to reimagine the alliance after the 2020 us ...;Oct 7, 2020 — sive track record of adaptivity, resilience, and achievement. The essays in this ... It upgraded its technical infrastructures to enable secure work from home. NATO's leadership ... extensive record of Humanitarian Assistance/Disaster. Relief missions ... investing in new software development processes like.;https://www.atlanticcouncil.org/wp-content/uploads/2020/10/NATO-20-2020-Twenty-bold-ideas-to-reimagine-the-alliance-after-the-2020-US-election.pdf;https;www.atlanticcouncil.org;/wp-content/uploads/2020/10/NATO-20-2020-Twenty-bold-ideas-to-reimagine-the-alliance-after-the-2020-US-election.pdf;;;atlanticcouncil;104.20.19.178;geolocation;{};US;United States;California;San Jose;-121.83822631835938;37.330528259277344;104.20.19.178;twenty bold ideas to reimagine the alliance after the 2020 us ...;Oct 7, 2020 — sive track record of adaptivity, resilience, and achievement. The essays in this ... It upgraded its technical infrastructures to enable secure work from home. NATO's leadership ... extensive record of Humanitarian Assistance/Disaster. Relief missions ... investing in new software development processes like.
106;2020-10-07;3 Ways Companies are Working on Security by Design;Oct 7, 2020 — When we think about responsibility in software development and responsibility as a bank to deliver to our customers, everything needs to be ...;https://www.darkreading.com/application-security/3-ways-companies-are-working-on-security-by-design/d/d-id/1339111;https;www.darkreading.com;/application-security/3-ways-companies-are-working-on-security-by-design/d/d-id/1339111;;;darkreading;104.17.119.99;geolocation;{};US;United States;California;San Jose;-121.83822631835938;37.330528259277344;104.17.119.99;3 Ways Companies are Working on Security by Design;Oct 7, 2020 — When we think about responsibility in software development and responsibility as a bank to deliver to our customers, everything needs to be ...
107;2020-10-07;Water Resources Leader - Shimmick Construction Company ...;Oct 7, 2020 — You will be redirected to Shimmick Construction Company's preferred application process. Job Expires: November 6, 2020. More Work-from- ...;https://wfhjobs.us/job/water-resources-leader-at-shimmick-construction-company-in-austin-tx/;https;wfhjobs.us;/job/water-resources-leader-at-shimmick-construction-company-in-austin-tx/;;;wfhjobs;35.244.220.179;geolocation;{};US;United States;Kansas;Prairie Village;-94.53961181640625;39.10771179199219;35.244.220.179;Water Resources Leader - Shimmick Construction Company ...;Oct 7, 2020 — You will be redirected to Shimmick Construction Company's preferred application process. Job Expires: November 6, 2020. More Work-from- ...
108;2020-10-07;C / C++ Embedded Software Developer – Big Data Products ...;Experience with agile software development process. Familiarity with ... Embrace resilience – seeing every challenge as a learning opportunity and invitation to grow. Passion for ... Remote working and flexible working time. Competitive ...;https://www.aptiv.com/careers/posting/c-c-embedded-software-developer-big-data-products-in-aptiv-connected-services-j000599324;https;www.aptiv.com;/careers/posting/c-c-embedded-software-developer-big-data-products-in-aptiv-connected-services-j000599324;;;aptiv;13.107.246.10;geolocation;{};US;United States;Washington;Cottage Lake;-122.12094116210938;47.68050003051758;13.107.246.10;C / C++ Embedded Software Developer – Big Data Products ...;Experience with agile software development process. Familiarity with ... Embrace resilience – seeing every challenge as a learning opportunity and invitation to grow. Passion for ... Remote working and flexible working time. Competitive ...
109;2020-10-07;Feed - Complete Developer Podcast;However, if you want to work from home over the long term, there are a lot of things you ... We talk often on the show about software development methodologies such as ... your own personal power is ripe for disaster when you don't think before acting. ... Resilience is the ability or capacity to quickly recover from difficulties.;https://completedeveloperpodcast.com/feed/podcast/;https;completedeveloperpodcast.com;/feed/podcast/;;;completedeveloperpodcast;204.14.92.16;geolocation;{};US;United States;Pennsylvania;King of Prussia;-75.37745666503906;40.154319763183594;204.14.92.16;Feed - Complete Developer Podcast;However, if you want to work from home over the long term, there are a lot of things you ... We talk often on the show about software development methodologies such as ... your own personal power is ripe for disaster when you don't think before acting. ... Resilience is the ability or capacity to quickly recover from difficulties.
110;2020-10-07;Cybersecurity Awareness Month 2020: Key insights from ...;Oct 8, 2020 — For businesses, resilience and continuity strategies have had to adapt ... “Not only did widespread remote working exacerbate existing issues,” ...;https://uktechnews.co.uk/2020/10/08/cybersecurity-awareness-month-2020-key-insights-from-industry-experts/;https;uktechnews.co.uk;/2020/10/08/cybersecurity-awareness-month-2020-key-insights-from-industry-experts/;;;co;172.67.159.16;geolocation;{};US;United States;California;San Francisco;-122.39286041259766;37.76784896850586;172.67.159.16;Cybersecurity Awareness Month 2020: Key insights from ...;Oct 8, 2020 — For businesses, resilience and continuity strategies have had to adapt ... “Not only did widespread remote working exacerbate existing issues,” ...
111;2020-10-07;Video: 10 Minute IT Jams - Who is Tradify? - IT Brief;The importance of data resilience in the current cybersecurity climate ... Secureworks: Remote working ...;https://itbrief.co.nz/story/video-10-minute-it-jams-who-is-tradify;https;itbrief.co.nz;/story/video-10-minute-it-jams-who-is-tradify;;;co;113.21.226.180;geolocation;{};NZ;New Zealand;Auckland;Auckland;174.6802978515625;-36.78810119628906;113.21.226.180;Video: 10 Minute IT Jams - Who is Tradify? - IT Brief;The importance of data resilience in the current cybersecurity climate ... Secureworks: Remote working ...
112;2020-10-07;Video: 10 Minute IT Jams - Who is Tradify? - IT Brief;The importance of data resilience in the current cybersecurity climate ... Secureworks: Remote working ...;https://itbrief.co.nz/story/video-10-minute-it-jams-who-is-tradify;https;itbrief.co.nz;/story/video-10-minute-it-jams-who-is-tradify;;;co;113.21.226.180;geolocation;{};NZ;New Zealand;Auckland;Auckland;174.6802978515625;-36.78810119628906;113.21.226.180;Video: 10 Minute IT Jams - Who is Tradify? - IT Brief;The importance of data resilience in the current cybersecurity climate ... Secureworks: Remote working ...
113;2020-10-07;Video: 10 Minute IT Jams - Who is Tradify? - IT Brief;The importance of data resilience in the current cybersecurity climate ... Secureworks: Remote working ...;https://itbrief.co.nz/story/video-10-minute-it-jams-who-is-tradify;https;itbrief.co.nz;/story/video-10-minute-it-jams-who-is-tradify;;;co;113.21.226.180;geolocation;{};NZ;New Zealand;Auckland;Auckland;174.6802978515625;-36.78810119628906;113.21.226.180;Video: 10 Minute IT Jams - Who is Tradify? - IT Brief;The importance of data resilience in the current cybersecurity climate ... Secureworks: Remote working ...
114;2020-10-07;Video: 10 Minute IT Jams - Who is Tradify? - IT Brief;The importance of data resilience in the current cybersecurity climate ... Secureworks: Remote working ...;https://itbrief.co.nz/story/video-10-minute-it-jams-who-is-tradify;https;itbrief.co.nz;/story/video-10-minute-it-jams-who-is-tradify;;;co;113.21.226.180;geolocation;{};NZ;New Zealand;Auckland;Auckland;174.6802978515625;-36.78810119628906;113.21.226.180;Video: 10 Minute IT Jams - Who is Tradify? - IT Brief;The importance of data resilience in the current cybersecurity climate ... Secureworks: Remote working ...
115;2020-10-07;Video: 10 Minute IT Jams - Who is Tradify? - IT Brief;The importance of data resilience in the current cybersecurity climate ... Secureworks: Remote working ...;https://itbrief.co.nz/story/video-10-minute-it-jams-who-is-tradify;https;itbrief.co.nz;/story/video-10-minute-it-jams-who-is-tradify;;;co;113.21.226.180;geolocation;{};NZ;New Zealand;Auckland;Auckland;174.6802978515625;-36.78810119628906;113.21.226.180;Video: 10 Minute IT Jams - Who is Tradify? - IT Brief;The importance of data resilience in the current cybersecurity climate ... Secureworks: Remote working ...
116;2020-10-07;Ryan Rauner, CCIM – Ryan Rauner's Real Estate Blog;Many force majeure events like a natural disaster, i.e. hurricane, are limited in ... the area has one the largest concentrations of software engineers in the nation, ...;https://ryanrauner.blog/author/ryanrauner/;https;ryanrauner.blog;/author/ryanrauner/;;;ryanrauner;192.0.78.240;geolocation;{};US;United States;California;Santa Monica;-118.44526672363281;33.97785186767578;192.0.78.240;Ryan Rauner, CCIM – Ryan Rauner's Real Estate Blog;Many force majeure events like a natural disaster, i.e. hurricane, are limited in ... the area has one the largest concentrations of software engineers in the nation, ...
117;2020-10-07;ReactJS Developers are in Demand-2020-21 – Slacker News;Oct 7, 2020 — Facebook · courses, Onlinetraining, react, react-native, software- ...;https://slacker.ro/2020/10/07/reactjs-developers-are-in-demand-2020-21/;https;slacker.ro;/2020/10/07/reactjs-developers-are-in-demand-2020-21/;;;slacker;172.67.132.112;geolocation;{};US;United States;California;San Francisco;-122.39286041259766;37.76784896850586;172.67.132.112;ReactJS Developers are in Demand-2020-21 – Slacker News;Oct 7, 2020 — Facebook · courses, Onlinetraining, react, react-native, software- ...
118;2020-10-07;Delaware Network Experts, IT Outsource, Computer Network ...;... network infrastructure architects, disaster recovery specialists, and certified security ... and affordable quarantine of software development or evaluation systems ... Augmentation Expertise Wilmington DE 24 Hour Wilmington Work from Home ...;https://www.progent.com/DE.htm;https;www.progent.com;/DE.htm;;;progent;162.211.28.140;geolocation;{};US;United States;California;San Jose;-121.93639373779297;37.316280364990234;162.211.28.140;Delaware Network Experts, IT Outsource, Computer Network ...;... network infrastructure architects, disaster recovery specialists, and certified security ... and affordable quarantine of software development or evaluation systems ... Augmentation Expertise Wilmington DE 24 Hour Wilmington Work from Home ...
119;2020-10-07;Software Engineer work from home Job in North Myrtle Beach ...;It is Work from Home (WFH), anywhere in the USA. ... and performance, plan and execute disaster recovery procedures, and provide Tier II technical support. ... Required minimum of 5-7 years of software development experience required.;https://www.jobilize.com/job/software-engineer-work-from-home-north-myrtle-beach-american-red-cross;https;www.jobilize.com;/job/software-engineer-work-from-home-north-myrtle-beach-american-red-cross;;;jobilize;207.38.87.179;geolocation;{};US;United States;Arizona;Scottsdale;-111.89010620117188;33.610958099365234;207.38.87.179;Software Engineer work from home Job in North Myrtle Beach ...;It is Work from Home (WFH), anywhere in the USA. ... and performance, plan and execute disaster recovery procedures, and provide Tier II technical support. ... Required minimum of 5-7 years of software development experience required.
120;2020-10-07;Power BI for Epicor Template: Sales Review - 2WTech : 2WTech;Oct 7, 2020 — ... Azure VMs, Azure VPN Gateway, BaaS, Backup, Backup and Disaster Recovery ... continuity, Digital Manufacturing, Digital Manufacturing Trends, digital resilience ... Software Deployment, software development, Software integration ... Work from home policy, Work From Home Policy Checklist, workflows ...;https://2wtech.com/power-bi-for-epicor-template-sales-review/;https;2wtech.com;/power-bi-for-epicor-template-sales-review/;;;2wtech;151.101.66.159;geolocation;{};US;United States;California;San Francisco;-122.39286041259766;37.76784896850586;151.101.66.159;Power BI for Epicor Template: Sales Review - 2WTech : 2WTech;Oct 7, 2020 — ... Azure VMs, Azure VPN Gateway, BaaS, Backup, Backup and Disaster Recovery ... continuity, Digital Manufacturing, Digital Manufacturing Trends, digital resilience ... Software Deployment, software development, Software integration ... Work from home policy, Work From Home Policy Checklist, workflows ...
