;date;header;summary;link;protocol;domain;path;query;fragment;host_name;ip_address;Type;AdditionalData;CountryCode;CountryName;State;City;Longitude;Latitude;IpAddress;header_context_true;summary_context_true
0;2020-07-26;Future Of Work: Quantified Workplaces & AI-Powered ...;Jul 27, 2020 — ... a large number of people to work from home, the remote working trend was picking ... per cent of the entire workforce will work from home at least a couple of times per ... help them develop their skills, and support their wellbeing and resilience. ... Insights to Agile Methodologies for Software Development.;https://www.experfy.com/blog/the-future-of-work-is-all-about-quantified-workplaces-and-ai-powered-recruitment/;https;www.experfy.com;/blog/the-future-of-work-is-all-about-quantified-workplaces-and-ai-powered-recruitment/;;;experfy;172.67.70.199;geolocation;{};US;United States;California;San Francisco;-122.39286041259766;37.76784896850586;172.67.70.199;Future Of Work: Quantified Workplaces & AI-Powered ...;Jul 27, 2020 — ... a large number of people to work from home, the remote working trend was picking ... per cent of the entire workforce will work from home at least a couple of times per ... help them develop their skills, and support their wellbeing and resilience. ... Insights to Agile Methodologies for Software Development.
1;2020-07-26;Education during COVID-19: the Commonwealth response;build the resilience of educational systems in the face of pandemics and climate ... software development job at a private company to take care of her newborn ...;http://oasis.col.org/bitstream/handle/11599/3626/PDF?sequence=1&isAllowed=y;http;oasis.col.org;/bitstream/handle/11599/3626/PDF;sequence=1&isAllowed=y;;col;54.245.252.98;geolocation;{};US;United States;Oregon;Boardman;-119.6989974975586;45.83599853515625;54.245.252.98;Education during COVID-19: the Commonwealth response;build the resilience of educational systems in the face of pandemics and climate ... software development job at a private company to take care of her newborn ...
2;2020-07-26;Villa College - Turning Problems into Opportunities, finding ...;... know having people who work from home in a how come we support them ... up from the IT software ...;https://www.facebook.com/villacollege.edu.mv/videos/turning-problems-into-opportunities-finding-success-in-a-vuca-world/295071844901010/;https;www.facebook.com;/villacollege.edu.mv/videos/turning-problems-into-opportunities-finding-success-in-a-vuca-world/295071844901010/;;;facebook;157.240.18.35;geolocation;{};US;United States;California;Menlo Park;-122.1860580444336;37.45903015136719;157.240.18.35;Villa College - Turning Problems into Opportunities, finding ...;... know having people who work from home in a how come we support them ... up from the IT software ...
3;2020-07-26;New Zealand enshrines civil service principles in law ...;Jul 27, 2020 — ... Skills and Systems for Remote Working – On Demand Webinar · Submit Jobs ... Global resilience has taken a hit – these countries will bear the brunt ... is now the preferred method for most software development and digital ...;https://www.globalgovernmentforum.com/new-zealand-enshrines-civil-service-principles-in-law/;https;www.globalgovernmentforum.com;/new-zealand-enshrines-civil-service-principles-in-law/;;;globalgovernmentforum;172.67.70.64;geolocation;{};US;United States;California;San Francisco;-122.39286041259766;37.76784896850586;172.67.70.64;New Zealand enshrines civil service principles in law ...;Jul 27, 2020 — ... Skills and Systems for Remote Working – On Demand Webinar · Submit Jobs ... Global resilience has taken a hit – these countries will bear the brunt ... is now the preferred method for most software development and digital ...
4;2020-07-26;Information Technology Specialist (Support) job opening with ...;Jul 27, 2020 — Responsibilities. You will have broad areas of responsibility, including Network Administrations, System Administration, IT Security, Disaster ...;https://employzone.com/job-view/us-ut-logan/information-technology-specialist-support/centeva/3115873514?ez_source=alert&ez_campaign=daily-alert&ez_medium=azcs;https;employzone.com;/job-view/us-ut-logan/information-technology-specialist-support/centeva/3115873514;ez_source=alert&ez_campaign=daily-alert&ez_medium=azcs;;employzone;104.26.13.19;geolocation;{};US;United States;California;San Jose;-121.83822631835938;37.330528259277344;104.26.13.19;Information Technology Specialist (Support) job opening with ...;Jul 27, 2020 — Responsibilities. You will have broad areas of responsibility, including Network Administrations, System Administration, IT Security, Disaster ...
5;2020-07-26;IDWR Strategic Plan - Idaho Department of Water Resources;prioritizing software development projects by December 31, 2020. Goal 4, Objective 2: ... Plan (COOP) and Disaster Recovery Plan. (DRP) and ... Acquire permanent VPN and RDP licensing to support agency-wide remote working capabilities ...;https://idwr.idaho.gov/files/general/IDWR-Strategic-Plan.pdf;https;idwr.idaho.gov;/files/general/IDWR-Strategic-Plan.pdf;;;idaho;164.165.228.91;geolocation;{};US;United States;Idaho;Eagle;-116.21330261230469;43.727779388427734;164.165.228.91;IDWR Strategic Plan - Idaho Department of Water Resources;prioritizing software development projects by December 31, 2020. Goal 4, Objective 2: ... Plan (COOP) and Disaster Recovery Plan. (DRP) and ... Acquire permanent VPN and RDP licensing to support agency-wide remote working capabilities ...
6;2020-07-26;Protect You Web Server From Hackers - Network Systems ...;... Software Development Asterisk Solutions Call Recording Solutions Disaster Planning Open ... Branch VPN/Remote Working ... NET Software Development ...;http://network-systems-solutions.com/webattackers.php?drilldown=185.31.163.237;http;network-systems-solutions.com;/webattackers.php;drilldown=185.31.163.237;;network-systems-solutions;162.222.184.250;geolocation;{};US;United States;California;Los Angeles;-118.26486206054688;34.05284881591797;162.222.184.250;Protect You Web Server From Hackers - Network Systems ...;... Software Development Asterisk Solutions Call Recording Solutions Disaster Planning Open ... Branch VPN/Remote Working ... NET Software Development ...
7;2020-07-26;Protect You Web Server From Hackers - Network Systems ...;... Software Development Asterisk Solutions Call Recording Solutions Disaster Planning Open ... Branch VPN/Remote Working ... NET Software Development ...;http://network-systems-solutions.com/webattackers.php?drilldown=185.31.163.237;http;network-systems-solutions.com;/webattackers.php;drilldown=185.31.163.237;;network-systems-solutions;162.222.184.250;geolocation;{};US;United States;California;Los Angeles;-118.26486206054688;34.05284881591797;162.222.184.250;Protect You Web Server From Hackers - Network Systems ...;... Software Development Asterisk Solutions Call Recording Solutions Disaster Planning Open ... Branch VPN/Remote Working ... NET Software Development ...
8;2020-07-26;Customer engagement saw dramatic decline across the ...;Jul 26, 2020 — ... are engaging with customers – from implementing remote working capabilities and integrating disparate digital communications channels, ...;https://uktechnews.co.uk/2020/07/26/customer-engagement-saw-dramatic-decline-across-the-economy-during-covid-19-lockdown-according-to-research-from-content-guru/;https;uktechnews.co.uk;/2020/07/26/customer-engagement-saw-dramatic-decline-across-the-economy-during-covid-19-lockdown-according-to-research-from-content-guru/;;;co;104.18.57.251;geolocation;{};US;United States;California;San Jose;-121.83822631835938;37.330528259277344;104.18.57.251;Customer engagement saw dramatic decline across the ...;Jul 26, 2020 — ... are engaging with customers – from implementing remote working capabilities and integrating disparate digital communications channels, ...
9;2020-07-26;Logistics technology in the new normal | SHD Logistics;Jul 27, 2020 — In the new normal, remote working and an increase in automation is going ... going to find your maintenance engineers are software engineers.;https://www.shdlogistics.com/machine-learning-ai/logistics-technology-new-normal;https;www.shdlogistics.com;/machine-learning-ai/logistics-technology-new-normal;;;shdlogistics;13.249.134.72;geolocation;{};US;United States;Illinois;Chicago;-87.67124938964844;41.84885025024414;13.249.134.72;Logistics technology in the new normal | SHD Logistics;Jul 27, 2020 — In the new normal, remote working and an increase in automation is going ... going to find your maintenance engineers are software engineers.
10;2020-07-26;Network Engineer (Temporary/6 Month Contract) job in ...;Jul 26, 2020 — Your primary duties will include maintenance of computer networks, hardware, software, and other related systems, performing disaster ...;https://lensa.com/network-engineer-temporary6-month-contract-jobs/brentwood/jd/83352324f6be7ecf9a002fc46fc4d094;https;lensa.com;/network-engineer-temporary6-month-contract-jobs/brentwood/jd/83352324f6be7ecf9a002fc46fc4d094;;;lensa;54.205.78.42;geolocation;{};US;United States;Virginia;Ashburn;-77.47419738769531;39.043701171875;54.205.78.42;Network Engineer (Temporary/6 Month Contract) job in ...;Jul 26, 2020 — Your primary duties will include maintenance of computer networks, hardware, software, and other related systems, performing disaster ...
11;2020-07-26;What's the 80/20 rule in business? Are you doing it right? -;"Jul 27, 2020 — 20% of customers equal 80% of sales; 20% of the marketing efforts represent 80% of the results; 20% of software development efforts account ...";https://realbusiness.co.uk/80-20-rule/;https;realbusiness.co.uk;/80-20-rule/;;;co;35.242.137.186;geolocation;{};GB;United Kingdom;England;Acton;-0.22777999937534332;51.49610900878906;35.242.137.186;What's the 80/20 rule in business? Are you doing it right? -;"Jul 27, 2020 — 20% of customers equal 80% of sales; 20% of the marketing efforts represent 80% of the results; 20% of software development efforts account ..."
12;2020-07-26;Protect You Web Server From Hackers - Network Systems ...;... Software Development E-Mail Compliance Asterisk Solutions Data Recovery Open ... Continuity/Disaster Recovery Planning ... Branch VPN/Remote Working.;http://www.networksystemssolutions.info/webattackers.php?drilldown=45.132.242.110;http;www.networksystemssolutions.info;/webattackers.php;drilldown=45.132.242.110;;networksystemssolutions;162.222.184.250;geolocation;{};US;United States;California;Los Angeles;-118.26486206054688;34.05284881591797;162.222.184.250;Protect You Web Server From Hackers - Network Systems ...;... Software Development E-Mail Compliance Asterisk Solutions Data Recovery Open ... Continuity/Disaster Recovery Planning ... Branch VPN/Remote Working.
13;2020-07-26;Protect You Web Server From Hackers - Network Systems ...;... Software Development E-Mail Compliance Asterisk Solutions Data Recovery Open ... Continuity/Disaster Recovery Planning ... Branch VPN/Remote Working.;http://www.networksystemssolutions.info/webattackers.php?drilldown=45.132.242.110;http;www.networksystemssolutions.info;/webattackers.php;drilldown=45.132.242.110;;networksystemssolutions;162.222.184.250;geolocation;{};US;United States;California;Los Angeles;-118.26486206054688;34.05284881591797;162.222.184.250;Protect You Web Server From Hackers - Network Systems ...;... Software Development E-Mail Compliance Asterisk Solutions Data Recovery Open ... Continuity/Disaster Recovery Planning ... Branch VPN/Remote Working.
14;2020-07-26;Australia issues new cloud computing guidelines;Jul 27, 2020 — ... comes after the expiry of the government's cloud services certification programme, will help to bolster Australia's cyber security resilience.;https://www.computerweekly.com/news/252486669/Australia-issues-new-cloud-computing-guidelines;https;www.computerweekly.com;/news/252486669/Australia-issues-new-cloud-computing-guidelines;;;computerweekly;206.19.49.153;geolocation;{};US;United States;Louisiana;Reddell;-92.42642211914062;30.675010681152344;206.19.49.153;Australia issues new cloud computing guidelines;Jul 27, 2020 — ... comes after the expiry of the government's cloud services certification programme, will help to bolster Australia's cyber security resilience.
15;2020-07-26;Australia issues new cloud computing guidelines;Jul 27, 2020 — ... comes after the expiry of the government's cloud services certification programme, will help to bolster Australia's cyber security resilience.;https://www.computerweekly.com/news/252486669/Australia-issues-new-cloud-computing-guidelines;https;www.computerweekly.com;/news/252486669/Australia-issues-new-cloud-computing-guidelines;;;computerweekly;206.19.49.153;geolocation;{};US;United States;Louisiana;Reddell;-92.42642211914062;30.675010681152344;206.19.49.153;Australia issues new cloud computing guidelines;Jul 27, 2020 — ... comes after the expiry of the government's cloud services certification programme, will help to bolster Australia's cyber security resilience.
16;2020-07-26;Treehouse Festival | Hopin;Jul 27, 2020 — Building Career Resilience During the Pandemic ... How to Work From Home Effectively ... Software Development Instructor at Treehouse.;https://hopin.to/events/treehouse-festival?ref=33a152777f21;https;hopin.to;/events/treehouse-festival;ref=33a152777f21;;hopin;104.18.13.50;geolocation;{};US;United States;California;San Jose;-121.83822631835938;37.330528259277344;104.18.13.50;Treehouse Festival | Hopin;Jul 27, 2020 — Building Career Resilience During the Pandemic ... How to Work From Home Effectively ... Software Development Instructor at Treehouse.
17;2020-07-26;Open-Source Raspberry Tablet CutiePi Lets Developers ...;Jul 26, 2020 — ... and Firmware. Development · Discover QCon Plus by InfoQ: A Virtual Conference for Senior Software Engineers and Architects (Nov 4-18) ...;https://www.infoq.com/news/2020/07/raspberry-tablet-cutiepi-open/;https;www.infoq.com;/news/2020/07/raspberry-tablet-cutiepi-open/;;;infoq;199.119.126.68;geolocation;{};US;United States;Missouri;Clayton;-90.1923828125;38.631370544433594;199.119.126.68;Open-Source Raspberry Tablet CutiePi Lets Developers ...;Jul 26, 2020 — ... and Firmware. Development · Discover QCon Plus by InfoQ: A Virtual Conference for Senior Software Engineers and Architects (Nov 4-18) ...
18;2020-07-26;CrowdStrike uncovers key cybersecurity findings following ...;Jul 27, 2020 — The importance of data resilience in the current cybersecurity climate ... Juniper Networks expands security offering for remote working. Juniper Networks has launched new solutions to enhance work from home security. ... PagerDuty was born from the idea that software development and operations could ...;https://itbrief.co.nz/story/crowdstrike-uncovers-key-cybersecurity-findings-following-covid-19;https;itbrief.co.nz;/story/crowdstrike-uncovers-key-cybersecurity-findings-following-covid-19;;;co;113.21.226.180;geolocation;{};NZ;New Zealand;Auckland;Auckland;174.6802978515625;-36.78810119628906;113.21.226.180;CrowdStrike uncovers key cybersecurity findings following ...;Jul 27, 2020 — The importance of data resilience in the current cybersecurity climate ... Juniper Networks expands security offering for remote working. Juniper Networks has launched new solutions to enhance work from home security. ... PagerDuty was born from the idea that software development and operations could ...
19;2020-07-26;CrowdStrike uncovers key cybersecurity findings following ...;Jul 27, 2020 — The importance of data resilience in the current cybersecurity climate ... Juniper Networks expands security offering for remote working. Juniper Networks has launched new solutions to enhance work from home security. ... PagerDuty was born from the idea that software development and operations could ...;https://itbrief.co.nz/story/crowdstrike-uncovers-key-cybersecurity-findings-following-covid-19;https;itbrief.co.nz;/story/crowdstrike-uncovers-key-cybersecurity-findings-following-covid-19;;;co;113.21.226.180;geolocation;{};NZ;New Zealand;Auckland;Auckland;174.6802978515625;-36.78810119628906;113.21.226.180;CrowdStrike uncovers key cybersecurity findings following ...;Jul 27, 2020 — The importance of data resilience in the current cybersecurity climate ... Juniper Networks expands security offering for remote working. Juniper Networks has launched new solutions to enhance work from home security. ... PagerDuty was born from the idea that software development and operations could ...
20;2020-07-26;Computer Science Jobs, Employment in Omi, NY | Indeed.com;Software Development Intern. Harris Computer Systems3.3. Albany, NY. 11 days ago ... Disaster Project Coordinator. The Research Foundation for The State ...;https://www.indeed.com/q-Computer-Science-l-Omi,-NY-jobs.html;https;www.indeed.com;/q-Computer-Science-l-Omi,-NY-jobs.html;;;indeed;3.17.53.43;geolocation;{};US;United States;Ohio;Columbus;-82.99945831298828;39.99557876586914;3.17.53.43;Computer Science Jobs, Employment in Omi, NY | Indeed.com;Software Development Intern. Harris Computer Systems3.3. Albany, NY. 11 days ago ... Disaster Project Coordinator. The Research Foundation for The State ...
21;2020-07-26;Pivot or perish: Indian companies rethink business models to ...;Jul 27, 2020 — Remote Working—The new future of work in a post-pandemic world ... doing great in pre-COVID era, but it is time of crisis which highlights its resilience. ... challenge to shift entire online infrastructure to an agile work from home mode. ... app or software development processes, and modern developer tools.;https://smefutures.com/pivot-or-perish-indian-companies-rethink-business-models-to-thrive-during-post-covid-19-world/;https;smefutures.com;/pivot-or-perish-indian-companies-rethink-business-models-to-thrive-during-post-covid-19-world/;;;smefutures;15.207.150.80;geolocation;{};IN;India;Maharashtra;Powai;72.87770080566406;19.076000213623047;15.207.150.80;Pivot or perish: Indian companies rethink business models to ...;Jul 27, 2020 — Remote Working—The new future of work in a post-pandemic world ... doing great in pre-COVID era, but it is time of crisis which highlights its resilience. ... challenge to shift entire online infrastructure to an agile work from home mode. ... app or software development processes, and modern developer tools.
22;2020-07-26;Heroes of Hardship: How Enterprises Can Rethink Human ...;In a world where large-scale remote working and contingent workforces may be the ... management, software development, consulting and managed services.;https://www.wipro.com/blogs/bill-stith/heroes-of-hardship-how-enterprises-can-rethink-human-centricity-in-times-of-crisis/;https;www.wipro.com;/blogs/bill-stith/heroes-of-hardship-how-enterprises-can-rethink-human-centricity-in-times-of-crisis/;;;wipro;99.86.230.37;geolocation;{};US;United States;Washington;Shaw;-77.02839660644531;38.906898498535156;99.86.230.37;Heroes of Hardship: How Enterprises Can Rethink Human ...;In a world where large-scale remote working and contingent workforces may be the ... management, software development, consulting and managed services.
23;2020-07-26;Cloud Azure Engineer - IT Disaster Recovery/IaaS/PaaS (4-6 ...;Jul 27, 2020 — Cloud Azure Engineer - IT Disaster Recovery/IaaS/PaaS (4-6 yrs) ... Infrastructure,PaaS,IaaS,IT Disaster Recovery,CommVault,Windows OS ... Lending Kart - Software Development Engineer II - Java ... May work from home.;https://www.hirist.com/j/cloud-azure-engineer-it-disaster-recoveryiaaspaas-4-6-yrs-621613.html?ref=cl;https;www.hirist.com;/j/cloud-azure-engineer-it-disaster-recoveryiaaspaas-4-6-yrs-621613.html;ref=cl;;hirist;13.233.235.167;geolocation;{};IN;India;Maharashtra;Powai;72.87770080566406;19.076000213623047;13.233.235.167;Cloud Azure Engineer - IT Disaster Recovery/IaaS/PaaS (4-6 ...;Jul 27, 2020 — Cloud Azure Engineer - IT Disaster Recovery/IaaS/PaaS (4-6 yrs) ... Infrastructure,PaaS,IaaS,IT Disaster Recovery,CommVault,Windows OS ... Lending Kart - Software Development Engineer II - Java ... May work from home.
24;2020-07-26;Remote work leads to 'transformative' growth for virtual ...;Jul 27, 2020 — The importance of data resilience in the current cybersecurity climate ... of calling setup, remote working capability, and significant cost savings.More ... PagerDuty was born from the idea that software development and ... Juniper Networks has launched new solutions to enhance work from home security.;https://itbrief.com.au/story/remote-work-leads-to-transformative-growth-for-virtual-meeting-solutions;https;itbrief.com.au;/story/remote-work-leads-to-transformative-growth-for-virtual-meeting-solutions;;;com;113.21.226.180;geolocation;{};NZ;New Zealand;Auckland;Auckland;174.6802978515625;-36.78810119628906;113.21.226.180;Remote work leads to 'transformative' growth for virtual ...;Jul 27, 2020 — The importance of data resilience in the current cybersecurity climate ... of calling setup, remote working capability, and significant cost savings.More ... PagerDuty was born from the idea that software development and ... Juniper Networks has launched new solutions to enhance work from home security.
25;2020-07-26;Remote work leads to 'transformative' growth for virtual ...;Jul 27, 2020 — The importance of data resilience in the current cybersecurity climate ... of calling setup, remote working capability, and significant cost savings.More ... PagerDuty was born from the idea that software development and ... Juniper Networks has launched new solutions to enhance work from home security.;https://itbrief.com.au/story/remote-work-leads-to-transformative-growth-for-virtual-meeting-solutions;https;itbrief.com.au;/story/remote-work-leads-to-transformative-growth-for-virtual-meeting-solutions;;;com;113.21.226.180;geolocation;{};NZ;New Zealand;Auckland;Auckland;174.6802978515625;-36.78810119628906;113.21.226.180;Remote work leads to 'transformative' growth for virtual ...;Jul 27, 2020 — The importance of data resilience in the current cybersecurity climate ... of calling setup, remote working capability, and significant cost savings.More ... PagerDuty was born from the idea that software development and ... Juniper Networks has launched new solutions to enhance work from home security.
26;2020-07-26;Principal Active Directory Engineer - Relocate to Austin, TX ...;Jul 27, 2020 — We are open to consider/discuss remote work from home situations. ... Posted 3 hours ago Software Development Engineer ... Security Operations and Resilience, Application Security and Vulnerability Management.Posted 3 ...;https://jobsearcher.com/j/principal-active-directory-engineer-relocate-to-austin-tx-at-whole-foods-market-in-austin-texas-RQL7QD;https;jobsearcher.com;/j/principal-active-directory-engineer-relocate-to-austin-tx-at-whole-foods-market-in-austin-texas-RQL7QD;;;jobsearcher;35.172.252.65;geolocation;{};US;United States;Virginia;Ashburn;-77.47419738769531;39.043701171875;35.172.252.65;Principal Active Directory Engineer - Relocate to Austin, TX ...;Jul 27, 2020 — We are open to consider/discuss remote work from home situations. ... Posted 3 hours ago Software Development Engineer ... Security Operations and Resilience, Application Security and Vulnerability Management.Posted 3 ...
27;2020-07-26;The present-focused, future-ready R&D organization | McKinsey;Jul 27, 2020 — Agile Organizations · Innovating Europe · Artificial Intelligence · Business Resilience ... Embedding software development within existing departments. ... not only software engineers but also hardware engineers from the steering, ... are hearing is: how does all of this work in a remote working environment?;https://www.mckinsey.com/business-functions/operations/our-insights/the-present-focused-future-ready-rd-organization;https;www.mckinsey.com;/business-functions/operations/our-insights/the-present-focused-future-ready-rd-organization;;;mckinsey;23.44.165.146;geolocation;{};US;United States;Illinois;Chicago;-87.67124938964844;41.84885025024414;23.44.165.146;The present-focused, future-ready R&D organization | McKinsey;Jul 27, 2020 — Agile Organizations · Innovating Europe · Artificial Intelligence · Business Resilience ... Embedding software development within existing departments. ... not only software engineers but also hardware engineers from the steering, ... are hearing is: how does all of this work in a remote working environment?
28;2020-07-26;SAP Q2 2020 results: SAP partially divests Qualtrics as ...;Jul 27, 2020 — Microsoft results show impact of tech-driven business resilience. Amazon commits to reinvesting $4bn of projected second-quarter profit into ...;https://www.computerweekly.com/news/252486681/SAP-Q2-2020-results-SAP-partially-divests-Qualtrics-as-positive-results-posted-against-Covid-crisis;https;www.computerweekly.com;/news/252486681/SAP-Q2-2020-results-SAP-partially-divests-Qualtrics-as-positive-results-posted-against-Covid-crisis;;;computerweekly;206.19.49.153;geolocation;{};US;United States;Louisiana;Reddell;-92.42642211914062;30.675010681152344;206.19.49.153;SAP Q2 2020 results: SAP partially divests Qualtrics as ...;Jul 27, 2020 — Microsoft results show impact of tech-driven business resilience. Amazon commits to reinvesting $4bn of projected second-quarter profit into ...
