;date;header;summary;link;protocol;domain;path;query;fragment;host_name;ip_address;Type;AdditionalData;CountryCode;CountryName;State;City;Longitude;Latitude;IpAddress;header_context_true;summary_context_true
31;2020-07-21;Our Blog - AtNetPlus;Jul 21, 2020 — Does Your Business Have an Emergency “Work from Home” Strategy? In response to COVID-19 (Coronavirus), some businesses and schools ...;https://atnetplus.com/our-blog/;https;atnetplus.com;/our-blog/;;;atnetplus;35.208.136.153;geolocation;{};US;United States;Iowa;Council Bluffs;-95.87735748291016;41.23295974731445;35.208.136.153;Our Blog - AtNetPlus;Jul 21, 2020 — Does Your Business Have an Emergency “Work from Home” Strategy? In response to COVID-19 (Coronavirus), some businesses and schools ...
32;2020-07-21;How A Disaster Recovery Strategy Can Safeguard Your ...;Jul 21, 2020 — Here's how TMB is keeping its customers IT services safe from disaster recovery with a proactive approach to disaster management - contact us ...;https://blog.tmb.co.uk/safeguard-your-business-with-disaster-recovery-strategy;https;blog.tmb.co.uk;/safeguard-your-business-with-disaster-recovery-strategy;;;co;104.17.129.180;geolocation;{};US;United States;California;San Jose;-121.83822631835938;37.330528259277344;104.17.129.180;How A Disaster Recovery Strategy Can Safeguard Your ...;Jul 21, 2020 — Here's how TMB is keeping its customers IT services safe from disaster recovery with a proactive approach to disaster management - contact us ...
33;2020-07-21;Work-from-Home Unleashes Nightmare for Office Landlords ...;Jul 22, 2020 — The whirlwind of the shift to work-from-home is hitting businesses such ... thinking when they outsourced the 737 MAX software development.;https://wolfstreet.com/2020/07/22/work-from-home-unleashes-nightmare-for-office-landlords-surrounding-businesses/;https;wolfstreet.com;/2020/07/22/work-from-home-unleashes-nightmare-for-office-landlords-surrounding-businesses/;;;wolfstreet;64.131.77.113;geolocation;{};US;United States;Virginia;Manassas;-77.53645324707031;38.7936897277832;64.131.77.113;Work-from-Home Unleashes Nightmare for Office Landlords ...;Jul 22, 2020 — The whirlwind of the shift to work-from-home is hitting businesses such ... thinking when they outsourced the 737 MAX software development.
34;2020-07-21;40 Legit Companies That Will Pay You To Work From Home;Jul 22, 2020 — Note that job listings change constantly, and some work-from-home ... Examples of positions available: Software development engineer, senior ...;https://www.yahoo.com/news/40-legit-companies-pay-home-090340602.html;https;www.yahoo.com;/news/40-legit-companies-pay-home-090340602.html;;;yahoo;74.6.231.20;geolocation;{};US;United States;New York;Manhattan;-73.9884033203125;40.73139190673828;74.6.231.20;40 Legit Companies That Will Pay You To Work From Home;Jul 22, 2020 — Note that job listings change constantly, and some work-from-home ... Examples of positions available: Software development engineer, senior ...
35;2020-07-21;Microsoft's secret cloud sales army - Protocol;Jul 22, 2020 — Will the pandemic usher in a new era of remote working, or will we all come back ... which barely anyone in the U.S. is using to track this ongoing disaster. ... software development practices designed around cloud computing.;https://www.protocol.com/newsletters/cloud/microsofts-secret-cloud-sales-army;https;www.protocol.com;/newsletters/cloud/microsofts-secret-cloud-sales-army;;;protocol;151.101.1.68;geolocation;{};US;United States;California;San Francisco;-122.39286041259766;37.76784896850586;151.101.1.68;Microsoft's secret cloud sales army - Protocol;Jul 22, 2020 — Will the pandemic usher in a new era of remote working, or will we all come back ... which barely anyone in the U.S. is using to track this ongoing disaster. ... software development practices designed around cloud computing.
36;2020-07-21;New opportunities for Nordic startups post-Covid-19 as virtual ...;Jul 22, 2020 — ... make remote working a permanent setup, following the lead of global ... who have said they'll allow employees to work from home 'forever' if ...;https://www.computerweekly.com/news/252486484/New-opportunities-for-Nordic-startups-post-Covid-19-as-virtual-offices-become-the-norm;https;www.computerweekly.com;/news/252486484/New-opportunities-for-Nordic-startups-post-Covid-19-as-virtual-offices-become-the-norm;;;computerweekly;206.19.49.153;geolocation;{};US;United States;Louisiana;Reddell;-92.42642211914062;30.675010681152344;206.19.49.153;New opportunities for Nordic startups post-Covid-19 as virtual ...;Jul 22, 2020 — ... make remote working a permanent setup, following the lead of global ... who have said they'll allow employees to work from home 'forever' if ...
37;2020-07-21;New opportunities for Nordic startups post-Covid-19 as virtual ...;Jul 22, 2020 — ... make remote working a permanent setup, following the lead of global ... who have said they'll allow employees to work from home 'forever' if ...;https://www.computerweekly.com/news/252486484/New-opportunities-for-Nordic-startups-post-Covid-19-as-virtual-offices-become-the-norm;https;www.computerweekly.com;/news/252486484/New-opportunities-for-Nordic-startups-post-Covid-19-as-virtual-offices-become-the-norm;;;computerweekly;206.19.49.153;geolocation;{};US;United States;Louisiana;Reddell;-92.42642211914062;30.675010681152344;206.19.49.153;New opportunities for Nordic startups post-Covid-19 as virtual ...;Jul 22, 2020 — ... make remote working a permanent setup, following the lead of global ... who have said they'll allow employees to work from home 'forever' if ...
38;2020-07-21;What Is The Cloud And Why Is It Important? - AIS-now.com;Jul 21, 2020 — It can also be used for email, disaster recovery, data back up, virtual desktops, software development and testing, analytics, and ...;https://www.ais-now.com/blog/what-is-the-cloud-why-important;https;www.ais-now.com;/blog/what-is-the-cloud-why-important;;;ais-now;104.17.127.180;geolocation;{};US;United States;California;San Jose;-121.83822631835938;37.330528259277344;104.17.127.180;What Is The Cloud And Why Is It Important? - AIS-now.com;Jul 21, 2020 — It can also be used for email, disaster recovery, data back up, virtual desktops, software development and testing, analytics, and ...
39;2020-07-21;Tech skills are needed now more than ever, but companies ...;Jul 21, 2020 — There is also a crucial need to build resilience for potential future ... in areas such as Cloud Architecture, Software Development and Systems Analysts ... onboarding experience and investing in remote working capabilities will ...;https://www.itproportal.com/features/tech-skills-are-needed-now-more-than-ever-but-companies-must-embrace-flexibility-to-prosper/;https;www.itproportal.com;/features/tech-skills-are-needed-now-more-than-ever-but-companies-must-embrace-flexibility-to-prosper/;;;itproportal;52.88.76.30;geolocation;{};US;United States;Oregon;Boardman;-119.6989974975586;45.83599853515625;52.88.76.30;Tech skills are needed now more than ever, but companies ...;Jul 21, 2020 — There is also a crucial need to build resilience for potential future ... in areas such as Cloud Architecture, Software Development and Systems Analysts ... onboarding experience and investing in remote working capabilities will ...
40;2020-07-21;5 Things the Coronavirus Forced the World to Learn About ...;3: It's improving productivity! This sounds like something employees would say to convince their bosses to let them work from home, so that they can sleep in until ...;https://medium.com/swlh/5-things-the-coronavirus-forced-the-world-to-learn-about-remote-work-66dc6efcaf04;https;medium.com;/swlh/5-things-the-coronavirus-forced-the-world-to-learn-about-remote-work-66dc6efcaf04;;;medium;104.16.124.127;geolocation;{};US;United States;California;San Jose;-121.83822631835938;37.330528259277344;104.16.124.127;5 Things the Coronavirus Forced the World to Learn About ...;3: It's improving productivity! This sounds like something employees would say to convince their bosses to let them work from home, so that they can sleep in until ...
41;2020-07-21;Telework and Remote Work Suitability Guide - Human ...;interested in teleworking/remote working. ▫ Step 3: Manager Responsibility to Ensure Telework & Remote. Work Success. ▫ Step 4: Ensure Telework Success ...;https://www.hr.vt.edu/content/dam/hr_vt_edu/fall-2020-ready-documents/Telework_Remote_Work_Suitability_Guide.pdf;https;www.hr.vt.edu;/content/dam/hr_vt_edu/fall-2020-ready-documents/Telework_Remote_Work_Suitability_Guide.pdf;;;vt;198.82.215.14;geolocation;{};US;United States;Virginia;Blacksburg;-80.41490173339844;37.228599548339844;198.82.215.14;Telework and Remote Work Suitability Guide - Human ...;interested in teleworking/remote working. ▫ Step 3: Manager Responsibility to Ensure Telework & Remote. Work Success. ▫ Step 4: Ensure Telework Success ...
42;2020-07-21;M&A and divestment | Transformation | Cutover;Operational resilience / ... 17 systems, 458 releases, 20 million lines of code, and $140 million spent on software development. ... remote working COVID-19.;https://www.cutover.com/transformation/divestment-programs;https;www.cutover.com;/transformation/divestment-programs;;;cutover;104.17.136.180;geolocation;{};US;United States;Florida;Flagami;-80.31195831298828;25.762859344482422;104.17.136.180;M&A and divestment | Transformation | Cutover;Operational resilience / ... 17 systems, 458 releases, 20 million lines of code, and $140 million spent on software development. ... remote working COVID-19.
43;2020-07-21;IBM's Q2 tapered by pandemic business recovery;Jul 21, 2020 — CIOs may be asked to automate more and support high levels of remote working. Software developers can work remotely, but if workers are ...;https://www.computerweekly.com/news/252486405/IBMs-Q2-tapered-by-pandemic-business-recovery;https;www.computerweekly.com;/news/252486405/IBMs-Q2-tapered-by-pandemic-business-recovery;;;computerweekly;206.19.49.153;geolocation;{};US;United States;Louisiana;Reddell;-92.42642211914062;30.675010681152344;206.19.49.153;IBM's Q2 tapered by pandemic business recovery;Jul 21, 2020 — CIOs may be asked to automate more and support high levels of remote working. Software developers can work remotely, but if workers are ...
44;2020-07-21;IBM's Q2 tapered by pandemic business recovery;Jul 21, 2020 — CIOs may be asked to automate more and support high levels of remote working. Software developers can work remotely, but if workers are ...;https://www.computerweekly.com/news/252486405/IBMs-Q2-tapered-by-pandemic-business-recovery;https;www.computerweekly.com;/news/252486405/IBMs-Q2-tapered-by-pandemic-business-recovery;;;computerweekly;206.19.49.153;geolocation;{};US;United States;Louisiana;Reddell;-92.42642211914062;30.675010681152344;206.19.49.153;IBM's Q2 tapered by pandemic business recovery;Jul 21, 2020 — CIOs may be asked to automate more and support high levels of remote working. Software developers can work remotely, but if workers are ...
45;2020-07-21;Webinar: The role of technology in making (or breaking ...;Jul 22, 2020 — Remote working is here to stay - and employees love it, says GitLab report ... the trend of big brands flocking to South Africa for software development, the ... Juniper Networks has launched new solutions to enhance work from home security. ... Resilience sits at the heart of security, and there is a need for ...;https://remoteworkertech.asia/story/webinar-the-role-of-technology-in-making-or-breaking-employee-engagement;https;remoteworkertech.asia;/story/webinar-the-role-of-technology-in-making-or-breaking-employee-engagement;;;remoteworkertech;113.21.226.180;geolocation;{};NZ;New Zealand;Auckland;Auckland;174.6802978515625;-36.78810119628906;113.21.226.180;Webinar: The role of technology in making (or breaking ...;Jul 22, 2020 — Remote working is here to stay - and employees love it, says GitLab report ... the trend of big brands flocking to South Africa for software development, the ... Juniper Networks has launched new solutions to enhance work from home security. ... Resilience sits at the heart of security, and there is a need for ...
46;2020-07-21;Webinar: The role of technology in making (or breaking ...;Jul 22, 2020 — Remote working is here to stay - and employees love it, says GitLab report ... the trend of big brands flocking to South Africa for software development, the ... Juniper Networks has launched new solutions to enhance work from home security. ... Resilience sits at the heart of security, and there is a need for ...;https://remoteworkertech.asia/story/webinar-the-role-of-technology-in-making-or-breaking-employee-engagement;https;remoteworkertech.asia;/story/webinar-the-role-of-technology-in-making-or-breaking-employee-engagement;;;remoteworkertech;113.21.226.180;geolocation;{};NZ;New Zealand;Auckland;Auckland;174.6802978515625;-36.78810119628906;113.21.226.180;Webinar: The role of technology in making (or breaking ...;Jul 22, 2020 — Remote working is here to stay - and employees love it, says GitLab report ... the trend of big brands flocking to South Africa for software development, the ... Juniper Networks has launched new solutions to enhance work from home security. ... Resilience sits at the heart of security, and there is a need for ...
47;2020-07-21;Webinar: The role of technology in making (or breaking ...;Jul 22, 2020 — Remote working is here to stay - and employees love it, says GitLab report ... the trend of big brands flocking to South Africa for software development, the ... Juniper Networks has launched new solutions to enhance work from home security. ... Resilience sits at the heart of security, and there is a need for ...;https://remoteworkertech.asia/story/webinar-the-role-of-technology-in-making-or-breaking-employee-engagement;https;remoteworkertech.asia;/story/webinar-the-role-of-technology-in-making-or-breaking-employee-engagement;;;remoteworkertech;113.21.226.180;geolocation;{};NZ;New Zealand;Auckland;Auckland;174.6802978515625;-36.78810119628906;113.21.226.180;Webinar: The role of technology in making (or breaking ...;Jul 22, 2020 — Remote working is here to stay - and employees love it, says GitLab report ... the trend of big brands flocking to South Africa for software development, the ... Juniper Networks has launched new solutions to enhance work from home security. ... Resilience sits at the heart of security, and there is a need for ...
48;2020-07-21;How Rackspace Technology helps enterprise in need for ...;Jul 21, 2020 — The demand to enforce remote working has seen the importance of agility and the resilience and accessibility of certain IT systems hold ...;https://www.cio.com/article/3567631/how-rackspace-technology-helps-enterprise-in-need-for-speed-and-agility.html;https;www.cio.com;/article/3567631/how-rackspace-technology-helps-enterprise-in-need-for-speed-and-agility.html;;;cio;151.101.2.165;geolocation;{};US;United States;California;San Francisco;-122.39286041259766;37.76784896850586;151.101.2.165;How Rackspace Technology helps enterprise in need for ...;Jul 21, 2020 — The demand to enforce remote working has seen the importance of agility and the resilience and accessibility of certain IT systems hold ...
49;2020-07-21;Architect | Work From Home Jobs - WFH Jobs;Jul 22, 2020 — Work From Home Jobs » Architect at Department of Defense in Sunnyvale, CA ... Experience with customer interaction and software development ... Create and maintain the Disaster Recovery documents related to the AD ...;https://wfhjobs.us/job/architect-at-department-of-defense-in-sunnyvale-ca/;https;wfhjobs.us;/job/architect-at-department-of-defense-in-sunnyvale-ca/;;;wfhjobs;35.244.220.179;geolocation;{};US;United States;Kansas;Prairie Village;-94.53961181640625;39.10771179199219;35.244.220.179;Architect | Work From Home Jobs - WFH Jobs;Jul 22, 2020 — Work From Home Jobs » Architect at Department of Defense in Sunnyvale, CA ... Experience with customer interaction and software development ... Create and maintain the Disaster Recovery documents related to the AD ...
50;2020-07-21;Oracle Announces a Fully-Managed Cloud Region with Cloud ...;Jul 21, 2020 — Remote Working for Tech Workers is Here to Stay ... A virtual conference for senior software engineers and architects on the trends, best ...;https://www.infoq.com/news/2020/07/oracle-cloud-dedicated-region/;https;www.infoq.com;/news/2020/07/oracle-cloud-dedicated-region/;;;infoq;199.119.126.68;geolocation;{};US;United States;Missouri;Clayton;-90.1923828125;38.631370544433594;199.119.126.68;Oracle Announces a Fully-Managed Cloud Region with Cloud ...;Jul 21, 2020 — Remote Working for Tech Workers is Here to Stay ... A virtual conference for senior software engineers and architects on the trends, best ...
51;2020-07-21;Earnings Preview: What To Expect From Microsoft on ... - Forbes;Jul 21, 2020 — The Company's segments include Productivity and Business Processes, Intelligent Cloud and More Personal Computing. The Company's ...;https://www.forbes.com/sites/adamsarhan/2020/07/21/earnings-preview-what-to-expect-from-microsoft-on-wednesday/;https;www.forbes.com;/sites/adamsarhan/2020/07/21/earnings-preview-what-to-expect-from-microsoft-on-wednesday/;;;forbes;151.101.2.49;geolocation;{};US;United States;California;San Francisco;-122.39286041259766;37.76784896850586;151.101.2.49;Earnings Preview: What To Expect From Microsoft on ... - Forbes;Jul 21, 2020 — The Company's segments include Productivity and Business Processes, Intelligent Cloud and More Personal Computing. The Company's ...
52;2020-07-21;Senior Software Engineer | Greenville, SC | iQuasar LLC;Posted 22 hours ago Software Engineer (work from home) (Greenville,SC) ... with ZFS or DRBDExperience with Backup and Disaster Recovery software is a ...;https://jobsearcher.com/j/senior-software-engineer-at-iquasar-llc-in-null-null-J7JRnG;https;jobsearcher.com;/j/senior-software-engineer-at-iquasar-llc-in-null-null-J7JRnG;;;jobsearcher;52.21.160.98;geolocation;{};US;United States;Virginia;Ashburn;-77.47419738769531;39.043701171875;52.21.160.98;Senior Software Engineer | Greenville, SC | iQuasar LLC;Posted 22 hours ago Software Engineer (work from home) (Greenville,SC) ... with ZFS or DRBDExperience with Backup and Disaster Recovery software is a ...
53;2020-07-21;Senior Software Engineer | Greenville, SC | iQuasar LLC;Posted 22 hours ago Software Engineer (work from home) (Greenville,SC) ... with ZFS or DRBDExperience with Backup and Disaster Recovery software is a ...;https://jobsearcher.com/j/senior-software-engineer-at-iquasar-llc-in-null-null-J7JRnG;https;jobsearcher.com;/j/senior-software-engineer-at-iquasar-llc-in-null-null-J7JRnG;;;jobsearcher;52.21.160.98;geolocation;{};US;United States;Virginia;Ashburn;-77.47419738769531;39.043701171875;52.21.160.98;Senior Software Engineer | Greenville, SC | iQuasar LLC;Posted 22 hours ago Software Engineer (work from home) (Greenville,SC) ... with ZFS or DRBDExperience with Backup and Disaster Recovery software is a ...
54;2020-07-21;Useful websites from around the world - UK Jobs;Auto First Aid Kits - Complete safety and disaster preparedness kits to provide full first ... Custom Software Development - IRange is a software development company, that ... Work From Home - Top 25 Rated Work From Home Opportunities.;http://www.ukjobsnet.com/useful-websites;http;www.ukjobsnet.com;/useful-websites;;;ukjobsnet;159.65.86.246;geolocation;{};GB;United Kingdom;England;Pinner;-0.3397200107574463;51.587501525878906;159.65.86.246;Useful websites from around the world - UK Jobs;Auto First Aid Kits - Complete safety and disaster preparedness kits to provide full first ... Custom Software Development - IRange is a software development company, that ... Work From Home - Top 25 Rated Work From Home Opportunities.
55;2020-07-21;22-Jul-2020 Business in BRICS- Biannual Magazine- Vol. 7;Jul 21, 2020 — information technology hardware and software development projects. ... employees to work from home – have performed better than those that ... the BRICS countries may have to reactivate an existing disaster response.;https://www.amity.edu/gurugram/pdf/gurugramnewsletter21july2020.pdf;https;www.amity.edu;/gurugram/pdf/gurugramnewsletter21july2020.pdf;;;amity;3.7.133.214;geolocation;{};IN;India;Maharashtra;Powai;72.87770080566406;19.076000213623047;3.7.133.214;22-Jul-2020 Business in BRICS- Biannual Magazine- Vol. 7;Jul 21, 2020 — information technology hardware and software development projects. ... employees to work from home – have performed better than those that ... the BRICS countries may have to reactivate an existing disaster response.
