;date;header;summary;link;protocol;domain;path;query;fragment;host_name;ip_address;Type;AdditionalData;CountryCode;CountryName;State;City;Longitude;Latitude;IpAddress;header_context_true;summary_context_true
0;2020-08-26;Software Development Solutions Services - Elite Group;Backup and disaster recovery is important in any business. We can work closely with internal IT and system stakeholders to identify current backup policies and ...;https://www.elitegroup.com/cloud-services/software-development/;https;www.elitegroup.com;/cloud-services/software-development/;;;elitegroup;185.207.111.145;geolocation;{};GB;United Kingdom;England;Manchester;-2.2679998874664307;53.45899963378906;185.207.111.145;Software Development Solutions Services - Elite Group;Backup and disaster recovery is important in any business. We can work closely with internal IT and system stakeholders to identify current backup policies and ...
1;2020-08-26;Senior Manager/ Director - Mumbai | Zoek India;We are passionate about further evolving the specific areas of software development, software and network architecture, network operations, and complex cloud ...;http://zoek.co.in/jobs/997202fbfd5c49499d61077842d15752/senior-manager-director-hr-business-partner?fromsearch=true;http;zoek.co.in;/jobs/997202fbfd5c49499d61077842d15752/senior-manager-director-hr-business-partner;fromsearch=true;;co;13.69.68.15;geolocation;{};NL;Netherlands;North Holland;Diemen;4.916999816894531;52.349998474121094;13.69.68.15;Senior Manager/ Director - Mumbai | Zoek India;We are passionate about further evolving the specific areas of software development, software and network architecture, network operations, and complex cloud ...
2;2020-08-26;Find Senior Analyst Run-The-Bank positions with WhatJobs UK;... in non-functional requirements during the Software Development Lifecycle ... Russell Rebalance and Disaster Recovery Testing • Developing a deep SME ...;https://uk.whatjobs.com/job/senior-analyst-run-the-bank?index=37547010%7E4;https;uk.whatjobs.com;/job/senior-analyst-run-the-bank;index=37547010%7E4;;whatjobs;104.26.7.145;geolocation;{};US;United States;Virginia;Ashburn;-77.47419738769531;39.043701171875;104.26.7.145;Find Senior Analyst Run-The-Bank positions with WhatJobs UK;... in non-functional requirements during the Software Development Lifecycle ... Russell Rebalance and Disaster Recovery Testing • Developing a deep SME ...
3;2020-08-26;Business - Gulf Times;Aug 26, 2020 — resilience into supply chains while maintaining ... money, but have resilience built in so they are resistant ... successes of today, and if we software development and are to continue ... to work from home and carry out meetings ...;https://m.gulf-times.com/content/pdf/Business/Business2020_8_26436297.PDF;https;m.gulf-times.com;/content/pdf/Business/Business2020_8_26436297.PDF;;;gulf-times;104.28.19.9;geolocation;{};US;United States;California;San Jose;-121.83822631835938;37.330528259277344;104.28.19.9;Business - Gulf Times;Aug 26, 2020 — resilience into supply chains while maintaining ... money, but have resilience built in so they are resistant ... successes of today, and if we software development and are to continue ... to work from home and carry out meetings ...
4;2020-08-26;made in India software: Latest News & Videos, Photos about ...;IT companies want work from home relaxations to be made permanent. 07 Jul, 2020, 08.28 AM IST. Companies including TCS, HCL are seeking regulatory ...;https://economictimes.indiatimes.com/topic/made-in-India-software;https;economictimes.indiatimes.com;/topic/made-in-India-software;;;indiatimes;23.194.106.203;geolocation;{};US;United States;Illinois;Chicago;-87.67124938964844;41.84885025024414;23.194.106.203;made in India software: Latest News & Videos, Photos about ...;IT companies want work from home relaxations to be made permanent. 07 Jul, 2020, 08.28 AM IST. Companies including TCS, HCL are seeking regulatory ...
5;2020-08-26;WEST — Wellbeing and Emotional Support Team;"... in remote working"":""wellbeingservice_public"",""Epistemic ... **Protective factors - things that are going well, that might be going well, resilience factors, * Aim of ... we can work from home effectively and promoting staff well-being - considering physical ... from the 'OpenSource' movement in computer software development.";https://manuals.annafreud.org/wellbeingservice/index.html;https;manuals.annafreud.org;/wellbeingservice/index.html;;;annafreud;52.85.224.84;geolocation;{};US;United States;Illinois;Chicago;-87.67124938964844;41.84885025024414;52.85.224.84;WEST — Wellbeing and Emotional Support Team;"... in remote working"":""wellbeingservice_public"",""Epistemic ... **Protective factors - things that are going well, that might be going well, resilience factors, * Aim of ... we can work from home effectively and promoting staff well-being - considering physical ... from the 'OpenSource' movement in computer software development."
6;2020-08-26;FXL Annual Report 2020 - flexigroup;Aug 26, 2020 — whole team to work from home, weeks ... benefits and resilience of a business ... roles are better suited to remote working than ... Australian Red Cross Disaster Relief ... Costs incurred on software development projects (relating to the design and testing of new or improved software products) are recognised ...;https://investors.flexigroup.com.au/FormBuilder/_Resource/_module/7jG9ikYqmkOo8Txf6baoiQ/file/annual-reports/2020_annual_report.pdf;https;investors.flexigroup.com.au;/FormBuilder/_Resource/_module/7jG9ikYqmkOo8Txf6baoiQ/file/annual-reports/2020_annual_report.pdf;;;com;203.41.57.175;geolocation;{};AU;Australia;Queensland;Brisbane;153.02789306640625;-27.467580795288086;203.41.57.175;FXL Annual Report 2020 - flexigroup;Aug 26, 2020 — whole team to work from home, weeks ... benefits and resilience of a business ... roles are better suited to remote working than ... Australian Red Cross Disaster Relief ... Costs incurred on software development projects (relating to the design and testing of new or improved software products) are recognised ...
7;2020-08-26;FXL Annual Report 2020 - flexigroup;Aug 26, 2020 — whole team to work from home, weeks ... benefits and resilience of a business ... roles are better suited to remote working than ... Australian Red Cross Disaster Relief ... Costs incurred on software development projects (relating to the design and testing of new or improved software products) are recognised ...;https://investors.flexigroup.com.au/FormBuilder/_Resource/_module/7jG9ikYqmkOo8Txf6baoiQ/file/annual-reports/2020_annual_report.pdf;https;investors.flexigroup.com.au;/FormBuilder/_Resource/_module/7jG9ikYqmkOo8Txf6baoiQ/file/annual-reports/2020_annual_report.pdf;;;com;203.41.57.175;geolocation;{};AU;Australia;Queensland;Brisbane;153.02789306640625;-27.467580795288086;203.41.57.175;FXL Annual Report 2020 - flexigroup;Aug 26, 2020 — whole team to work from home, weeks ... benefits and resilience of a business ... roles are better suited to remote working than ... Australian Red Cross Disaster Relief ... Costs incurred on software development projects (relating to the design and testing of new or improved software products) are recognised ...
8;2020-08-26;FXL Annual Report 2020 - flexigroup;Aug 26, 2020 — whole team to work from home, weeks ... benefits and resilience of a business ... roles are better suited to remote working than ... Australian Red Cross Disaster Relief ... Costs incurred on software development projects (relating to the design and testing of new or improved software products) are recognised ...;https://investors.flexigroup.com.au/FormBuilder/_Resource/_module/7jG9ikYqmkOo8Txf6baoiQ/file/annual-reports/2020_annual_report.pdf;https;investors.flexigroup.com.au;/FormBuilder/_Resource/_module/7jG9ikYqmkOo8Txf6baoiQ/file/annual-reports/2020_annual_report.pdf;;;com;203.41.57.175;geolocation;{};AU;Australia;Queensland;Brisbane;153.02789306640625;-27.467580795288086;203.41.57.175;FXL Annual Report 2020 - flexigroup;Aug 26, 2020 — whole team to work from home, weeks ... benefits and resilience of a business ... roles are better suited to remote working than ... Australian Red Cross Disaster Relief ... Costs incurred on software development projects (relating to the design and testing of new or improved software products) are recognised ...
9;2020-08-26;2020 - For personal use only;Aug 26, 2020 — enabling secure remote working capability through IT ... emphasis on the resilience and diversity of our networks. ... disaster recovery plans, work area recovery sites and ... Hardware and software development. Lightbox Sport ...;http://www.asx.com.au/asxpdf/20200826/pdf/44lwvbp3hz8mkz.pdf;http;www.asx.com.au;/asxpdf/20200826/pdf/44lwvbp3hz8mkz.pdf;;;com;203.15.147.66;geolocation;{};AU;Australia;New South Wales;Sydney;151.2087860107422;-33.859249114990234;203.15.147.66;2020 - For personal use only;Aug 26, 2020 — enabling secure remote working capability through IT ... emphasis on the resilience and diversity of our networks. ... disaster recovery plans, work area recovery sites and ... Hardware and software development. Lightbox Sport ...
10;2020-08-26;H1 2020 Results Presentation - Atlas Arteria;Aug 27, 2020 — Reinstatement of distributions reflects resilience in APRR's financial performance ... remote working remains strongly encouraged and ... software at APRR, and software development with Asset Vision at Dulles Greenway).;https://www.atlasarteria.com/stores/_sharedfiles/H1_2020_Results/3.InvestorPresentation.pdf;https;www.atlasarteria.com;/stores/_sharedfiles/H1_2020_Results/3.InvestorPresentation.pdf;;;atlasarteria;172.67.155.183;geolocation;{};US;United States;California;San Francisco;-122.39286041259766;37.76784896850586;172.67.155.183;H1 2020 Results Presentation - Atlas Arteria;Aug 27, 2020 — Reinstatement of distributions reflects resilience in APRR's financial performance ... remote working remains strongly encouraged and ... software at APRR, and software development with Asset Vision at Dulles Greenway).
11;2020-08-26;What happened in the 'Call of Duty: Warzone' Cold War event;Aug 26, 2020 — “Many data labeling companies were forced to move to a work-from-home model ... And they can opt to use Dataloop's Python software development kit ... Accurics CEO Sachin Aggarwal makes the claim that cyber resilience ...;https://technocodex.com/what-happened-in-the-call-of-duty-warzone-cold-war-event/;https;technocodex.com;/what-happened-in-the-call-of-duty-warzone-cold-war-event/;;;technocodex;104.27.183.82;geolocation;{};US;United States;Virginia;Ashburn;-77.47419738769531;39.043701171875;104.27.183.82;What happened in the 'Call of Duty: Warzone' Cold War event;Aug 26, 2020 — “Many data labeling companies were forced to move to a work-from-home model ... And they can opt to use Dataloop's Python software development kit ... Accurics CEO Sachin Aggarwal makes the claim that cyber resilience ...
12;2020-08-26;CxO of the Week: Leila Pourhashemi, CIO & VP – Technology ...;Aug 26, 2020 — We can consider resilience and flexibility as core skills in navigating ... to lockdowns, and technology companies shifting to work-from-home, we ...;https://www.ciol.com/cxo-of-the-week-leila-pourhashemi-cio-vp-technology-business-operations-blackhawk-network/;https;www.ciol.com;/cxo-of-the-week-leila-pourhashemi-cio-vp-technology-business-operations-blackhawk-network/;;;ciol;192.124.249.158;geolocation;{};US;United States;California;Menifee;-117.1891098022461;33.65753173828125;192.124.249.158;CxO of the Week: Leila Pourhashemi, CIO & VP – Technology ...;Aug 26, 2020 — We can consider resilience and flexibility as core skills in navigating ... to lockdowns, and technology companies shifting to work-from-home, we ...
13;2020-08-26;Appendix 4E and 2020 Annual ReportOpens in a ... - Investors;Aug 26, 2020 — This provides ReadyTech with inherent resilience. ... just 24 hours to a 'work-from-home' operational model, our team has adopted a ... An intangible asset arising from software development expenditure on an internal project ...;https://investors.readytech.com.au/DownloadFile.axd?file=/Report/ComNews/20200826/02271619.pdf;https;investors.readytech.com.au;/DownloadFile.axd;file=/Report/ComNews/20200826/02271619.pdf;;com;203.41.57.175;geolocation;{};AU;Australia;Queensland;Brisbane;153.02789306640625;-27.467580795288086;203.41.57.175;Appendix 4E and 2020 Annual ReportOpens in a ... - Investors;Aug 26, 2020 — This provides ReadyTech with inherent resilience. ... just 24 hours to a 'work-from-home' operational model, our team has adopted a ... An intangible asset arising from software development expenditure on an internal project ...
14;2020-08-26;Appendix 4E and 2020 Annual ReportOpens in a ... - Investors;Aug 26, 2020 — This provides ReadyTech with inherent resilience. ... just 24 hours to a 'work-from-home' operational model, our team has adopted a ... An intangible asset arising from software development expenditure on an internal project ...;https://investors.readytech.com.au/DownloadFile.axd?file=/Report/ComNews/20200826/02271619.pdf;https;investors.readytech.com.au;/DownloadFile.axd;file=/Report/ComNews/20200826/02271619.pdf;;com;203.41.57.175;geolocation;{};AU;Australia;Queensland;Brisbane;153.02789306640625;-27.467580795288086;203.41.57.175;Appendix 4E and 2020 Annual ReportOpens in a ... - Investors;Aug 26, 2020 — This provides ReadyTech with inherent resilience. ... just 24 hours to a 'work-from-home' operational model, our team has adopted a ... An intangible asset arising from software development expenditure on an internal project ...
15;2020-08-26;Appendix 4E and 2020 Annual ReportOpens in a ... - Investors;Aug 26, 2020 — This provides ReadyTech with inherent resilience. ... just 24 hours to a 'work-from-home' operational model, our team has adopted a ... An intangible asset arising from software development expenditure on an internal project ...;https://investors.readytech.com.au/DownloadFile.axd?file=/Report/ComNews/20200826/02271619.pdf;https;investors.readytech.com.au;/DownloadFile.axd;file=/Report/ComNews/20200826/02271619.pdf;;com;203.41.57.175;geolocation;{};AU;Australia;Queensland;Brisbane;153.02789306640625;-27.467580795288086;203.41.57.175;Appendix 4E and 2020 Annual ReportOpens in a ... - Investors;Aug 26, 2020 — This provides ReadyTech with inherent resilience. ... just 24 hours to a 'work-from-home' operational model, our team has adopted a ... An intangible asset arising from software development expenditure on an internal project ...
16;2020-08-26;Form 424B5 NIO Inc. - StreetInsider;Aug 27, 2020 — Some of our systems are not fully redundant, and our disaster recovery ... among others, remote working arrangements for our employees. ... and software development teams) attributable to our continuous cost control efforts.;https://www.streetinsider.com/SEC+Filings/Form++424B5++++++NIO+Inc./17298677.html;https;www.streetinsider.com;/SEC+Filings/Form++424B5++++++NIO+Inc./17298677.html;;;streetinsider;192.225.209.8;geolocation;{};US;United States;Washington;Washington;-77.12261199951172;38.8749885559082;192.225.209.8;Form 424B5 NIO Inc. - StreetInsider;Aug 27, 2020 — Some of our systems are not fully redundant, and our disaster recovery ... among others, remote working arrangements for our employees. ... and software development teams) attributable to our continuous cost control efforts.
17;2020-08-26;Velodyne Lidar S1 IPO registration | GRAF 27 Aug 20 - Docoh;Aug 27, 2020 — Velodyne does not have a formal disaster recovery plan or policy in place ... We implemented global travel restrictions and work-from-home policies for ... as we increase our investment in software development to broaden the ...;https://docoh.com/filing/1745317/0001104659-20-098887/GRAF-S1;https;docoh.com;/filing/1745317/0001104659-20-098887/GRAF-S1;;;docoh;165.227.109.26;geolocation;{};US;United States;New York;Manhattan;-73.97901916503906;40.7589111328125;165.227.109.26;Velodyne Lidar S1 IPO registration | GRAF 27 Aug 20 - Docoh;Aug 27, 2020 — Velodyne does not have a formal disaster recovery plan or policy in place ... We implemented global travel restrictions and work-from-home policies for ... as we increase our investment in software development to broaden the ...
18;2020-08-26;War Drum Studios Becomes Grove Street Games | | IT ...;Aug 27, 2020 — ... Digital Identity (1), Digital Marketing (2), Digital Signage (1), Disaster Recovery (1) ... Remote Working (8), Repair (1), Research (5), Resilience ... SME (1), SMS (1), Social Media (6), Software (9), Software Development (3) ...;https://www.itbusinessnet.com/2020/08/war-drum-studios-becomes-grove-street-games/;https;www.itbusinessnet.com;/2020/08/war-drum-studios-becomes-grove-street-games/;;;itbusinessnet;104.31.87.205;geolocation;{};US;United States;California;San Jose;-121.83822631835938;37.330528259277344;104.31.87.205;War Drum Studios Becomes Grove Street Games | | IT ...;Aug 27, 2020 — ... Digital Identity (1), Digital Marketing (2), Digital Signage (1), Disaster Recovery (1) ... Remote Working (8), Repair (1), Research (5), Resilience ... SME (1), SMS (1), Social Media (6), Software (9), Software Development (3) ...
19;2020-08-26;War Drum Studios Becomes Grove Street Games | | IT ...;Aug 27, 2020 — ... Digital Identity (1), Digital Marketing (2), Digital Signage (1), Disaster Recovery (1) ... Remote Working (8), Repair (1), Research (5), Resilience ... SME (1), SMS (1), Social Media (6), Software (9), Software Development (3) ...;https://www.itbusinessnet.com/2020/08/war-drum-studios-becomes-grove-street-games/;https;www.itbusinessnet.com;/2020/08/war-drum-studios-becomes-grove-street-games/;;;itbusinessnet;104.31.87.205;geolocation;{};US;United States;California;San Jose;-121.83822631835938;37.330528259277344;104.31.87.205;War Drum Studios Becomes Grove Street Games | | IT ...;Aug 27, 2020 — ... Digital Identity (1), Digital Marketing (2), Digital Signage (1), Disaster Recovery (1) ... Remote Working (8), Repair (1), Research (5), Resilience ... SME (1), SMS (1), Social Media (6), Software (9), Software Development (3) ...
20;2020-08-26;China Merchants Cooperates with Singapore GT Robot ...;Aug 27, 2020 — ... Digital Identity (1), Digital Marketing (2), Digital Signage (1), Disaster Recovery (1) ... Remote Working (7), Repair (1), Research (5), Resilience ... SME (1), SMS (1), Social Media (6), Software (8), Software Development (3) ...;https://www.itbusinessnet.com/2020/08/china-merchants-cooperates-with-singapore-gt-robot-company-to-launch-an-all-purpose-robot/;https;www.itbusinessnet.com;/2020/08/china-merchants-cooperates-with-singapore-gt-robot-company-to-launch-an-all-purpose-robot/;;;itbusinessnet;104.31.87.205;geolocation;{};US;United States;California;San Jose;-121.83822631835938;37.330528259277344;104.31.87.205;China Merchants Cooperates with Singapore GT Robot ...;Aug 27, 2020 — ... Digital Identity (1), Digital Marketing (2), Digital Signage (1), Disaster Recovery (1) ... Remote Working (7), Repair (1), Research (5), Resilience ... SME (1), SMS (1), Social Media (6), Software (8), Software Development (3) ...
21;2020-08-26;China Merchants Cooperates with Singapore GT Robot ...;Aug 27, 2020 — ... Digital Identity (1), Digital Marketing (2), Digital Signage (1), Disaster Recovery (1) ... Remote Working (7), Repair (1), Research (5), Resilience ... SME (1), SMS (1), Social Media (6), Software (8), Software Development (3) ...;https://www.itbusinessnet.com/2020/08/china-merchants-cooperates-with-singapore-gt-robot-company-to-launch-an-all-purpose-robot/;https;www.itbusinessnet.com;/2020/08/china-merchants-cooperates-with-singapore-gt-robot-company-to-launch-an-all-purpose-robot/;;;itbusinessnet;104.31.87.205;geolocation;{};US;United States;California;San Jose;-121.83822631835938;37.330528259277344;104.31.87.205;China Merchants Cooperates with Singapore GT Robot ...;Aug 27, 2020 — ... Digital Identity (1), Digital Marketing (2), Digital Signage (1), Disaster Recovery (1) ... Remote Working (7), Repair (1), Research (5), Resilience ... SME (1), SMS (1), Social Media (6), Software (8), Software Development (3) ...
22;2020-08-26;e-democracy handbook - Coe - Council of Europe;"Aug 27, 2020 — their staff working methods (remote working, use of electronic signatures);. • the delivery of ... to enhance resilience in the face of emergencies. ... In this kind of software development process, the city benefits from international.";https://rm.coe.int/11th-cddg-session-10-11-september-2020-e-democracy-handbook/16809f5a72;https;rm.coe.int;/11th-cddg-session-10-11-september-2020-e-democracy-handbook/16809f5a72;;;coe;193.164.229.84;geolocation;{};FR;France;Grand Est;Strasbourg;7.745500087738037;48.583900451660156;193.164.229.84;e-democracy handbook - Coe - Council of Europe;"Aug 27, 2020 — their staff working methods (remote working, use of electronic signatures);. • the delivery of ... to enhance resilience in the face of emergencies. ... In this kind of software development process, the city benefits from international."
23;2020-08-26;"Aug. 26: Servicing, MLO, Ops jobs; marketing, automation ...";Aug 26, 2020 — ... this high-volume, work-from-home environment is even more difficult. ... software engineers, business analyst, technical writers, and trainers ...;https://www.lendernews.com/aug-26-servicing-mlo-ops-jobs-marketing-automation-tech-mgt-tools-5-agency-refi-hit-delayed-now-what-2/;https;www.lendernews.com;/aug-26-servicing-mlo-ops-jobs-marketing-automation-tech-mgt-tools-5-agency-refi-hit-delayed-now-what-2/;;;lendernews;104.27.129.15;geolocation;{};US;United States;California;San Jose;-121.83822631835938;37.330528259277344;104.27.129.15;"Aug. 26: Servicing, MLO, Ops jobs; marketing, automation ...";Aug 26, 2020 — ... this high-volume, work-from-home environment is even more difficult. ... software engineers, business analyst, technical writers, and trainers ...
24;2020-08-26;NetApp, Inc. (NTAP) CEO George Kurian on Q1 2021 Results ...;Aug 27, 2020 — ... beyond the initial response to the pandemic of operationalizing work from home. ... to collaborate and accelerate application software development. ... We are seeing the use of cloud increasingly for disaster protection and ...;https://seekingalpha.com/article/4371015-netapp-inc-ntap-ceo-george-kurian-on-q1-2021-results-earnings-call-transcript;https;seekingalpha.com;/article/4371015-netapp-inc-ntap-ceo-george-kurian-on-q1-2021-results-earnings-call-transcript;;;seekingalpha;151.101.2.2;geolocation;{};US;United States;California;San Francisco;-122.39286041259766;37.76784896850586;151.101.2.2;NetApp, Inc. (NTAP) CEO George Kurian on Q1 2021 Results ...;Aug 27, 2020 — ... beyond the initial response to the pandemic of operationalizing work from home. ... to collaborate and accelerate application software development. ... We are seeing the use of cloud increasingly for disaster protection and ...
25;2020-08-26;Modern Application Development Security - BankInfoSecurity;Vendor Risk Management · Business Continuity & Disaster Recovery ... Secure Software Development Lifecycle (SSDLC) · DevSecOps ... Live Webinar | Remote Working with Teams & Zoom - Stay Secure & Avoid Data Loss. Nigel Hawthorn •.;https://www.bankinfosecurity.com/whitepapers/modern-application-development-security-w-6663;https;www.bankinfosecurity.com;/whitepapers/modern-application-development-security-w-6663;;;bankinfosecurity;50.56.167.254;geolocation;{};US;United States;Texas;Dallas;-96.8142318725586;32.8054313659668;50.56.167.254;Modern Application Development Security - BankInfoSecurity;Vendor Risk Management · Business Continuity & Disaster Recovery ... Secure Software Development Lifecycle (SSDLC) · DevSecOps ... Live Webinar | Remote Working with Teams & Zoom - Stay Secure & Avoid Data Loss. Nigel Hawthorn •.
26;2020-08-26;Graf Industrial Corp. IPO Investment Prospectus S-1;Aug 26, 2020 — Velodyne does not have a formal disaster recovery plan or policy in place ... We implemented global travel restrictions and work-from-home policies for ... as we increase our investment in software development to broaden the ...;https://sec.report/Document/0001104659-20-098887/;https;sec.report;/Document/0001104659-20-098887/;;;sec;104.22.66.107;geolocation;{};US;United States;California;San Jose;-121.83822631835938;37.330528259277344;104.22.66.107;Graf Industrial Corp. IPO Investment Prospectus S-1;Aug 26, 2020 — Velodyne does not have a formal disaster recovery plan or policy in place ... We implemented global travel restrictions and work-from-home policies for ... as we increase our investment in software development to broaden the ...
27;2020-08-26;Graf Industrial Corp. IPO Investment Prospectus S-1;Aug 26, 2020 — Velodyne does not have a formal disaster recovery plan or policy in place ... We implemented global travel restrictions and work-from-home policies for ... as we increase our investment in software development to broaden the ...;https://sec.report/Document/0001104659-20-098887/;https;sec.report;/Document/0001104659-20-098887/;;;sec;104.22.66.107;geolocation;{};US;United States;California;San Jose;-121.83822631835938;37.330528259277344;104.22.66.107;Graf Industrial Corp. IPO Investment Prospectus S-1;Aug 26, 2020 — Velodyne does not have a formal disaster recovery plan or policy in place ... We implemented global travel restrictions and work-from-home policies for ... as we increase our investment in software development to broaden the ...
