;date;header;summary;link;protocol;domain;path;query;fragment;host_name;ip_address;Type;AdditionalData;CountryCode;CountryName;State;City;Longitude;Latitude;IpAddress;header_context_true;summary_context_true
0;2020-09-13;Pandemic programming | SpringerLink;Sep 14, 2020 — Many technology companies told their employees to work from home (Duffy 2020). ... Remote working can help restore and maintain operational capacity and ... Hypotheses H4 and H5: Disaster preparedness is directly related to change in ... 2003), it may not in software development or during pandemics.;https://link.springer.com/article/10.1007/s10664-020-09875-y;https;link.springer.com;/article/10.1007/s10664-020-09875-y;;;springer;151.101.0.95;geolocation;{};US;United States;California;San Francisco;-122.39286041259766;37.76784896850586;151.101.0.95;Pandemic programming | SpringerLink;Sep 14, 2020 — Many technology companies told their employees to work from home (Duffy 2020). ... Remote working can help restore and maintain operational capacity and ... Hypotheses H4 and H5: Disaster preparedness is directly related to change in ... 2003), it may not in software development or during pandemics.
1;2020-09-13;Find Front End Developer positions with WhatJobs UK;The passion to champion TDD/BDD software development. ... and opportunity we love - but bear in mind it also demands focus, patience and resilience.;https://uk.whatjobs.com/job/front-end-developer-1303?index=1a6ee5f5%7E8;https;uk.whatjobs.com;/job/front-end-developer-1303;index=1a6ee5f5%7E8;;whatjobs;172.67.72.65;geolocation;{};US;United States;California;San Francisco;-122.39286041259766;37.76784896850586;172.67.72.65;Find Front End Developer positions with WhatJobs UK;The passion to champion TDD/BDD software development. ... and opportunity we love - but bear in mind it also demands focus, patience and resilience.
2;2020-09-13;Microsoft Marketing Manager Salaries | Glassdoor;Sep 14, 2020 — Work From Home (10 comments) ... of: Bellevue Bravern Entrance Microsoft photo of: Our software development centers are located all over the ...;https://www.glassdoor.com.au/Salary/Microsoft-Marketing-Manager-Salaries-E1651_D_KO10,27.htm;https;www.glassdoor.com.au;/Salary/Microsoft-Marketing-Manager-Salaries-E1651_D_KO10,27.htm;;;com;104.16.153.30;geolocation;{};US;United States;California;San Jose;-121.83822631835938;37.330528259277344;104.16.153.30;Microsoft Marketing Manager Salaries | Glassdoor;Sep 14, 2020 — Work From Home (10 comments) ... of: Bellevue Bravern Entrance Microsoft photo of: Our software development centers are located all over the ...
3;2020-09-13;Senior Software Engineer - Amazejobs.co;Sep 14, 2020 — We are also open to regular work from home days as we are looking for ... and resilience of machine-to-machine communications of the future.;https://www.amazejobs.co/job-details-senior-software-engineer-employerid-3608b577fe8e;https;www.amazejobs.co;/job-details-senior-software-engineer-employerid-3608b577fe8e;;;amazejobs;160.153.221.47;geolocation;{};US;United States;Arizona;Scottsdale;-111.89010620117188;33.610958099365234;160.153.221.47;Senior Software Engineer - Amazejobs.co;Sep 14, 2020 — We are also open to regular work from home days as we are looking for ... and resilience of machine-to-machine communications of the future.
4;2020-09-13;my job's travel conflicts with husband's job, talking to my boss ...;Sep 14, 2020 — ... but in software development all the important stuff is happening in ... if someone in my household tests positive, can I work from home for 2 ...;https://www.askamanager.org/2020/09/my-jobs-travel-conflicts-with-husbands-job-talking-to-my-boss-about-imposter-syndrome-and-more.html;https;www.askamanager.org;/2020/09/my-jobs-travel-conflicts-with-husbands-job-talking-to-my-boss-about-imposter-syndrome-and-more.html;;;askamanager;104.26.13.26;geolocation;{};US;United States;California;San Jose;-121.83822631835938;37.330528259277344;104.26.13.26;my job's travel conflicts with husband's job, talking to my boss ...;Sep 14, 2020 — ... but in software development all the important stuff is happening in ... if someone in my household tests positive, can I work from home for 2 ...
5;2020-09-13;Download New School Business Continuity Plan Template ...;Here are 70 things that go wrong during a disaster. ... Work From Home Business ... Code found in iOS 7.1's software development kit indicates that Siri is one its way to a ... Build resilience through recovery Common Goal, Priorities, Content ...;https://www.pinterest.com/pin/634515034985112720/;https;www.pinterest.com;/pin/634515034985112720/;;;pinterest;23.200.60.229;geolocation;{};US;United States;Illinois;Chicago;-87.67124938964844;41.84885025024414;23.200.60.229;Download New School Business Continuity Plan Template ...;Here are 70 things that go wrong during a disaster. ... Work From Home Business ... Code found in iOS 7.1's software development kit indicates that Siri is one its way to a ... Build resilience through recovery Common Goal, Priorities, Content ...
6;2020-09-13;Moonshine Technology - Technical Project Manager - Game ...;Sep 14, 2020 — Preserves assets by implementing disaster recovery and back-up ... Lendingkart - Software Development Engineer III - Java/C++ Programming.;https://www.hirist.com/j/moonshine-technology-technical-project-manager-game-design-4-10-yrs-643944.html;https;www.hirist.com;/j/moonshine-technology-technical-project-manager-game-design-4-10-yrs-643944.html;;;hirist;13.233.235.167;geolocation;{};IN;India;Maharashtra;Powai;72.87770080566406;19.076000213623047;13.233.235.167;Moonshine Technology - Technical Project Manager - Game ...;Sep 14, 2020 — Preserves assets by implementing disaster recovery and back-up ... Lendingkart - Software Development Engineer III - Java/C++ Programming.
7;2020-09-13;A professional tax and ... - Schroeder & Co., CPA's, LLC;SBA REOPENS ECONOMIC INJURY DISASTER LOAN (EIDL) PROGRAM TO ... Business owners who work from home may qualify for home office deductions. ... you can also currently deduct internal website software development costs as ...;https://www.schroedercocpas.com/blog;https;www.schroedercocpas.com;/blog;;;schroedercocpas;54.186.178.19;geolocation;{};US;United States;Oregon;Boardman;-119.6989974975586;45.83599853515625;54.186.178.19;A professional tax and ... - Schroeder & Co., CPA's, LLC;SBA REOPENS ECONOMIC INJURY DISASTER LOAN (EIDL) PROGRAM TO ... Business owners who work from home may qualify for home office deductions. ... you can also currently deduct internal website software development costs as ...
8;2020-09-13;Decentralised Futures - Nesta;Sep 14, 2020 — decentralisation – including greater resilience, increased ... Before the pandemic, remote working was primarily an ... set by the software engineers, designers and ... using highly vetted Software Development ... will increasingly work from home or virtual offices ... 'Climate change and disaster displacement.;https://media.nesta.org.uk/documents/Decentralised_Futures_Essays_FA.pdf;https;media.nesta.org.uk;/documents/Decentralised_Futures_Essays_FA.pdf;;;org;172.67.33.57;geolocation;{};US;United States;California;San Francisco;-122.39286041259766;37.76784896850586;172.67.33.57;Decentralised Futures - Nesta;Sep 14, 2020 — decentralisation – including greater resilience, increased ... Before the pandemic, remote working was primarily an ... set by the software engineers, designers and ... using highly vetted Software Development ... will increasingly work from home or virtual offices ... 'Climate change and disaster displacement.
9;2020-09-13;Form S-1/A JFrog Ltd - StreetInsider;Sep 14, 2020 — Our platform is the critical bridge between software development and deployment of ... If a natural disaster, power outage, connectivity issue, or other event ... The increase in remote working may also result in privacy, data ... Our research and development team consists of our architects, software engineers, ...;https://www.streetinsider.com/dr/news.php?id=17351645;https;www.streetinsider.com;/dr/news.php;id=17351645;;streetinsider;192.225.209.8;geolocation;{};US;United States;Washington;Washington;-77.12261199951172;38.8749885559082;192.225.209.8;Form S-1/A JFrog Ltd - StreetInsider;Sep 14, 2020 — Our platform is the critical bridge between software development and deployment of ... If a natural disaster, power outage, connectivity issue, or other event ... The increase in remote working may also result in privacy, data ... Our research and development team consists of our architects, software engineers, ...
10;2020-09-13;Software Testing Tutorials;Sep 13, 2020 — Here is the list of best Software testing tutorials, tools, and the articles. You can go through the list or search for the tutorials on specific topics.;https://www.softwaretestinghelp.com/software-testing-tutorials/;https;www.softwaretestinghelp.com;/software-testing-tutorials/;;;softwaretestinghelp;35.193.232.176;geolocation;{};US;United States;Iowa;Council Bluffs;-95.87735748291016;41.23295974731445;35.193.232.176;Software Testing Tutorials;Sep 13, 2020 — Here is the list of best Software testing tutorials, tools, and the articles. You can go through the list or search for the tutorials on specific topics.
11;2020-09-13;Open Banking needs a killer app - iTWire;Sep 14, 2020 — Revisiting the pandemic as a test of national resilience. What… SolarWinds Service Desk can transform your IT Dept from chaos to calm.;https://www.itwire.com/business-software/open-banking-needs-a-killer-app.html;https;www.itwire.com;/business-software/open-banking-needs-a-killer-app.html;;;itwire;101.0.65.50;geolocation;{};AU;Australia;New South Wales;Sydney;151.2071075439453;-33.86714172363281;101.0.65.50;Open Banking needs a killer app - iTWire;Sep 14, 2020 — Revisiting the pandemic as a test of national resilience. What… SolarWinds Service Desk can transform your IT Dept from chaos to calm.
12;2020-09-13;Ping An Insurance of China : Interim Report 2020 ...;Sep 14, 2020 — Ping An enabled its nearly 400,000 employees to work from home and attend online ... and key construction projects with disaster and loss prevention services. ... to normal owing to China's economic resilience and growth momentum, ... and applying the Secure Software Development Life Cycle (S-SDLC).;https://www.marketscreener.com/quote/stock/PING-AN-INSURANCE-GROUP-1412620/news/Ping-An-Insurance-of-China-Interim-Report-2020-31288097/;https;www.marketscreener.com;/quote/stock/PING-AN-INSURANCE-GROUP-1412620/news/Ping-An-Insurance-of-China-Interim-Report-2020-31288097/;;;marketscreener;213.182.38.210;geolocation;{};FR;France;Île-de-France;Clichy;2.304080009460449;48.9026985168457;213.182.38.210;Ping An Insurance of China : Interim Report 2020 ...;Sep 14, 2020 — Ping An enabled its nearly 400,000 employees to work from home and attend online ... and key construction projects with disaster and loss prevention services. ... to normal owing to China's economic resilience and growth momentum, ... and applying the Secure Software Development Life Cycle (S-SDLC).
13;2020-09-13;INFOPARK Smart Space Cochin;Sep 14, 2020 — Good knowledge of Software Development Life Cycle. ... Working with our software engineers and data scientists on the team to rapidly build, test and ... 3) Perks based on performance such as salary hike, Work from home ... Immediate joiners will be given preference, no remote working options available.;http://www.infopark.in/company_vacancy_all.php;http;www.infopark.in;/company_vacancy_all.php;;;infopark;198.11.230.226;geolocation;{};US;United States;California;San Jose;-121.83822631835938;37.330528259277344;198.11.230.226;INFOPARK Smart Space Cochin;Sep 14, 2020 — Good knowledge of Software Development Life Cycle. ... Working with our software engineers and data scientists on the team to rapidly build, test and ... 3) Perks based on performance such as salary hike, Work from home ... Immediate joiners will be given preference, no remote working options available.
14;2020-09-13;BRR Softwares Systems Private Limited;Covid-19 Resilience Program ... right tools and technologies that support 100% work from Home, and yet produce a high quality deliverables ... We have opened-up several software positions(Sales, Marketing, HR, Software Development etc.) ...;https://www.brrsoftwares.com/covid-19.html;https;www.brrsoftwares.com;/covid-19.html;;;brrsoftwares;162.214.80.27;geolocation;{};US;United States;Utah;Provo;-111.6124267578125;40.21580123901367;162.214.80.27;BRR Softwares Systems Private Limited;Covid-19 Resilience Program ... right tools and technologies that support 100% work from Home, and yet produce a high quality deliverables ... We have opened-up several software positions(Sales, Marketing, HR, Software Development etc.) ...
15;2020-09-13;National Energy and Climate Plan NECP 2021-2030 Section A;Sep 13, 2020 — to increase the energy sector's resilience to climate change risks. ... by reinforcing measures such as remote working, carpooling, etc. ... As regards disaster risk management, Wallonia is working with the other Belgian ... continue the software development of Terra so that there can be fluid reporting on the ...;https://ec.europa.eu/energy/sites/ener/files/documents/be_final_necp_parta_en.pdf;https;ec.europa.eu;/energy/sites/ener/files/documents/be_final_necp_parta_en.pdf;;;europa;147.67.210.30;geolocation;{};LU;Luxembourg;Luxembourg;Luxembourg;6.1062397956848145;49.616241455078125;147.67.210.30;National Energy and Climate Plan NECP 2021-2030 Section A;Sep 13, 2020 — to increase the energy sector's resilience to climate change risks. ... by reinforcing measures such as remote working, carpooling, etc. ... As regards disaster risk management, Wallonia is working with the other Belgian ... continue the software development of Terra so that there can be fluid reporting on the ...
16;2020-09-13;Back End Software Engineer Jobs in Gurgaon - Bayt.com;13 Jobs — Job Title: Big Data Developer / Software Development Engineer - II (Big Data) What we are looking for : Are you fascinated by data… ... architectures with software engineers and other developer stakeholders, ... Practice resilience engineering for every frontend/backend component. ... Work from Home Jobs New;https://www.bayt.com/en/india/jobs/back-end-software-engineer-jobs-in-gurgaon/;https;www.bayt.com;/en/india/jobs/back-end-software-engineer-jobs-in-gurgaon/;;;bayt;209.251.59.181;geolocation;{};CA;Canada;Ontario;Brampton;-79.63720703125;43.59708023071289;209.251.59.181;Back End Software Engineer Jobs in Gurgaon - Bayt.com;13 Jobs — Job Title: Big Data Developer / Software Development Engineer - II (Big Data) What we are looking for : Are you fascinated by data… ... architectures with software engineers and other developer stakeholders, ... Practice resilience engineering for every frontend/backend component. ... Work from Home Jobs New
17;2020-09-13;HR (Human Resources) Solutions Latest News | Virtualization ...;... HR tech solutions provider based out of Gurugram, India, made public the news of securing a deal with Titansoft, the leading software development compan.;https://www.virtualizationdemand.com/category/news/human-resources-news/hr-solutions-news/;https;www.virtualizationdemand.com;/category/news/human-resources-news/hr-solutions-news/;;;virtualizationdemand;104.31.77.142;geolocation;{};US;United States;New Jersey;Newark;-74.19452667236328;40.738731384277344;104.31.77.142;HR (Human Resources) Solutions Latest News | Virtualization ...;... HR tech solutions provider based out of Gurugram, India, made public the news of securing a deal with Titansoft, the leading software development compan.
18;2020-09-13;DC BLOX To Build Major Data Center in Greenville County ...;Sep 13, 2020 — ... space, power and network connectivity in support of the City's digital transformation, business continuity and disaster recovery (DR) plans.;https://www.smarthostingplans.com/news/dc-blox-to-build-major-data-center-in-greenville-county-south-carolina/;https;www.smarthostingplans.com;/news/dc-blox-to-build-major-data-center-in-greenville-county-south-carolina/;;;smarthostingplans;208.109.175.158;geolocation;{};US;United States;Arizona;Scottsdale;-111.89010620117188;33.610958099365234;208.109.175.158;DC BLOX To Build Major Data Center in Greenville County ...;Sep 13, 2020 — ... space, power and network connectivity in support of the City's digital transformation, business continuity and disaster recovery (DR) plans.
19;2020-09-13;On the SPOT - Technology Podcast - SPeed Of Technology;In the early 2000's, she asked her software development manager how she ... help desk operations, disaster recovery planning, infrastructure management, and ...;https://www.onthespot.tech/feed/podcast/;https;www.onthespot.tech;/feed/podcast/;;;onthespot;69.163.164.46;geolocation;{};US;United States;Texas;Dallas;-96.8142318725586;32.8054313659668;69.163.164.46;On the SPOT - Technology Podcast - SPeed Of Technology;In the early 2000's, she asked her software development manager how she ... help desk operations, disaster recovery planning, infrastructure management, and ...
20;2020-09-13;The Importance of Mental Health Support in the Workplace ...;Sep 14, 2020 — The work from home culture, social distancing and self-isolation have made it more evident than ever that we pay serious attention on our ...;https://www.ciol.com/importance-mental-health-support-workplace-change/;https;www.ciol.com;/importance-mental-health-support-workplace-change/;;;ciol;192.124.249.158;geolocation;{};US;United States;California;Menifee;-117.1891098022461;33.65753173828125;192.124.249.158;The Importance of Mental Health Support in the Workplace ...;Sep 14, 2020 — The work from home culture, social distancing and self-isolation have made it more evident than ever that we pay serious attention on our ...
21;2020-09-13;Coin pluz Forum;Build a complete remote working solution with Microsoft. Build a complete ... What is the Usefulness of Interventions to Enhance the Resilience of Soldiers.. What is the ... Work From Home, part 6 – Jabber and Softphone Usage the EASY way ... Improve your business process with custom software development! Improve ...;https://coinpluz.com/forum/;https;coinpluz.com;/forum/;;;coinpluz;172.67.205.206;geolocation;{};US;United States;California;San Francisco;-122.39286041259766;37.76784896850586;172.67.205.206;Coin pluz Forum;Build a complete remote working solution with Microsoft. Build a complete ... What is the Usefulness of Interventions to Enhance the Resilience of Soldiers.. What is the ... Work From Home, part 6 – Jabber and Softphone Usage the EASY way ... Improve your business process with custom software development! Improve ...
22;2020-09-13;Articles | EgyptInnovate;Sep 13, 2020 — ... about web and software development to get it on with marketing and online sales. ... of them were ethical, money was being robbed and it was a disaster. ... who may need to work from home, while earning respectable fees.;https://egyptinnovate.com/en/datasets/bazaar;https;egyptinnovate.com;/en/datasets/bazaar;;;egyptinnovate;40.118.17.44;geolocation;{};NL;Netherlands;North Holland;Diemen;4.916999816894531;52.349998474121094;40.118.17.44;Articles | EgyptInnovate;Sep 13, 2020 — ... about web and software development to get it on with marketing and online sales. ... of them were ethical, money was being robbed and it was a disaster. ... who may need to work from home, while earning respectable fees.
23;2020-09-13;Livingplus.info (ePUB/PDF);Sep 14, 2020 — Beautiful Disaster: Roman: 1 By Jamie McGuire.pdf ... Michelle Grabner: I Work From Home By Rose Bouthillier 2014-08-31 By Rose ... Your C# Effective Software Development Series English Edition By Bill Wagner.pdf;http://livingplus.info/;http;livingplus.info;/;;;livingplus;157.245.78.34;geolocation;{};US;United States;Oregon;Springfield;-123.24848175048828;44.028099060058594;157.245.78.34;Livingplus.info (ePUB/PDF);Sep 14, 2020 — Beautiful Disaster: Roman: 1 By Jamie McGuire.pdf ... Michelle Grabner: I Work From Home By Rose Bouthillier 2014-08-31 By Rose ... Your C# Effective Software Development Series English Edition By Bill Wagner.pdf
24;2020-09-13;Livingplus.info (ePUB/PDF);Sep 14, 2020 — Beautiful Disaster: Roman: 1 By Jamie McGuire.pdf ... Michelle Grabner: I Work From Home By Rose Bouthillier 2014-08-31 By Rose ... Your C# Effective Software Development Series English Edition By Bill Wagner.pdf;http://livingplus.info/;http;livingplus.info;/;;;livingplus;157.245.78.34;geolocation;{};US;United States;Oregon;Springfield;-123.24848175048828;44.028099060058594;157.245.78.34;Livingplus.info (ePUB/PDF);Sep 14, 2020 — Beautiful Disaster: Roman: 1 By Jamie McGuire.pdf ... Michelle Grabner: I Work From Home By Rose Bouthillier 2014-08-31 By Rose ... Your C# Effective Software Development Series English Edition By Bill Wagner.pdf
25;2020-09-13;Livingplus.info (ePUB/PDF);Sep 14, 2020 — Beautiful Disaster: Roman: 1 By Jamie McGuire.pdf ... Michelle Grabner: I Work From Home By Rose Bouthillier 2014-08-31 By Rose ... Your C# Effective Software Development Series English Edition By Bill Wagner.pdf;http://livingplus.info/;http;livingplus.info;/;;;livingplus;157.245.78.34;geolocation;{};US;United States;Oregon;Springfield;-123.24848175048828;44.028099060058594;157.245.78.34;Livingplus.info (ePUB/PDF);Sep 14, 2020 — Beautiful Disaster: Roman: 1 By Jamie McGuire.pdf ... Michelle Grabner: I Work From Home By Rose Bouthillier 2014-08-31 By Rose ... Your C# Effective Software Development Series English Edition By Bill Wagner.pdf
26;2020-09-13;Livingplus.info (ePUB/PDF);Sep 14, 2020 — Beautiful Disaster: Roman: 1 By Jamie McGuire.pdf ... Michelle Grabner: I Work From Home By Rose Bouthillier 2014-08-31 By Rose ... Your C# Effective Software Development Series English Edition By Bill Wagner.pdf;http://livingplus.info/;http;livingplus.info;/;;;livingplus;157.245.78.34;geolocation;{};US;United States;Oregon;Springfield;-123.24848175048828;44.028099060058594;157.245.78.34;Livingplus.info (ePUB/PDF);Sep 14, 2020 — Beautiful Disaster: Roman: 1 By Jamie McGuire.pdf ... Michelle Grabner: I Work From Home By Rose Bouthillier 2014-08-31 By Rose ... Your C# Effective Software Development Series English Edition By Bill Wagner.pdf
27;2020-09-13;HP Rajya Bijli Board Recruitment 2020, HPPCL 1892 ...;Sep 14, 2020 — ... Ministry · Directorate of Purchase and Stores DPSDAE · Disaster Management ... Sofa Agreement · Softech · Software · Software Development Course ... Vocational teachers · Vodafone Latest · Vodafone Work From Home ...;https://www.sscbankgk.in/2020/09/hp-rajya-bijli-board-recruitment-2020.html;https;www.sscbankgk.in;/2020/09/hp-rajya-bijli-board-recruitment-2020.html;;;sscbankgk;108.177.121.121;geolocation;{};US;United States;California;Mountain View;-122.07540893554688;37.419158935546875;108.177.121.121;HP Rajya Bijli Board Recruitment 2020, HPPCL 1892 ...;Sep 14, 2020 — ... Ministry · Directorate of Purchase and Stores DPSDAE · Disaster Management ... Sofa Agreement · Softech · Software · Software Development Course ... Vocational teachers · Vodafone Latest · Vodafone Work From Home ...
28;2020-09-13;Coupon-sites.com (ePUB/PDF);Sep 14, 2020 — Walking Disaster SEMI-POCHE LITT French Edition By Jamie McGuire.pdf ... Start An Online Business: How To Work From Home Generating Passive Income ... Succeeding With Agile: Software Development Using Scrum ...;http://coupon-sites.com/;http;coupon-sites.com;/;;;coupon-sites;157.245.78.34;geolocation;{};US;United States;Oregon;Springfield;-123.24848175048828;44.028099060058594;157.245.78.34;Coupon-sites.com (ePUB/PDF);Sep 14, 2020 — Walking Disaster SEMI-POCHE LITT French Edition By Jamie McGuire.pdf ... Start An Online Business: How To Work From Home Generating Passive Income ... Succeeding With Agile: Software Development Using Scrum ...
29;2020-09-13;Coupon-sites.com (ePUB/PDF);Sep 14, 2020 — Walking Disaster SEMI-POCHE LITT French Edition By Jamie McGuire.pdf ... Start An Online Business: How To Work From Home Generating Passive Income ... Succeeding With Agile: Software Development Using Scrum ...;http://coupon-sites.com/;http;coupon-sites.com;/;;;coupon-sites;157.245.78.34;geolocation;{};US;United States;Oregon;Springfield;-123.24848175048828;44.028099060058594;157.245.78.34;Coupon-sites.com (ePUB/PDF);Sep 14, 2020 — Walking Disaster SEMI-POCHE LITT French Edition By Jamie McGuire.pdf ... Start An Online Business: How To Work From Home Generating Passive Income ... Succeeding With Agile: Software Development Using Scrum ...
30;2020-09-13;Coupon-sites.com (ePUB/PDF);Sep 14, 2020 — Walking Disaster SEMI-POCHE LITT French Edition By Jamie McGuire.pdf ... Start An Online Business: How To Work From Home Generating Passive Income ... Succeeding With Agile: Software Development Using Scrum ...;http://coupon-sites.com/;http;coupon-sites.com;/;;;coupon-sites;157.245.78.34;geolocation;{};US;United States;Oregon;Springfield;-123.24848175048828;44.028099060058594;157.245.78.34;Coupon-sites.com (ePUB/PDF);Sep 14, 2020 — Walking Disaster SEMI-POCHE LITT French Edition By Jamie McGuire.pdf ... Start An Online Business: How To Work From Home Generating Passive Income ... Succeeding With Agile: Software Development Using Scrum ...
