;date;header;summary;link;protocol;domain;path;query;fragment;host_name;ip_address;Type;AdditionalData;CountryCode;CountryName;State;City;Longitude;Latitude;IpAddress;header_context_true;summary_context_true
58;2020-10-07;Morgan Stanley Manager Salaries | Glassdoor;Oct 8, 2020 — Work From Home (11 comments). “I never had ... It would've been used in case of there was a natural disaster, but for average days...” Maternity ...;https://www.glassdoor.co.in/Salary/Morgan-Stanley-Manager-Salaries-E2282_D_KO15,22.htm;https;www.glassdoor.co.in;/Salary/Morgan-Stanley-Manager-Salaries-E2282_D_KO15,22.htm;;;co;104.16.118.102;geolocation;{};US;United States;California;San Jose;-121.83822631835938;37.330528259277344;104.16.118.102;Morgan Stanley Manager Salaries | Glassdoor;Oct 8, 2020 — Work From Home (11 comments). “I never had ... It would've been used in case of there was a natural disaster, but for average days...” Maternity ...
59;2020-10-07;Livestreaming wins big for Lazada during the COVID-19 ...;During this work-from-home period, Southeast Asia viewers are also viewing more ... software development kit (SDK) for building applications on DPU-accelerated ... I've always said that Singtel's strength lies in the resilience of our people and ...;https://www.techtradeasia.com/2020/05/livestreaming-wins-big-for-lazada.html?view=classic;https;www.techtradeasia.com;/2020/05/livestreaming-wins-big-for-lazada.html;view=classic;;techtradeasia;108.177.111.121;geolocation;{};US;United States;California;Mountain View;-122.07540893554688;37.419158935546875;108.177.111.121;Livestreaming wins big for Lazada during the COVID-19 ...;During this work-from-home period, Southeast Asia viewers are also viewing more ... software development kit (SDK) for building applications on DPU-accelerated ... I've always said that Singtel's strength lies in the resilience of our people and ...
60;2020-10-07;Fail to Succeed Blog — Succeed Through Failure;A crisis is something like, a natural disaster. Maybe an ... Now we need to pivot to focus on healthcare workers and other who are unable to work from home.;https://www.laurenpiner.com/stf;https;www.laurenpiner.com;/stf;;;laurenpiner;198.49.23.144;geolocation;{};US;United States;New York;Manhattan;-74.0101089477539;40.73432922363281;198.49.23.144;Fail to Succeed Blog — Succeed Through Failure;A crisis is something like, a natural disaster. Maybe an ... Now we need to pivot to focus on healthcare workers and other who are unable to work from home.
61;2020-10-07;Waymo and Cruise safety drivers face a bleak choice ...;... and software divisions of these companies get to continue to work from home. ... Unlike the software engineers and other salaried employees at Waymo and ... “Two people in a car with the air conditioner running is a recipe for disaster,” the ...;https://todaynewspost.com/news/technology-news/waymo-and-cruise-safety-drivers-face-a-bleak-choice-pandemic-or-pollution/;https;todaynewspost.com;/news/technology-news/waymo-and-cruise-safety-drivers-face-a-bleak-choice-pandemic-or-pollution/;;;todaynewspost;104.27.156.41;geolocation;{};US;United States;Virginia;Ashburn;-77.47419738769531;39.043701171875;104.27.156.41;Waymo and Cruise safety drivers face a bleak choice ...;... and software divisions of these companies get to continue to work from home. ... Unlike the software engineers and other salaried employees at Waymo and ... “Two people in a car with the air conditioner running is a recipe for disaster,” the ...
62;2020-10-07;Stuart, Author at W.Media - Page 3 of 24;... to the rising work-from-home workforce catalysed by the COVID-19 pandemic. ... Covid-19 tracking, fire mapping and disaster management,” said Brian Cross, the ... pandemic causing security concerns in the 'new normal' of remote working, ... Cisco's suite of cybersecurity products and the software development, as well ...;https://w.media/author/stuart-crowley/page/3/;https;w.media;/author/stuart-crowley/page/3/;;;w;101.100.226.153;geolocation;{};SG;Singapore;;Singapore;103.8198013305664;1.3200000524520874;101.100.226.153;Stuart, Author at W.Media - Page 3 of 24;... to the rising work-from-home workforce catalysed by the COVID-19 pandemic. ... Covid-19 tracking, fire mapping and disaster management,” said Brian Cross, the ... pandemic causing security concerns in the 'new normal' of remote working, ... Cisco's suite of cybersecurity products and the software development, as well ...
63;2020-10-07;Total It Experience 10 To 15 Years Of Experience Relevant ...;10 to 15+ years of relevant experience as a storage and backup / data protection / Disaster recovery technologies. Skills : Storage & Backup , · Disaster ...;https://www.monsterindia.com/search/total-it-experience-10-to-15-years-of-experience-relevant-experience-over-7-years-which-includes-technology-implementation-jobs;https;www.monsterindia.com;/search/total-it-experience-10-to-15-years-of-experience-relevant-experience-over-7-years-which-includes-technology-implementation-jobs;;;monsterindia;23.65.246.131;geolocation;{};US;United States;California;San Jose;-121.83822631835938;37.330528259277344;23.65.246.131;Total It Experience 10 To 15 Years Of Experience Relevant ...;10 to 15+ years of relevant experience as a storage and backup / data protection / Disaster recovery technologies. Skills : Storage & Backup , · Disaster ...
64;2020-10-07;Total It Experience 10 To 15 Years Of Experience Relevant ...;10 to 15+ years of relevant experience as a storage and backup / data protection / Disaster recovery technologies. Skills : Storage & Backup , · Disaster ...;https://www.monsterindia.com/search/total-it-experience-10-to-15-years-of-experience-relevant-experience-over-7-years-which-includes-technology-implementation-jobs;https;www.monsterindia.com;/search/total-it-experience-10-to-15-years-of-experience-relevant-experience-over-7-years-which-includes-technology-implementation-jobs;;;monsterindia;23.65.246.131;geolocation;{};US;United States;California;San Jose;-121.83822631835938;37.330528259277344;23.65.246.131;Total It Experience 10 To 15 Years Of Experience Relevant ...;10 to 15+ years of relevant experience as a storage and backup / data protection / Disaster recovery technologies. Skills : Storage & Backup , · Disaster ...
65;2020-10-07;Total It Experience 10 To 15 Years Of Experience Relevant ...;10 to 15+ years of relevant experience as a storage and backup / data protection / Disaster recovery technologies. Skills : Storage & Backup , · Disaster ...;https://www.monsterindia.com/search/total-it-experience-10-to-15-years-of-experience-relevant-experience-over-7-years-which-includes-technology-implementation-jobs;https;www.monsterindia.com;/search/total-it-experience-10-to-15-years-of-experience-relevant-experience-over-7-years-which-includes-technology-implementation-jobs;;;monsterindia;23.65.246.131;geolocation;{};US;United States;California;San Jose;-121.83822631835938;37.330528259277344;23.65.246.131;Total It Experience 10 To 15 Years Of Experience Relevant ...;10 to 15+ years of relevant experience as a storage and backup / data protection / Disaster recovery technologies. Skills : Storage & Backup , · Disaster ...
66;2020-10-07;DevOps Engineer - Azure (6-10 yrs),Bangalore,DevOps,Azure ...;Configure Azure infra for high availability and disaster recovery. - Experience in designing devops architecture for micro services and NoSQL databases on ...;https://www.hirist.com/j/devops-engineer-azure-6-10-yrs-580769.html;https;www.hirist.com;/j/devops-engineer-azure-6-10-yrs-580769.html;;;hirist;13.233.235.167;geolocation;{};IN;India;Maharashtra;Powai;72.87770080566406;19.076000213623047;13.233.235.167;DevOps Engineer - Azure (6-10 yrs),Bangalore,DevOps,Azure ...;Configure Azure infra for high availability and disaster recovery. - Experience in designing devops architecture for micro services and NoSQL databases on ...
67;2020-10-07;Time Doctor Pricing, Cost & Reviews - Capterra Ireland;Individuals and teams who want to increase their productivity, teams who have remote working team members, working form home and want to track their time ...;https://www.capterra.ie/software/129984/time-doctor;https;www.capterra.ie;/software/129984/time-doctor;;;capterra;172.67.148.128;geolocation;{};US;United States;California;San Francisco;-122.39286041259766;37.76784896850586;172.67.148.128;Time Doctor Pricing, Cost & Reviews - Capterra Ireland;Individuals and teams who want to increase their productivity, teams who have remote working team members, working form home and want to track their time ...
68;2020-10-07;Solution Provider Onepath Rebrands As '1Path' - CRN;Oct 8, 2020 — ... workflow automation, and low-code/no-code software development. 1Pathworks is a gold partner with both Microsoft and Cisco Systems, ...;https://www.crn.com/news/channel-programs/solution-provider-onepath-rebrands-as-1path-;https;www.crn.com;/news/channel-programs/solution-provider-onepath-rebrands-as-1path-;;;crn;99.84.168.122;geolocation;{};US;United States;Illinois;Chicago;-87.67124938964844;41.84885025024414;99.84.168.122;Solution Provider Onepath Rebrands As '1Path' - CRN;Oct 8, 2020 — ... workflow automation, and low-code/no-code software development. 1Pathworks is a gold partner with both Microsoft and Cisco Systems, ...
69;2020-10-07;Relativity Software Engineer(Internship) Interview Questions ...;Oct 7, 2020 — ... a great software experience through this crisis—but providing opportunities to learn and grow, in your skillset and our collective resilience.;https://www.glassdoor.com/Interview/Relativity-Interview-Questions-E1771815.htm?filter.jobTitleExact=Software%20Engineer(Internship);https;www.glassdoor.com;/Interview/Relativity-Interview-Questions-E1771815.htm;filter.jobTitleExact=Software%20Engineer(Internship);;glassdoor;104.17.90.51;geolocation;{};US;United States;New Jersey;Newark;-74.19452667236328;40.738731384277344;104.17.90.51;Relativity Software Engineer(Internship) Interview Questions ...;Oct 7, 2020 — ... a great software experience through this crisis—but providing opportunities to learn and grow, in your skillset and our collective resilience.
70;2020-10-07;Abrams & McKeever CPAs LLC: A professional tax and ...;An alternative position is that your software development costs represent currently ... aren't currently deductible, even if your employer requires you to work from home. ... The operation of the filer was affected by fire, casualty or natural disaster.;https://www.abramsmckeever.com/business-briefs1;https;www.abramsmckeever.com;/business-briefs1;;;abramsmckeever;54.186.178.19;geolocation;{};US;United States;Oregon;Boardman;-119.6989974975586;45.83599853515625;54.186.178.19;Abrams & McKeever CPAs LLC: A professional tax and ...;An alternative position is that your software development costs represent currently ... aren't currently deductible, even if your employer requires you to work from home. ... The operation of the filer was affected by fire, casualty or natural disaster.
71;2020-10-07;AEM Architect - 12+ Yrs at Primesoft, Inc - DailyRemote;Oct 7, 2020 — ... and platform limitations Govern scalability and resilience of modules ... 6.x project Thorough understanding of Agile software development, ...;https://dailyremote.com/remote-job/aem-architect-12-yrs-116053;https;dailyremote.com;/remote-job/aem-architect-12-yrs-116053;;;dailyremote;172.67.136.141;geolocation;{};US;United States;California;San Francisco;-122.39286041259766;37.76784896850586;172.67.136.141;AEM Architect - 12+ Yrs at Primesoft, Inc - DailyRemote;Oct 7, 2020 — ... and platform limitations Govern scalability and resilience of modules ... 6.x project Thorough understanding of Agile software development, ...
72;2020-10-07;ALMtoolbox News;Oct 8, 2020 — This is important if GitLab is critical for your organization, and its downtime disables software development, CI/CD pipelines and delivery times.;https://www.almtoolbox.com/blog/;https;www.almtoolbox.com;/blog/;;;almtoolbox;208.113.220.184;geolocation;{};US;United States;California;Brea;-117.8853988647461;33.92700958251953;208.113.220.184;ALMtoolbox News;Oct 8, 2020 — This is important if GitLab is critical for your organization, and its downtime disables software development, CI/CD pipelines and delivery times.
73;2020-10-07;The Cyber Edge | SIGNAL Magazine - AFCEA International;Even contractors work from home legally, securely and effectively. ... commission's theory of deterrence by denial and how it embraced the concept of resilience. ... in starting to “break the mold” of Defense Department software development.;https://www.afcea.org/content/tags/cyber-edge;https;www.afcea.org;/content/tags/cyber-edge;;;afcea;63.65.212.51;geolocation;{};US;United States;Virginia;Merrifield;-77.37677001953125;38.879371643066406;63.65.212.51;The Cyber Edge | SIGNAL Magazine - AFCEA International;Even contractors work from home legally, securely and effectively. ... commission's theory of deterrence by denial and how it embraced the concept of resilience. ... in starting to “break the mold” of Defense Department software development.
74;2020-10-07;Cybersecurity – Never Ending War Against Cybercrime - Teceze;Oct 8, 2020 — Teceze can start helping by conducting 1 free remote working IT review to assess the security posture of your organization. Teceze is a leading ...;https://www.teceze.com/cybersecurity-never-ending-war-against-cybercrime/;https;www.teceze.com;/cybersecurity-never-ending-war-against-cybercrime/;;;teceze;104.26.15.148;geolocation;{};US;United States;Virginia;Ashburn;-77.47419738769531;39.043701171875;104.26.15.148;Cybersecurity – Never Ending War Against Cybercrime - Teceze;Oct 8, 2020 — Teceze can start helping by conducting 1 free remote working IT review to assess the security posture of your organization. Teceze is a leading ...
75;2020-10-07;Cybersecurity – Never Ending War Against Cybercrime - Teceze;Oct 8, 2020 — Teceze can start helping by conducting 1 free remote working IT review to assess the security posture of your organization. Teceze is a leading ...;https://www.teceze.com/cybersecurity-never-ending-war-against-cybercrime/;https;www.teceze.com;/cybersecurity-never-ending-war-against-cybercrime/;;;teceze;104.26.15.148;geolocation;{};US;United States;Virginia;Ashburn;-77.47419738769531;39.043701171875;104.26.15.148;Cybersecurity – Never Ending War Against Cybercrime - Teceze;Oct 8, 2020 — Teceze can start helping by conducting 1 free remote working IT review to assess the security posture of your organization. Teceze is a leading ...
76;2020-10-07;Overlooked Security Threats to Businesses | Cyber security ...;Oct 8, 2020 — Infrastructure Penetration Testing · Wireless Network Penetration Testing · Remote Working Penetration Testing · Social ... Big Data · Software Development · Website Design · Mobile Apps ... Disaster Recovery Plans vs.;https://www.teceze.com/overlooked-cyber-security-threats-to-businesses/;https;www.teceze.com;/overlooked-cyber-security-threats-to-businesses/;;;teceze;104.26.15.148;geolocation;{};US;United States;Virginia;Ashburn;-77.47419738769531;39.043701171875;104.26.15.148;Overlooked Security Threats to Businesses | Cyber security ...;Oct 8, 2020 — Infrastructure Penetration Testing · Wireless Network Penetration Testing · Remote Working Penetration Testing · Social ... Big Data · Software Development · Website Design · Mobile Apps ... Disaster Recovery Plans vs.
77;2020-10-07;Overlooked Security Threats to Businesses | Cyber security ...;Oct 8, 2020 — Infrastructure Penetration Testing · Wireless Network Penetration Testing · Remote Working Penetration Testing · Social ... Big Data · Software Development · Website Design · Mobile Apps ... Disaster Recovery Plans vs.;https://www.teceze.com/overlooked-cyber-security-threats-to-businesses/;https;www.teceze.com;/overlooked-cyber-security-threats-to-businesses/;;;teceze;104.26.15.148;geolocation;{};US;United States;Virginia;Ashburn;-77.47419738769531;39.043701171875;104.26.15.148;Overlooked Security Threats to Businesses | Cyber security ...;Oct 8, 2020 — Infrastructure Penetration Testing · Wireless Network Penetration Testing · Remote Working Penetration Testing · Social ... Big Data · Software Development · Website Design · Mobile Apps ... Disaster Recovery Plans vs.
78;2020-10-07;Why zero trust remote networking is key to thriving in the 'new ...;Oct 7, 2020 — ... both company managed devices and unmanaged personal devices. At the same time, top security considerations for remote working include: ...;https://remoteworkertech.asia/story/why-zero-trust-remote-networking-is-key-to-thriving-in-the-new-normal-business-world;https;remoteworkertech.asia;/story/why-zero-trust-remote-networking-is-key-to-thriving-in-the-new-normal-business-world;;;remoteworkertech;113.21.226.180;geolocation;{};NZ;New Zealand;Auckland;Auckland;174.6802978515625;-36.78810119628906;113.21.226.180;Why zero trust remote networking is key to thriving in the 'new ...;Oct 7, 2020 — ... both company managed devices and unmanaged personal devices. At the same time, top security considerations for remote working include: ...
79;2020-10-07;Why zero trust remote networking is key to thriving in the 'new ...;Oct 7, 2020 — ... both company managed devices and unmanaged personal devices. At the same time, top security considerations for remote working include: ...;https://remoteworkertech.asia/story/why-zero-trust-remote-networking-is-key-to-thriving-in-the-new-normal-business-world;https;remoteworkertech.asia;/story/why-zero-trust-remote-networking-is-key-to-thriving-in-the-new-normal-business-world;;;remoteworkertech;113.21.226.180;geolocation;{};NZ;New Zealand;Auckland;Auckland;174.6802978515625;-36.78810119628906;113.21.226.180;Why zero trust remote networking is key to thriving in the 'new ...;Oct 7, 2020 — ... both company managed devices and unmanaged personal devices. At the same time, top security considerations for remote working include: ...
80;2020-10-07;Why zero trust remote networking is key to thriving in the 'new ...;Oct 7, 2020 — ... both company managed devices and unmanaged personal devices. At the same time, top security considerations for remote working include: ...;https://remoteworkertech.asia/story/why-zero-trust-remote-networking-is-key-to-thriving-in-the-new-normal-business-world;https;remoteworkertech.asia;/story/why-zero-trust-remote-networking-is-key-to-thriving-in-the-new-normal-business-world;;;remoteworkertech;113.21.226.180;geolocation;{};NZ;New Zealand;Auckland;Auckland;174.6802978515625;-36.78810119628906;113.21.226.180;Why zero trust remote networking is key to thriving in the 'new ...;Oct 7, 2020 — ... both company managed devices and unmanaged personal devices. At the same time, top security considerations for remote working include: ...
81;2020-10-07;Why zero trust remote networking is key to thriving in the 'new ...;Oct 7, 2020 — ... both company managed devices and unmanaged personal devices. At the same time, top security considerations for remote working include: ...;https://remoteworkertech.asia/story/why-zero-trust-remote-networking-is-key-to-thriving-in-the-new-normal-business-world;https;remoteworkertech.asia;/story/why-zero-trust-remote-networking-is-key-to-thriving-in-the-new-normal-business-world;;;remoteworkertech;113.21.226.180;geolocation;{};NZ;New Zealand;Auckland;Auckland;174.6802978515625;-36.78810119628906;113.21.226.180;Why zero trust remote networking is key to thriving in the 'new ...;Oct 7, 2020 — ... both company managed devices and unmanaged personal devices. At the same time, top security considerations for remote working include: ...
82;2020-10-07;Why zero trust remote networking is key to thriving in the 'new ...;Oct 7, 2020 — ... both company managed devices and unmanaged personal devices. At the same time, top security considerations for remote working include: ...;https://remoteworkertech.asia/story/why-zero-trust-remote-networking-is-key-to-thriving-in-the-new-normal-business-world;https;remoteworkertech.asia;/story/why-zero-trust-remote-networking-is-key-to-thriving-in-the-new-normal-business-world;;;remoteworkertech;113.21.226.180;geolocation;{};NZ;New Zealand;Auckland;Auckland;174.6802978515625;-36.78810119628906;113.21.226.180;Why zero trust remote networking is key to thriving in the 'new ...;Oct 7, 2020 — ... both company managed devices and unmanaged personal devices. At the same time, top security considerations for remote working include: ...
83;2020-10-07;Resilience and demand will reboot the semiconductor industry ...;Resilience and demand will reboot the semiconductor industry in 2020 and beyond ... Board-level design and software development work had slowed down while ... video streaming and conferencing as more people work from home Demand ...;https://telecom.economictimes.indiatimes.com/tele-talk/resilience-and-demand-will-reboot-the-semiconductor-industry-in-2020-and-beyond/4258;https;telecom.economictimes.indiatimes.com;/tele-talk/resilience-and-demand-will-reboot-the-semiconductor-industry-in-2020-and-beyond/4258;;;indiatimes;72.246.20.235;geolocation;{};US;United States;Illinois;Chicago;-87.67124938964844;41.84885025024414;72.246.20.235;Resilience and demand will reboot the semiconductor industry ...;Resilience and demand will reboot the semiconductor industry in 2020 and beyond ... Board-level design and software development work had slowed down while ... video streaming and conferencing as more people work from home Demand ...
84;2020-10-07;Staffing a Multiskilled Workforce with Varying Levels of ...;Oct 7, 2020 — Download Citation | Staffing a Multiskilled Workforce with Varying Levels of Productivity: An Analysis of Cross-Training Policies | Service ...;https://www.researchgate.net/publication/229911438_Staffing_a_Multiskilled_Workforce_with_Varying_Levels_of_Productivity_An_Analysis_of_Cross-Training_Policies;https;www.researchgate.net;/publication/229911438_Staffing_a_Multiskilled_Workforce_with_Varying_Levels_of_Productivity_An_Analysis_of_Cross-Training_Policies;;;researchgate;104.17.32.105;geolocation;{};US;United States;Florida;Flagami;-80.31195831298828;25.762859344482422;104.17.32.105;Staffing a Multiskilled Workforce with Varying Levels of ...;Oct 7, 2020 — Download Citation | Staffing a Multiskilled Workforce with Varying Levels of Productivity: An Analysis of Cross-Training Policies | Service ...
85;2020-10-07;AVIA's Satellite Industry Forum highlights the resilience of the ...;Oct 8, 2020 — SINGAPORE, Oct 8, 2020 - (ACN Newswire) - The Asia Video Industry Association (AVIA) held its annual Satellite Industry Forum (SIF) as a ...;https://www.itbusinessnet.com/2020/10/avias-satellite-industry-forum-highlights-the-resilience-of-the-satellite-industry-and-the-key-role-it-will-continue-to-have-in-this-age-of-connectivity/;https;www.itbusinessnet.com;/2020/10/avias-satellite-industry-forum-highlights-the-resilience-of-the-satellite-industry-and-the-key-role-it-will-continue-to-have-in-this-age-of-connectivity/;;;itbusinessnet;104.31.87.205;geolocation;{};US;United States;California;San Jose;-121.83822631835938;37.330528259277344;104.31.87.205;AVIA's Satellite Industry Forum highlights the resilience of the ...;Oct 8, 2020 — SINGAPORE, Oct 8, 2020 - (ACN Newswire) - The Asia Video Industry Association (AVIA) held its annual Satellite Industry Forum (SIF) as a ...
86;2020-10-07;Gibraltar's leading IT service provider | ITMS;Oct 7, 2020 — Disaster Recovery. itms gibraltar ... to safe remote working and are proud to donate our services to ChildLine. ... Software Development 100%.;https://itmsltd.net/services/;https;itmsltd.net;/services/;;;itmsltd;160.153.138.177;geolocation;{};US;United States;Arizona;Scottsdale;-111.89010620117188;33.610958099365234;160.153.138.177;Gibraltar's leading IT service provider | ITMS;Oct 7, 2020 — Disaster Recovery. itms gibraltar ... to safe remote working and are proud to donate our services to ChildLine. ... Software Development 100%.
87;2020-10-07;Why zero trust remote networking is key to thriving in the 'new ...;Oct 7, 2020 — ... both company managed devices and unmanaged personal devices. At the same time, top security considerations for remote working include: ...;https://itbrief.com.au/story/why-zero-trust-remote-networking-is-key-to-thriving-in-the-new-normal-business-world;https;itbrief.com.au;/story/why-zero-trust-remote-networking-is-key-to-thriving-in-the-new-normal-business-world;;;com;113.21.226.180;geolocation;{};NZ;New Zealand;Auckland;Auckland;174.6802978515625;-36.78810119628906;113.21.226.180;Why zero trust remote networking is key to thriving in the 'new ...;Oct 7, 2020 — ... both company managed devices and unmanaged personal devices. At the same time, top security considerations for remote working include: ...
88;2020-10-07;Why zero trust remote networking is key to thriving in the 'new ...;Oct 7, 2020 — ... both company managed devices and unmanaged personal devices. At the same time, top security considerations for remote working include: ...;https://itbrief.com.au/story/why-zero-trust-remote-networking-is-key-to-thriving-in-the-new-normal-business-world;https;itbrief.com.au;/story/why-zero-trust-remote-networking-is-key-to-thriving-in-the-new-normal-business-world;;;com;113.21.226.180;geolocation;{};NZ;New Zealand;Auckland;Auckland;174.6802978515625;-36.78810119628906;113.21.226.180;Why zero trust remote networking is key to thriving in the 'new ...;Oct 7, 2020 — ... both company managed devices and unmanaged personal devices. At the same time, top security considerations for remote working include: ...
