;date;header;summary;link;protocol;domain;path;query;fragment;host_name;ip_address;Type;AdditionalData;CountryCode;CountryName;State;City;Longitude;Latitude;IpAddress;header_context_true;summary_context_true
89;2020-08-26;Video: 10 Minute IT Jams - Who is SonicWall?;Juniper Networks expands security offering for remote working ... who discusses the trend of big brands ...;https://remoteworkertech.asia/story/video-10-minute-it-jams-who-is-sonicwall;https;remoteworkertech.asia;/story/video-10-minute-it-jams-who-is-sonicwall;;;remoteworkertech;113.21.226.180;geolocation;{};NZ;New Zealand;Auckland;Auckland;174.6802978515625;-36.78810119628906;113.21.226.180;Video: 10 Minute IT Jams - Who is SonicWall?;Juniper Networks expands security offering for remote working ... who discusses the trend of big brands ...
90;2020-08-26;Video: 10 Minute IT Jams - Who is SonicWall?;Juniper Networks expands security offering for remote working ... who discusses the trend of big brands ...;https://remoteworkertech.asia/story/video-10-minute-it-jams-who-is-sonicwall;https;remoteworkertech.asia;/story/video-10-minute-it-jams-who-is-sonicwall;;;remoteworkertech;113.21.226.180;geolocation;{};NZ;New Zealand;Auckland;Auckland;174.6802978515625;-36.78810119628906;113.21.226.180;Video: 10 Minute IT Jams - Who is SonicWall?;Juniper Networks expands security offering for remote working ... who discusses the trend of big brands ...
91;2020-08-26;Video: 10 Minute IT Jams - Who is SonicWall?;Juniper Networks expands security offering for remote working ... who discusses the trend of big brands ...;https://remoteworkertech.asia/story/video-10-minute-it-jams-who-is-sonicwall;https;remoteworkertech.asia;/story/video-10-minute-it-jams-who-is-sonicwall;;;remoteworkertech;113.21.226.180;geolocation;{};NZ;New Zealand;Auckland;Auckland;174.6802978515625;-36.78810119628906;113.21.226.180;Video: 10 Minute IT Jams - Who is SonicWall?;Juniper Networks expands security offering for remote working ... who discusses the trend of big brands ...
92;2020-08-26;Business Technology News and Commentary - Dark Reading;Residual work-from-home policies will require changes to security policies, ... of remote working to how enterprise security strategy will be affected long term.;https://www.darkreading.com/archives.asp?newsandcommentary=yes&tag_id=662&piddl_month=8&piddl_year=2020;https;www.darkreading.com;/archives.asp;newsandcommentary=yes&tag_id=662&piddl_month=8&piddl_year=2020;;darkreading;104.17.119.99;geolocation;{};US;United States;California;San Jose;-121.83822631835938;37.330528259277344;104.17.119.99;Business Technology News and Commentary - Dark Reading;Residual work-from-home policies will require changes to security policies, ... of remote working to how enterprise security strategy will be affected long term.
93;2020-08-26;Application Support, Tech Lead at Fiserv, Inc.;Aug 26, 2020 — Maintain and/or create technical support documentation. Maintain the certification, Disaster Recovery and Production Environment with regards ...;https://www.careers.fiserv.com/job/pune/application-support-tech-lead/1758/17169940;https;www.careers.fiserv.com;/job/pune/application-support-tech-lead/1758/17169940;;;fiserv;23.35.71.48;geolocation;{};US;United States;Illinois;Chicago;-87.67124938964844;41.84885025024414;23.35.71.48;Application Support, Tech Lead at Fiserv, Inc.;Aug 26, 2020 — Maintain and/or create technical support documentation. Maintain the certification, Disaster Recovery and Production Environment with regards ...
94;2020-08-26;Offshore Development Archives - Norgic.com;"Aug 26, 2020 — Ever since the disaster occurred, companies are making faster decisions. ... Outsourcing software development companies isn't something new, ... outsourcing company; remote working can simply be described as a benefit.";https://norgic.com/blog/category/offshore-development/;https;norgic.com;/blog/category/offshore-development/;;;norgic;213.32.105.52;geolocation;{};SE;Sweden;Stockholm;Jakobsberg;17.83679962158203;59.41006851196289;213.32.105.52;Offshore Development Archives - Norgic.com;"Aug 26, 2020 — Ever since the disaster occurred, companies are making faster decisions. ... Outsourcing software development companies isn't something new, ... outsourcing company; remote working can simply be described as a benefit."
95;2020-08-26;Current Openings - Russell Doyle Professionals;Aug 27, 2020 — Seeking software engineers to work closely with computer scientists, ... 1821, Technical Sr. Director of Software Development (Cloud) ... Seeking Software Engineers to develop disaster recovery and database restoration software. ... C, Linux OS Internals, device dri, Orange County, CA (work from home), ...;https://russelldoyle.com/index.php/current-openings/;https;russelldoyle.com;/index.php/current-openings/;;;russelldoyle;172.104.238.113;geolocation;{};DE;Germany;Hesse;Frankfurt am Main;8.682100296020508;50.11090087890625;172.104.238.113;Current Openings - Russell Doyle Professionals;Aug 27, 2020 — Seeking software engineers to work closely with computer scientists, ... 1821, Technical Sr. Director of Software Development (Cloud) ... Seeking Software Engineers to develop disaster recovery and database restoration software. ... C, Linux OS Internals, device dri, Orange County, CA (work from home), ...
96;2020-08-26;Jumpstart Issue 30: The Lockdown Issue by Jumpstart ... - Issuu;Aug 26, 2020 — With the rise of remote working, office productivity tools, and cloud technology, ... to rise as workers around the world–from lawyers and software engineers to ... has calmed down? hether it's a natural disaster, economic crash, or even ... While we adapt to the new normal, digitization and work from home are ...;https://issuu.com/jumpstartmagazine/docs/fall_2020;https;issuu.com;/jumpstartmagazine/docs/fall_2020;;;issuu;54.164.224.80;geolocation;{};US;United States;Virginia;Ashburn;-77.47419738769531;39.043701171875;54.164.224.80;Jumpstart Issue 30: The Lockdown Issue by Jumpstart ... - Issuu;Aug 26, 2020 — With the rise of remote working, office productivity tools, and cloud technology, ... to rise as workers around the world–from lawyers and software engineers to ... has calmed down? hether it's a natural disaster, economic crash, or even ... While we adapt to the new normal, digitization and work from home are ...
97;2020-08-26;Net Developer - wellpaid.io;... a Microsoft environment1 - 2 years Financial Services industryStrong knowledge of common concepts, architectures and processes in software development.;https://wellpaid.io/job/net-developer-indeedus-4d2c385a1d8629c4;https;wellpaid.io;/job/net-developer-indeedus-4d2c385a1d8629c4;;;wellpaid;172.67.149.82;geolocation;{};US;United States;California;San Francisco;-122.39286041259766;37.76784896850586;172.67.149.82;Net Developer - wellpaid.io;... a Microsoft environment1 - 2 years Financial Services industryStrong knowledge of common concepts, architectures and processes in software development.
98;2020-08-26;IMS launches recruitment drive to boost workforce | Insurance ...;Aug 27, 2020 — Claire Birks, the group HR director at IMS, said the company would offer a work-from-home option for the new roles. “We like to give people the ...;https://www.insurancebusinessmag.com/uk/news/breaking-news/ims-launches-recruitment-drive-to-boost-workforce-231891.aspx;https;www.insurancebusinessmag.com;/uk/news/breaking-news/ims-launches-recruitment-drive-to-boost-workforce-231891.aspx;;;insurancebusinessmag;52.168.10.1;geolocation;{};US;United States;Virginia;Washington;-78.15899658203125;38.7130012512207;52.168.10.1;IMS launches recruitment drive to boost workforce | Insurance ...;Aug 27, 2020 — Claire Birks, the group HR director at IMS, said the company would offer a work-from-home option for the new roles. “We like to give people the ...
99;2020-08-26;NetApp (NTAP) Q1 2021 Earnings Call Transcript | The Motley ...;Aug 27, 2020 — Companies are moving beyond the initial response to the pandemic of operationalizing work from home. They are now looking to accelerate ...;https://www.fool.com/earnings/call-transcripts/2020/08/27/netapp-ntap-q1-2021-earnings-call-transcript/;https;www.fool.com;/earnings/call-transcripts/2020/08/27/netapp-ntap-q1-2021-earnings-call-transcript/;;;fool;151.101.1.143;geolocation;{};US;United States;California;San Francisco;-122.39286041259766;37.76784896850586;151.101.1.143;NetApp (NTAP) Q1 2021 Earnings Call Transcript | The Motley ...;Aug 27, 2020 — Companies are moving beyond the initial response to the pandemic of operationalizing work from home. They are now looking to accelerate ...
100;2020-08-26;Data Scientist - Auth0 | Built In Seattle;Aug 26, 2020 — Operations is about the availability, fast access and the resilience of our systems. ... Work from home with up to 50% travel within region. ... We are looking for software engineers with the motivation and experience to bring it all ...;https://www.builtinseattle.com/job/data/data-scientist/22795;https;www.builtinseattle.com;/job/data/data-scientist/22795;;;builtinseattle;104.17.76.46;geolocation;{};US;United States;Virginia;Ashburn;-77.47419738769531;39.043701171875;104.17.76.46;Data Scientist - Auth0 | Built In Seattle;Aug 26, 2020 — Operations is about the availability, fast access and the resilience of our systems. ... Work from home with up to 50% travel within region. ... We are looking for software engineers with the motivation and experience to bring it all ...
101;2020-08-26;Sitemap - e-max machines for recycling & solid waste ...;... 0.6 http://emaxindustry.com/337-work-from-home-software-development-jobs-in- ... 0.5 http://emaxindustry.com/901-software-engineers-work-at-home 2020-09-25 ... 0.7 http://emaxindustry.com/1099-disaster-recovery-plan-work-from-home ...;https://www.emaxindustry.com/sitemap.xml;https;www.emaxindustry.com;/sitemap.xml;;;emaxindustry;162.241.24.212;geolocation;{};US;United States;Utah;Provo;-111.6124267578125;40.21580123901367;162.241.24.212;Sitemap - e-max machines for recycling & solid waste ...;... 0.6 http://emaxindustry.com/337-work-from-home-software-development-jobs-in- ... 0.5 http://emaxindustry.com/901-software-engineers-work-at-home 2020-09-25 ... 0.7 http://emaxindustry.com/1099-disaster-recovery-plan-work-from-home ...
102;2020-08-26;How Argo Tunnel engineering uses Argo Tunnel - Slacker News;Aug 27, 2020 — ... Application Protection, Application Resilience, Application Security, Application ... noms, Non software development, Non-Computer, Non-Permanent ... remote-work, remote-working, removing backgrounds, Renaissance, rental ... words, WordsAPI, Wordsmith, work, Work from home, Work Life Balance ...;https://slacker.ro/2020/08/27/how-argo-tunnel-engineering-uses-argo-tunnel/;https;slacker.ro;/2020/08/27/how-argo-tunnel-engineering-uses-argo-tunnel/;;;slacker;104.28.14.71;geolocation;{};US;United States;California;San Jose;-121.83822631835938;37.330528259277344;104.28.14.71;How Argo Tunnel engineering uses Argo Tunnel - Slacker News;Aug 27, 2020 — ... Application Protection, Application Resilience, Application Security, Application ... noms, Non software development, Non-Computer, Non-Permanent ... remote-work, remote-working, removing backgrounds, Renaissance, rental ... words, WordsAPI, Wordsmith, work, Work from home, Work Life Balance ...
103;2020-08-26;The Gorman Group - Posts | Facebook;This position also oversees the implementation of new software, maintaining existing software, and prepares for IT disaster recovery. Primary Duties • Maintain ...;https://www.facebook.com/gormanroads/posts;https;www.facebook.com;/gormanroads/posts;;;facebook;157.240.18.35;geolocation;{};US;United States;California;Menlo Park;-122.1860580444336;37.45903015136719;157.240.18.35;The Gorman Group - Posts | Facebook;This position also oversees the implementation of new software, maintaining existing software, and prepares for IT disaster recovery. Primary Duties • Maintain ...
104;2020-08-26;GoTo & Microsoft Teams: A winning collaboration;Aug 26, 2020 — Juniper Networks expands security offering for remote working. Juniper Networks has launched new solutions to enhance work from home security.More ... PagerDuty was born from the idea that software development and operations ... Accurics, a cloud cyber resilience company specialising in cloud native ...;https://itbrief.com.au/story/goto-microsoft-teams-a-winning-collaboration;https;itbrief.com.au;/story/goto-microsoft-teams-a-winning-collaboration;;;com;113.21.226.180;geolocation;{};NZ;New Zealand;Auckland;Auckland;174.6802978515625;-36.78810119628906;113.21.226.180;GoTo & Microsoft Teams: A winning collaboration;Aug 26, 2020 — Juniper Networks expands security offering for remote working. Juniper Networks has launched new solutions to enhance work from home security.More ... PagerDuty was born from the idea that software development and operations ... Accurics, a cloud cyber resilience company specialising in cloud native ...
105;2020-08-26;GoTo & Microsoft Teams: A winning collaboration;Aug 26, 2020 — Juniper Networks expands security offering for remote working. Juniper Networks has launched new solutions to enhance work from home security.More ... PagerDuty was born from the idea that software development and operations ... Accurics, a cloud cyber resilience company specialising in cloud native ...;https://itbrief.com.au/story/goto-microsoft-teams-a-winning-collaboration;https;itbrief.com.au;/story/goto-microsoft-teams-a-winning-collaboration;;;com;113.21.226.180;geolocation;{};NZ;New Zealand;Auckland;Auckland;174.6802978515625;-36.78810119628906;113.21.226.180;GoTo & Microsoft Teams: A winning collaboration;Aug 26, 2020 — Juniper Networks expands security offering for remote working. Juniper Networks has launched new solutions to enhance work from home security.More ... PagerDuty was born from the idea that software development and operations ... Accurics, a cloud cyber resilience company specialising in cloud native ...
106;2020-08-26;GoTo & Microsoft Teams: A winning collaboration;Aug 26, 2020 — Juniper Networks expands security offering for remote working. Juniper Networks has launched new solutions to enhance work from home security.More ... PagerDuty was born from the idea that software development and operations ... Accurics, a cloud cyber resilience company specialising in cloud native ...;https://itbrief.com.au/story/goto-microsoft-teams-a-winning-collaboration;https;itbrief.com.au;/story/goto-microsoft-teams-a-winning-collaboration;;;com;113.21.226.180;geolocation;{};NZ;New Zealand;Auckland;Auckland;174.6802978515625;-36.78810119628906;113.21.226.180;GoTo & Microsoft Teams: A winning collaboration;Aug 26, 2020 — Juniper Networks expands security offering for remote working. Juniper Networks has launched new solutions to enhance work from home security.More ... PagerDuty was born from the idea that software development and operations ... Accurics, a cloud cyber resilience company specialising in cloud native ...
107;2020-08-26;UOU Open University PHD Syllabus, Counselling Date ...;Aug 27, 2020 — ... Ministry · Directorate of Purchase and Stores DPSDAE · Disaster Management ... Sofa Agreement · Softech · Software · Software Development Course ... Vocational teachers · Vodafone Latest · Vodafone Work From Home ...;https://www.sscbankgk.in/2020/08/uou-open-university-phd-syllabus.html;https;www.sscbankgk.in;/2020/08/uou-open-university-phd-syllabus.html;;;sscbankgk;173.194.74.121;geolocation;{};US;United States;California;Mountain View;-122.07540893554688;37.419158935546875;173.194.74.121;UOU Open University PHD Syllabus, Counselling Date ...;Aug 27, 2020 — ... Ministry · Directorate of Purchase and Stores DPSDAE · Disaster Management ... Sofa Agreement · Softech · Software · Software Development Course ... Vocational teachers · Vodafone Latest · Vodafone Work From Home ...
108;2020-08-26;UOU Open University PHD Syllabus, Counselling Date ...;Aug 27, 2020 — ... Ministry · Directorate of Purchase and Stores DPSDAE · Disaster Management ... Sofa Agreement · Softech · Software · Software Development Course ... Vocational teachers · Vodafone Latest · Vodafone Work From Home ...;https://www.sscbankgk.in/2020/08/uou-open-university-phd-syllabus.html;https;www.sscbankgk.in;/2020/08/uou-open-university-phd-syllabus.html;;;sscbankgk;173.194.74.121;geolocation;{};US;United States;California;Mountain View;-122.07540893554688;37.419158935546875;173.194.74.121;UOU Open University PHD Syllabus, Counselling Date ...;Aug 27, 2020 — ... Ministry · Directorate of Purchase and Stores DPSDAE · Disaster Management ... Sofa Agreement · Softech · Software · Software Development Course ... Vocational teachers · Vodafone Latest · Vodafone Work From Home ...
109;2020-08-26;https://www.wwt.com weekly 0.3 https://www.wwt.com/about ...;... 0.7 https://www.wwt.com/lab/rubrik-disaster-recovery-validation ... Remote working is persisting longer than any of us anticipated Industries with direct customer ... About Agile Software Development https://creativecommons.org/licenses/by/4.0/ ... -up-a-faster-more-secure-broadband-speed-for-work-from-home-employees ...;https://www.wwt.com/sitemap.xml;https;www.wwt.com;/sitemap.xml;;;wwt;198.200.139.195;geolocation;{};US;United States;Missouri;Maryland Heights;-90.4557113647461;38.73085021972656;198.200.139.195;https://www.wwt.com weekly 0.3 https://www.wwt.com/about ...;... 0.7 https://www.wwt.com/lab/rubrik-disaster-recovery-validation ... Remote working is persisting longer than any of us anticipated Industries with direct customer ... About Agile Software Development https://creativecommons.org/licenses/by/4.0/ ... -up-a-faster-more-secure-broadband-speed-for-work-from-home-employees ...
110;2020-08-26;COVID-19 and the Demand for WVD and Remote Workforces ...;Aug 26, 2020 — It also can be recovered to a secondary region in case of Disaster ... It's also a useful solution for software development testing – software ...;https://www.version1.com/blog-azure-windows-virtual-desktop/;https;www.version1.com;/blog-azure-windows-virtual-desktop/;;;version1;34.249.84.157;geolocation;{};IE;Ireland;Leinster;Dublin;-6.243330001831055;53.35388946533203;34.249.84.157;COVID-19 and the Demand for WVD and Remote Workforces ...;Aug 26, 2020 — It also can be recovered to a secondary region in case of Disaster ... It's also a useful solution for software development testing – software ...
111;2020-08-26;Why unified tools are a better choice for physical security;Aug 27, 2020 — ... surveillance through software development kits (SDKs) or application programming ... Cohesity announces integrated, automated disaster recovery ... many businesses have had to embrace remote working as business as usual. ... Data resilience strategies are becoming more crucial as more value is ...;https://itbrief.co.nz/story/why-unified-tools-are-a-better-choice-for-physical-security;https;itbrief.co.nz;/story/why-unified-tools-are-a-better-choice-for-physical-security;;;co;113.21.226.180;geolocation;{};NZ;New Zealand;Auckland;Auckland;174.6802978515625;-36.78810119628906;113.21.226.180;Why unified tools are a better choice for physical security;Aug 27, 2020 — ... surveillance through software development kits (SDKs) or application programming ... Cohesity announces integrated, automated disaster recovery ... many businesses have had to embrace remote working as business as usual. ... Data resilience strategies are becoming more crucial as more value is ...
112;2020-08-26;Why unified tools are a better choice for physical security;Aug 27, 2020 — ... surveillance through software development kits (SDKs) or application programming ... Cohesity announces integrated, automated disaster recovery ... many businesses have had to embrace remote working as business as usual. ... Data resilience strategies are becoming more crucial as more value is ...;https://itbrief.co.nz/story/why-unified-tools-are-a-better-choice-for-physical-security;https;itbrief.co.nz;/story/why-unified-tools-are-a-better-choice-for-physical-security;;;co;113.21.226.180;geolocation;{};NZ;New Zealand;Auckland;Auckland;174.6802978515625;-36.78810119628906;113.21.226.180;Why unified tools are a better choice for physical security;Aug 27, 2020 — ... surveillance through software development kits (SDKs) or application programming ... Cohesity announces integrated, automated disaster recovery ... many businesses have had to embrace remote working as business as usual. ... Data resilience strategies are becoming more crucial as more value is ...
113;2020-08-26;Why unified tools are a better choice for physical security;Aug 27, 2020 — ... surveillance through software development kits (SDKs) or application programming ... Cohesity announces integrated, automated disaster recovery ... many businesses have had to embrace remote working as business as usual. ... Data resilience strategies are becoming more crucial as more value is ...;https://itbrief.co.nz/story/why-unified-tools-are-a-better-choice-for-physical-security;https;itbrief.co.nz;/story/why-unified-tools-are-a-better-choice-for-physical-security;;;co;113.21.226.180;geolocation;{};NZ;New Zealand;Auckland;Auckland;174.6802978515625;-36.78810119628906;113.21.226.180;Why unified tools are a better choice for physical security;Aug 27, 2020 — ... surveillance through software development kits (SDKs) or application programming ... Cohesity announces integrated, automated disaster recovery ... many businesses have had to embrace remote working as business as usual. ... Data resilience strategies are becoming more crucial as more value is ...
114;2020-08-26;Nyriad hiring Senior Software Developer in Cambridge ...;Aug 27, 2020 — ... New Zealand, however, we may consider work from home arrangements should we identify a candidate who is an exceptional fit for the role.;https://nz.linkedin.com/jobs/view/senior-software-developer-at-nyriad-2010022826;https;nz.linkedin.com;/jobs/view/senior-software-developer-at-nyriad-2010022826;;;linkedin;108.174.10.14;geolocation;{};US;United States;California;Sunnyvale;-122.01677703857422;37.38859939575195;108.174.10.14;Nyriad hiring Senior Software Developer in Cambridge ...;Aug 27, 2020 — ... New Zealand, however, we may consider work from home arrangements should we identify a candidate who is an exceptional fit for the role.
115;2020-08-26;Working at Sling TV: Employee Reviews | Indeed.com;Software Development Engineer (Current Employee) - American Fork, UT - August 26, 2020. STAY AWAY. ... Lack of communication and transparency makes working for Sling TV a disaster. Was this ... Are there work from home opportunities?;https://www.indeed.com/cmp/Sling-Tv/reviews;https;www.indeed.com;/cmp/Sling-Tv/reviews;;;indeed;18.218.22.89;geolocation;{};US;United States;Ohio;Columbus;-82.99945831298828;39.99557876586914;18.218.22.89;Working at Sling TV: Employee Reviews | Indeed.com;Software Development Engineer (Current Employee) - American Fork, UT - August 26, 2020. STAY AWAY. ... Lack of communication and transparency makes working for Sling TV a disaster. Was this ... Are there work from home opportunities?
116;2020-08-26;These are some of the conspiracy theories and fringe views ...;The scheduled speakers at this year's Republican National Convention have shared so many conspiracies and debunked claims that previous conventions look ...;https://imad.edu.es/business-school/these-are-some-of-the-conspiracy-theories-and-fringe-views-floated-by-scheduled-speakers-at-this-years-republican-national-convention/;https;imad.edu.es;/business-school/these-are-some-of-the-conspiracy-theories-and-fringe-views-floated-by-scheduled-speakers-at-this-years-republican-national-convention/;;;edu;185.37.226.35;geolocation;{};ES;Spain;Madrid;Alcobendas;-3.6497199535369873;40.516151428222656;185.37.226.35;These are some of the conspiracy theories and fringe views ...;The scheduled speakers at this year's Republican National Convention have shared so many conspiracies and debunked claims that previous conventions look ...
117;2020-08-26;Ab Initio Support Engineer - Global Investment Banking ...;Aug 27, 2020 — Participate to Resiliency events (Disaster Recovery, Sustained ... Amazon - Software Development Engineer II - Backend Technologies.;https://www.hirist.com/j/ab-initio-support-engineer-global-investment-banking-domain-3-5-yrs-635382.html?ref=rl&pref=ep;https;www.hirist.com;/j/ab-initio-support-engineer-global-investment-banking-domain-3-5-yrs-635382.html;ref=rl&pref=ep;;hirist;13.233.235.167;geolocation;{};IN;India;Maharashtra;Powai;72.87770080566406;19.076000213623047;13.233.235.167;Ab Initio Support Engineer - Global Investment Banking ...;Aug 27, 2020 — Participate to Resiliency events (Disaster Recovery, Sustained ... Amazon - Software Development Engineer II - Backend Technologies.
118;2020-08-26;Solution Architect job in Cincinnati at EIS Group | Lensa;Aug 26, 2020 — This is a Remote / Work From Home Opportunity ** EIS is an insurance software company that enables leading insurers to innovate and ...;https://lensa.com/solution-architect-jobs/cincinnati/jd/2429f1b16b92e9cf5b8a8703e95ac76b;https;lensa.com;/solution-architect-jobs/cincinnati/jd/2429f1b16b92e9cf5b8a8703e95ac76b;;;lensa;3.209.132.185;geolocation;{};US;United States;Virginia;Ashburn;-77.47419738769531;39.043701171875;3.209.132.185;Solution Architect job in Cincinnati at EIS Group | Lensa;Aug 26, 2020 — This is a Remote / Work From Home Opportunity ** EIS is an insurance software company that enables leading insurers to innovate and ...
