;date;header;summary;link;protocol;domain;path;query;fragment;host_name;ip_address;Type;AdditionalData;CountryCode;CountryName;State;City;Longitude;Latitude;IpAddress;header_context_true;summary_context_true
0;2019-12-24;A Structured Analysis of Job Demands, Resources, Work ...;high- and low-tech) not associated with crowdsourcing (e.g. software development, social work, health care, engineering, and teaching.) Proc. ACM Hum.-Comput.;https://lykourentzou.com/uploads/7/5/4/2/75426219/group_paper_2020___wang_et_al_.pdf;https;lykourentzou.com;/uploads/7/5/4/2/75426219/group_paper_2020___wang_et_al_.pdf;;;lykourentzou;185.25.23.54;geolocation;{};GR;Greece;Attica;Athens;23.719989776611328;37.96998977661133;185.25.23.54;A Structured Analysis of Job Demands, Resources, Work ...;high- and low-tech) not associated with crowdsourcing (e.g. software development, social work, health care, engineering, and teaching.) Proc. ACM Hum.-Comput.
1;2019-12-24;HNGIL Recruitment 2020 Executive, Technician, Trainee ...;Dec 24, 2019 — ... Ministry · Directorate of Purchase and Stores DPSDAE · Disaster Management ... Sofa Agreement · Softech · Software · Software Development Course ... Vocational teachers · Vodafone Latest · Vodafone Work From Home ...;https://www.sscbankgk.in/2019/12/hngil-recruitment-2020-executive.html;https;www.sscbankgk.in;/2019/12/hngil-recruitment-2020-executive.html;;;sscbankgk;173.194.196.121;geolocation;{};US;United States;California;Mountain View;-122.07540893554688;37.419158935546875;173.194.196.121;HNGIL Recruitment 2020 Executive, Technician, Trainee ...;Dec 24, 2019 — ... Ministry · Directorate of Purchase and Stores DPSDAE · Disaster Management ... Sofa Agreement · Softech · Software · Software Development Course ... Vocational teachers · Vodafone Latest · Vodafone Work From Home ...
2;2019-12-24;Buy BRUSTRO Artists' Palette Knives (Set of 18) (Painting ...;This full range of 18 traditional Knives offers the right combination of stainless steel resilience and flexible spring to facilitate any Painting application like Gesso, ...;https://www.ideakart.com/products/brustro-artists-palette-knives-set-of-18-painting-knives-479353;https;www.ideakart.com;/products/brustro-artists-palette-knives-set-of-18-painting-knives-479353;;;ideakart;104.28.1.21;geolocation;{};US;United States;New Jersey;Newark;-74.19452667236328;40.738731384277344;104.28.1.21;Buy BRUSTRO Artists' Palette Knives (Set of 18) (Painting ...;This full range of 18 traditional Knives offers the right combination of stainless steel resilience and flexible spring to facilitate any Painting application like Gesso, ...
3;2019-12-24;Fundamentals Of Organizational Behaviour [1d473g1352l2];Items 1 - 10 — ... or Attila the Hun to managing software engineers in the twenty-first century? ... for doing similar work, allowing an employee to work from home several days ... of its own supplies to a disaster 70 urally to them, but they can learn it.;https://idoc.pub/documents/fundamentals-of-organizational-behaviour-1d473g1352l2;https;idoc.pub;/documents/fundamentals-of-organizational-behaviour-1d473g1352l2;;;idoc;104.24.120.164;geolocation;{};US;United States;California;San Jose;-121.83822631835938;37.330528259277344;104.24.120.164;Fundamentals Of Organizational Behaviour [1d473g1352l2];Items 1 - 10 — ... or Attila the Hun to managing software engineers in the twenty-first century? ... for doing similar work, allowing an employee to work from home several days ... of its own supplies to a disaster 70 urally to them, but they can learn it.
4;2019-12-24;booklet2019_Web.pdf - Jobzella;of software engineers. Talk to top ... We have over 1,200 software engineers ... Andela in Egypt runs on a remote working model ... Expert leveraging software-development lifecycle (SDLC) ... Knowledge of disaster recovery, computer forensic ...;https://www.jobzella.com/frontend/stand_alone_pages/booklet2020/assets/booklet2019_Web.pdf;https;www.jobzella.com;/frontend/stand_alone_pages/booklet2020/assets/booklet2019_Web.pdf;;;jobzella;108.128.64.151;geolocation;{};IE;Ireland;Leinster;Dublin;-6.243330001831055;53.35388946533203;108.128.64.151;booklet2019_Web.pdf - Jobzella;of software engineers. Talk to top ... We have over 1,200 software engineers ... Andela in Egypt runs on a remote working model ... Expert leveraging software-development lifecycle (SDLC) ... Knowledge of disaster recovery, computer forensic ...
5;2019-12-24;In what circumstances should you hire a defense criminal ...;More and more commentators and business owners are suggesting that work from home will become the new ... How to Develop a Cyber Resilience Strategy? How Can Web Development and Software Development Affect Business Trend ...;https://www.winarco.com/in-what-circumstances-should-you-hire-a-defense-criminal-lawyer/;https;www.winarco.com;/in-what-circumstances-should-you-hire-a-defense-criminal-lawyer/;;;winarco;185.201.10.92;geolocation;{};US;United States;North Carolina;Asheville;-82.55660247802734;35.59769821166992;185.201.10.92;In what circumstances should you hire a defense criminal ...;More and more commentators and business owners are suggesting that work from home will become the new ... How to Develop a Cyber Resilience Strategy? How Can Web Development and Software Development Affect Business Trend ...
6;2019-12-24;SSL and HTTPS: A Technical Guide - Internet & Technology ...;Dec 24, 2019 — ... Aastha Bhatnagar work from home, Aastha Bhatnagar wunderman thompson, Aastha ... AggregateIQ, aggregation theory, Agile, agile software development, agility ... automated disaster recovery, automated driving, automated flight ... remote workforce trends, remote working, remote year, remotely shot ...;https://www.smarthostingplans.com/uncategorized/ssl-and-https-a-technical-guide/;https;www.smarthostingplans.com;/uncategorized/ssl-and-https-a-technical-guide/;;;smarthostingplans;208.109.175.158;geolocation;{};US;United States;Arizona;Scottsdale;-111.89010620117188;33.610958099365234;208.109.175.158;SSL and HTTPS: A Technical Guide - Internet & Technology ...;Dec 24, 2019 — ... Aastha Bhatnagar work from home, Aastha Bhatnagar wunderman thompson, Aastha ... AggregateIQ, aggregation theory, Agile, agile software development, agility ... automated disaster recovery, automated driving, automated flight ... remote workforce trends, remote working, remote year, remotely shot ...
7;2019-12-24;SSL and HTTPS: A Technical Guide - Internet & Technology ...;Dec 24, 2019 — ... Aastha Bhatnagar work from home, Aastha Bhatnagar wunderman thompson, Aastha ... AggregateIQ, aggregation theory, Agile, agile software development, agility ... automated disaster recovery, automated driving, automated flight ... remote workforce trends, remote working, remote year, remotely shot ...;https://www.smarthostingplans.com/uncategorized/ssl-and-https-a-technical-guide/;https;www.smarthostingplans.com;/uncategorized/ssl-and-https-a-technical-guide/;;;smarthostingplans;208.109.175.158;geolocation;{};US;United States;Arizona;Scottsdale;-111.89010620117188;33.610958099365234;208.109.175.158;SSL and HTTPS: A Technical Guide - Internet & Technology ...;Dec 24, 2019 — ... Aastha Bhatnagar work from home, Aastha Bhatnagar wunderman thompson, Aastha ... AggregateIQ, aggregation theory, Agile, agile software development, agility ... automated disaster recovery, automated driving, automated flight ... remote workforce trends, remote working, remote year, remotely shot ...
8;2019-12-24;Pyka and its autonomous, electric crop-spraying drone land ...;Dec 24, 2019 — ... Aastha Bhatnagar work from home, Aastha Bhatnagar wunderman thompson, Aastha ... AggregateIQ, aggregation theory, Agile, agile software development, agility ... automated disaster recovery, automated driving, automated flight ... remote workforce trends, remote working, remote year, remotely shot ...;https://www.smarthostingplans.com/artificial-intelligence/pyka-and-its-autonomous-electric-crop-spraying-drone-land-11m-seed-round/;https;www.smarthostingplans.com;/artificial-intelligence/pyka-and-its-autonomous-electric-crop-spraying-drone-land-11m-seed-round/;;;smarthostingplans;208.109.175.158;geolocation;{};US;United States;Arizona;Scottsdale;-111.89010620117188;33.610958099365234;208.109.175.158;Pyka and its autonomous, electric crop-spraying drone land ...;Dec 24, 2019 — ... Aastha Bhatnagar work from home, Aastha Bhatnagar wunderman thompson, Aastha ... AggregateIQ, aggregation theory, Agile, agile software development, agility ... automated disaster recovery, automated driving, automated flight ... remote workforce trends, remote working, remote year, remotely shot ...
9;2019-12-24;Pyka and its autonomous, electric crop-spraying drone land ...;Dec 24, 2019 — ... Aastha Bhatnagar work from home, Aastha Bhatnagar wunderman thompson, Aastha ... AggregateIQ, aggregation theory, Agile, agile software development, agility ... automated disaster recovery, automated driving, automated flight ... remote workforce trends, remote working, remote year, remotely shot ...;https://www.smarthostingplans.com/artificial-intelligence/pyka-and-its-autonomous-electric-crop-spraying-drone-land-11m-seed-round/;https;www.smarthostingplans.com;/artificial-intelligence/pyka-and-its-autonomous-electric-crop-spraying-drone-land-11m-seed-round/;;;smarthostingplans;208.109.175.158;geolocation;{};US;United States;Arizona;Scottsdale;-111.89010620117188;33.610958099365234;208.109.175.158;Pyka and its autonomous, electric crop-spraying drone land ...;Dec 24, 2019 — ... Aastha Bhatnagar work from home, Aastha Bhatnagar wunderman thompson, Aastha ... AggregateIQ, aggregation theory, Agile, agile software development, agility ... automated disaster recovery, automated driving, automated flight ... remote workforce trends, remote working, remote year, remotely shot ...
10;2019-12-24;Van Vibhag Lucknow Recruitment 2020 UPSSSC Forest ...;Dec 24, 2019 — ... Disaster Management Department · Dish TV Channel Selector App · Dish TV ... Sofa Agreement · Softech · Software · Software Development Course ... Vocational teachers · Vodafone Latest · Vodafone Work From Home ...;https://www.sscbankgk.in/2015/02/van-vibhag-lucknow-recruitment-2015.html;https;www.sscbankgk.in;/2015/02/van-vibhag-lucknow-recruitment-2015.html;;;sscbankgk;172.217.214.121;geolocation;{};US;United States;California;Mountain View;-122.07540893554688;37.419158935546875;172.217.214.121;Van Vibhag Lucknow Recruitment 2020 UPSSSC Forest ...;Dec 24, 2019 — ... Disaster Management Department · Dish TV Channel Selector App · Dish TV ... Sofa Agreement · Softech · Software · Software Development Course ... Vocational teachers · Vodafone Latest · Vodafone Work From Home ...
11;2019-12-24;https://www.peoplematters.in/news/leadership/mahindra ...;... of business CEOs, Agility, Sentiments, CEO Outlook, KPMG, Resilience, India, ... home jobs Google, search, job search, work from home jobs, remote working, ... -women-software-engineers-from-india-21411 2019-04-15T13:46:26+05:30 ...;https://www.peoplematters.in/sitemap.xml/news/2019;https;www.peoplematters.in;/sitemap.xml/news/2019;;;peoplematters;167.99.28.98;geolocation;{};SG;Singapore;;Singapore;103.8198013305664;1.3200000524520874;167.99.28.98;https://www.peoplematters.in/news/leadership/mahindra ...;... of business CEOs, Agility, Sentiments, CEO Outlook, KPMG, Resilience, India, ... home jobs Google, search, job search, work from home jobs, remote working, ... -women-software-engineers-from-india-21411 2019-04-15T13:46:26+05:30 ...
12;2019-12-24;ICNL-19Q4-P2 - IEEE Web Hosting;the New York Daily Newspaper, Software Development Times magazine, Newsmax Finance, ... spell bounds us, one key question that stumps software engineers, especially the quality ... office emails, work from home options, work-on-commute options etc. ... (12) Hult F, Sivanesan G. What good cyber resilience looks like.;https://site.ieee.org/indiacouncil/files/2019/12/icnl-19q4-p2-1.pdf;https;site.ieee.org;/indiacouncil/files/2019/12/icnl-19q4-p2-1.pdf;;;ieee;35.231.9.82;geolocation;{};US;United States;South Carolina;North Charleston;-80.0589370727539;32.890079498291016;35.231.9.82;ICNL-19Q4-P2 - IEEE Web Hosting;the New York Daily Newspaper, Software Development Times magazine, Newsmax Finance, ... spell bounds us, one key question that stumps software engineers, especially the quality ... office emails, work from home options, work-on-commute options etc. ... (12) Hult F, Sivanesan G. What good cyber resilience looks like.
13;2019-12-24;MOOC: Helping you step up your career | hrnxt.com;Dec 24, 2019 — ... for a PG Diploma or a Certificate course in data science, machine learning , software development, digital marketing amongst many on offer.;https://hrnxt.com/insights/mooc-helping-you-step-up-your-career/10901/2019/12/24/;https;hrnxt.com;/insights/mooc-helping-you-step-up-your-career/10901/2019/12/24/;;;hrnxt;103.53.40.198;geolocation;{};IN;India;Maharashtra;Powai;72.87770080566406;19.076000213623047;103.53.40.198;MOOC: Helping you step up your career | hrnxt.com;Dec 24, 2019 — ... for a PG Diploma or a Certificate course in data science, machine learning , software development, digital marketing amongst many on offer.
14;2019-12-24;As we enter 2020, these are the tech trends that have been ...;Dec 24, 2019 — But 2020 will be the beginning of a change in narrative for cybersecurity. We can expect to “see an increased focus on cyber resilience and how ...;https://e27.co/stay-current-for-2020-these-are-the-trend-predictions-in-startup-tech-realm-as-we-enter-new-decade-20191224/;https;e27.co;/stay-current-for-2020-these-are-the-trend-predictions-in-startup-tech-realm-as-we-enter-new-decade-20191224/;;;e27;172.67.73.227;geolocation;{};US;United States;California;San Francisco;-122.39286041259766;37.76784896850586;172.67.73.227;As we enter 2020, these are the tech trends that have been ...;Dec 24, 2019 — But 2020 will be the beginning of a change in narrative for cybersecurity. We can expect to “see an increased focus on cyber resilience and how ...
15;2019-12-24;Cyber Security Manager - Vulnerability Assessment & Security ...;Dec 25, 2019 — EY - Security Consultant - Cyber Resilience ... May work from home ... Lendingkart - Software Development Engineer III - Java/C++ ... HappilyUnmarried.com - Magento 2 Developer - Software Development - MySQL/MVC.;https://www.hirist.com/j/cyber-security-manager-vulnerability-assessment-security-testing-5-15-yrs-534322.html?ref=kp;https;www.hirist.com;/j/cyber-security-manager-vulnerability-assessment-security-testing-5-15-yrs-534322.html;ref=kp;;hirist;3.7.36.164;geolocation;{};IN;India;Maharashtra;Powai;72.87770080566406;19.076000213623047;3.7.36.164;Cyber Security Manager - Vulnerability Assessment & Security ...;Dec 25, 2019 — EY - Security Consultant - Cyber Resilience ... May work from home ... Lendingkart - Software Development Engineer III - Java/C++ ... HappilyUnmarried.com - Magento 2 Developer - Software Development - MySQL/MVC.
16;2019-12-24;Clinical Nurse Specialist job in Wilmington at PPD | Lensa;Dec 24, 2019 — ... diagnoses, and treat patients en route to hospitals or at disaster site triage centers. ... Note Will work from home during covid. ... DESIGN SOFTWARE DEVELOPMENT DEBUG SKILLS KNOWLEDGE bull Knowledge of ...;https://lensa.com/clinical-nurse-specialist-jobs/wilmington/jd/02ebac7f3b5135bad04c6ffeacc32395;https;lensa.com;/clinical-nurse-specialist-jobs/wilmington/jd/02ebac7f3b5135bad04c6ffeacc32395;;;lensa;52.54.1.120;geolocation;{};US;United States;Virginia;Ashburn;-77.47419738769531;39.043701171875;52.54.1.120;Clinical Nurse Specialist job in Wilmington at PPD | Lensa;Dec 24, 2019 — ... diagnoses, and treat patients en route to hospitals or at disaster site triage centers. ... Note Will work from home during covid. ... DESIGN SOFTWARE DEVELOPMENT DEBUG SKILLS KNOWLEDGE bull Knowledge of ...
17;2019-12-24;Former Post Office CEO apologises to subpostmasters over ...;Dec 24, 2019 — ... Datacentre cooling infrastructure · Disaster recovery/security · Green IT ... SOA · Software development · Software licensing · Virtualisation · Web software ... Financial services staff want work-from-home policies to continue ...;https://www.computerweekly.com/news/252475989/Former-Post-Office-CEO-apologises-to-subpostmasters-over-Horizon-scandal;https;www.computerweekly.com;/news/252475989/Former-Post-Office-CEO-apologises-to-subpostmasters-over-Horizon-scandal;;;computerweekly;206.19.49.153;geolocation;{};US;United States;Louisiana;Reddell;-92.42642211914062;30.675010681152344;206.19.49.153;Former Post Office CEO apologises to subpostmasters over ...;Dec 24, 2019 — ... Datacentre cooling infrastructure · Disaster recovery/security · Green IT ... SOA · Software development · Software licensing · Virtualisation · Web software ... Financial services staff want work-from-home policies to continue ...
18;2019-12-24;Former Post Office CEO apologises to subpostmasters over ...;Dec 24, 2019 — ... Datacentre cooling infrastructure · Disaster recovery/security · Green IT ... SOA · Software development · Software licensing · Virtualisation · Web software ... Financial services staff want work-from-home policies to continue ...;https://www.computerweekly.com/news/252475989/Former-Post-Office-CEO-apologises-to-subpostmasters-over-Horizon-scandal;https;www.computerweekly.com;/news/252475989/Former-Post-Office-CEO-apologises-to-subpostmasters-over-Horizon-scandal;;;computerweekly;206.19.49.153;geolocation;{};US;United States;Louisiana;Reddell;-92.42642211914062;30.675010681152344;206.19.49.153;Former Post Office CEO apologises to subpostmasters over ...;Dec 24, 2019 — ... Datacentre cooling infrastructure · Disaster recovery/security · Green IT ... SOA · Software development · Software licensing · Virtualisation · Web software ... Financial services staff want work-from-home policies to continue ...
19;2019-12-24;Top 10 end-user computing stories of 2019 - Computer Weekly;... Datacentre cooling infrastructure · Disaster recovery/security · Green IT · Performance, ... systems · SOA · Software development · Software licensing · Virtualisation · Web software ... A work-from-home reimbursement policy for network tech.;https://www.computerweekly.com/ehandbook/Top-10-end-user-computing-stories-of-2019;https;www.computerweekly.com;/ehandbook/Top-10-end-user-computing-stories-of-2019;;;computerweekly;206.19.49.153;geolocation;{};US;United States;Louisiana;Reddell;-92.42642211914062;30.675010681152344;206.19.49.153;Top 10 end-user computing stories of 2019 - Computer Weekly;... Datacentre cooling infrastructure · Disaster recovery/security · Green IT · Performance, ... systems · SOA · Software development · Software licensing · Virtualisation · Web software ... A work-from-home reimbursement policy for network tech.
20;2019-12-24;Top 10 end-user computing stories of 2019 - Computer Weekly;... Datacentre cooling infrastructure · Disaster recovery/security · Green IT · Performance, ... systems · SOA · Software development · Software licensing · Virtualisation · Web software ... A work-from-home reimbursement policy for network tech.;https://www.computerweekly.com/ehandbook/Top-10-end-user-computing-stories-of-2019;https;www.computerweekly.com;/ehandbook/Top-10-end-user-computing-stories-of-2019;;;computerweekly;206.19.49.153;geolocation;{};US;United States;Louisiana;Reddell;-92.42642211914062;30.675010681152344;206.19.49.153;Top 10 end-user computing stories of 2019 - Computer Weekly;... Datacentre cooling infrastructure · Disaster recovery/security · Green IT · Performance, ... systems · SOA · Software development · Software licensing · Virtualisation · Web software ... A work-from-home reimbursement policy for network tech.
21;2019-12-24;Pyka and its autonomous, electric crop-spraying ... - nigeria;Dec 25, 2019 — ... Aggregate IQ, agile software development, Agora.io, agribusiness, Agric investors, agricultural intervention fund, Agriculture, agriculture tech ...;https://publicnewsupdate.com/pyka-and-its-autonomous-electric-crop-spraying-drone-land-11m-seed-round/;https;publicnewsupdate.com;/pyka-and-its-autonomous-electric-crop-spraying-drone-land-11m-seed-round/;;;publicnewsupdate;34.248.68.200;geolocation;{};IE;Ireland;Leinster;Dublin;-6.243330001831055;53.35388946533203;34.248.68.200;Pyka and its autonomous, electric crop-spraying ... - nigeria;Dec 25, 2019 — ... Aggregate IQ, agile software development, Agora.io, agribusiness, Agric investors, agricultural intervention fund, Agriculture, agriculture tech ...
22;2019-12-24;విజయసాయి లేఖకు స్పందన.. సుజనా ...;Dec 24, 2019 — ... #WORK FROM HOME #CHEATERS #DELHI #LOCKDOWN #WORK FROM ... POLICE STATION narsingh yadav naryana national disaster national ... engieer Software engineer Software engineers Soinya dandhi Solar ...;http://www.thesakshi.com/president-responce-to-vijaya-sai-reddy-letter/;http;www.thesakshi.com;/president-responce-to-vijaya-sai-reddy-letter/;;;thesakshi;166.62.28.89;geolocation;{};US;United States;Arizona;Scottsdale;-111.89010620117188;33.610958099365234;166.62.28.89;విజయసాయి లేఖకు స్పందన.. సుజనా ...;Dec 24, 2019 — ... #WORK FROM HOME #CHEATERS #DELHI #LOCKDOWN #WORK FROM ... POLICE STATION narsingh yadav naryana national disaster national ... engieer Software engineer Software engineers Soinya dandhi Solar ...
