;date;header;summary;link;protocol;domain;path;query;fragment;host_name;ip_address;Type;AdditionalData;CountryCode;CountryName;State;City;Longitude;Latitude;IpAddress;header_context_true;summary_context_true
29;2020-10-07;Fortinet & Vandis: Partners to Empower Networking ...;Why Cyber Resilience Programs Are So Critical https://t.co/Aya92LiQIr via @bnkinfosecurity https://t.co/hEmQhOGVKT. 5 minutes ago. Retweet. SteveSanders7.;https://www.bankinfosecurity.com/fortinet-vandis-partners-to-empower-networking-transformation-a-14958;https;www.bankinfosecurity.com;/fortinet-vandis-partners-to-empower-networking-transformation-a-14958;;;bankinfosecurity;50.56.167.254;geolocation;{};US;United States;Texas;Dallas;-96.8142318725586;32.8054313659668;50.56.167.254;Fortinet & Vandis: Partners to Empower Networking ...;Why Cyber Resilience Programs Are So Critical https://t.co/Aya92LiQIr via @bnkinfosecurity https://t.co/hEmQhOGVKT. 5 minutes ago. Retweet. SteveSanders7.
30;2020-10-07;Fortinet & Vandis: Partners to Empower Networking ...;Why Cyber Resilience Programs Are So Critical https://t.co/Aya92LiQIr via @bnkinfosecurity https://t.co/hEmQhOGVKT. 5 minutes ago. Retweet. SteveSanders7.;https://www.bankinfosecurity.com/fortinet-vandis-partners-to-empower-networking-transformation-a-14958;https;www.bankinfosecurity.com;/fortinet-vandis-partners-to-empower-networking-transformation-a-14958;;;bankinfosecurity;50.56.167.254;geolocation;{};US;United States;Texas;Dallas;-96.8142318725586;32.8054313659668;50.56.167.254;Fortinet & Vandis: Partners to Empower Networking ...;Why Cyber Resilience Programs Are So Critical https://t.co/Aya92LiQIr via @bnkinfosecurity https://t.co/hEmQhOGVKT. 5 minutes ago. Retweet. SteveSanders7.
31;2020-10-07;Reasons Why Virtualization in Automotive is a Thing of ...;Oct 8, 2020 — It includes autonomous driving, connectivity, and mobility, wherein the role of software development is predicted to increase exponentially.;https://www.virtualizationdemand.com/insights/cloud/virtualization/reasons-why-virtualization-in-automotive-is-a-thing-of-tomorrow/;https;www.virtualizationdemand.com;/insights/cloud/virtualization/reasons-why-virtualization-in-automotive-is-a-thing-of-tomorrow/;;;virtualizationdemand;104.31.76.142;geolocation;{};US;United States;California;San Jose;-121.83822631835938;37.330528259277344;104.31.76.142;Reasons Why Virtualization in Automotive is a Thing of ...;Oct 8, 2020 — It includes autonomous driving, connectivity, and mobility, wherein the role of software development is predicted to increase exponentially.
32;2020-10-07;Business Development Manager Jobs in Lebanon - Bayt.com;32 Jobs — Every day… leader in software development for trading, risk management ... development company committed to empowering local ... resilience whist ...;https://www.bayt.com/en/lebanon/jobs/business-development-manager-jobs/;https;www.bayt.com;/en/lebanon/jobs/business-development-manager-jobs/;;;bayt;209.251.59.181;geolocation;{};CA;Canada;Ontario;Brampton;-79.63720703125;43.59708023071289;209.251.59.181;Business Development Manager Jobs in Lebanon - Bayt.com;32 Jobs — Every day… leader in software development for trading, risk management ... development company committed to empowering local ... resilience whist ...
33;2020-10-07;Australia's Federal Budget 2020-21: reaction from IT ... - iTWire;"Oct 8, 2020 — ""When COVID hit, many organisations were forced to create temporary solutions to enable work from home, but the investment into systems ...";https://www.itwire.com/government-tech-policy/australia-s-federal-budget-2020-21-reaction-from-it-vendor-leaders.html;https;www.itwire.com;/government-tech-policy/australia-s-federal-budget-2020-21-reaction-from-it-vendor-leaders.html;;;itwire;101.0.65.50;geolocation;{};AU;Australia;New South Wales;Sydney;151.2071075439453;-33.86714172363281;101.0.65.50;Australia's Federal Budget 2020-21: reaction from IT ... - iTWire;"Oct 8, 2020 — ""When COVID hit, many organisations were forced to create temporary solutions to enable work from home, but the investment into systems ..."
34;2020-10-07;Power of 2: Digital Twin Technology for Enterprise IT ...;Oct 8, 2020 — Distributed deployment at scale and agile software development expose applications to various factors that can cause performance disruptions ...;https://www.technologyforyou.org/power-of-2-digital-twin-technology-for-enterprise-it/;https;www.technologyforyou.org;/power-of-2-digital-twin-technology-for-enterprise-it/;;;technologyforyou;209.99.16.42;geolocation;{};US;United States;Massachusetts;Burlington;-71.20453643798828;42.50598907470703;209.99.16.42;Power of 2: Digital Twin Technology for Enterprise IT ...;Oct 8, 2020 — Distributed deployment at scale and agile software development expose applications to various factors that can cause performance disruptions ...
35;2020-10-07;Submit Best Press Release– Max Newswire;“As businesses work to rebuild the economy, their resilience and innovation make for essential reading. ... summer and COVID-19 “work from home” guidelines, face-to-face meaningful ... business continuity and disaster recovery documentation, including plans, ... Software development agency Coara is one such example.;https://www.maxnewswire.com/pressroom/category/7;https;www.maxnewswire.com;/pressroom/category/7;;;maxnewswire;35.224.226.126;geolocation;{};US;United States;Iowa;Council Bluffs;-95.87735748291016;41.23295974731445;35.224.226.126;Submit Best Press Release– Max Newswire;“As businesses work to rebuild the economy, their resilience and innovation make for essential reading. ... summer and COVID-19 “work from home” guidelines, face-to-face meaningful ... business continuity and disaster recovery documentation, including plans, ... Software development agency Coara is one such example.
36;2020-10-07;Elvie adds a non-electric breast pump and cups to its growing ...;Oct 7, 2020 — ... AgFunder, Aggregate IQ, AggregateIQ, agile software development, agility robotics ... Disabilities, disability, disaster, disaster recovery, disaster response ... remote working, remote year, Ren Zhengfei, renaissance capital, Renata ... wordpress.com, work, work from anywhere, Work From Home, work out ...;https://www.what-is-new.info/2020/10/07/elvie-adds-a-non-electric-breast-pump-and-cups-to-its-growing-femtech-portfolio/;https;www.what-is-new.info;/2020/10/07/elvie-adds-a-non-electric-breast-pump-and-cups-to-its-growing-femtech-portfolio/;;;what-is-new;87.106.18.184;geolocation;{};DE;Germany;Berlin;Berlin;13.406100273132324;52.51919937133789;87.106.18.184;Elvie adds a non-electric breast pump and cups to its growing ...;Oct 7, 2020 — ... AgFunder, Aggregate IQ, AggregateIQ, agile software development, agility robotics ... Disabilities, disability, disaster, disaster recovery, disaster response ... remote working, remote year, Ren Zhengfei, renaissance capital, Renata ... wordpress.com, work, work from anywhere, Work From Home, work out ...
37;2020-10-07;Bwin Forum - Bwin Asia;Tips for Finding Your Software Development Match. Tips for ... Remote working tips. Remote ... Working with your family: Tips to survive work-from-home life ... New Software Engineers ... Resilience A Priority in Global Supply Chains—McKinsey ... State insurance officials set up disaster readiness centers in Wilmington.;https://bwinylyx8.com/bw/;https;bwinylyx8.com;/bw/;;;bwinylyx8;104.28.15.132;geolocation;{};US;United States;California;San Jose;-121.83822631835938;37.330528259277344;104.28.15.132;Bwin Forum - Bwin Asia;Tips for Finding Your Software Development Match. Tips for ... Remote working tips. Remote ... Working with your family: Tips to survive work-from-home life ... New Software Engineers ... Resilience A Priority in Global Supply Chains—McKinsey ... State insurance officials set up disaster readiness centers in Wilmington.
38;2020-10-07;JDG Motor Services Ltd - Suffolk Business Directory;"We work from home so are always contactable during the day 7 days a week. ... services; WordPress web design and bespoke/custom software development. ... it a natural disaster, or any number of situations that can occur – you'll have me ...";https://www.suffolkbusinessdirectory.com/item/jdg-motor-services-ltd/;https;www.suffolkbusinessdirectory.com;/item/jdg-motor-services-ltd/;;;suffolkbusinessdirectory;35.214.80.134;geolocation;{};GB;United Kingdom;England;Acton;-0.22777999937534332;51.49610900878906;35.214.80.134;JDG Motor Services Ltd - Suffolk Business Directory;"We work from home so are always contactable during the day 7 days a week. ... services; WordPress web design and bespoke/custom software development. ... it a natural disaster, or any number of situations that can occur – you'll have me ..."
39;2020-10-07;How to get rid of the LinkedIn Stories? Use these tips. - CIOL;Oct 7, 2020 — ... IntelligencewomenWomen in TechWomen's Daywork from homeWorkforceWorkforce ManagementWorkKeyWorkplaceWorld CupWorld Data ...;https://www.ciol.com/get-rid-linkedin-stories/;https;www.ciol.com;/get-rid-linkedin-stories/;;;ciol;192.124.249.158;geolocation;{};US;United States;California;Menifee;-117.1891098022461;33.65753173828125;192.124.249.158;How to get rid of the LinkedIn Stories? Use these tips. - CIOL;Oct 7, 2020 — ... IntelligencewomenWomen in TechWomen's Daywork from homeWorkforceWorkforce ManagementWorkKeyWorkplaceWorld CupWorld Data ...
40;2020-10-07;Search Results for “data privacy” – Asia Blockchain Review ...;These are citizens who may be suffering from a natural disaster and require ... liability will reduce operations vulnerabilities from a safety and resilience perspective. ... Physical distancing, remote working and the new normal is putting enormous ... built specifically for the COVID-19 purpose but being a software development ...;https://www.asiablockchainreview.com/search/data+privacy/feed/rss2/;https;www.asiablockchainreview.com;/search/data+privacy/feed/rss2/;;;asiablockchainreview;104.24.109.242;geolocation;{};US;United States;California;San Jose;-121.83822631835938;37.330528259277344;104.24.109.242;Search Results for “data privacy” – Asia Blockchain Review ...;These are citizens who may be suffering from a natural disaster and require ... liability will reduce operations vulnerabilities from a safety and resilience perspective. ... Physical distancing, remote working and the new normal is putting enormous ... built specifically for the COVID-19 purpose but being a software development ...
41;2020-10-07;725 Business Intelligence Manager jobs in United Kingdom ...;"Oct 8, 2020 — Administration of company project and software development standards ... During the pandemic all but essential roles in Belfast require remote working. ... across technical & non-technical stakeholders; Resilience; Capable to ...";https://uk.linkedin.com/jobs/view/business-intelligence-manager-at-reed-professional-services-2001260952;https;uk.linkedin.com;/jobs/view/business-intelligence-manager-at-reed-professional-services-2001260952;;;linkedin;108.174.10.14;geolocation;{};US;United States;California;Sunnyvale;-122.01677703857422;37.38859939575195;108.174.10.14;725 Business Intelligence Manager jobs in United Kingdom ...;"Oct 8, 2020 — Administration of company project and software development standards ... During the pandemic all but essential roles in Belfast require remote working. ... across technical & non-technical stakeholders; Resilience; Capable to ..."
42;2020-10-07;RBI Guidelines (India) - information security careers;Reporting Security Incidents in Work-From-Home Environment · Geetha Nandikotkur • May 5, 2020. Organizations that have shifted to a remote workforce as a ...;https://www.careersinfosecurity.in/rbi-guidelines-c-437;https;www.careersinfosecurity.in;/rbi-guidelines-c-437;;;careersinfosecurity;50.56.167.254;geolocation;{};US;United States;Texas;Dallas;-96.8142318725586;32.8054313659668;50.56.167.254;RBI Guidelines (India) - information security careers;Reporting Security Incidents in Work-From-Home Environment · Geetha Nandikotkur • May 5, 2020. Organizations that have shifted to a remote workforce as a ...
43;2020-10-07;RBI Guidelines (India) - information security careers;Reporting Security Incidents in Work-From-Home Environment · Geetha Nandikotkur • May 5, 2020. Organizations that have shifted to a remote workforce as a ...;https://www.careersinfosecurity.in/rbi-guidelines-c-437;https;www.careersinfosecurity.in;/rbi-guidelines-c-437;;;careersinfosecurity;50.56.167.254;geolocation;{};US;United States;Texas;Dallas;-96.8142318725586;32.8054313659668;50.56.167.254;RBI Guidelines (India) - information security careers;Reporting Security Incidents in Work-From-Home Environment · Geetha Nandikotkur • May 5, 2020. Organizations that have shifted to a remote workforce as a ...
44;2020-10-07;RBI Guidelines (India) - information security careers;Reporting Security Incidents in Work-From-Home Environment · Geetha Nandikotkur • May 5, 2020. Organizations that have shifted to a remote workforce as a ...;https://www.careersinfosecurity.in/rbi-guidelines-c-437;https;www.careersinfosecurity.in;/rbi-guidelines-c-437;;;careersinfosecurity;50.56.167.254;geolocation;{};US;United States;Texas;Dallas;-96.8142318725586;32.8054313659668;50.56.167.254;RBI Guidelines (India) - information security careers;Reporting Security Incidents in Work-From-Home Environment · Geetha Nandikotkur • May 5, 2020. Organizations that have shifted to a remote workforce as a ...
45;2020-10-07;Search Results for “evolve” – Samsung Global Newsroom;Despite this challenging time, we also see hope in our resilience. ... journeys and have strongly advised employees to work from home where possible. ... In 2018 the company revealed a software development kit (SDK) for Bixby and currently ...;https://news.samsung.com/global/search/evolve/feed/rss2/;https;news.samsung.com;/global/search/evolve/feed/rss2/;;;samsung;23.66.167.178;geolocation;{};US;United States;Illinois;Chicago;-87.67124938964844;41.84885025024414;23.66.167.178;Search Results for “evolve” – Samsung Global Newsroom;Despite this challenging time, we also see hope in our resilience. ... journeys and have strongly advised employees to work from home where possible. ... In 2018 the company revealed a software development kit (SDK) for Bixby and currently ...
46;2020-10-07;RBI Guidelines (India) - information risk management;Reporting Security Incidents in Work-From-Home Environment · Geetha Nandikotkur • May 5, 2020. Organizations that have shifted to a remote workforce as a ...;https://www.inforisktoday.in/rbi-guidelines-c-437;https;www.inforisktoday.in;/rbi-guidelines-c-437;;;inforisktoday;50.56.167.254;geolocation;{};US;United States;Texas;Dallas;-96.8142318725586;32.8054313659668;50.56.167.254;RBI Guidelines (India) - information risk management;Reporting Security Incidents in Work-From-Home Environment · Geetha Nandikotkur • May 5, 2020. Organizations that have shifted to a remote workforce as a ...
47;2020-10-07;RBI Guidelines (India) - information risk management;Reporting Security Incidents in Work-From-Home Environment · Geetha Nandikotkur • May 5, 2020. Organizations that have shifted to a remote workforce as a ...;https://www.inforisktoday.in/rbi-guidelines-c-437;https;www.inforisktoday.in;/rbi-guidelines-c-437;;;inforisktoday;50.56.167.254;geolocation;{};US;United States;Texas;Dallas;-96.8142318725586;32.8054313659668;50.56.167.254;RBI Guidelines (India) - information risk management;Reporting Security Incidents in Work-From-Home Environment · Geetha Nandikotkur • May 5, 2020. Organizations that have shifted to a remote workforce as a ...
48;2020-10-07;RBI Guidelines (India) - information risk management;Reporting Security Incidents in Work-From-Home Environment · Geetha Nandikotkur • May 5, 2020. Organizations that have shifted to a remote workforce as a ...;https://www.inforisktoday.in/rbi-guidelines-c-437;https;www.inforisktoday.in;/rbi-guidelines-c-437;;;inforisktoday;50.56.167.254;geolocation;{};US;United States;Texas;Dallas;-96.8142318725586;32.8054313659668;50.56.167.254;RBI Guidelines (India) - information risk management;Reporting Security Incidents in Work-From-Home Environment · Geetha Nandikotkur • May 5, 2020. Organizations that have shifted to a remote workforce as a ...
49;2020-10-07;'Again we are a house divided': Biden calls for unity in ...;Oct 7, 2020 — ... Aggregate IQ, agile software development, Agora.io, agribusiness, Agric investors ... Disabilities, Disability, disaster recovery, disaster relief, discharged, discord ... remote work, Remote workers, remote working, Removable media ... Work, Work & careers, work from anywhere, Work From Home, work visa ...;https://publicnewsupdate.com/again-we-are-a-house-divided-biden-calls-for-unity-in-gettysburg-speech/;https;publicnewsupdate.com;/again-we-are-a-house-divided-biden-calls-for-unity-in-gettysburg-speech/;;;publicnewsupdate;34.248.68.200;geolocation;{};IE;Ireland;Leinster;Dublin;-6.243330001831055;53.35388946533203;34.248.68.200;'Again we are a house divided': Biden calls for unity in ...;Oct 7, 2020 — ... Aggregate IQ, agile software development, Agora.io, agribusiness, Agric investors ... Disabilities, Disability, disaster recovery, disaster relief, discharged, discord ... remote work, Remote workers, remote working, Removable media ... Work, Work & careers, work from anywhere, Work From Home, work visa ...
50;2020-10-07;'Again we are a house divided': Biden calls for unity in ...;Oct 7, 2020 — ... Aggregate IQ, agile software development, Agora.io, agribusiness, Agric investors ... Disabilities, Disability, disaster recovery, disaster relief, discharged, discord ... remote work, Remote workers, remote working, Removable media ... Work, Work & careers, work from anywhere, Work From Home, work visa ...;https://publicnewsupdate.com/again-we-are-a-house-divided-biden-calls-for-unity-in-gettysburg-speech/;https;publicnewsupdate.com;/again-we-are-a-house-divided-biden-calls-for-unity-in-gettysburg-speech/;;;publicnewsupdate;34.248.68.200;geolocation;{};IE;Ireland;Leinster;Dublin;-6.243330001831055;53.35388946533203;34.248.68.200;'Again we are a house divided': Biden calls for unity in ...;Oct 7, 2020 — ... Aggregate IQ, agile software development, Agora.io, agribusiness, Agric investors ... Disabilities, Disability, disaster recovery, disaster relief, discharged, discord ... remote work, Remote workers, remote working, Removable media ... Work, Work & careers, work from anywhere, Work From Home, work visa ...
51;2020-10-07;Covid drug given to Trump developed using cells derived from ...;Oct 8, 2020 — ... Aggregate IQ, agile software development, Agora.io, agribusiness, Agric investors ... Disabilities, Disability, disaster recovery, disaster relief, discharged, discord ... remote work, Remote workers, remote working, Removable media ... Work, Work & careers, work from anywhere, Work From Home, work visa ...;https://publicnewsupdate.com/covid-drug-given-to-trump-developed-using-cells-derived-from-aborted-fetus/;https;publicnewsupdate.com;/covid-drug-given-to-trump-developed-using-cells-derived-from-aborted-fetus/;;;publicnewsupdate;34.248.68.200;geolocation;{};IE;Ireland;Leinster;Dublin;-6.243330001831055;53.35388946533203;34.248.68.200;Covid drug given to Trump developed using cells derived from ...;Oct 8, 2020 — ... Aggregate IQ, agile software development, Agora.io, agribusiness, Agric investors ... Disabilities, Disability, disaster recovery, disaster relief, discharged, discord ... remote work, Remote workers, remote working, Removable media ... Work, Work & careers, work from anywhere, Work From Home, work visa ...
52;2020-10-07;Covid drug given to Trump developed using cells derived from ...;Oct 8, 2020 — ... Aggregate IQ, agile software development, Agora.io, agribusiness, Agric investors ... Disabilities, Disability, disaster recovery, disaster relief, discharged, discord ... remote work, Remote workers, remote working, Removable media ... Work, Work & careers, work from anywhere, Work From Home, work visa ...;https://publicnewsupdate.com/covid-drug-given-to-trump-developed-using-cells-derived-from-aborted-fetus/;https;publicnewsupdate.com;/covid-drug-given-to-trump-developed-using-cells-derived-from-aborted-fetus/;;;publicnewsupdate;34.248.68.200;geolocation;{};IE;Ireland;Leinster;Dublin;-6.243330001831055;53.35388946533203;34.248.68.200;Covid drug given to Trump developed using cells derived from ...;Oct 8, 2020 — ... Aggregate IQ, agile software development, Agora.io, agribusiness, Agric investors ... Disabilities, Disability, disaster recovery, disaster relief, discharged, discord ... remote work, Remote workers, remote working, Removable media ... Work, Work & careers, work from anywhere, Work From Home, work visa ...
53;2020-10-07;AGS – Association of Geotechnical and Geoenvironmental ...;"Oct 7, 2020 — For a time, we all had to work from home, but thankfully we were ... the energy transition; and resilience to climate change, all of which are ...";https://www.ags.org.uk/author/katie-kennedy/;https;www.ags.org.uk;/author/katie-kennedy/;;;org;80.87.129.95;geolocation;{};GB;United Kingdom;England;City of Westminster;-0.17000000178813934;51.50416946411133;80.87.129.95;AGS – Association of Geotechnical and Geoenvironmental ...;"Oct 7, 2020 — For a time, we all had to work from home, but thankfully we were ... the energy transition; and resilience to climate change, all of which are ..."
54;2020-10-07;Annual Report 2019/20 - Porirua City Council;Oct 8, 2020 — Restoration and resilience work continues: We have an ongoing restoration ... provided during lockdown, most staff were able to continue their work from home. ... software development costs recognised as assets are amortised over the ... In addition to Council's insurance, in the event of natural disaster it is ...;https://poriruacity.govt.nz/documents/4377/Report_10.2_-_Annual_Report_2019_20.pdf;https;poriruacity.govt.nz;/documents/4377/Report_10.2_-_Annual_Report_2019_20.pdf;;;govt;216.239.32.21;geolocation;{};US;United States;California;Mountain View;-122.07540893554688;37.419158935546875;216.239.32.21;Annual Report 2019/20 - Porirua City Council;Oct 8, 2020 — Restoration and resilience work continues: We have an ongoing restoration ... provided during lockdown, most staff were able to continue their work from home. ... software development costs recognised as assets are amortised over the ... In addition to Council's insurance, in the event of natural disaster it is ...
55;2020-10-07;Kromek Group substantial expansion programme ...;Oct 7, 2020 — “I am immensely proud of the resilience and attitude of our staff as we have ... its employees in the UK and US to remote working in order to protect the ... the Group has received an additional order for software development to ...;https://www.directorstalk.net/kromek-group-substantial-expansion-programme-implemented-at-uk-headquarters/;https;www.directorstalk.net;/kromek-group-substantial-expansion-programme-implemented-at-uk-headquarters/;;;directorstalk;216.194.169.73;geolocation;{};US;United States;California;El Segundo;-118.40408325195312;33.91606140136719;216.194.169.73;Kromek Group substantial expansion programme ...;Oct 7, 2020 — “I am immensely proud of the resilience and attitude of our staff as we have ... its employees in the UK and US to remote working in order to protect the ... the Group has received an additional order for software development to ...
56;2020-10-07;Sungard AS Launches Private Cloud with Fully Automated ...;Oct 7, 2020 — Cohesity Unveils Automated Disaster Recovery Solution Data management solutions vendor Cohesity, with its web-scale platform, spanning ...;https://www.smarthostingplans.com/news/sungard-as-launches-private-cloud-with-fully-automated-recovery/;https;www.smarthostingplans.com;/news/sungard-as-launches-private-cloud-with-fully-automated-recovery/;;;smarthostingplans;208.109.175.158;geolocation;{};US;United States;Arizona;Scottsdale;-111.89010620117188;33.610958099365234;208.109.175.158;Sungard AS Launches Private Cloud with Fully Automated ...;Oct 7, 2020 — Cohesity Unveils Automated Disaster Recovery Solution Data management solutions vendor Cohesity, with its web-scale platform, spanning ...
57;2020-10-07;Category: Quantum Computer - Nano Medicine;... computing, may disrupt current algorithms and software development. ... such as virtualization, work from home, remote IT and security management, and new normal ... It ensures highest resilience in performance-intensive, business critical ...;https://www.nanomedicine.tv/category/quantum-computer;https;www.nanomedicine.tv;/category/quantum-computer;;;nanomedicine;209.159.144.43;geolocation;{};US;United States;New Jersey;Secaucus;-74.06452941894531;40.77825927734375;209.159.144.43;Category: Quantum Computer - Nano Medicine;... computing, may disrupt current algorithms and software development. ... such as virtualization, work from home, remote IT and security management, and new normal ... It ensures highest resilience in performance-intensive, business critical ...
