;date;header;summary;link;protocol;domain;path;query;fragment;host_name;ip_address;Type;AdditionalData;CountryCode;CountryName;State;City;Longitude;Latitude;IpAddress;header_context_true;summary_context_true
0;2020-09-08;Work From Home - Make It A Reality With These 4 Things;Sep 8, 2020 — How can work from home (WFH) become a permanent arrangement with your organization? ... The emphasis needs to be placed on how remote working will benefit you, your co-workers, ... productivity, reduced turnover and absenteeism, and better disaster preparedness. ... Software Development vs …;https://itchronicles.com/work-from-home/4-things-you-can-do-to-get-to-work-from-home/?utm_source=rss&utm_medium=rss&utm_campaign=4-things-you-can-do-to-get-to-work-from-home;https;itchronicles.com;/work-from-home/4-things-you-can-do-to-get-to-work-from-home/;utm_source=rss&utm_medium=rss&utm_campaign=4-things-you-can-do-to-get-to-work-from-home;;itchronicles;66.70.207.31;geolocation;{};CA;Canada;Quebec;Montréal;-73.56201171875;45.502079010009766;66.70.207.31;Work From Home - Make It A Reality With These 4 Things;Sep 8, 2020 — How can work from home (WFH) become a permanent arrangement with your organization? ... The emphasis needs to be placed on how remote working will benefit you, your co-workers, ... productivity, reduced turnover and absenteeism, and better disaster preparedness. ... Software Development vs …
1;2020-09-08;Beginnings markentier.tech;Sep 9, 2020 — And so I finally stepped into the professional software development. ... of work, and then add social distancing, work from home, and isolation to the mix. ... and in meetups, I had a conference workshop once (what a disaster!);https://markentier.tech/posts/2020/09/beginnings/;https;markentier.tech;/posts/2020/09/beginnings/;;;markentier;104.248.63.248;geolocation;{};US;United States;New York;Manhattan;-73.97901916503906;40.7589111328125;104.248.63.248;Beginnings markentier.tech;Sep 9, 2020 — And so I finally stepped into the professional software development. ... of work, and then add social distancing, work from home, and isolation to the mix. ... and in meetups, I had a conference workshop once (what a disaster!)
2;2020-09-08;Why AI Will be a Game Changer for the Global Oil and Gas ...;Sep 9, 2020 — As business leaders in the oil and gas industry come to terms with the “new normal” of remote working, digital-led interactions, and increased ...;https://oilmanmagazine.com/article/why-ai-will-be-a-game-changer-for-the-global-oil-and-gas-sector/;https;oilmanmagazine.com;/article/why-ai-will-be-a-game-changer-for-the-global-oil-and-gas-sector/;;;oilmanmagazine;159.65.231.226;geolocation;{};US;United States;New York;Manhattan;-73.97901916503906;40.7589111328125;159.65.231.226;Why AI Will be a Game Changer for the Global Oil and Gas ...;Sep 9, 2020 — As business leaders in the oil and gas industry come to terms with the “new normal” of remote working, digital-led interactions, and increased ...
3;2020-09-08;Cerner Healthcare Solutions Reviews by 242 Employees ...;Providing work from home, discounts on office appliances, additional leaves related to the COVID-19 . ... Anonymous · Software Development Division. 3. 2.;https://www.ambitionbox.com/reviews/cerner-healthcare-solutions-reviews;https;www.ambitionbox.com;/reviews/cerner-healthcare-solutions-reviews;;;ambitionbox;69.192.63.79;geolocation;{};US;United States;Illinois;Chicago;-87.67124938964844;41.84885025024414;69.192.63.79;Cerner Healthcare Solutions Reviews by 242 Employees ...;Providing work from home, discounts on office appliances, additional leaves related to the COVID-19 . ... Anonymous · Software Development Division. 3. 2.
4;2020-09-08;"Slack Is Now Almost A Value Stock; Buy The Dip (NYSE ...";Sep 9, 2020 — The communications and collaboration software company, thought to be one of the biggest beneficiaries of the coronavirus/work-from-home ...;https://seekingalpha.com/article/4373317-slack-is-now-almost-value-stock-buy-dip;https;seekingalpha.com;/article/4373317-slack-is-now-almost-value-stock-buy-dip;;;seekingalpha;151.101.194.2;geolocation;{};US;United States;California;San Francisco;-122.39286041259766;37.76784896850586;151.101.194.2;"Slack Is Now Almost A Value Stock; Buy The Dip (NYSE ...";Sep 9, 2020 — The communications and collaboration software company, thought to be one of the biggest beneficiaries of the coronavirus/work-from-home ...
5;2020-09-08;Automate Elastic Cloud workflows using an SDK and ...;Sep 8, 2020 — ... API Specification, which allows you to use tools like Swagger to generate software development kits (SDKs) in any programming language.;https://slacker.ro/2020/09/08/automate-elastic-cloud-workflows-using-an-sdk-and-elasticsearch-service-api/;https;slacker.ro;/2020/09/08/automate-elastic-cloud-workflows-using-an-sdk-and-elasticsearch-service-api/;;;slacker;104.28.15.71;geolocation;{};US;United States;California;San Jose;-121.83822631835938;37.330528259277344;104.28.15.71;Automate Elastic Cloud workflows using an SDK and ...;Sep 8, 2020 — ... API Specification, which allows you to use tools like Swagger to generate software development kits (SDKs) in any programming language.
6;2020-09-08;Hands-on review: The 2020 iMac is as 'pro' as desktops can get;Sep 9, 2020 — This year's iMac is a beast. It ticks all boxes from design to display, internals, camera, mic and speakers. It even has the Apple T2 Security Chip ...;https://itbrief.co.nz/story/hands-on-review-the-2020-imac-is-as-pro-as-desktops-can-get;https;itbrief.co.nz;/story/hands-on-review-the-2020-imac-is-as-pro-as-desktops-can-get;;;co;113.21.226.180;geolocation;{};NZ;New Zealand;Auckland;Auckland;174.6802978515625;-36.78810119628906;113.21.226.180;Hands-on review: The 2020 iMac is as 'pro' as desktops can get;Sep 9, 2020 — This year's iMac is a beast. It ticks all boxes from design to display, internals, camera, mic and speakers. It even has the Apple T2 Security Chip ...
7;2020-09-08;Hands-on review: The 2020 iMac is as 'pro' as desktops can get;Sep 9, 2020 — This year's iMac is a beast. It ticks all boxes from design to display, internals, camera, mic and speakers. It even has the Apple T2 Security Chip ...;https://itbrief.co.nz/story/hands-on-review-the-2020-imac-is-as-pro-as-desktops-can-get;https;itbrief.co.nz;/story/hands-on-review-the-2020-imac-is-as-pro-as-desktops-can-get;;;co;113.21.226.180;geolocation;{};NZ;New Zealand;Auckland;Auckland;174.6802978515625;-36.78810119628906;113.21.226.180;Hands-on review: The 2020 iMac is as 'pro' as desktops can get;Sep 9, 2020 — This year's iMac is a beast. It ticks all boxes from design to display, internals, camera, mic and speakers. It even has the Apple T2 Security Chip ...
8;2020-09-08;Hands-on review: The 2020 iMac is as 'pro' as desktops can get;Sep 9, 2020 — This year's iMac is a beast. It ticks all boxes from design to display, internals, camera, mic and speakers. It even has the Apple T2 Security Chip ...;https://itbrief.co.nz/story/hands-on-review-the-2020-imac-is-as-pro-as-desktops-can-get;https;itbrief.co.nz;/story/hands-on-review-the-2020-imac-is-as-pro-as-desktops-can-get;;;co;113.21.226.180;geolocation;{};NZ;New Zealand;Auckland;Auckland;174.6802978515625;-36.78810119628906;113.21.226.180;Hands-on review: The 2020 iMac is as 'pro' as desktops can get;Sep 9, 2020 — This year's iMac is a beast. It ticks all boxes from design to display, internals, camera, mic and speakers. It even has the Apple T2 Security Chip ...
9;2020-09-08;The Who-is-Who Directory In The Public Safety Industry;Sep 8, 2020 — We oer software development and implementation services based on open ... category, caller's health related symptoms, or natural disaster hit points which ... Agencies will need to enable remote working and facilitate cross agency collaboration. ... High Availability -> Resilience at site and system level.;https://eena.org/knowledge-hub/documents/who-is-who-in-the-public-safety-industry-9/;https;eena.org;/knowledge-hub/documents/who-is-who-in-the-public-safety-industry-9/;;;eena;104.22.31.76;geolocation;{};US;United States;California;San Jose;-121.83822631835938;37.330528259277344;104.22.31.76;The Who-is-Who Directory In The Public Safety Industry;Sep 8, 2020 — We oer software development and implementation services based on open ... category, caller's health related symptoms, or natural disaster hit points which ... Agencies will need to enable remote working and facilitate cross agency collaboration. ... High Availability -> Resilience at site and system level.
10;2020-09-08;Bay Area Home Prices Are All Time High - Blind;Sep 8, 2020 — I didn't see any covid impact. As usual overbidding for a 1.3 to 1.5 million houses in the range of 100-200 K . very very less inventory;https://www.teamblind.com/post/Bay-Area-Home-Prices-Are-All-Time-High-kCMtd1XQ;https;www.teamblind.com;/post/Bay-Area-Home-Prices-Are-All-Time-High-kCMtd1XQ;;;teamblind;52.85.224.32;geolocation;{};US;United States;Illinois;Chicago;-87.67124938964844;41.84885025024414;52.85.224.32;Bay Area Home Prices Are All Time High - Blind;Sep 8, 2020 — I didn't see any covid impact. As usual overbidding for a 1.3 to 1.5 million houses in the range of 100-200 K . very very less inventory
11;2020-09-08;Find Software Development Manager positions with WhatJobs ...;Software Development Manager required by a growing business based in Doncaster, this business has really proven its resilience during the COVID-19 period by ...;https://uk.whatjobs.com/job/software-development-manager-166;https;uk.whatjobs.com;/job/software-development-manager-166;;;whatjobs;104.26.7.145;geolocation;{};US;United States;Virginia;Ashburn;-77.47419738769531;39.043701171875;104.26.7.145;Find Software Development Manager positions with WhatJobs ...;Software Development Manager required by a growing business based in Doncaster, this business has really proven its resilience during the COVID-19 period by ...
12;2020-09-08;App Developers | AppStudio;Sep 9, 2020 — work from home during Covid-19 ... The coronavirus crisis has tested our resilience and our ability to respond to the challenges facing us as a ...;https://www.appstudio.ca/blog/category/app-developers/;https;www.appstudio.ca;/blog/category/app-developers/;;;appstudio;15.222.181.195;geolocation;{};CA;Canada;Quebec;Montréal;-73.56999969482422;45.52000045776367;15.222.181.195;App Developers | AppStudio;Sep 9, 2020 — work from home during Covid-19 ... The coronavirus crisis has tested our resilience and our ability to respond to the challenges facing us as a ...
13;2020-09-08;SAP Concur India Summit | Re-envision » Reinvent » Reset ...;Sep 8, 2020 — ... and establish cost controls while maintaining employee experience and productivity to support the current remote working conditions.;https://cfo.economictimes.indiatimes.com/sap-concur-india-summit?rgstr=1&form_id=form-336-1596621624&msid=479&ag=brandsolutions;https;cfo.economictimes.indiatimes.com;/sap-concur-india-summit;rgstr=1&form_id=form-336-1596621624&msid=479&ag=brandsolutions;;indiatimes;184.28.239.229;geolocation;{};US;United States;Illinois;Chicago;-87.67124938964844;41.84885025024414;184.28.239.229;SAP Concur India Summit | Re-envision » Reinvent » Reset ...;Sep 8, 2020 — ... and establish cost controls while maintaining employee experience and productivity to support the current remote working conditions.
14;2020-09-08;Has COVID-19 Fast-Tracked 4IR? – Barry Dwolatzky;Sep 9, 2020 — On March 15th the President declared a State of Disaster and on 26th ... to enable employees to work from home, B2C organisations had to fast ...;http://www.softwareengineer.org.za/has-covid-19-fast-tracked-4ir/;http;www.softwareengineer.org.za;/has-covid-19-fast-tracked-4ir/;;;org;41.203.18.57;geolocation;{};ZA;South Africa;Gauteng;Johannesburg;28.0563907623291;-26.199169158935547;41.203.18.57;Has COVID-19 Fast-Tracked 4IR? – Barry Dwolatzky;Sep 9, 2020 — On March 15th the President declared a State of Disaster and on 26th ... to enable employees to work from home, B2C organisations had to fast ...
15;2020-09-08;Jfrog Ltd IPO Investment Prospectus S-1/A - SEC Report;Sep 8, 2020 — Our platform is the critical bridge between software development and deployment of ... If a natural disaster, power outage, connectivity issue, or other event ... The increase in remote working may also result in privacy, data ... Our research and development team consists of our architects, software engineers, ...;https://sec.report/Document/0001193125-20-240498/;https;sec.report;/Document/0001193125-20-240498/;;;sec;104.22.66.107;geolocation;{};US;United States;California;San Jose;-121.83822631835938;37.330528259277344;104.22.66.107;Jfrog Ltd IPO Investment Prospectus S-1/A - SEC Report;Sep 8, 2020 — Our platform is the critical bridge between software development and deployment of ... If a natural disaster, power outage, connectivity issue, or other event ... The increase in remote working may also result in privacy, data ... Our research and development team consists of our architects, software engineers, ...
16;2020-09-08;Technical Project Manager job in Austin at THRIVE | Lensa;Sep 9, 2020 — 8-10 years of experience with prior software development (web, java full ... Manager III Location Remote-Work from Home initially (potential to ...;https://lensa.com/technical-project-manager-jobs/austin/jd/839d009b3c4674aba4634aafc967ec81;https;lensa.com;/technical-project-manager-jobs/austin/jd/839d009b3c4674aba4634aafc967ec81;;;lensa;3.209.132.185;geolocation;{};US;United States;Virginia;Ashburn;-77.47419738769531;39.043701171875;3.209.132.185;Technical Project Manager job in Austin at THRIVE | Lensa;Sep 9, 2020 — 8-10 years of experience with prior software development (web, java full ... Manager III Location Remote-Work from Home initially (potential to ...
17;2020-09-08;annual report 2020 - Investors;Sep 8, 2020 — remote working and deliver an uninterrupted service to our customers. ... In December, we invested in Hero Brands, a software development house. ... capacity and provides access to high calibre software engineers. Our organic ... This growth highlights the resilience of the ELMO platform. The growth in ...;https://investors.elmosoftware.com.au/DownloadFile.axd?file=/Report/ComNews/20200908/02278422.pdf;https;investors.elmosoftware.com.au;/DownloadFile.axd;file=/Report/ComNews/20200908/02278422.pdf;;com;203.41.57.175;geolocation;{};AU;Australia;Queensland;Brisbane;153.02789306640625;-27.467580795288086;203.41.57.175;annual report 2020 - Investors;Sep 8, 2020 — remote working and deliver an uninterrupted service to our customers. ... In December, we invested in Hero Brands, a software development house. ... capacity and provides access to high calibre software engineers. Our organic ... This growth highlights the resilience of the ELMO platform. The growth in ...
18;2020-09-08;Infosec Analyst - IT Security Strategy (4-10 yrs),Bangalore ...;Sep 9, 2020 — ... Management,IT Risk,Cyber Security,IT Disaster Recovery,Project Manager - Security,IT Governance,IT Compliance, Tech IT Jobs - hirist.com.;https://www.hirist.com/j/infosec-analyst-it-security-strategy-4-10-yrs-641646.html;https;www.hirist.com;/j/infosec-analyst-it-security-strategy-4-10-yrs-641646.html;;;hirist;13.233.235.167;geolocation;{};IN;India;Maharashtra;Powai;72.87770080566406;19.076000213623047;13.233.235.167;Infosec Analyst - IT Security Strategy (4-10 yrs),Bangalore ...;Sep 9, 2020 — ... Management,IT Risk,Cyber Security,IT Disaster Recovery,Project Manager - Security,IT Governance,IT Compliance, Tech IT Jobs - hirist.com.
19;2020-09-08;With a Federal Eviction Moratorium in Place, States Develop ...;Sep 8, 2020 — Black and Latinx workers are also more likely to be unable to work from home, ... end-to-end management of the entire software development lifecycle ... CDC's Building Resilience Against Climate Effects (BRACE) program.;https://www.nashp.org/with-a-federal-eviction-moratorium-in-place-states-develop-additional-protections-for-low-income-renters/;https;www.nashp.org;/with-a-federal-eviction-moratorium-in-place-states-develop-additional-protections-for-low-income-renters/;;;nashp;64.91.224.73;geolocation;{};US;United States;Michigan;Holt;-84.63233947753906;42.718868255615234;64.91.224.73;With a Federal Eviction Moratorium in Place, States Develop ...;Sep 8, 2020 — Black and Latinx workers are also more likely to be unable to work from home, ... end-to-end management of the entire software development lifecycle ... CDC's Building Resilience Against Climate Effects (BRACE) program.
20;2020-09-08;5G, election hacking and a Java RAT - - Enterprise Times;Sep 8, 2020 — ... increase in vulnerabilities from poor software development practices. ... outcome is not only the definition of insanity but a recipe for disaster.;https://www.enterprisetimes.co.uk/2020/09/08/5g-election-hacking-and-a-java-rat/;https;www.enterprisetimes.co.uk;/2020/09/08/5g-election-hacking-and-a-java-rat/;;;co;217.148.34.12;geolocation;{};GB;United Kingdom;England;Islington;-0.03999999910593033;51.5111083984375;217.148.34.12;5G, election hacking and a Java RAT - - Enterprise Times;Sep 8, 2020 — ... increase in vulnerabilities from poor software development practices. ... outcome is not only the definition of insanity but a recipe for disaster.
21;2020-09-08;Cloud Computing Jobs - Monster Malaysia;5+ years design/implementation/consulting experience with distributed applications<br>. Skills : Liferay Developer , · Security , · Disaster Recovery , · Liferay ...;https://www.monster.com.my/search/cloud-computing-jobs;https;www.monster.com.my;/search/cloud-computing-jobs;;;com;23.65.246.131;geolocation;{};US;United States;California;San Jose;-121.83822631835938;37.330528259277344;23.65.246.131;Cloud Computing Jobs - Monster Malaysia;5+ years design/implementation/consulting experience with distributed applications<br>. Skills : Liferay Developer , · Security , · Disaster Recovery , · Liferay ...
22;2020-09-08;Microsoft User Experience Designer II Salaries | Glassdoor;Sep 8, 2020 — Work From Home (87 comments) ... of: Our software development centers are located all over the world, including Microsoft photo of: Connector ...;https://www.glassdoor.co.in/Salary/Microsoft-User-Experience-Designer-II-Salaries-E1651_D_KO10,37.htm;https;www.glassdoor.co.in;/Salary/Microsoft-User-Experience-Designer-II-Salaries-E1651_D_KO10,37.htm;;;co;104.16.118.102;geolocation;{};US;United States;California;San Jose;-121.83822631835938;37.330528259277344;104.16.118.102;Microsoft User Experience Designer II Salaries | Glassdoor;Sep 8, 2020 — Work From Home (87 comments) ... of: Our software development centers are located all over the world, including Microsoft photo of: Connector ...
23;2020-09-08;FY21-Q1 OKRs | GitLab;Sep 8, 2020 — VP of Security: Improve GitLab Security resilience and availability by creating ... Director of Quality KR: Develop Career Matrix for Software Engineers in ... Develop new approaches to remote working to improve collaboration, ...;https://about.gitlab.com/company/okrs/fy21-q1/;https;about.gitlab.com;/company/okrs/fy21-q1/;;;gitlab;151.101.194.49;geolocation;{};US;United States;California;San Francisco;-122.39286041259766;37.76784896850586;151.101.194.49;FY21-Q1 OKRs | GitLab;Sep 8, 2020 — VP of Security: Improve GitLab Security resilience and availability by creating ... Director of Quality KR: Develop Career Matrix for Software Engineers in ... Develop new approaches to remote working to improve collaboration, ...
24;2020-09-08;IT Infrastructure | RSM Technology Blog;Does my organization have a disaster recovery solution or a backup solution ... Should employees be allowed to work from home? ... A traditional software development life cycle does not work very well for SharePoint projects. This.;https://technologyblog.rsmus.com/it-infrastructure/;https;technologyblog.rsmus.com;/it-infrastructure/;;;rsmus;192.124.249.5;geolocation;{};US;United States;California;Menifee;-117.1891098022461;33.65753173828125;192.124.249.5;IT Infrastructure | RSM Technology Blog;Does my organization have a disaster recovery solution or a backup solution ... Should employees be allowed to work from home? ... A traditional software development life cycle does not work very well for SharePoint projects. This.
25;2020-09-08;How Technologies Can Help Business Overcome COVID-19 ...;Sep 9, 2020 — The new work-from-home trend won't disappear even after the pandemic ... economy” to boost supply chain resilience, says Forbes contributor, ...;https://www.nixsolutions.com/blog/4-tech-tools-help-enterprises-overcome-covid-19-crisis/;https;www.nixsolutions.com;/blog/4-tech-tools-help-enterprises-overcome-covid-19-crisis/;;;nixsolutions;104.27.178.60;geolocation;{};US;United States;California;San Jose;-121.83822631835938;37.330528259277344;104.27.178.60;How Technologies Can Help Business Overcome COVID-19 ...;Sep 9, 2020 — The new work-from-home trend won't disappear even after the pandemic ... economy” to boost supply chain resilience, says Forbes contributor, ...
26;2020-09-08;9 September 2020 Sanne Group plc (the Group, SANNE or ...;Sep 9, 2020 — Outlook: o The business has shown good resilience during H1 2020 during ... transitioned from office working to remote working across all our locations. ... equipment and software purchases and software development costs.;https://www.sannegroup.com/media/hxqk33oy/sanne-group-plc-h1-2020-results-published-rns-final-9-september-2020.pdf;https;www.sannegroup.com;/media/hxqk33oy/sanne-group-plc-h1-2020-results-published-rns-final-9-september-2020.pdf;;;sannegroup;104.22.6.214;geolocation;{};SG;Singapore;;Singapore;103.8198013305664;1.3200000524520874;104.22.6.214;9 September 2020 Sanne Group plc (the Group, SANNE or ...;Sep 9, 2020 — Outlook: o The business has shown good resilience during H1 2020 during ... transitioned from office working to remote working across all our locations. ... equipment and software purchases and software development costs.
27;2020-09-08;Open Source Summit + Embedded Linux Conference Europe ...;Panel Discussion: Leveraging Blockchain to Drive Supply Chain Resilience and ... of disaster or disruption - Use cases from customers across a mix of industries, ... Ana is currently working at Bitergia, a Software Development Analytics firm ... be useful to people who are curious about RISC-V. Software engineers may find it ...;https://osseu2020.sched.com/list/descriptions/;https;osseu2020.sched.com;/list/descriptions/;;;sched;108.62.103.29;geolocation;{};US;United States;Illinois;Chicago;-87.62474060058594;41.845821380615234;108.62.103.29;Open Source Summit + Embedded Linux Conference Europe ...;Panel Discussion: Leveraging Blockchain to Drive Supply Chain Resilience and ... of disaster or disruption - Use cases from customers across a mix of industries, ... Ana is currently working at Bitergia, a Software Development Analytics firm ... be useful to people who are curious about RISC-V. Software engineers may find it ...
28;2020-09-08;Annual report and financial statements 2019/20;"resilience. One area of concern going forward is the amount of debt taken on by ... and software development. ... systems to enable higher quality remote working ... Our business continuity and disaster ... as usual on a ""work from home"" basis;.";https://developmentbank.wales/sites/default/files/2020-09/DBW_Annual%20Report%2019-20_%20English.pdf;https;developmentbank.wales;/sites/default/files/2020-09/DBW_Annual%20Report%2019-20_%20English.pdf;;;developmentbank;83.151.213.140;geolocation;{};GB;United Kingdom;England;Farnborough;-0.7739999890327454;51.28900146484375;83.151.213.140;Annual report and financial statements 2019/20;"resilience. One area of concern going forward is the amount of debt taken on by ... and software development. ... systems to enable higher quality remote working ... Our business continuity and disaster ... as usual on a ""work from home"" basis;."
29;2020-09-08;CVE-2020-16875 | Cyber Security and Consulting;Sep 8, 2020 — Microsoft today released updates to remedy nearly 130 security vulnerabilities in its Windows operating system and supported software.;https://www.themodernlogicgroup.com/tag/cve-2020-16875/;https;www.themodernlogicgroup.com;/tag/cve-2020-16875/;;;themodernlogicgroup;172.67.138.4;geolocation;{};US;United States;California;San Francisco;-122.39286041259766;37.76784896850586;172.67.138.4;CVE-2020-16875 | Cyber Security and Consulting;Sep 8, 2020 — Microsoft today released updates to remedy nearly 130 security vulnerabilities in its Windows operating system and supported software.
30;2020-09-08;Collaboration Archives - postPerspective;Sep 8, 2020 — This is Chimney editor Sam O'Hare's work-from-home setup. ... directors, designers, architects, product designers, software engineers and gaming experts. ... To help guide companies through this new reality of remote working, ... Diary of a Teenage Girl, The Disaster Artist and Can You Ever Forgive Me?;https://postperspective.com/category/collaboration/;https;postperspective.com;/category/collaboration/;;;postperspective;107.170.243.131;geolocation;{};US;United States;California;San Francisco;-122.44249725341797;37.769168853759766;107.170.243.131;Collaboration Archives - postPerspective;Sep 8, 2020 — This is Chimney editor Sam O'Hare's work-from-home setup. ... directors, designers, architects, product designers, software engineers and gaming experts. ... To help guide companies through this new reality of remote working, ... Diary of a Teenage Girl, The Disaster Artist and Can You Ever Forgive Me?
