;date;header;summary;link;protocol;domain;path;query;fragment;host_name;ip_address;Type;AdditionalData;CountryCode;CountryName;State;City;Longitude;Latitude;IpAddress;header_context_true;summary_context_true
31;2020-09-13;Coupon-sites.com (ePUB/PDF);Sep 14, 2020 — Walking Disaster SEMI-POCHE LITT French Edition By Jamie McGuire.pdf ... Start An Online Business: How To Work From Home Generating Passive Income ... Succeeding With Agile: Software Development Using Scrum ...;http://coupon-sites.com/;http;coupon-sites.com;/;;;coupon-sites;157.245.78.34;geolocation;{};US;United States;Oregon;Springfield;-123.24848175048828;44.028099060058594;157.245.78.34;Coupon-sites.com (ePUB/PDF);Sep 14, 2020 — Walking Disaster SEMI-POCHE LITT French Edition By Jamie McGuire.pdf ... Start An Online Business: How To Work From Home Generating Passive Income ... Succeeding With Agile: Software Development Using Scrum ...
32;2020-09-13;Www.moonstonemedia.mobi (ePUB/PDF);Sep 14, 2020 — ... Scrum Agile Software Development Series English Edition By Craig Larman.pdf ... Start An Online Business: 2 Manuscripts - How To Work From Home ... III: Conscious Leadership And Resilience: Orchestrating Innovation And ... Items For Disaster Preparedness English Edition By Ronald Williams.pdf;http://www.moonstonemedia.mobi/;http;www.moonstonemedia.mobi;/;;;moonstonemedia;157.245.78.34;geolocation;{};US;United States;Oregon;Springfield;-123.24848175048828;44.028099060058594;157.245.78.34;Www.moonstonemedia.mobi (ePUB/PDF);Sep 14, 2020 — ... Scrum Agile Software Development Series English Edition By Craig Larman.pdf ... Start An Online Business: 2 Manuscripts - How To Work From Home ... III: Conscious Leadership And Resilience: Orchestrating Innovation And ... Items For Disaster Preparedness English Edition By Ronald Williams.pdf
33;2020-09-13;Www.moonstonemedia.mobi (ePUB/PDF);Sep 14, 2020 — ... Scrum Agile Software Development Series English Edition By Craig Larman.pdf ... Start An Online Business: 2 Manuscripts - How To Work From Home ... III: Conscious Leadership And Resilience: Orchestrating Innovation And ... Items For Disaster Preparedness English Edition By Ronald Williams.pdf;http://www.moonstonemedia.mobi/;http;www.moonstonemedia.mobi;/;;;moonstonemedia;157.245.78.34;geolocation;{};US;United States;Oregon;Springfield;-123.24848175048828;44.028099060058594;157.245.78.34;Www.moonstonemedia.mobi (ePUB/PDF);Sep 14, 2020 — ... Scrum Agile Software Development Series English Edition By Craig Larman.pdf ... Start An Online Business: 2 Manuscripts - How To Work From Home ... III: Conscious Leadership And Resilience: Orchestrating Innovation And ... Items For Disaster Preparedness English Edition By Ronald Williams.pdf
34;2020-09-13;Www.moonstonemedia.mobi (ePUB/PDF);Sep 14, 2020 — ... Scrum Agile Software Development Series English Edition By Craig Larman.pdf ... Start An Online Business: 2 Manuscripts - How To Work From Home ... III: Conscious Leadership And Resilience: Orchestrating Innovation And ... Items For Disaster Preparedness English Edition By Ronald Williams.pdf;http://www.moonstonemedia.mobi/;http;www.moonstonemedia.mobi;/;;;moonstonemedia;157.245.78.34;geolocation;{};US;United States;Oregon;Springfield;-123.24848175048828;44.028099060058594;157.245.78.34;Www.moonstonemedia.mobi (ePUB/PDF);Sep 14, 2020 — ... Scrum Agile Software Development Series English Edition By Craig Larman.pdf ... Start An Online Business: 2 Manuscripts - How To Work From Home ... III: Conscious Leadership And Resilience: Orchestrating Innovation And ... Items For Disaster Preparedness English Edition By Ronald Williams.pdf
35;2020-09-13;Www.moonstonemedia.mobi (ePUB/PDF);Sep 14, 2020 — ... Scrum Agile Software Development Series English Edition By Craig Larman.pdf ... Start An Online Business: 2 Manuscripts - How To Work From Home ... III: Conscious Leadership And Resilience: Orchestrating Innovation And ... Items For Disaster Preparedness English Edition By Ronald Williams.pdf;http://www.moonstonemedia.mobi/;http;www.moonstonemedia.mobi;/;;;moonstonemedia;157.245.78.34;geolocation;{};US;United States;Oregon;Springfield;-123.24848175048828;44.028099060058594;157.245.78.34;Www.moonstonemedia.mobi (ePUB/PDF);Sep 14, 2020 — ... Scrum Agile Software Development Series English Edition By Craig Larman.pdf ... Start An Online Business: 2 Manuscripts - How To Work From Home ... III: Conscious Leadership And Resilience: Orchestrating Innovation And ... Items For Disaster Preparedness English Edition By Ronald Williams.pdf
36;2020-09-13;Relentlessinvestor.com (ePUB/PDF);Sep 14, 2020 — Outlines Highlights For Business Continuity And Disaster Recovery Planning For It ... Operational Risk And Resilience Understanding And Minimising ... Software Development For Engineers C C Pascal Assembly Visual Basic Html ... Secrets Of A Successful Online Psychic How To Work From Home As A ...;http://relentlessinvestor.com/;http;relentlessinvestor.com;/;;;relentlessinvestor;188.166.34.108;geolocation;{};NL;Netherlands;North Holland;Diemen;4.940189838409424;52.309051513671875;188.166.34.108;Relentlessinvestor.com (ePUB/PDF);Sep 14, 2020 — Outlines Highlights For Business Continuity And Disaster Recovery Planning For It ... Operational Risk And Resilience Understanding And Minimising ... Software Development For Engineers C C Pascal Assembly Visual Basic Html ... Secrets Of A Successful Online Psychic How To Work From Home As A ...
37;2020-09-13;Relentlessinvestor.com (ePUB/PDF);Sep 14, 2020 — Outlines Highlights For Business Continuity And Disaster Recovery Planning For It ... Operational Risk And Resilience Understanding And Minimising ... Software Development For Engineers C C Pascal Assembly Visual Basic Html ... Secrets Of A Successful Online Psychic How To Work From Home As A ...;http://relentlessinvestor.com/;http;relentlessinvestor.com;/;;;relentlessinvestor;188.166.34.108;geolocation;{};NL;Netherlands;North Holland;Diemen;4.940189838409424;52.309051513671875;188.166.34.108;Relentlessinvestor.com (ePUB/PDF);Sep 14, 2020 — Outlines Highlights For Business Continuity And Disaster Recovery Planning For It ... Operational Risk And Resilience Understanding And Minimising ... Software Development For Engineers C C Pascal Assembly Visual Basic Html ... Secrets Of A Successful Online Psychic How To Work From Home As A ...
38;2020-09-13;Christopherkehoe.com (ePUB/PDF);Specifying Systems The Tla Language And Tools For Hardware And Software Engineers ... Forces Guide Preparing To Survive Being Ready For When Disaster Strikes ... Secrets Of A Successful Online Psychic How To Work From Home As A ...;http://christopherkehoe.com/;http;christopherkehoe.com;/;;;christopherkehoe;188.166.34.108;geolocation;{};NL;Netherlands;North Holland;Diemen;4.940189838409424;52.309051513671875;188.166.34.108;Christopherkehoe.com (ePUB/PDF);Specifying Systems The Tla Language And Tools For Hardware And Software Engineers ... Forces Guide Preparing To Survive Being Ready For When Disaster Strikes ... Secrets Of A Successful Online Psychic How To Work From Home As A ...
39;2020-09-13;Christopherkehoe.com (ePUB/PDF);Specifying Systems The Tla Language And Tools For Hardware And Software Engineers ... Forces Guide Preparing To Survive Being Ready For When Disaster Strikes ... Secrets Of A Successful Online Psychic How To Work From Home As A ...;http://christopherkehoe.com/;http;christopherkehoe.com;/;;;christopherkehoe;188.166.34.108;geolocation;{};NL;Netherlands;North Holland;Diemen;4.940189838409424;52.309051513671875;188.166.34.108;Christopherkehoe.com (ePUB/PDF);Specifying Systems The Tla Language And Tools For Hardware And Software Engineers ... Forces Guide Preparing To Survive Being Ready For When Disaster Strikes ... Secrets Of A Successful Online Psychic How To Work From Home As A ...
40;2020-09-13;Simity Crencor 706-844-0150 - Crencor Leasing & Sales;Network communication software development process where does disability fit in? Perfect dip for me. ... (706) 844-0150 Random seed function for disaster relief. ... Resilience to health in the certificate. You shut up. ... Moving work from home.;http://simity.crencor.com/7068440150;http;simity.crencor.com;/7068440150;;;crencor;127.0.0.1;geolocation;{};;;;;;;127.0.0.1;Simity Crencor 706-844-0150 - Crencor Leasing & Sales;Network communication software development process where does disability fit in? Perfect dip for me. ... (706) 844-0150 Random seed function for disaster relief. ... Resilience to health in the certificate. You shut up. ... Moving work from home.
41;2020-09-13;Joe Biden's campaign app had a bug that made it too easy to ...;Sep 14, 2020 — ... after math, after school, aftermath, agent, agile software development, aging, agreement ... disability, disappearing tweets, disaster, disaster relief, disaster response ... remote working, remove, removed, remuneration, rename studio ... work, work from anywhere, Work From Home, work hub, Work-Bench ...;https://www.wilsonsmedia.com/joe-bidens-campaign-app-had-a-bug-that-made-it-too-easy-to-access-voter-info/;https;www.wilsonsmedia.com;/joe-bidens-campaign-app-had-a-bug-that-made-it-too-easy-to-access-voter-info/;;;wilsonsmedia;144.217.146.128;geolocation;{};IE;Ireland;;;-8.0;53.0;144.217.146.128;Joe Biden's campaign app had a bug that made it too easy to ...;Sep 14, 2020 — ... after math, after school, aftermath, agent, agile software development, aging, agreement ... disability, disappearing tweets, disaster, disaster relief, disaster response ... remote working, remove, removed, remuneration, rename studio ... work, work from anywhere, Work From Home, work hub, Work-Bench ...
42;2020-09-13;Joe Biden's campaign app had a bug that made it too easy to ...;Sep 14, 2020 — ... after math, after school, aftermath, agent, agile software development, aging, agreement ... disability, disappearing tweets, disaster, disaster relief, disaster response ... remote working, remove, removed, remuneration, rename studio ... work, work from anywhere, Work From Home, work hub, Work-Bench ...;https://www.wilsonsmedia.com/joe-bidens-campaign-app-had-a-bug-that-made-it-too-easy-to-access-voter-info/;https;www.wilsonsmedia.com;/joe-bidens-campaign-app-had-a-bug-that-made-it-too-easy-to-access-voter-info/;;;wilsonsmedia;144.217.146.128;geolocation;{};IE;Ireland;;;-8.0;53.0;144.217.146.128;Joe Biden's campaign app had a bug that made it too easy to ...;Sep 14, 2020 — ... after math, after school, aftermath, agent, agile software development, aging, agreement ... disability, disappearing tweets, disaster, disaster relief, disaster response ... remote working, remove, removed, remuneration, rename studio ... work, work from anywhere, Work From Home, work hub, Work-Bench ...
43;2020-09-13;Oracle reportedly wins deal for TikTok's US operations as ...;Sep 14, 2020 — ... after math, after school, aftermath, agent, agile software development, aging, agreement ... disability, disappearing tweets, disaster, disaster relief, disaster response ... remote working, remove, removed, remuneration, rename studio ... work, work from anywhere, Work From Home, work hub, Work-Bench ...;https://www.wilsonsmedia.com/oracle-reportedly-wins-deal-for-tiktoks-us-operations-as-trusted-tech-partner/;https;www.wilsonsmedia.com;/oracle-reportedly-wins-deal-for-tiktoks-us-operations-as-trusted-tech-partner/;;;wilsonsmedia;144.217.146.128;geolocation;{};IE;Ireland;;;-8.0;53.0;144.217.146.128;Oracle reportedly wins deal for TikTok's US operations as ...;Sep 14, 2020 — ... after math, after school, aftermath, agent, agile software development, aging, agreement ... disability, disappearing tweets, disaster, disaster relief, disaster response ... remote working, remove, removed, remuneration, rename studio ... work, work from anywhere, Work From Home, work hub, Work-Bench ...
44;2020-09-13;Oracle reportedly wins deal for TikTok's US operations as ...;Sep 14, 2020 — ... after math, after school, aftermath, agent, agile software development, aging, agreement ... disability, disappearing tweets, disaster, disaster relief, disaster response ... remote working, remove, removed, remuneration, rename studio ... work, work from anywhere, Work From Home, work hub, Work-Bench ...;https://www.wilsonsmedia.com/oracle-reportedly-wins-deal-for-tiktoks-us-operations-as-trusted-tech-partner/;https;www.wilsonsmedia.com;/oracle-reportedly-wins-deal-for-tiktoks-us-operations-as-trusted-tech-partner/;;;wilsonsmedia;144.217.146.128;geolocation;{};IE;Ireland;;;-8.0;53.0;144.217.146.128;Oracle reportedly wins deal for TikTok's US operations as ...;Sep 14, 2020 — ... after math, after school, aftermath, agent, agile software development, aging, agreement ... disability, disappearing tweets, disaster, disaster relief, disaster response ... remote working, remove, removed, remuneration, rename studio ... work, work from anywhere, Work From Home, work hub, Work-Bench ...
45;2020-09-13;Oyo Rooms Jobs in Bengaluru Bangalore (Oct 2020) - Salary ...;Sep 14, 2020 — Urgent Required Technical Support Engineer. Skills : Disaster Recovery , · Hardware Service Engineer , · Bcp , · Business Continuity ...;https://www.monsterindia.com/search/oyo-rooms-jobs-in-bengaluru-bangalore;https;www.monsterindia.com;/search/oyo-rooms-jobs-in-bengaluru-bangalore;;;monsterindia;23.33.169.182;geolocation;{};US;United States;Illinois;Chicago;-87.67124938964844;41.84885025024414;23.33.169.182;Oyo Rooms Jobs in Bengaluru Bangalore (Oct 2020) - Salary ...;Sep 14, 2020 — Urgent Required Technical Support Engineer. Skills : Disaster Recovery , · Hardware Service Engineer , · Bcp , · Business Continuity ...
46;2020-09-13;Techrights | Tux Machines;Even a tiny heat rise can spell disaster. This Is a Climate Emergency. We Need More Than Half-Measures from Democrats. How to get the Democrats' climate ...;http://tuxmachines.org/aggregator/sources/48?quicktabs_authors=2;http;tuxmachines.org;/aggregator/sources/48;quicktabs_authors=2;;tuxmachines;199.19.78.20;geolocation;{};US;United States;Nevada;Paradise;-115.14961242675781;36.08955001831055;199.19.78.20;Techrights | Tux Machines;Even a tiny heat rise can spell disaster. This Is a Climate Emergency. We Need More Than Half-Measures from Democrats. How to get the Democrats' climate ...
47;2020-09-13;Solarsat Ltd - Suffolk Business Directory;"We work from home so are always contactable during the day 7 days a week. ... services; WordPress web design and bespoke/custom software development. ... it a natural disaster, or any number of situations that can occur – you'll have me ...";https://www.suffolkbusinessdirectory.com/item/solarsat-ltd/;https;www.suffolkbusinessdirectory.com;/item/solarsat-ltd/;;;suffolkbusinessdirectory;35.214.80.134;geolocation;{};GB;United Kingdom;England;Acton;-0.22777999937534332;51.49610900878906;35.214.80.134;Solarsat Ltd - Suffolk Business Directory;"We work from home so are always contactable during the day 7 days a week. ... services; WordPress web design and bespoke/custom software development. ... it a natural disaster, or any number of situations that can occur – you'll have me ..."
48;2020-09-13;Planet - ChurchTuring.org;While you're at it, check out some of these other work-from-home hacks. ... blogs, a poster (above), and a graphic novel full of useful disaster preparedness tips for ordinary citizens. ... now expound on Rust being the future of safe software development and have adopted using it. ... Remote working will not replace the office.;http://feeds.churchturing.org/?s=zou;http;feeds.churchturing.org;/;s=zou;;churchturing;69.163.152.33;geolocation;{};US;United States;Texas;Brownsville;-97.44976043701172;25.992679595947266;69.163.152.33;Planet - ChurchTuring.org;While you're at it, check out some of these other work-from-home hacks. ... blogs, a poster (above), and a graphic novel full of useful disaster preparedness tips for ordinary citizens. ... now expound on Rust being the future of safe software development and have adopted using it. ... Remote working will not replace the office.
49;2020-09-13;Microsoft Software Engineer II Salaries in Vancouver | Glassdoor;Sep 14, 2020 — Work From Home (8 comments) ... of: Our software development centers are located all over the world, including Microsoft photo of: Connector ...;https://www.glassdoor.sg/Salary/Microsoft-Software-Engineer-II-Vancouver-Salaries-EJI_IE1651.0,9_KO10,30_IL.31,40_IM972.htm;https;www.glassdoor.sg;/Salary/Microsoft-Software-Engineer-II-Vancouver-Salaries-EJI_IE1651.0,9_KO10,30_IL.31,40_IM972.htm;;;glassdoor;104.16.94.86;geolocation;{};US;United States;California;San Jose;-121.83822631835938;37.330528259277344;104.16.94.86;Microsoft Software Engineer II Salaries in Vancouver | Glassdoor;Sep 14, 2020 — Work From Home (8 comments) ... of: Our software development centers are located all over the world, including Microsoft photo of: Connector ...
50;2020-09-13;APT28 Mounts Rapid, Large-Scale Theft of Office 365 Logins ...;Sep 13, 2020 — The Russia-linked possibility community is harvesting credentials for Microsoft's cloud providing, and focused on basically election-linked ...;https://kkhacklabs.com/apt28-mounts-rapid-large-scale-theft-of-office-365-logins/;https;kkhacklabs.com;/apt28-mounts-rapid-large-scale-theft-of-office-365-logins/;;;kkhacklabs;3.12.124.129;geolocation;{};US;United States;Ohio;Columbus;-82.99945831298828;39.99557876586914;3.12.124.129;APT28 Mounts Rapid, Large-Scale Theft of Office 365 Logins ...;Sep 13, 2020 — The Russia-linked possibility community is harvesting credentials for Microsoft's cloud providing, and focused on basically election-linked ...
51;2020-09-13;Council 17 September 2020 Attachment Item 9.1 - Manawatū ...;Sep 17, 2020 — 150 staff to work from home during lockdown. ... Council's emergency resilience reserve made it possible. ... Direct costs include the software development, ... In the event of a disaster it is expected that the repair and/or ...;https://www.mdc.govt.nz/MDC/council_minutes/Council/Attachments/Attachment%20Item%209.1%20Annual%20Report%202019-20_17-09-2020.pdf;https;www.mdc.govt.nz;/MDC/council_minutes/Council/Attachments/Attachment%20Item%209.1%20Annual%20Report%202019-20_17-09-2020.pdf;;;govt;203.114.162.157;geolocation;{};NZ;New Zealand;Manawatu-Wanganui;Palmerston North;175.60891723632812;-40.35483932495117;203.114.162.157;Council 17 September 2020 Attachment Item 9.1 - Manawatū ...;Sep 17, 2020 — 150 staff to work from home during lockdown. ... Council's emergency resilience reserve made it possible. ... Direct costs include the software development, ... In the event of a disaster it is expected that the repair and/or ...
52;2020-09-13;Roger Stone to Donald Trump: bring in martial law if you lose ...;Sep 13, 2020 — ... Aggregate IQ, agile software development, Agora.io, agribusiness, Agric investors ... Disabilities, Disability, disaster recovery, disaster relief, discharged, discord ... remote work, Remote workers, remote working, Removable media ... Work, Work & careers, work from anywhere, Work From Home, work visa ...;https://publicnewsupdate.com/roger-stone-to-donald-trump-bring-in-martial-law-if-you-lose-election/;https;publicnewsupdate.com;/roger-stone-to-donald-trump-bring-in-martial-law-if-you-lose-election/;;;publicnewsupdate;34.248.68.200;geolocation;{};IE;Ireland;Leinster;Dublin;-6.243330001831055;53.35388946533203;34.248.68.200;Roger Stone to Donald Trump: bring in martial law if you lose ...;Sep 13, 2020 — ... Aggregate IQ, agile software development, Agora.io, agribusiness, Agric investors ... Disabilities, Disability, disaster recovery, disaster relief, discharged, discord ... remote work, Remote workers, remote working, Removable media ... Work, Work & careers, work from anywhere, Work From Home, work visa ...
53;2020-09-13;Www.kellyannschaefer.org (ePUB/PDF);Sep 14, 2020 — Start An Online Business: How To Work From Home Generating Passive Income With ... Succeeding With Agile: Software Development Using Scrum ... Your Family During The Disaster English Edition By Sharon Reeves.pdf;http://www.kellyannschaefer.org/;http;www.kellyannschaefer.org;/;;;kellyannschaefer;157.245.78.34;geolocation;{};US;United States;Oregon;Springfield;-123.24848175048828;44.028099060058594;157.245.78.34;Www.kellyannschaefer.org (ePUB/PDF);Sep 14, 2020 — Start An Online Business: How To Work From Home Generating Passive Income With ... Succeeding With Agile: Software Development Using Scrum ... Your Family During The Disaster English Edition By Sharon Reeves.pdf
54;2020-09-13;Www.kellyannschaefer.org (ePUB/PDF);Sep 14, 2020 — Start An Online Business: How To Work From Home Generating Passive Income With ... Succeeding With Agile: Software Development Using Scrum ... Your Family During The Disaster English Edition By Sharon Reeves.pdf;http://www.kellyannschaefer.org/;http;www.kellyannschaefer.org;/;;;kellyannschaefer;157.245.78.34;geolocation;{};US;United States;Oregon;Springfield;-123.24848175048828;44.028099060058594;157.245.78.34;Www.kellyannschaefer.org (ePUB/PDF);Sep 14, 2020 — Start An Online Business: How To Work From Home Generating Passive Income With ... Succeeding With Agile: Software Development Using Scrum ... Your Family During The Disaster English Edition By Sharon Reeves.pdf
55;2020-09-13;Www.kellyannschaefer.org (ePUB/PDF);Sep 14, 2020 — Start An Online Business: How To Work From Home Generating Passive Income With ... Succeeding With Agile: Software Development Using Scrum ... Your Family During The Disaster English Edition By Sharon Reeves.pdf;http://www.kellyannschaefer.org/;http;www.kellyannschaefer.org;/;;;kellyannschaefer;157.245.78.34;geolocation;{};US;United States;Oregon;Springfield;-123.24848175048828;44.028099060058594;157.245.78.34;Www.kellyannschaefer.org (ePUB/PDF);Sep 14, 2020 — Start An Online Business: How To Work From Home Generating Passive Income With ... Succeeding With Agile: Software Development Using Scrum ... Your Family During The Disaster English Edition By Sharon Reeves.pdf
56;2020-09-13;Www.kellyannschaefer.org (ePUB/PDF);Sep 14, 2020 — Start An Online Business: How To Work From Home Generating Passive Income With ... Succeeding With Agile: Software Development Using Scrum ... Your Family During The Disaster English Edition By Sharon Reeves.pdf;http://www.kellyannschaefer.org/;http;www.kellyannschaefer.org;/;;;kellyannschaefer;157.245.78.34;geolocation;{};US;United States;Oregon;Springfield;-123.24848175048828;44.028099060058594;157.245.78.34;Www.kellyannschaefer.org (ePUB/PDF);Sep 14, 2020 — Start An Online Business: How To Work From Home Generating Passive Income With ... Succeeding With Agile: Software Development Using Scrum ... Your Family During The Disaster English Edition By Sharon Reeves.pdf
57;2020-09-13;Internet of Things Security - government information security;Having an accurate view of the resilience of organizations and industries against cyber-attacks can help target efforts to reduce exposure to the sectors that need ...;https://www.govinfosecurity.com/internet-things-security-c-465;https;www.govinfosecurity.com;/internet-things-security-c-465;;;govinfosecurity;50.56.167.254;geolocation;{};US;United States;Texas;Dallas;-96.8142318725586;32.8054313659668;50.56.167.254;Internet of Things Security - government information security;Having an accurate view of the resilience of organizations and industries against cyber-attacks can help target efforts to reduce exposure to the sectors that need ...
58;2020-09-13;Internet of Things Security - government information security;Having an accurate view of the resilience of organizations and industries against cyber-attacks can help target efforts to reduce exposure to the sectors that need ...;https://www.govinfosecurity.com/internet-things-security-c-465;https;www.govinfosecurity.com;/internet-things-security-c-465;;;govinfosecurity;50.56.167.254;geolocation;{};US;United States;Texas;Dallas;-96.8142318725586;32.8054313659668;50.56.167.254;Internet of Things Security - government information security;Having an accurate view of the resilience of organizations and industries against cyber-attacks can help target efforts to reduce exposure to the sectors that need ...
59;2020-09-13;Palantir Technologies Inc. IPO Investment Prospectus S-1/A;Sep 14, 2020 — Our software engineers are on the front lines. ... We may experience difficulties with software development, design, or marketing that delay ... If a natural disaster, power outage, connectivity issue, or other event occurred that ... The increase in remote working may also result in increased consumer privacy, ...;https://sec.report/Document/0001193125-20-244936/;https;sec.report;/Document/0001193125-20-244936/;;;sec;172.67.9.252;geolocation;{};US;United States;California;San Francisco;-122.39286041259766;37.76784896850586;172.67.9.252;Palantir Technologies Inc. IPO Investment Prospectus S-1/A;Sep 14, 2020 — Our software engineers are on the front lines. ... We may experience difficulties with software development, design, or marketing that delay ... If a natural disaster, power outage, connectivity issue, or other event occurred that ... The increase in remote working may also result in increased consumer privacy, ...
