;date;header;summary;link;protocol;domain;path;query;fragment;host_name;ip_address;Type;AdditionalData;CountryCode;CountryName;State;City;Longitude;Latitude;IpAddress;header_context_true;summary_context_true
28;2020-02-19;Privacy Fashion: Profit from the Surveillance State - National ...;Feb 20, 2020 — ... M. Bloom · Building Resilience for the Stressful Times Ahead by: Mary Crane ... Hostile Environment Claims in a Work-From-Home World by: Taylor L. ... distribution, branding, software development, hosted application and ...;https://www.natlawreview.com/article/privacy-fashion-profit-surveillance-state;https;www.natlawreview.com;/article/privacy-fashion-profit-surveillance-state;;;natlawreview;54.173.64.14;geolocation;{};US;United States;Virginia;Ashburn;-77.47419738769531;39.043701171875;54.173.64.14;Privacy Fashion: Profit from the Surveillance State - National ...;Feb 20, 2020 — ... M. Bloom · Building Resilience for the Stressful Times Ahead by: Mary Crane ... Hostile Environment Claims in a Work-From-Home World by: Taylor L. ... distribution, branding, software development, hosted application and ...
29;2020-02-19;Full Agenda - European SAFe Summit;... come from software development including practices such as small batches, ... a Continuous Learning Culture, resilience, a growth mindset and measurement. ... effective working environment to support remote working - Focused activities ...;https://europe.safesummit.com/agenda/;https;europe.safesummit.com;/agenda/;;;safesummit;146.148.108.109;geolocation;{};US;United States;Iowa;Council Bluffs;-95.87735748291016;41.23295974731445;146.148.108.109;Full Agenda - European SAFe Summit;... come from software development including practices such as small batches, ... a Continuous Learning Culture, resilience, a growth mindset and measurement. ... effective working environment to support remote working - Focused activities ...
30;2020-02-19;Forensics & Law Enforcement Encrypted Data Security Solutions;Custom Software Development Services · Onsite Hardware Support Services ... Oil & Gas · Secure Data Archive & Backup · Disaster Recovery & Business Continuity · Secure Transport & Data Migration · Virtualization · Work from Home.;https://ciphertex.com/solutions/forensics/;https;ciphertex.com;/solutions/forensics/;;;ciphertex;162.214.97.131;geolocation;{};US;United States;Utah;Provo;-111.6124267578125;40.21580123901367;162.214.97.131;Forensics & Law Enforcement Encrypted Data Security Solutions;Custom Software Development Services · Onsite Hardware Support Services ... Oil & Gas · Secure Data Archive & Backup · Disaster Recovery & Business Continuity · Secure Transport & Data Migration · Virtualization · Work from Home.
31;2020-02-19;February 2020 – Cronicle Press;COVID's impact can vary,” Wagner said. “The semiconductor industry is playing a crucial role to enable work from home. ... to recruit University of Michigan software development talent to help make the 100-year-old automaker more agile and ...;https://cronicle.press/2020/02/;https;cronicle.press;/2020/02/;;;cronicle;23.185.0.1;geolocation;{};US;United States;California;San Francisco;-122.40872955322266;37.79093933105469;23.185.0.1;February 2020 – Cronicle Press;COVID's impact can vary,” Wagner said. “The semiconductor industry is playing a crucial role to enable work from home. ... to recruit University of Michigan software development talent to help make the 100-year-old automaker more agile and ...
32;2020-02-19;Engineering Program Manager - Endpoint Protection (Remote ...;... required your leadership and fortitude to turn the tides of potential disaster. ... working in a program/project management capacity for software development.;https://dailyremote.com/remote-job/engineering-program-manager-endpoint-protection-remote-139112;https;dailyremote.com;/remote-job/engineering-program-manager-endpoint-protection-remote-139112;;;dailyremote;104.27.187.8;geolocation;{};US;United States;New Jersey;Newark;-74.19452667236328;40.738731384277344;104.27.187.8;Engineering Program Manager - Endpoint Protection (Remote ...;... required your leadership and fortitude to turn the tides of potential disaster. ... working in a program/project management capacity for software development.
33;2020-02-19;Blog - Launch Compass, LLC;Director of Emergency Management/Disaster Relief ... Vice President of Software Development, Large Company ... Even with the growing number of remote or work from home positions available, most employees work as part of a larger unit.;https://launchcompass.org/blog/;https;launchcompass.org;/blog/;;;launchcompass;162.241.218.139;geolocation;{};US;United States;Utah;Provo;-111.6124267578125;40.21580123901367;162.241.218.139;Blog - Launch Compass, LLC;Director of Emergency Management/Disaster Relief ... Vice President of Software Development, Large Company ... Even with the growing number of remote or work from home positions available, most employees work as part of a larger unit.
34;2020-02-19;Building an Adaptive, Multi-Tenant Stream Bus with Kafka and ...;Feb 19, 2020 — Disaster Recovery. Data from Kafka topics should be backed up in AWS S3 via Firehose. Command line tools are expected to ease replay of ...;https://slacker.ro/2020/02/19/building-an-adaptive-multi-tenant-stream-bus-with-kafka-and-golang/;https;slacker.ro;/2020/02/19/building-an-adaptive-multi-tenant-stream-bus-with-kafka-and-golang/;;;slacker;172.67.132.112;geolocation;{};US;United States;California;San Francisco;-122.39286041259766;37.76784896850586;172.67.132.112;Building an Adaptive, Multi-Tenant Stream Bus with Kafka and ...;Feb 19, 2020 — Disaster Recovery. Data from Kafka topics should be backed up in AWS S3 via Firehose. Command line tools are expected to ease replay of ...
35;2020-02-19;Building an Adaptive, Multi-Tenant Stream Bus with Kafka and ...;Feb 19, 2020 — Disaster Recovery. Data from Kafka topics should be backed up in AWS S3 via Firehose. Command line tools are expected to ease replay of ...;https://slacker.ro/2020/02/19/building-an-adaptive-multi-tenant-stream-bus-with-kafka-and-golang/;https;slacker.ro;/2020/02/19/building-an-adaptive-multi-tenant-stream-bus-with-kafka-and-golang/;;;slacker;172.67.132.112;geolocation;{};US;United States;California;San Francisco;-122.39286041259766;37.76784896850586;172.67.132.112;Building an Adaptive, Multi-Tenant Stream Bus with Kafka and ...;Feb 19, 2020 — Disaster Recovery. Data from Kafka topics should be backed up in AWS S3 via Firehose. Command line tools are expected to ease replay of ...
36;2020-02-19;Jobs in Buckinghamshire | British Careers;614 jobs — ... recording of monthly employee expenses in QuickBooks Soft Skill: Resilience Ability ... working, some remote working, a training budget and generous holidays. ... or equivalent in Software Development or similar relevant discipline.;https://nationaljobportal.net/states/jobs-in-buckinghamshire/;https;nationaljobportal.net;/states/jobs-in-buckinghamshire/;;;nationaljobportal;104.219.248.115;geolocation;{};US;United States;California;Los Angeles;-118.42788696289062;34.037078857421875;104.219.248.115;Jobs in Buckinghamshire | British Careers;614 jobs — ... recording of monthly employee expenses in QuickBooks Soft Skill: Resilience Ability ... working, some remote working, a training budget and generous holidays. ... or equivalent in Software Development or similar relevant discipline.
