;date;header;summary;link;protocol;domain;path;query;fragment;host_name;ip_address;Type;AdditionalData;CountryCode;CountryName;State;City;Longitude;Latitude;IpAddress;header_context_true;summary_context_true
0;2020-07-21;Microsoft Employee Benefit: Work From Home | Glassdoor;What Work From Home benefit do Microsoft employees get? Microsoft Work From Home, reported anonymously by Microsoft employees.;https://www.glassdoor.com/Benefits/Microsoft-Work-From-Home-Ireland-BNFT155_E1651_N70.htm;https;www.glassdoor.com;/Benefits/Microsoft-Work-From-Home-Ireland-BNFT155_E1651_N70.htm;;;glassdoor;104.17.90.51;geolocation;{};US;United States;New Jersey;Newark;-74.19452667236328;40.738731384277344;104.17.90.51;Microsoft Employee Benefit: Work From Home | Glassdoor;What Work From Home benefit do Microsoft employees get? Microsoft Work From Home, reported anonymously by Microsoft employees.
1;2020-07-21;Integrator Solutions Remote Work White Paper Layout Visual ...;Remote working. Cloud software ... remote working – i.e. the Cloud, wide access to broadband, online collaboration tools and ... May 2020, for example, expect they will work from home between one and three days ... Increased desire for disaster preparedness ... software development and support teams for more than 10 ...;https://integrator.solutions/wp-content/uploads/2020/07/Integrator-Housing-Solutions-Remote-Work-White-Paper-2020.pdf;https;integrator.solutions;/wp-content/uploads/2020/07/Integrator-Housing-Solutions-Remote-Work-White-Paper-2020.pdf;;;integrator;94.237.120.196;geolocation;{};GB;United Kingdom;England;City of Westminster;-0.19916999340057373;51.49555969238281;94.237.120.196;Integrator Solutions Remote Work White Paper Layout Visual ...;Remote working. Cloud software ... remote working – i.e. the Cloud, wide access to broadband, online collaboration tools and ... May 2020, for example, expect they will work from home between one and three days ... Increased desire for disaster preparedness ... software development and support teams for more than 10 ...
2;2020-07-21;UK FinTech: Moving mountains and moving mainstream - EY;Product 60 - 80 — us connected. Technology is already enabling us to work from home, ... The COVID-19 situation has shone a light on the resilience, ... with skills such as computer and software development ... permanent remote-working policies, and the effect this ... computer programmers, software engineers and designers,.;https://assets.ey.com/content/dam/ey-sites/ey-com/en_gl/topics/emeia-financial-services/ey-uk-fintech-2020-report.pdf;https;assets.ey.com;/content/dam/ey-sites/ey-com/en_gl/topics/emeia-financial-services/ey-uk-fintech-2020-report.pdf;;;ey;99.84.251.18;geolocation;{};US;United States;Illinois;Chicago;-87.67124938964844;41.84885025024414;99.84.251.18;UK FinTech: Moving mountains and moving mainstream - EY;Product 60 - 80 — us connected. Technology is already enabling us to work from home, ... The COVID-19 situation has shone a light on the resilience, ... with skills such as computer and software development ... permanent remote-working policies, and the effect this ... computer programmers, software engineers and designers,.
3;2020-07-21;2020 Annual Report;Jul 22, 2020 — Focus on software development, or software and engineering-driven ... Our inability to successfully recover from a disaster or other business ... infrastructure is or will be equipped to facilitate effective remote working arrangements and ... pandemic as more individuals are work from home and utilize home ...;https://s24.q4cdn.com/151081985/files/doc_financials/2019/ar/NortonLifeLock-Inc.-2020-Annual-Report.pdf;https;s24.q4cdn.com;/151081985/files/doc_financials/2019/ar/NortonLifeLock-Inc.-2020-Annual-Report.pdf;;;q4cdn;68.70.205.2;geolocation;{};CH;Switzerland;Zurich;Winterthur;8.726160049438477;47.499881744384766;68.70.205.2;2020 Annual Report;Jul 22, 2020 — Focus on software development, or software and engineering-driven ... Our inability to successfully recover from a disaster or other business ... infrastructure is or will be equipped to facilitate effective remote working arrangements and ... pandemic as more individuals are work from home and utilize home ...
4;2020-07-21;Does Your Managed Services Agreement Address Contract ...;Jul 22, 2020 — The former owner of a software development company and having ... Are You Helping Customers with Their Work-From-Home Challenges?;https://www.xaasjournal.com/does-your-managed-services-agreement-address-contract-termination/;https;www.xaasjournal.com;/does-your-managed-services-agreement-address-contract-termination/;;;xaasjournal;35.209.190.21;geolocation;{};US;United States;Iowa;Council Bluffs;-95.87735748291016;41.23295974731445;35.209.190.21;Does Your Managed Services Agreement Address Contract ...;Jul 22, 2020 — The former owner of a software development company and having ... Are You Helping Customers with Their Work-From-Home Challenges?
5;2020-07-21;Teradata hiring Senior Program Manager - Platforms in San ...;"Jul 21, 2020 — ... support elastic scalability, on-demand self-service, disaster recovery, and usage ... and software development teams; Strong customer focus, ownership, ... Many roles will be temporarily remote or work from home to comply ...";https://www.linkedin.com/jobs/view/senior-program-manager-platforms-at-teradata-1950756136;https;www.linkedin.com;/jobs/view/senior-program-manager-platforms-at-teradata-1950756136;;;linkedin;13.107.43.14;geolocation;{};US;United States;Washington;Cottage Lake;-122.12094116210938;47.68050003051758;13.107.43.14;Teradata hiring Senior Program Manager - Platforms in San ...;"Jul 21, 2020 — ... support elastic scalability, on-demand self-service, disaster recovery, and usage ... and software development teams; Strong customer focus, ownership, ... Many roles will be temporarily remote or work from home to comply ..."
6;2020-07-21;Bruce Dahlgren announced as new CEO of MetricStream -;Jul 22, 2020 — “We are delighted to welcome Bruce to MetricStream as we move into our next phase of growth in GRC/IRM, helping customers build resilience ...;https://uktechnews.co.uk/2020/07/22/bruce-dahlgren-announced-as-new-ceo-of-metricstream/;https;uktechnews.co.uk;/2020/07/22/bruce-dahlgren-announced-as-new-ceo-of-metricstream/;;;co;104.18.56.251;geolocation;{};US;United States;California;San Jose;-121.83822631835938;37.330528259277344;104.18.56.251;Bruce Dahlgren announced as new CEO of MetricStream -;Jul 22, 2020 — “We are delighted to welcome Bruce to MetricStream as we move into our next phase of growth in GRC/IRM, helping customers build resilience ...
7;2020-07-21;The 12 Biggest Global Technology Trends in 2020 | Hive Life ...;Jul 21, 2020 — In tandem with this industry growth, custom hardware and software development companies have begun to offer their expertise in development, ...;https://hivelife.com/global-technology-trends/;https;hivelife.com;/global-technology-trends/;;;hivelife;104.26.8.181;geolocation;{};SG;Singapore;;Singapore;103.8198013305664;1.3200000524520874;104.26.8.181;The 12 Biggest Global Technology Trends in 2020 | Hive Life ...;Jul 21, 2020 — In tandem with this industry growth, custom hardware and software development companies have begun to offer their expertise in development, ...
8;2020-07-21;Navigating change - Investor relations - Beazley;Jul 22, 2020 — designed to improve resilience to external factors such as more ... secure systems in place to work from home with minimal disruption. Without question the enforced remote working ... Expenditure on software development ... its insurance risk and runs various realistic disaster scenarios (RDS) to monitor ...;https://investor.relations.beazley.com/~/media/Files/B/Beazley-IR/documents/annual-reports/interim-reports/beazley-interim-report-2020-final.pdf;https;investor.relations.beazley.com;/~/media/Files/B/Beazley-IR/documents/annual-reports/interim-reports/beazley-interim-report-2020-final.pdf;;;beazley;23.35.71.235;geolocation;{};US;United States;Illinois;Chicago;-87.67124938964844;41.84885025024414;23.35.71.235;Navigating change - Investor relations - Beazley;Jul 22, 2020 — designed to improve resilience to external factors such as more ... secure systems in place to work from home with minimal disruption. Without question the enforced remote working ... Expenditure on software development ... its insurance risk and runs various realistic disaster scenarios (RDS) to monitor ...
9;2020-07-21;Video: 10 Minute IT Jams - Who is BlackLine? - IT Brief;The importance of data resilience in the current cybersecurity climate ... Juniper Networks expands security ...;https://itbrief.co.nz/story/video-10-minute-it-jams-who-is-blackline;https;itbrief.co.nz;/story/video-10-minute-it-jams-who-is-blackline;;;co;113.21.226.180;geolocation;{};NZ;New Zealand;Auckland;Auckland;174.6802978515625;-36.78810119628906;113.21.226.180;Video: 10 Minute IT Jams - Who is BlackLine? - IT Brief;The importance of data resilience in the current cybersecurity climate ... Juniper Networks expands security ...
10;2020-07-21;Video: 10 Minute IT Jams - Who is BlackLine? - IT Brief;The importance of data resilience in the current cybersecurity climate ... Juniper Networks expands security ...;https://itbrief.co.nz/story/video-10-minute-it-jams-who-is-blackline;https;itbrief.co.nz;/story/video-10-minute-it-jams-who-is-blackline;;;co;113.21.226.180;geolocation;{};NZ;New Zealand;Auckland;Auckland;174.6802978515625;-36.78810119628906;113.21.226.180;Video: 10 Minute IT Jams - Who is BlackLine? - IT Brief;The importance of data resilience in the current cybersecurity climate ... Juniper Networks expands security ...
11;2020-07-21;Video: 10 Minute IT Jams - Who is BlackLine? - IT Brief;The importance of data resilience in the current cybersecurity climate ... Juniper Networks expands security ...;https://itbrief.co.nz/story/video-10-minute-it-jams-who-is-blackline;https;itbrief.co.nz;/story/video-10-minute-it-jams-who-is-blackline;;;co;113.21.226.180;geolocation;{};NZ;New Zealand;Auckland;Auckland;174.6802978515625;-36.78810119628906;113.21.226.180;Video: 10 Minute IT Jams - Who is BlackLine? - IT Brief;The importance of data resilience in the current cybersecurity climate ... Juniper Networks expands security ...
12;2020-07-21;Virtual Doctor Telehealth Solutions | Healthcare Cloud Services;e-PHI and HIPAA-compliant support for data migration, storage, and disaster recovery. ... our critical systems into the AWS, 80% our staff is now remote working.;https://cloudcomputingtechnologies.com/healthcare-cloud-services/;https;cloudcomputingtechnologies.com;/healthcare-cloud-services/;;;cloudcomputingtechnologies;184.73.187.186;geolocation;{};US;United States;Virginia;Ashburn;-77.47419738769531;39.043701171875;184.73.187.186;Virtual Doctor Telehealth Solutions | Healthcare Cloud Services;e-PHI and HIPAA-compliant support for data migration, storage, and disaster recovery. ... our critical systems into the AWS, 80% our staff is now remote working.
13;2020-07-21;Virtual | Bryan Campbell;Jul 21, 2020 — ... scaling agile Social Media software development software selection status ... Much has been said about individual resilience but organizations need to ... Remote working has helped organizations reduce costs, improve the ... -a-one-in-three-chance-of-a-massive-disaster-that-could-be-worse-than-covid- ...;https://7c-consulting.com/tag/virtual/;https;7c-consulting.com;/tag/virtual/;;;7c-consulting;198.71.233.199;geolocation;{};US;United States;Arizona;Scottsdale;-111.89010620117188;33.610958099365234;198.71.233.199;Virtual | Bryan Campbell;Jul 21, 2020 — ... scaling agile Social Media software development software selection status ... Much has been said about individual resilience but organizations need to ... Remote working has helped organizations reduce costs, improve the ... -a-one-in-three-chance-of-a-massive-disaster-that-could-be-worse-than-covid- ...
14;2020-07-21;Virtual | Bryan Campbell;Jul 21, 2020 — ... scaling agile Social Media software development software selection status ... Much has been said about individual resilience but organizations need to ... Remote working has helped organizations reduce costs, improve the ... -a-one-in-three-chance-of-a-massive-disaster-that-could-be-worse-than-covid- ...;https://7c-consulting.com/tag/virtual/;https;7c-consulting.com;/tag/virtual/;;;7c-consulting;198.71.233.199;geolocation;{};US;United States;Arizona;Scottsdale;-111.89010620117188;33.610958099365234;198.71.233.199;Virtual | Bryan Campbell;Jul 21, 2020 — ... scaling agile Social Media software development software selection status ... Much has been said about individual resilience but organizations need to ... Remote working has helped organizations reduce costs, improve the ... -a-one-in-three-chance-of-a-massive-disaster-that-could-be-worse-than-covid- ...
15;2020-07-21;Agile | Bryan Campbell;Jul 21, 2020 — The answer is developing resilience and one important step is developing a ... chance of a global disaster larger than Covid-19 occurring in the next decade[1]. ... Remote working has helped organizations reduce costs, improve the environment ... is often a neglected component of software development.;https://7c-consulting.com/tag/agile/;https;7c-consulting.com;/tag/agile/;;;7c-consulting;198.71.233.199;geolocation;{};US;United States;Arizona;Scottsdale;-111.89010620117188;33.610958099365234;198.71.233.199;Agile | Bryan Campbell;Jul 21, 2020 — The answer is developing resilience and one important step is developing a ... chance of a global disaster larger than Covid-19 occurring in the next decade[1]. ... Remote working has helped organizations reduce costs, improve the environment ... is often a neglected component of software development.
16;2020-07-21;Agile | Bryan Campbell;Jul 21, 2020 — The answer is developing resilience and one important step is developing a ... chance of a global disaster larger than Covid-19 occurring in the next decade[1]. ... Remote working has helped organizations reduce costs, improve the environment ... is often a neglected component of software development.;https://7c-consulting.com/tag/agile/;https;7c-consulting.com;/tag/agile/;;;7c-consulting;198.71.233.199;geolocation;{};US;United States;Arizona;Scottsdale;-111.89010620117188;33.610958099365234;198.71.233.199;Agile | Bryan Campbell;Jul 21, 2020 — The answer is developing resilience and one important step is developing a ... chance of a global disaster larger than Covid-19 occurring in the next decade[1]. ... Remote working has helped organizations reduce costs, improve the environment ... is often a neglected component of software development.
17;2020-07-21;Aero industry assembles online - Aviation International News;Jul 21, 2020 — UK defense industry demonstrates resilience during Covid crisis. The UK defense ... by Matt Thurber. While many people work from home or.;https://www.ainonline.com/sites/ainonline.com/files/full-issues/fia0720_compressed_new.pdf;https;www.ainonline.com;/sites/ainonline.com/files/full-issues/fia0720_compressed_new.pdf;;;ainonline;3.224.74.208;geolocation;{};US;United States;Virginia;Ashburn;-77.47419738769531;39.043701171875;3.224.74.208;Aero industry assembles online - Aviation International News;Jul 21, 2020 — UK defense industry demonstrates resilience during Covid crisis. The UK defense ... by Matt Thurber. While many people work from home or.
18;2020-07-21;Ergo scoops top IT services provider award - Sunday ...;“They are experiencing unprecedented uncertainty and need to build agility and resilience into their systems to make them less vulnerable to disruption.;https://www.ergogroup.ie/news/sunday-business-post-ergo-scoops-top-it-services-provider-award;https;www.ergogroup.ie;/news/sunday-business-post-ergo-scoops-top-it-services-provider-award;;;ergogroup;87.76.17.141;geolocation;{};GB;United Kingdom;The Scottish Borders;Melrose;-2.7209999561309814;55.597999572753906;87.76.17.141;Ergo scoops top IT services provider award - Sunday ...;“They are experiencing unprecedented uncertainty and need to build agility and resilience into their systems to make them less vulnerable to disruption.
19;2020-07-21;What's Happening at SRE From Home | Digital Experience ...;Jul 22, 2020 — ... collaboration during work from home situations to minimize meeting fatigue? ... tasks must happen on-site (i.e. not from home) in software development? ... with SRE, Monitoring, and Resilience Engineering in her portfolio.;https://blog.catchpoint.com/2020/07/22/whats-happening-at-sre-from-home/;https;blog.catchpoint.com;/2020/07/22/whats-happening-at-sre-from-home/;;;catchpoint;151.101.1.63;geolocation;{};US;United States;California;San Francisco;-122.39286041259766;37.76784896850586;151.101.1.63;What's Happening at SRE From Home | Digital Experience ...;Jul 22, 2020 — ... collaboration during work from home situations to minimize meeting fatigue? ... tasks must happen on-site (i.e. not from home) in software development? ... with SRE, Monitoring, and Resilience Engineering in her portfolio.
20;2020-07-21;Delivery Associate Part-Time job in Austin at American Freight ...;Jul 22, 2020 — ... demonstrate good negotiation and objection handling skills, empathy, assertiveness, tact, resilience and have the ability to relate to people.;https://lensa.com/delivery-associate-part-time-jobs/austin/jd/06264163c813460d2db296b641251c41;https;lensa.com;/delivery-associate-part-time-jobs/austin/jd/06264163c813460d2db296b641251c41;;;lensa;3.209.132.185;geolocation;{};US;United States;Virginia;Ashburn;-77.47419738769531;39.043701171875;3.209.132.185;Delivery Associate Part-Time job in Austin at American Freight ...;Jul 22, 2020 — ... demonstrate good negotiation and objection handling skills, empathy, assertiveness, tact, resilience and have the ability to relate to people.
21;2020-07-21;Coronavirus Impact: All India manufacturers' organisation ...;Remote Working—The new future of work in a post-pandemic world. Earlier, managements considered work from home a privilege for a few employees, but it has ...;https://smefutures.com/coronavirus-impact-all-india-manufacturers-organisation-urges-govt-to-provide-support-package-to-msmes/page/11/;https;smefutures.com;/coronavirus-impact-all-india-manufacturers-organisation-urges-govt-to-provide-support-package-to-msmes/page/11/;;;smefutures;13.232.79.86;geolocation;{};IN;India;Maharashtra;Powai;72.87770080566406;19.076000213623047;13.232.79.86;Coronavirus Impact: All India manufacturers' organisation ...;Remote Working—The new future of work in a post-pandemic world. Earlier, managements considered work from home a privilege for a few employees, but it has ...
22;2020-07-21;AU Small Finance Bank - PIM/CyberArk L2 Support ...;Jul 21, 2020 — Knowledge about disaster recovery for vault - System integration and ... Software Development Engineer II - iOS. 3 - 5 YearsBangalore.;https://www.hirist.com/j/au-small-finance-bank-pim-cyberark-l2-support-application-server-3-7-yrs-619267.html?ref=cj;https;www.hirist.com;/j/au-small-finance-bank-pim-cyberark-l2-support-application-server-3-7-yrs-619267.html;ref=cj;;hirist;13.233.235.167;geolocation;{};IN;India;Maharashtra;Powai;72.87770080566406;19.076000213623047;13.233.235.167;AU Small Finance Bank - PIM/CyberArk L2 Support ...;Jul 21, 2020 — Knowledge about disaster recovery for vault - System integration and ... Software Development Engineer II - iOS. 3 - 5 YearsBangalore.
23;2020-07-21;Lenovo announces first AMD Threadripper Pro workstation;Jul 21, 2020 — The importance of data resilience in the current cybersecurity climate. Protecting an organisation's data is one of the most crucial functions of ...;https://itbrief.com.au/story/lenovo-announces-first-amd-threadripper-pro-workstation;https;itbrief.com.au;/story/lenovo-announces-first-amd-threadripper-pro-workstation;;;com;113.21.226.180;geolocation;{};NZ;New Zealand;Auckland;Auckland;174.6802978515625;-36.78810119628906;113.21.226.180;Lenovo announces first AMD Threadripper Pro workstation;Jul 21, 2020 — The importance of data resilience in the current cybersecurity climate. Protecting an organisation's data is one of the most crucial functions of ...
24;2020-07-21;Lenovo announces first AMD Threadripper Pro workstation;Jul 21, 2020 — The importance of data resilience in the current cybersecurity climate. Protecting an organisation's data is one of the most crucial functions of ...;https://itbrief.com.au/story/lenovo-announces-first-amd-threadripper-pro-workstation;https;itbrief.com.au;/story/lenovo-announces-first-amd-threadripper-pro-workstation;;;com;113.21.226.180;geolocation;{};NZ;New Zealand;Auckland;Auckland;174.6802978515625;-36.78810119628906;113.21.226.180;Lenovo announces first AMD Threadripper Pro workstation;Jul 21, 2020 — The importance of data resilience in the current cybersecurity climate. Protecting an organisation's data is one of the most crucial functions of ...
25;2020-07-21;Lenovo announces first AMD Threadripper Pro workstation;Jul 21, 2020 — The importance of data resilience in the current cybersecurity climate. Protecting an organisation's data is one of the most crucial functions of ...;https://itbrief.com.au/story/lenovo-announces-first-amd-threadripper-pro-workstation;https;itbrief.com.au;/story/lenovo-announces-first-amd-threadripper-pro-workstation;;;com;113.21.226.180;geolocation;{};NZ;New Zealand;Auckland;Auckland;174.6802978515625;-36.78810119628906;113.21.226.180;Lenovo announces first AMD Threadripper Pro workstation;Jul 21, 2020 — The importance of data resilience in the current cybersecurity climate. Protecting an organisation's data is one of the most crucial functions of ...
26;2020-07-21;Nvidia Reportedly Interested In Buying Arm From SoftBank;Jul 22, 2020 — The company is doing this by making its CUDA-X libraries, GPU-accelerated AI frameworks and software development tools available to Arm ...;https://www.crn.com/news/components-peripherals/nvidia-reportedly-interested-in-buying-arm-from-softbank;https;www.crn.com;/news/components-peripherals/nvidia-reportedly-interested-in-buying-arm-from-softbank;;;crn;99.84.167.8;geolocation;{};US;United States;Illinois;Chicago;-87.67124938964844;41.84885025024414;99.84.167.8;Nvidia Reportedly Interested In Buying Arm From SoftBank;Jul 22, 2020 — The company is doing this by making its CUDA-X libraries, GPU-accelerated AI frameworks and software development tools available to Arm ...
27;2020-07-21;What is Google Cloud Platform? - Agosto;On the technology side, 1901 Group is emphasizing knowledge in cloud engineering, AI and machine learning, cybersecurity, software development, and ...;https://www.agosto.com/?afdt=22mQrlO_UugKEwinhZXswqyZAhUMKhoKHflaEfcQAhgDIAAwx6f2DlDHp_YOUMu6iw9Qhe-oEFDCwpQpUOCgrylQypH2rgE&search;https;www.agosto.com;/;afdt=22mQrlO_UugKEwinhZXswqyZAhUMKhoKHflaEfcQAhgDIAAwx6f2DlDHp_YOUMu6iw9Qhe-oEFDCwpQpUOCgrylQypH2rgE&search;;agosto;151.101.66.159;geolocation;{};US;United States;California;San Francisco;-122.39286041259766;37.76784896850586;151.101.66.159;What is Google Cloud Platform? - Agosto;On the technology side, 1901 Group is emphasizing knowledge in cloud engineering, AI and machine learning, cybersecurity, software development, and ...
28;2020-07-21;Senior Site Reliability Engineer | Charlotte, North Carolina ...;Posted 18 hours ago Full Stack Software Development Engineer ... Engineer K8S/Cloud - Policy - Open to remote office location in US / Work from home office;https://jobsearcher.com/j/senior-site-reliability-engineer-at-centene-in-charlotte-north-carolina-MnVq49;https;jobsearcher.com;/j/senior-site-reliability-engineer-at-centene-in-charlotte-north-carolina-MnVq49;;;jobsearcher;52.21.160.98;geolocation;{};US;United States;Virginia;Ashburn;-77.47419738769531;39.043701171875;52.21.160.98;Senior Site Reliability Engineer | Charlotte, North Carolina ...;Posted 18 hours ago Full Stack Software Development Engineer ... Engineer K8S/Cloud - Policy - Open to remote office location in US / Work from home office
29;2020-07-21;Senior Site Reliability Engineer | Charlotte, North Carolina ...;Posted 18 hours ago Full Stack Software Development Engineer ... Engineer K8S/Cloud - Policy - Open to remote office location in US / Work from home office;https://jobsearcher.com/j/senior-site-reliability-engineer-at-centene-in-charlotte-north-carolina-MnVq49;https;jobsearcher.com;/j/senior-site-reliability-engineer-at-centene-in-charlotte-north-carolina-MnVq49;;;jobsearcher;52.21.160.98;geolocation;{};US;United States;Virginia;Ashburn;-77.47419738769531;39.043701171875;52.21.160.98;Senior Site Reliability Engineer | Charlotte, North Carolina ...;Posted 18 hours ago Full Stack Software Development Engineer ... Engineer K8S/Cloud - Policy - Open to remote office location in US / Work from home office
30;2020-07-21;COVID-19 crisis shifts cybersecurity priorities and budgets ...;Jul 21, 2020 — ... a work-from-home model, chief information-security officers (CISOs) ... the risk of remote access to sensitive data and software-development ...;https://www.mckinsey.com/business-functions/risk/our-insights/covid-19-crisis-shifts-cybersecurity-priorities-and-budgets;https;www.mckinsey.com;/business-functions/risk/our-insights/covid-19-crisis-shifts-cybersecurity-priorities-and-budgets;;;mckinsey;23.44.165.146;geolocation;{};US;United States;Illinois;Chicago;-87.67124938964844;41.84885025024414;23.44.165.146;COVID-19 crisis shifts cybersecurity priorities and budgets ...;Jul 21, 2020 — ... a work-from-home model, chief information-security officers (CISOs) ... the risk of remote access to sensitive data and software-development ...
