;date;header;summary;link;protocol;domain;path;query;fragment;host_name;ip_address;Type;AdditionalData;CountryCode;CountryName;State;City;Longitude;Latitude;IpAddress;header_context_true;summary_context_true
0;2020-07-30;(PDF) Socio-Technical Congruence: A Framework for ...;Socio-Technical Congruence: A Framework for Assessing the Impact of Technical and Work Dependencies on Software Development Productivity. January 2008.;https://www.researchgate.net/publication/221494827_Socio-Technical_Congruence_A_Framework_for_Assessing_the_Impact_of_Technical_and_Work_Dependencies_on_Software_Development_Productivity;https;www.researchgate.net;/publication/221494827_Socio-Technical_Congruence_A_Framework_for_Assessing_the_Impact_of_Technical_and_Work_Dependencies_on_Software_Development_Productivity;;;researchgate;104.17.33.105;geolocation;{};US;United States;California;San Jose;-121.83822631835938;37.330528259277344;104.17.33.105;(PDF) Socio-Technical Congruence: A Framework for ...;Socio-Technical Congruence: A Framework for Assessing the Impact of Technical and Work Dependencies on Software Development Productivity. January 2008.
1;2020-07-30;6 ways to build culture and boost morale when everyone's ...;Jul 31, 2020 — One of the main challenges with remote working arises from the ... to gauge how teams are handling their new remote working situation. ... Next article Victoria declares state of disaster as Melbourne goes into stage 4 lockdown with an 8pm curfew ... The software development tool for agile teams: Try it free.;https://www.startupdaily.net/2020/07/6-ways-to-build-culture-boost-morale-working-remotely/;https;www.startupdaily.net;/2020/07/6-ways-to-build-culture-boost-morale-working-remotely/;;;startupdaily;107.191.56.25;geolocation;{};AU;Australia;New South Wales;Sydney;151.2071075439453;-33.86714172363281;107.191.56.25;6 ways to build culture and boost morale when everyone's ...;Jul 31, 2020 — One of the main challenges with remote working arises from the ... to gauge how teams are handling their new remote working situation. ... Next article Victoria declares state of disaster as Melbourne goes into stage 4 lockdown with an 8pm curfew ... The software development tool for agile teams: Try it free.
2;2020-07-30;PARROT (PARRO.PA) Stock Price, News, Quote & History ...;Jul 31, 2020 — The SDK (Software Development Kit) Program, launched in 2019 to ... staff to work from home, with all the infrastructures and systems in place, ...;https://finance.yahoo.com/quote/PARRO.PA/;https;finance.yahoo.com;/quote/PARRO.PA/;;;yahoo;69.147.64.34;geolocation;{};US;United States;New York;Manhattan;-73.9884033203125;40.73139190673828;69.147.64.34;PARROT (PARRO.PA) Stock Price, News, Quote & History ...;Jul 31, 2020 — The SDK (Software Development Kit) Program, launched in 2019 to ... staff to work from home, with all the infrastructures and systems in place, ...
3;2020-07-30;Financial Services Cyber Teams Face New Imperatives - Risk ...;Jul 31, 2020 — ... activities that focus on remote cyber hygiene for work-from-home environments. ... into the architecture and design stages of the software development life cycle could ... can support activities such as business continuity planning and disaster recovery, with an emphasis on enabling operational resilience.;https://deloitte.wsj.com/riskandcompliance/2020/07/31/financial-services-cyber-teams-face-new-imperatives/;https;deloitte.wsj.com;/riskandcompliance/2020/07/31/financial-services-cyber-teams-face-new-imperatives/;;;wsj;13.226.18.3;geolocation;{};US;United States;Illinois;Chicago;-87.67124938964844;41.84885025024414;13.226.18.3;Financial Services Cyber Teams Face New Imperatives - Risk ...;Jul 31, 2020 — ... activities that focus on remote cyber hygiene for work-from-home environments. ... into the architecture and design stages of the software development life cycle could ... can support activities such as business continuity planning and disaster recovery, with an emphasis on enabling operational resilience.
4;2020-07-30;Mitsubishi Electric announces consolidated financial results ...;Jul 30, 2020 — ... preventing and reducing disaster risks remaining buoyant in Japan. ... demand for IT infrastructure development to promote remote working.;https://www.automotiveworld.com/news-releases/mitsubishi-electric-announces-consolidated-financial-results-for-the-first-quarter-of-fiscal-2021/;https;www.automotiveworld.com;/news-releases/mitsubishi-electric-announces-consolidated-financial-results-for-the-first-quarter-of-fiscal-2021/;;;automotiveworld;34.75.247.208;geolocation;{};US;United States;South Carolina;North Charleston;-80.0589370727539;32.890079498291016;34.75.247.208;Mitsubishi Electric announces consolidated financial results ...;Jul 30, 2020 — ... preventing and reducing disaster risks remaining buoyant in Japan. ... demand for IT infrastructure development to promote remote working.
5;2020-07-30;B2B buyers more likely to buy from vendors with digital ...;Jul 30, 2020 — Juniper Networks expands security offering for remote working. Juniper Networks has launched new solutions to enhance work from home security. ... The importance of data resilience in the current cybersecurity climate ... PagerDuty was born from the idea that software development and operations could ...;https://itbrief.com.au/story/b2b-buyers-more-likely-to-buy-from-vendors-with-digital-purchasing-channels-report;https;itbrief.com.au;/story/b2b-buyers-more-likely-to-buy-from-vendors-with-digital-purchasing-channels-report;;;com;113.21.226.180;geolocation;{};NZ;New Zealand;Auckland;Auckland;174.6802978515625;-36.78810119628906;113.21.226.180;B2B buyers more likely to buy from vendors with digital ...;Jul 30, 2020 — Juniper Networks expands security offering for remote working. Juniper Networks has launched new solutions to enhance work from home security. ... The importance of data resilience in the current cybersecurity climate ... PagerDuty was born from the idea that software development and operations could ...
6;2020-07-30;B2B buyers more likely to buy from vendors with digital ...;Jul 30, 2020 — Juniper Networks expands security offering for remote working. Juniper Networks has launched new solutions to enhance work from home security. ... The importance of data resilience in the current cybersecurity climate ... PagerDuty was born from the idea that software development and operations could ...;https://itbrief.com.au/story/b2b-buyers-more-likely-to-buy-from-vendors-with-digital-purchasing-channels-report;https;itbrief.com.au;/story/b2b-buyers-more-likely-to-buy-from-vendors-with-digital-purchasing-channels-report;;;com;113.21.226.180;geolocation;{};NZ;New Zealand;Auckland;Auckland;174.6802978515625;-36.78810119628906;113.21.226.180;B2B buyers more likely to buy from vendors with digital ...;Jul 30, 2020 — Juniper Networks expands security offering for remote working. Juniper Networks has launched new solutions to enhance work from home security. ... The importance of data resilience in the current cybersecurity climate ... PagerDuty was born from the idea that software development and operations could ...
7;2020-07-30;B2B buyers more likely to buy from vendors with digital ...;Jul 30, 2020 — Juniper Networks expands security offering for remote working. Juniper Networks has launched new solutions to enhance work from home security. ... The importance of data resilience in the current cybersecurity climate ... PagerDuty was born from the idea that software development and operations could ...;https://itbrief.com.au/story/b2b-buyers-more-likely-to-buy-from-vendors-with-digital-purchasing-channels-report;https;itbrief.com.au;/story/b2b-buyers-more-likely-to-buy-from-vendors-with-digital-purchasing-channels-report;;;com;113.21.226.180;geolocation;{};NZ;New Zealand;Auckland;Auckland;174.6802978515625;-36.78810119628906;113.21.226.180;B2B buyers more likely to buy from vendors with digital ...;Jul 30, 2020 — Juniper Networks expands security offering for remote working. Juniper Networks has launched new solutions to enhance work from home security. ... The importance of data resilience in the current cybersecurity climate ... PagerDuty was born from the idea that software development and operations could ...
8;2020-07-30;FSE - Blog Archives - V2Solutions;Software Development | Software Testing |Full Stack Engineering | Web and Mobile ... With the sudden shift in culture, work-from-home patterns are forming as ...;https://www.v2solutions.com/resources/category/full-stack-engineering-blog/;https;www.v2solutions.com;/resources/category/full-stack-engineering-blog/;;;v2solutions;192.124.249.156;geolocation;{};US;United States;California;Menifee;-117.1891098022461;33.65753173828125;192.124.249.156;FSE - Blog Archives - V2Solutions;Software Development | Software Testing |Full Stack Engineering | Web and Mobile ... With the sudden shift in culture, work-from-home patterns are forming as ...
9;2020-07-30;Yoda Technologies - Office 365 Subject Matter Expert ...;Jul 31, 2020 — May work from home. Apply. Insights. Follow-up ... Lendingkart - Software Development Engineer III - Java/C++ Programming. 6 - 12 Years ...;https://www.hirist.com/j/yoda-technologies-office-365-subject-matter-expertarchitect-azureadfs-4-6-yrs-623353.html?ref=rl&pref=rl;https;www.hirist.com;/j/yoda-technologies-office-365-subject-matter-expertarchitect-azureadfs-4-6-yrs-623353.html;ref=rl&pref=rl;;hirist;3.7.36.164;geolocation;{};IN;India;Maharashtra;Powai;72.87770080566406;19.076000213623047;3.7.36.164;Yoda Technologies - Office 365 Subject Matter Expert ...;Jul 31, 2020 — May work from home. Apply. Insights. Follow-up ... Lendingkart - Software Development Engineer III - Java/C++ Programming. 6 - 12 Years ...
10;2020-07-30;canada - AMD.com;software development expertise and GPU-accelerated high-performance compute. (HPC) applications ... Remote learning, virtual meetups, work-from-home, video calls with loved ones, streaming ... We appreciate the shared resilience.;https://www.amd.com/system/files/documents/cr2020-canada.pdf;https;www.amd.com;/system/files/documents/cr2020-canada.pdf;;;amd;184.84.227.23;geolocation;{};US;United States;Illinois;Chicago;-87.67124938964844;41.84885025024414;184.84.227.23;canada - AMD.com;software development expertise and GPU-accelerated high-performance compute. (HPC) applications ... Remote learning, virtual meetups, work-from-home, video calls with loved ones, streaming ... We appreciate the shared resilience.
11;2020-07-30;Free online cybersecurity classes, with certificates;A work-from-home reimbursement policy for network tech. A work-from-home reimbursement plan should drive better network and internet connectivity rates for ...;https://searchsecurity.techtarget.com/feature/Security-School-Course-Catalog-from-SearchSecuritycom;https;searchsecurity.techtarget.com;/feature/Security-School-Course-Catalog-from-SearchSecuritycom;;;techtarget;206.19.49.153;geolocation;{};US;United States;Louisiana;Reddell;-92.42642211914062;30.675010681152344;206.19.49.153;Free online cybersecurity classes, with certificates;A work-from-home reimbursement policy for network tech. A work-from-home reimbursement plan should drive better network and internet connectivity rates for ...
12;2020-07-30;Free online cybersecurity classes, with certificates;A work-from-home reimbursement policy for network tech. A work-from-home reimbursement plan should drive better network and internet connectivity rates for ...;https://searchsecurity.techtarget.com/feature/Security-School-Course-Catalog-from-SearchSecuritycom;https;searchsecurity.techtarget.com;/feature/Security-School-Course-Catalog-from-SearchSecuritycom;;;techtarget;206.19.49.153;geolocation;{};US;United States;Louisiana;Reddell;-92.42642211914062;30.675010681152344;206.19.49.153;Free online cybersecurity classes, with certificates;A work-from-home reimbursement policy for network tech. A work-from-home reimbursement plan should drive better network and internet connectivity rates for ...
13;2020-07-30;Free online cybersecurity classes, with certificates;A work-from-home reimbursement policy for network tech. A work-from-home reimbursement plan should drive better network and internet connectivity rates for ...;https://searchsecurity.techtarget.com/feature/Security-School-Course-Catalog-from-SearchSecuritycom;https;searchsecurity.techtarget.com;/feature/Security-School-Course-Catalog-from-SearchSecuritycom;;;techtarget;206.19.49.153;geolocation;{};US;United States;Louisiana;Reddell;-92.42642211914062;30.675010681152344;206.19.49.153;Free online cybersecurity classes, with certificates;A work-from-home reimbursement policy for network tech. A work-from-home reimbursement plan should drive better network and internet connectivity rates for ...
14;2020-07-30;Browsers to Enforce Shorter Certificate Life Spans: ...;Jul 30, 2020 — ... on secure software development, securing our data on their servers, ... a result of remote working to how enterprise security strategy will be ...;https://www.darkreading.com/cloud/browsers-to-enforce-shorter-certificate-life-spans-what-businesses-should-know/d/d-id/1338507;https;www.darkreading.com;/cloud/browsers-to-enforce-shorter-certificate-life-spans-what-businesses-should-know/d/d-id/1338507;;;darkreading;104.17.121.99;geolocation;{};US;United States;California;San Jose;-121.83822631835938;37.330528259277344;104.17.121.99;Browsers to Enforce Shorter Certificate Life Spans: ...;Jul 30, 2020 — ... on secure software development, securing our data on their servers, ... a result of remote working to how enterprise security strategy will be ...
15;2020-07-30;English Instructor at Juni Learning - DailyRemote;Have a great attitude and desire to help kids build resilience and grit alongside their reading and writing skills. Are passionate about and dedicated to clarity and ...;https://dailyremote.com/remote-job/english-instructor-75247;https;dailyremote.com;/remote-job/english-instructor-75247;;;dailyremote;104.27.186.8;geolocation;{};US;United States;California;San Jose;-121.83822631835938;37.330528259277344;104.27.186.8;English Instructor at Juni Learning - DailyRemote;Have a great attitude and desire to help kids build resilience and grit alongside their reading and writing skills. Are passionate about and dedicated to clarity and ...
16;2020-07-30;July 2020 – ICube Media;Jul 31, 2020 — “It was a disaster,” Mia said after recounting her workday. ... virtual model in which some employees are on premises, while others work from home. ... CEO Marissa Mayer ended that company's remote-working experiment in 2013, ... services, IT, and software development, and under specific circumstances.;https://icubem.com/2020/07/;https;icubem.com;/2020/07/;;;icubem;43.255.154.47;geolocation;{};SG;Singapore;;Singapore;103.8198013305664;1.3200000524520874;43.255.154.47;July 2020 – ICube Media;Jul 31, 2020 — “It was a disaster,” Mia said after recounting her workday. ... virtual model in which some employees are on premises, while others work from home. ... CEO Marissa Mayer ended that company's remote-working experiment in 2013, ... services, IT, and software development, and under specific circumstances.
17;2020-07-30;Structural Grid Specialist job in Chicago at Ocado Group | Lensa;Jul 31, 2020 — Insurance / Disaster Restoration: Mitigation Manager or Asst. Manager ... Work from Home Independent Insurance Agent - 110K+ First Year!;https://lensa.com/structural-grid-specialist-jobs/chicago/jd/8b02b9e314490223fa172ea48fe0f5c8;https;lensa.com;/structural-grid-specialist-jobs/chicago/jd/8b02b9e314490223fa172ea48fe0f5c8;;;lensa;52.54.1.120;geolocation;{};US;United States;Virginia;Ashburn;-77.47419738769531;39.043701171875;52.54.1.120;Structural Grid Specialist job in Chicago at Ocado Group | Lensa;Jul 31, 2020 — Insurance / Disaster Restoration: Mitigation Manager or Asst. Manager ... Work from Home Independent Insurance Agent - 110K+ First Year!
18;2020-07-30;Structural Grid Specialist job in Chicago at Ocado Group | Lensa;Jul 31, 2020 — Insurance / Disaster Restoration: Mitigation Manager or Asst. Manager ... Work from Home Independent Insurance Agent - 110K+ First Year!;https://lensa.com/structural-grid-specialist-jobs/chicago/jd/8b02b9e314490223fa172ea48fe0f5c8;https;lensa.com;/structural-grid-specialist-jobs/chicago/jd/8b02b9e314490223fa172ea48fe0f5c8;;;lensa;52.54.1.120;geolocation;{};US;United States;Virginia;Ashburn;-77.47419738769531;39.043701171875;52.54.1.120;Structural Grid Specialist job in Chicago at Ocado Group | Lensa;Jul 31, 2020 — Insurance / Disaster Restoration: Mitigation Manager or Asst. Manager ... Work from Home Independent Insurance Agent - 110K+ First Year!
19;2020-07-30;Senior Social Network Analyst job in Reston at Invictus ...;Jul 31, 2020 — Due to COVID-19 this will be a work from home position for the foreseeable future. The mission lifecycle of DHA is to deploy the largest global ...;https://lensa.com/senior-social-network-analyst-jobs/reston/jd/3a8617ab380f4da5c2674415ea5b4928;https;lensa.com;/senior-social-network-analyst-jobs/reston/jd/3a8617ab380f4da5c2674415ea5b4928;;;lensa;52.54.1.120;geolocation;{};US;United States;Virginia;Ashburn;-77.47419738769531;39.043701171875;52.54.1.120;Senior Social Network Analyst job in Reston at Invictus ...;Jul 31, 2020 — Due to COVID-19 this will be a work from home position for the foreseeable future. The mission lifecycle of DHA is to deploy the largest global ...
20;2020-07-30;Senior Social Network Analyst job in Reston at Invictus ...;Jul 31, 2020 — Due to COVID-19 this will be a work from home position for the foreseeable future. The mission lifecycle of DHA is to deploy the largest global ...;https://lensa.com/senior-social-network-analyst-jobs/reston/jd/3a8617ab380f4da5c2674415ea5b4928;https;lensa.com;/senior-social-network-analyst-jobs/reston/jd/3a8617ab380f4da5c2674415ea5b4928;;;lensa;52.54.1.120;geolocation;{};US;United States;Virginia;Ashburn;-77.47419738769531;39.043701171875;52.54.1.120;Senior Social Network Analyst job in Reston at Invictus ...;Jul 31, 2020 — Due to COVID-19 this will be a work from home position for the foreseeable future. The mission lifecycle of DHA is to deploy the largest global ...
21;2020-07-30;1,000+ Java Developer jobs in London, England Metropolitan ...;Jul 31, 2020 — Java Developer - Remote working ... However, the CTO is looking for Software Engineers who have the in-depth back-end engineering ...;https://www.linkedin.com/jobs/java-developer-jobs-london?trk=public_profile_jserp;https;www.linkedin.com;/jobs/java-developer-jobs-london;trk=public_profile_jserp;;linkedin;13.107.43.14;geolocation;{};US;United States;Washington;Cottage Lake;-122.12094116210938;47.68050003051758;13.107.43.14;1,000+ Java Developer jobs in London, England Metropolitan ...;Jul 31, 2020 — Java Developer - Remote working ... However, the CTO is looking for Software Engineers who have the in-depth back-end engineering ...
22;2020-07-30;KishMan Solutions;Online presence. Your 24x7 store. No closing hours. World will know about your business. We offer a guarantee of the integrity of a software ...;https://www.kishman.org/;https;www.kishman.org;/;;;kishman;95.216.244.57;geolocation;{};FI;Finland;Uusimaa;Tuusula;25.011320114135742;60.42641830444336;95.216.244.57;KishMan Solutions;Online presence. Your 24x7 store. No closing hours. World will know about your business. We offer a guarantee of the integrity of a software ...
23;2020-07-30;Association of South Essex Local Authorities - Basildon Council;Jul 30, 2020 — work from home and are experiencing significant financial hardship. With micro ... reserves may reduce resilience and lead to high rates of failure, once central government support is ... in software development. 6.17 The full ...;https://www.basildon.gov.uk/media/10209/Association-of-South-Essex-Local-Authorities-Growth-and-Recovery-Prospectus-2020/pdf/Association_of_South_Essex_Local_Authorities_-_Growth_and_Recovery_Prospectus_2020.pdf?m=637322452673570000;https;www.basildon.gov.uk;/media/10209/Association-of-South-Essex-Local-Authorities-Growth-and-Recovery-Prospectus-2020/pdf/Association_of_South_Essex_Local_Authorities_-_Growth_and_Recovery_Prospectus_2020.pdf;m=637322452673570000;;gov;3.11.64.106;geolocation;{};GB;United Kingdom;England;Blackheath;-0.12620000541210175;51.50019836425781;3.11.64.106;Association of South Essex Local Authorities - Basildon Council;Jul 30, 2020 — work from home and are experiencing significant financial hardship. With micro ... reserves may reduce resilience and lead to high rates of failure, once central government support is ... in software development. 6.17 The full ...
24;2020-07-30;Download - North East Times;and the resilience to cope with future income or expenditure ... “building resilience, saving for the future, planning ahead and ... distancing, remote working and video calls. The ... skilled job roles including data analysts, software engineers and.;https://netimesmagazine.co.uk/wp-content/uploads/2020/07/NET-July-August-2020.pdf;https;netimesmagazine.co.uk;/wp-content/uploads/2020/07/NET-July-August-2020.pdf;;;co;5.153.250.216;geolocation;{};GB;United Kingdom;England;Godalming;-0.5680000185966492;51.11199951171875;5.153.250.216;Download - North East Times;and the resilience to cope with future income or expenditure ... “building resilience, saving for the future, planning ahead and ... distancing, remote working and video calls. The ... skilled job roles including data analysts, software engineers and.
25;2020-07-30;Visibility key to resilient supply chain amid COVID-19;Jul 30, 2020 — Visibility is key to successful automation and achieving resilience. ... trend of big brands flocking to South Africa for software development, ... many businesses have had to embrace remote working as business as usual. ... Juniper Networks has launched new solutions to enhance work from home security.;https://remoteworkertech.asia/story/visibility-key-to-resilient-supply-chain-amid-covid-19;https;remoteworkertech.asia;/story/visibility-key-to-resilient-supply-chain-amid-covid-19;;;remoteworkertech;113.21.226.180;geolocation;{};NZ;New Zealand;Auckland;Auckland;174.6802978515625;-36.78810119628906;113.21.226.180;Visibility key to resilient supply chain amid COVID-19;Jul 30, 2020 — Visibility is key to successful automation and achieving resilience. ... trend of big brands flocking to South Africa for software development, ... many businesses have had to embrace remote working as business as usual. ... Juniper Networks has launched new solutions to enhance work from home security.
26;2020-07-30;Visibility key to resilient supply chain amid COVID-19;Jul 30, 2020 — Visibility is key to successful automation and achieving resilience. ... trend of big brands flocking to South Africa for software development, ... many businesses have had to embrace remote working as business as usual. ... Juniper Networks has launched new solutions to enhance work from home security.;https://remoteworkertech.asia/story/visibility-key-to-resilient-supply-chain-amid-covid-19;https;remoteworkertech.asia;/story/visibility-key-to-resilient-supply-chain-amid-covid-19;;;remoteworkertech;113.21.226.180;geolocation;{};NZ;New Zealand;Auckland;Auckland;174.6802978515625;-36.78810119628906;113.21.226.180;Visibility key to resilient supply chain amid COVID-19;Jul 30, 2020 — Visibility is key to successful automation and achieving resilience. ... trend of big brands flocking to South Africa for software development, ... many businesses have had to embrace remote working as business as usual. ... Juniper Networks has launched new solutions to enhance work from home security.
27;2020-07-30;Visibility key to resilient supply chain amid COVID-19;Jul 30, 2020 — Visibility is key to successful automation and achieving resilience. ... trend of big brands flocking to South Africa for software development, ... many businesses have had to embrace remote working as business as usual. ... Juniper Networks has launched new solutions to enhance work from home security.;https://remoteworkertech.asia/story/visibility-key-to-resilient-supply-chain-amid-covid-19;https;remoteworkertech.asia;/story/visibility-key-to-resilient-supply-chain-amid-covid-19;;;remoteworkertech;113.21.226.180;geolocation;{};NZ;New Zealand;Auckland;Auckland;174.6802978515625;-36.78810119628906;113.21.226.180;Visibility key to resilient supply chain amid COVID-19;Jul 30, 2020 — Visibility is key to successful automation and achieving resilience. ... trend of big brands flocking to South Africa for software development, ... many businesses have had to embrace remote working as business as usual. ... Juniper Networks has launched new solutions to enhance work from home security.
28;2020-07-30;ABS-2020 Instructions - Census.gov - Census Bureau;This question asks if this business offered a work-from-home arrangement, such as ... efficacy, resource efficiency, reliability and resilience, affordability, ... Software development and database activities: in-house development and purchase of ...;https://www2.census.gov/programs-surveys/abs/information/ABS-2020-Instructions.pdf;https;www2.census.gov;/programs-surveys/abs/information/ABS-2020-Instructions.pdf;;;census;23.7.111.38;geolocation;{};US;United States;California;San Jose;-121.83822631835938;37.330528259277344;23.7.111.38;ABS-2020 Instructions - Census.gov - Census Bureau;This question asks if this business offered a work-from-home arrangement, such as ... efficacy, resource efficiency, reliability and resilience, affordability, ... Software development and database activities: in-house development and purchase of ...
