;date;header;summary;link;protocol;domain;path;query;fragment;host_name;ip_address;CountryCode;CountryName;State;City;Longitude;Latitude;Asn;edges;Type;AdditionalData;IpAddress;header_context_true;summary_context_true
0;2020-12-21;Top 10 remote working stories of 2020 - Computer Weekly;Dec 22, 2020 — 4. Productivity shrinks, but office and remote workers optimistic about new normal. Despite the bleak times caused by Covid-19, study finds a ...;https://www.computerweekly.com/news/252493166/Top-10-remote-working-stories-of-2020;https;www.computerweekly.com;/news/252493166/Top-10-remote-working-stories-of-2020;;;computerweekly.com;206.19.49.153;US;United States;Louisiana;Reddell;-92.42642211914062;30.675010681152344;7018.0;set();geolocation;{};206.19.49.153;Top 10 remote working stories of 2020 - Computer Weekly;Dec 22, 2020 — 4. Productivity shrinks, but office and remote workers optimistic about new normal. Despite the bleak times caused by Covid-19, study finds a ...
1;2020-12-21;Episode 33: From intern to CEO with agile testing expert Alex ...;Dec 22, 2020 — Alex: [00:03:01] Yeah, much like software development itself. ... I like to talk about resilience because that means that it's something you can practice. ... We have been able to learn from it, like remote working works.;https://www.software-engineering-unlocked.com/intern-ceo-agile-testing/;https;www.software-engineering-unlocked.com;/intern-ceo-agile-testing/;;;software-engineering-unlocked.com;134.209.193.61;US;United States;California;San Jose;-121.83822631835938;37.330528259277344;14061.0;set();geolocation;{};134.209.193.61;Episode 33: From intern to CEO with agile testing expert Alex ...;Dec 22, 2020 — Alex: [00:03:01] Yeah, much like software development itself. ... I like to talk about resilience because that means that it's something you can practice. ... We have been able to learn from it, like remote working works.
2;2020-12-21;Devops Engineer at GNS Healthcare - DailyRemote;"Back to Remote Software Development Jobs ... and security policies for system and network users; Contribute to business continuity and disaster recovery efforts ...";https://dailyremote.com/remote-job/devops-engineer-223526;https;dailyremote.com;/remote-job/devops-engineer-223526;;;dailyremote.com;172.67.136.141;US;United States;California;San Francisco;-122.39286041259766;37.76784896850586;13335.0;set();geolocation;{};172.67.136.141;Devops Engineer at GNS Healthcare - DailyRemote;"Back to Remote Software Development Jobs ... and security policies for system and network users; Contribute to business continuity and disaster recovery efforts ..."
3;2020-12-21;Cyber Security Awareness Training | ECS Biztech Ltd.;... compromises—including financial, intellectual property, customer trust and other major data losses—and increases businesses' resilience against attacks.;https://www.ecsbiztech.com/cyber-security-awareness-training/;https;www.ecsbiztech.com;/cyber-security-awareness-training/;;;ecsbiztech.com;103.27.120.39;IN;India;Gujarat;Sarkhej;72.51640319824219;23.036699295043945;132911.0;set();geolocation;{};103.27.120.39;Cyber Security Awareness Training | ECS Biztech Ltd.;... compromises—including financial, intellectual property, customer trust and other major data losses—and increases businesses' resilience against attacks.
4;2020-12-21;Microsoft Operations Program Manager Salaries | Glassdoor;Dec 22, 2020 — Work From Home (8 comments) ... of: Bellevue Bravern Entrance Microsoft photo of: Our software development centers are located all over the ...;https://www.glassdoor.sg/Salary/Microsoft-Operations-Program-Manager-Salaries-E1651_D_KO10,36.htm;https;www.glassdoor.sg;/Salary/Microsoft-Operations-Program-Manager-Salaries-E1651_D_KO10,36.htm;;;glassdoor.sg;104.16.95.86;US;United States;Virginia;Ashburn;-77.47419738769531;39.043701171875;13335.0;set();geolocation;{};104.16.95.86;Microsoft Operations Program Manager Salaries | Glassdoor;Dec 22, 2020 — Work From Home (8 comments) ... of: Bellevue Bravern Entrance Microsoft photo of: Our software development centers are located all over the ...
5;2020-12-21;UK international trade department unveils fintech match ...;Dec 22, 2020 — ... Building the right systems for remote working webinar on demand · Content ... How has the pandemic affected your country's resilience webinar on ... is now the preferred method for most software development and digital ...;https://www.globalgovernmentforum.com/uk-international-trade-department-unveils-fintech-match-making-initiative/;https;www.globalgovernmentforum.com;/uk-international-trade-department-unveils-fintech-match-making-initiative/;;;globalgovernmentforum.com;104.26.10.50;US;United States;California;San Jose;-121.83822631835938;37.330528259277344;13335.0;set();geolocation;{};104.26.10.50;UK international trade department unveils fintech match ...;Dec 22, 2020 — ... Building the right systems for remote working webinar on demand · Content ... How has the pandemic affected your country's resilience webinar on ... is now the preferred method for most software development and digital ...
6;2020-12-21;The ultimate guide to shopping safely online | E2E;Dec 21, 2020 — But what IT equipment and software do you need to work from home successfully?… 26th Oct 2020 by Ian Johnson. How to successfully manage ...;https://e2etechnologies.co.uk/blog/the-ultimate-guide-to-shopping-safely-online/;https;e2etechnologies.co.uk;/blog/the-ultimate-guide-to-shopping-safely-online/;;;e2etechnologies.co.uk;20.58.112.177;GB;United Kingdom;Wales;Cardiff;-3.1813900470733643;51.49443817138672;8075.0;set();geolocation;{};20.58.112.177;The ultimate guide to shopping safely online | E2E;Dec 21, 2020 — But what IT equipment and software do you need to work from home successfully?… 26th Oct 2020 by Ian Johnson. How to successfully manage ...
7;2020-12-21;Project Team Collaboration Archives - StartupHub;... or identify three highly skilled programmers for a software development task. ... a professional world, where a lack of collaboration sometimes leads to disaster.;https://startuphub.in/tag/project-team-collaboration/;https;startuphub.in;/tag/project-team-collaboration/;;;startuphub.in;159.65.145.82;IN;India;Karnataka;Bengaluru;77.59459686279297;12.971599578857422;14061.0;set();geolocation;{};159.65.145.82;Project Team Collaboration Archives - StartupHub;... or identify three highly skilled programmers for a software development task. ... a professional world, where a lack of collaboration sometimes leads to disaster.
8;2020-12-21;Paragon ID is now very well positioned for a return to future ...;Dec 22, 2020 — Application Software Development Centre. • Corporate ... Paragon Group has demonstrated outstanding resilience during a difficult period, with our ... Many governments have asked people to work from home where possible, to ... Creative Services, Workplace Solutions, Disaster Recovery. (via our CMCS ...;https://www.paragon-europe.com/sites/www.paragon-europe.com/files/paragon_2020_annualreport.pdf;https;www.paragon-europe.com;/sites/www.paragon-europe.com/files/paragon_2020_annualreport.pdf;;;paragon-europe.com;79.174.171.84;GB;United Kingdom;England;Rochford;0.7770000100135803;51.61000061035156;59565.0;set();geolocation;{};79.174.171.84;Paragon ID is now very well positioned for a return to future ...;Dec 22, 2020 — Application Software Development Centre. • Corporate ... Paragon Group has demonstrated outstanding resilience during a difficult period, with our ... Many governments have asked people to work from home where possible, to ... Creative Services, Workplace Solutions, Disaster Recovery. (via our CMCS ...
9;2020-12-21;Re-imagining Diffusion and Adoption of ... - IIM Trichy;Dec 21, 2020 — Volume two includes: • Information Technology and Disaster Management ... Pandemic Pandemonium and Remote Working: An Investigation ... existence, e.g., software development, which can be executed in many ways. 5 Example ... Keywords: Work from home 4 Artificial Intelligence 4 Indian IT industry.;https://www.iimtrichy.ac.in/sites/default/files/upload/21Dec2020193040_20201221192849IFIPConferenceProceddingsVol1.pdf;https;www.iimtrichy.ac.in;/sites/default/files/upload/21Dec2020193040_20201221192849IFIPConferenceProceddingsVol1.pdf;;;iimtrichy.ac.in;109.73.164.243;IN;India;Maharashtra;Powai;72.87770080566406;19.076000213623047;33182.0;set();geolocation;{};109.73.164.243;Re-imagining Diffusion and Adoption of ... - IIM Trichy;Dec 21, 2020 — Volume two includes: • Information Technology and Disaster Management ... Pandemic Pandemonium and Remote Working: An Investigation ... existence, e.g., software development, which can be executed in many ways. 5 Example ... Keywords: Work from home 4 Artificial Intelligence 4 Indian IT industry.
10;2020-12-21;Linux Administrator Jobs in Mumbai (Mar 2021) - Salary ...;Supervise daily backup status and knowledge of management tools. Skills : Disaster Recovery , · Library Management , Veritas Netbackup ...;https://www.monsterindia.com/search/linux-administrator-jobs-in-mumbai;https;www.monsterindia.com;/search/linux-administrator-jobs-in-mumbai;;;monsterindia.com;23.33.169.182;US;United States;Illinois;Chicago;-87.67124938964844;41.84885025024414;16625.0;set();geolocation;{};23.33.169.182;Linux Administrator Jobs in Mumbai (Mar 2021) - Salary ...;Supervise daily backup status and knowledge of management tools. Skills : Disaster Recovery , · Library Management , Veritas Netbackup ...
11;2020-12-21;Hunter Technology Signs Purchase Agreement | IT Business Net;Dec 22, 2020 — ... Digital Signage (1), Digital Transformation (2), Digital Twin (1), Disaster Recovery (1) ... Remote Working (10), Repair (1), Research (4), Resilience ... SMS (1), Social Media (7), Software (9), Software Development (3), South ...;http://www.itbusinessnet.com/2020/12/hunter-technology-signs-purchase-agreement/;http;www.itbusinessnet.com;/2020/12/hunter-technology-signs-purchase-agreement/;;;itbusinessnet.com;34.125.142.181;US;United States;Nevada;Spring Valley;-115.224853515625;36.142398834228516;15169.0;set();geolocation;{};34.125.142.181;Hunter Technology Signs Purchase Agreement | IT Business Net;Dec 22, 2020 — ... Digital Signage (1), Digital Transformation (2), Digital Twin (1), Disaster Recovery (1) ... Remote Working (10), Repair (1), Research (4), Resilience ... SMS (1), Social Media (7), Software (9), Software Development (3), South ...
12;2020-12-21;Cybersecurity Attacks in 2020: How Bad Did It Get? - BIZTEK;Dec 21, 2020 — Having employees work from home doesn't undermine a company's security systems – being unprepared for a sudden increase in WFH ...;https://biztek.org/cybersecurity-attacks-in-2020-how-bad-did-it-get/;https;biztek.org;/cybersecurity-attacks-in-2020-how-bad-did-it-get/;;;biztek.org;192.81.170.5;CA;Canada;Ontario;Toronto;-79.4426498413086;43.773109436035156;53479.0;set();geolocation;{};192.81.170.5;Cybersecurity Attacks in 2020: How Bad Did It Get? - BIZTEK;Dec 21, 2020 — Having employees work from home doesn't undermine a company's security systems – being unprepared for a sudden increase in WFH ...
13;2020-12-21;Kettering General Hospital's Chief Nursing Information Officer ...;Dec 22, 2020 — ... Digital Transformation, Disaster Recovery and Business Continuity ... R&D, Rapid App Development, Recruitment, Remote Working, Research, Retail ... Software Development, Software News, Space, Speech Recognition ...;https://uktechnews.co.uk/2020/12/22/kettering-general-hospitals-chief-nursing-information-officer-named-as-digital-leader-of-the-year-in-women-in-tech-excellence-awards-2020/;https;uktechnews.co.uk;/2020/12/22/kettering-general-hospitals-chief-nursing-information-officer-named-as-digital-leader-of-the-year-in-women-in-tech-excellence-awards-2020/;;;uktechnews.co.uk;172.67.159.16;US;United States;California;San Francisco;-122.39286041259766;37.76784896850586;13335.0;set();geolocation;{};172.67.159.16;Kettering General Hospital's Chief Nursing Information Officer ...;Dec 22, 2020 — ... Digital Transformation, Disaster Recovery and Business Continuity ... R&D, Rapid App Development, Recruitment, Remote Working, Research, Retail ... Software Development, Software News, Space, Speech Recognition ...
14;2020-12-21;Multitutor - Connecting The Student To The Right Tutor;Since online education can be perceived as work from home a tutor will not have ... Disaster Management And Mitigation, Disco, Discrete Fourier Transforms And ... Software Development Techniques For Engineering And Scientists, Software ...;https://multitutor.in/;https;multitutor.in;/;;;multitutor.in;104.21.14.127;US;United States;California;San Jose;-121.83822631835938;37.330528259277344;13335.0;set();geolocation;{};104.21.14.127;Multitutor - Connecting The Student To The Right Tutor;Since online education can be perceived as work from home a tutor will not have ... Disaster Management And Mitigation, Disco, Discrete Fourier Transforms And ... Software Development Techniques For Engineering And Scientists, Software ...
15;2020-12-21;Training & Security Leadership - healthcare information security;How Network Managers Can Gain Visibility & Secure 'Work From Home' Traffic. • November 25, 2020. This webinar with Osterman Research offers insights into ...;https://www.healthcareinfosecurity.com/training-security-leadership-c-488;https;www.healthcareinfosecurity.com;/training-security-leadership-c-488;;;healthcareinfosecurity.com;50.56.167.254;US;United States;Texas;Dallas;-96.8142318725586;32.8054313659668;33070.0;set();geolocation;{};50.56.167.254;Training & Security Leadership - healthcare information security;How Network Managers Can Gain Visibility & Secure 'Work From Home' Traffic. • November 25, 2020. This webinar with Osterman Research offers insights into ...
16;2020-12-21;Cisco Job Circular - SRE Devops Engineer - Lerip;"Design and develop improvements, focused on resilience, to Cisco's production ... and maintaining SRE technologies; Agile software development practices ...";https://www.lerip.com/uk/job/sre-devops-engineer-cisco-feltham/;https;www.lerip.com;/uk/job/sre-devops-engineer-cisco-feltham/;;;lerip.com;68.66.248.49;US;United States;Michigan;Ann Arbor;-83.74549865722656;42.283599853515625;55293.0;set();geolocation;{};68.66.248.49;Cisco Job Circular - SRE Devops Engineer - Lerip;"Design and develop improvements, focused on resilience, to Cisco's production ... and maintaining SRE technologies; Agile software development practices ..."
17;2020-12-21;Expert Commentary: An Analytics and Behavior-Centric ... - CIOL;Dec 22, 2020 — ... RealityAugmenting software developmentAujasAurionproAustralian Military ... DataDineoutDisaster RecoveryDisneydisplayDisruptorsDmartDo Your ... in TechWomen's Daywork from homeWorkforceWorkforce ...;https://www.ciol.com/expert-commentary-analytics-behavior-centric-approach-digital-payment-security-rbi/;https;www.ciol.com;/expert-commentary-analytics-behavior-centric-approach-digital-payment-security-rbi/;;;ciol.com;192.124.249.158;US;United States;California;Menifee;-117.1891098022461;33.65753173828125;30148.0;set();geolocation;{};192.124.249.158;Expert Commentary: An Analytics and Behavior-Centric ... - CIOL;Dec 22, 2020 — ... RealityAugmenting software developmentAujasAurionproAustralian Military ... DataDineoutDisaster RecoveryDisneydisplayDisruptorsDmartDo Your ... in TechWomen's Daywork from homeWorkforceWorkforce ...
18;2020-12-21;NEWLINK TECHNOLOGY INC. - HKEXnews;Dec 21, 2020 — revenue generated from our software development services over time, using ... Establish remote working environment and daily management process, ... Under our telecommuting work arrangement, our technical staff work from home using ... occurrence of business disruption, litigation or natural disaster, ...;https://www1.hkexnews.hk/listedco/listconews/sehk/2020/1221/2020122100005.pdf;https;www1.hkexnews.hk;/listedco/listconews/sehk/2020/1221/2020122100005.pdf;;;hkexnews.hk;184.30.42.167;US;United States;Illinois;Mount Prospect;-87.92555236816406;42.06269073486328;20940.0;set();geolocation;{};184.30.42.167;NEWLINK TECHNOLOGY INC. - HKEXnews;Dec 21, 2020 — revenue generated from our software development services over time, using ... Establish remote working environment and daily management process, ... Under our telecommuting work arrangement, our technical staff work from home using ... occurrence of business disruption, litigation or natural disaster, ...
19;2020-12-21;NEWLINK TECHNOLOGY INC. - 經濟通;Dec 21, 2020 — revenue generated from our software development services over time, using ... Establish remote working environment and daily management process, ... Under our telecommuting work arrangement, our technical staff work from home using ... occurrence of business disruption, litigation or natural disaster, ...;http://corpsv.etnet.com.hk/data/documents/ipo/20201221/HKEX-EPS_20201221_9554097_0.PDF;http;corpsv.etnet.com.hk;/data/documents/ipo/20201221/HKEX-EPS_20201221_9554097_0.PDF;;;etnet.com.hk;202.62.220.50;HK;Hong Kong SAR China;Tsuen Wan;Tsuen Wan;114.1094970703125;22.396400451660156;9906.0;set();geolocation;{};202.62.220.50;NEWLINK TECHNOLOGY INC. - 經濟通;Dec 21, 2020 — revenue generated from our software development services over time, using ... Establish remote working environment and daily management process, ... Under our telecommuting work arrangement, our technical staff work from home using ... occurrence of business disruption, litigation or natural disaster, ...
20;2020-12-21;Doctorpedia launches £1M funding round on Crowdcube ...;Dec 22, 2020 — ... Digital Skills, Digital Transformation, Disaster Recovery and Business Continuity ... Flexible Work & Work from Home, Flexible working, Food & Drink, Food and ... Redundancy, Regional Business Leadership, Remote Working ... Software Development, Software News, South East England News, South ...;https://smebusinessnews.co.uk/2020/12/22/doctorpedia-launches-1m-funding-round-on-crowdcube/;https;smebusinessnews.co.uk;/2020/12/22/doctorpedia-launches-1m-funding-round-on-crowdcube/;;;smebusinessnews.co.uk;81.19.215.15;GB;United Kingdom;England;Stroud;-2.2320001125335693;51.76300048828125;25369.0;set();geolocation;{};81.19.215.15;Doctorpedia launches £1M funding round on Crowdcube ...;Dec 22, 2020 — ... Digital Skills, Digital Transformation, Disaster Recovery and Business Continuity ... Flexible Work & Work from Home, Flexible working, Food & Drink, Food and ... Redundancy, Regional Business Leadership, Remote Working ... Software Development, Software News, South East England News, South ...
21;2020-12-21;Delta one java developer full stack engineer job offer - jocancy;Work life balance is also important and colleagues can choose to work from home one day or potentially more per week if that is what works best for them.;https://jocancy.com/New-York/newyork/etc/delta-one-java-developer-full-stack-engineer-7266420.html;https;jocancy.com;/New-York/newyork/etc/delta-one-java-developer-full-stack-engineer-7266420.html;;;jocancy.com;91.214.64.188;US;United States;California;Los Angeles;-118.26486206054688;34.05284881591797;35913.0;set();geolocation;{};91.214.64.188;Delta one java developer full stack engineer job offer - jocancy;Work life balance is also important and colleagues can choose to work from home one day or potentially more per week if that is what works best for them.
22;2020-12-21;Download Main Trends & Challenges in the Space Sector;Dec 21, 2020 — resilience to the COVID-19 crisis of the various domains in the space sector. Emerging Space Nations. March 2020. Provides an understanding ...;https://www.pwc.fr/fr/assets/files/pdf/2020/12/en-france-pwc-main-trends-and-challenges-in-the-space-sector.pdf;https;www.pwc.fr;/fr/assets/files/pdf/2020/12/en-france-pwc-main-trends-and-challenges-in-the-space-sector.pdf;;;pwc.fr;23.7.113.56;US;United States;Illinois;Prospect Heights;-87.92555236816406;42.06269073486328;16625.0;set();geolocation;{};23.7.113.56;Download Main Trends & Challenges in the Space Sector;Dec 21, 2020 — resilience to the COVID-19 crisis of the various domains in the space sector. Emerging Space Nations. March 2020. Provides an understanding ...
23;2020-12-21;it networking jobs salary - Casadevidrio;Dec 22, 2020 — Develops disaster recovery and resumption plans for the critical ... Salary 1200000 Work type Full Time, Work from Home Statute Permanent. ... Networking jobs like Driving, Management, Software Development and more US ...;https://casadevidrio.in/ns0eu0/61ad72-it-networking-jobs-salary;https;casadevidrio.in;/ns0eu0/61ad72-it-networking-jobs-salary;;;casadevidrio.in;162.144.12.13;US;United States;Utah;Provo;-111.6124267578125;40.21580123901367;46606.0;set();geolocation;{};162.144.12.13;it networking jobs salary - Casadevidrio;Dec 22, 2020 — Develops disaster recovery and resumption plans for the critical ... Salary 1200000 Work type Full Time, Work from Home Statute Permanent. ... Networking jobs like Driving, Management, Software Development and more US ...
24;2020-12-21;News: 21K Skills collaborates with global talent development ...;Dec 21, 2020 — With a growing alumni base of more than 8,000 professionals, Galvanize graduates more mid to advanced–level software engineers and data ...;https://www.peoplematters.in/news/skilling/21k-skills-collaborates-with-global-talent-development-and-training-leader-galvanize-27956;https;www.peoplematters.in;/news/skilling/21k-skills-collaborates-with-global-talent-development-and-training-leader-galvanize-27956;;;peoplematters.in;167.99.28.98;SG;Singapore;South West;Singapore;103.8198013305664;1.3200000524520874;14061.0;set();geolocation;{};167.99.28.98;News: 21K Skills collaborates with global talent development ...;Dec 21, 2020 — With a growing alumni base of more than 8,000 professionals, Galvanize graduates more mid to advanced–level software engineers and data ...
25;2020-12-21;Our COVID test came back positive - Ladders;Dec 21, 2020 — Came back positive for caring, positive for resilience, positive for love of ... with Ladders' then-crazy idea to work-from-home in case coronavirus ...;https://www.theladders.com/career-advice/our-covid-test-came-back-positive;https;www.theladders.com;/career-advice/our-covid-test-came-back-positive;;;theladders.com;54.239.174.18;US;United States;Illinois;Chicago;-87.67124938964844;41.84885025024414;16509.0;set();geolocation;{};54.239.174.18;Our COVID test came back positive - Ladders;Dec 21, 2020 — Came back positive for caring, positive for resilience, positive for love of ... with Ladders' then-crazy idea to work-from-home in case coronavirus ...
26;2020-12-21;2021 Employee Experience Isn't Just About Workflow ...;Dec 21, 2020 — ... workers say they prefer to work from home even after the pandemic. ... to everything they need for operational efficiency and resilience.;https://www.teaminternational.com/in-2021-employee-experience-will-be-more-critical-than-ever-how-not-to-fail/;https;www.teaminternational.com;/in-2021-employee-experience-will-be-more-critical-than-ever-how-not-to-fail/;;;teaminternational.com;52.185.68.16;US;United States;Iowa;Des Moines;-93.61509704589844;41.5890007019043;8075.0;set();geolocation;{};52.185.68.16;2021 Employee Experience Isn't Just About Workflow ...;Dec 21, 2020 — ... workers say they prefer to work from home even after the pandemic. ... to everything they need for operational efficiency and resilience.
27;2020-12-21;6 Microsoft Word Tips to Boost Productivity - SWK ...;Dec 21, 2020 — Read these 6 tips for boosting productivity in Microsoft Word and discover more tricks to Office 365 with the help of SWK.;https://www.swktech.com/6-microsoft-word-tips-to-boost-productivity/;https;www.swktech.com;/6-microsoft-word-tips-to-boost-productivity/;;;swktech.com;104.198.108.243;US;United States;Oregon;The Dalles;-121.18699645996094;45.55424880981445;15169.0;set();geolocation;{};104.198.108.243;6 Microsoft Word Tips to Boost Productivity - SWK ...;Dec 21, 2020 — Read these 6 tips for boosting productivity in Microsoft Word and discover more tricks to Office 365 with the help of SWK.
28;2020-12-21;Better Together - Breakthrough Technologies;Dec 22, 2020 — In the midst of a global pandemic, we fought to keep our families, friends, businesses and teams intact and we found resilience when we ...;https://www.breaktech.com/post/2020-better-together;https;www.breaktech.com;/post/2020-better-together;;;breaktech.com;185.230.60.161;US;United States;Virginia;Ashburn;-77.47419738769531;39.043701171875;58182.0;set();geolocation;{};185.230.60.161;Better Together - Breakthrough Technologies;Dec 22, 2020 — In the midst of a global pandemic, we fought to keep our families, friends, businesses and teams intact and we found resilience when we ...
29;2020-12-21;Companies shift to give employees sense of balance ...;Dec 22, 2020 — Sarah Simpson, senior manager, software development at Blackbaud, ... BoomTown also has reconsidered its work-from-home polices as it's on track for ... because of the coronavirus and other disaster-related emergencies.;https://charlestonbusiness.com/news/human-resources/79798/;https;charlestonbusiness.com;/news/human-resources/79798/;;;charlestonbusiness.com;52.6.128.250;US;United States;Virginia;Ashburn;-77.47419738769531;39.043701171875;14618.0;set();geolocation;{};52.6.128.250;Companies shift to give employees sense of balance ...;Dec 22, 2020 — Sarah Simpson, senior manager, software development at Blackbaud, ... BoomTown also has reconsidered its work-from-home polices as it's on track for ... because of the coronavirus and other disaster-related emergencies.
