;date;header;summary;link;protocol;domain;path;query;fragment;host_name;ip_address;Type;AdditionalData;CountryCode;CountryName;State;City;Longitude;Latitude;IpAddress;header_context_true;summary_context_true
0;2020-03-12;Are You Ready For Your Employees to Work from Home?;Mar 13, 2020 — Amongst the spread of COVID-19 many companies are preparing for their employees to work from home. However, if you do not have the ...;https://www.sierraexperts.com/are-you-ready-for-your-employees-to-work-from-home;https;www.sierraexperts.com;/are-you-ready-for-your-employees-to-work-from-home;;;sierraexperts;38.107.156.47;geolocation;{};US;United States;Pennsylvania;Pittsburgh;-80.10870361328125;40.435089111328125;38.107.156.47;Are You Ready For Your Employees to Work from Home?;Mar 13, 2020 — Amongst the spread of COVID-19 many companies are preparing for their employees to work from home. However, if you do not have the ...
1;2020-03-12;Cyber Security & Remote Work During Coronavirus - National ...;Mar 13, 2020 — Teleworking,remote working or simply working from home while ... while others may provide for contingencies in disaster recovery plans, BYOD ...;https://www.natlawreview.com/article/coronavirus-covid-19-managing-cyber-security-risks-remote-work;https;www.natlawreview.com;/article/coronavirus-covid-19-managing-cyber-security-risks-remote-work;;;natlawreview;34.203.145.130;geolocation;{};US;United States;Virginia;Ashburn;-77.47419738769531;39.043701171875;34.203.145.130;Cyber Security & Remote Work During Coronavirus - National ...;Mar 13, 2020 — Teleworking,remote working or simply working from home while ... while others may provide for contingencies in disaster recovery plans, BYOD ...
2;2020-03-12;Business Continuity in the Face of a Viral Pandemic – Panzura;Mar 12, 2020 — As the number of people who work from home escalates, the higher the ... So, how can business be disaster ready and capable of keeping up ...;https://panzura.com/blog/business-continuity-face-viral-pandemic/;https;panzura.com;/blog/business-continuity-face-viral-pandemic/;;;panzura;35.184.199.146;geolocation;{};US;United States;Iowa;Council Bluffs;-95.87735748291016;41.23295974731445;35.184.199.146;Business Continuity in the Face of a Viral Pandemic – Panzura;Mar 12, 2020 — As the number of people who work from home escalates, the higher the ... So, how can business be disaster ready and capable of keeping up ...
3;2020-03-12;Virtualizing 9-1-1 in Times of a Coronavirus Pandemic ...;Mar 13, 2020 — ... will enable work-from-home and true geographical diversity in our disaster ... Agile software development relies on iterative releases, and an ...;https://www.rapiddeploy.com/blog-feed/virtualizing-9-1-1-coronavirus-pandemic;https;www.rapiddeploy.com;/blog-feed/virtualizing-9-1-1-coronavirus-pandemic;;;rapiddeploy;104.18.25.70;geolocation;{};US;United States;California;San Jose;-121.83822631835938;37.330528259277344;104.18.25.70;Virtualizing 9-1-1 in Times of a Coronavirus Pandemic ...;Mar 13, 2020 — ... will enable work-from-home and true geographical diversity in our disaster ... Agile software development relies on iterative releases, and an ...
4;2020-03-12;12 security tips for the 'work from home' enterprise ...;Mar 13, 2020 — 12 security tips for the 'work from home' enterprise ... An Apple-centric guide to effective (and productive) remote working · Enterprise resilience: ...;https://www.computerworld.com/article/3532352/12-security-tips-for-the-work-from-home-enterprise.html;https;www.computerworld.com;/article/3532352/12-security-tips-for-the-work-from-home-enterprise.html;;;computerworld;151.101.2.165;geolocation;{};US;United States;California;San Francisco;-122.39286041259766;37.76784896850586;151.101.2.165;12 security tips for the 'work from home' enterprise ...;Mar 13, 2020 — 12 security tips for the 'work from home' enterprise ... An Apple-centric guide to effective (and productive) remote working · Enterprise resilience: ...
5;2020-03-12;12 security tips for the 'work from home' enterprise ...;Mar 13, 2020 — 12 security tips for the 'work from home' enterprise ... An Apple-centric guide to effective (and productive) remote working · Enterprise resilience: ...;https://www.computerworld.com/article/3532352/12-security-tips-for-the-work-from-home-enterprise.html;https;www.computerworld.com;/article/3532352/12-security-tips-for-the-work-from-home-enterprise.html;;;computerworld;151.101.2.165;geolocation;{};US;United States;California;San Francisco;-122.39286041259766;37.76784896850586;151.101.2.165;12 security tips for the 'work from home' enterprise ...;Mar 13, 2020 — 12 security tips for the 'work from home' enterprise ... An Apple-centric guide to effective (and productive) remote working · Enterprise resilience: ...
6;2020-03-12;12 security tips for the 'work from home' enterprise ...;Mar 13, 2020 — 12 security tips for the 'work from home' enterprise ... An Apple-centric guide to effective (and productive) remote working · Enterprise resilience: ...;https://www.computerworld.com/article/3532352/12-security-tips-for-the-work-from-home-enterprise.html;https;www.computerworld.com;/article/3532352/12-security-tips-for-the-work-from-home-enterprise.html;;;computerworld;151.101.2.165;geolocation;{};US;United States;California;San Francisco;-122.39286041259766;37.76784896850586;151.101.2.165;12 security tips for the 'work from home' enterprise ...;Mar 13, 2020 — 12 security tips for the 'work from home' enterprise ... An Apple-centric guide to effective (and productive) remote working · Enterprise resilience: ...
7;2020-03-12;Apple confirms WWDC 2020 is happening online ...;Mar 13, 2020 — 12 security tips for the 'work from home' enterprise · An Apple-centric guide to effective (and productive) remote working · Enterprise resilience: ...;https://www.computerworld.com/article/3532471/apple-confirms-wwdc-2020-is-happening-online.html;https;www.computerworld.com;/article/3532471/apple-confirms-wwdc-2020-is-happening-online.html;;;computerworld;151.101.2.165;geolocation;{};US;United States;California;San Francisco;-122.39286041259766;37.76784896850586;151.101.2.165;Apple confirms WWDC 2020 is happening online ...;Mar 13, 2020 — 12 security tips for the 'work from home' enterprise · An Apple-centric guide to effective (and productive) remote working · Enterprise resilience: ...
8;2020-03-12;Apple confirms WWDC 2020 is happening online ...;Mar 13, 2020 — 12 security tips for the 'work from home' enterprise · An Apple-centric guide to effective (and productive) remote working · Enterprise resilience: ...;https://www.computerworld.com/article/3532471/apple-confirms-wwdc-2020-is-happening-online.html;https;www.computerworld.com;/article/3532471/apple-confirms-wwdc-2020-is-happening-online.html;;;computerworld;151.101.2.165;geolocation;{};US;United States;California;San Francisco;-122.39286041259766;37.76784896850586;151.101.2.165;Apple confirms WWDC 2020 is happening online ...;Mar 13, 2020 — 12 security tips for the 'work from home' enterprise · An Apple-centric guide to effective (and productive) remote working · Enterprise resilience: ...
9;2020-03-12;Apple confirms WWDC 2020 is happening online ...;Mar 13, 2020 — 12 security tips for the 'work from home' enterprise · An Apple-centric guide to effective (and productive) remote working · Enterprise resilience: ...;https://www.computerworld.com/article/3532471/apple-confirms-wwdc-2020-is-happening-online.html;https;www.computerworld.com;/article/3532471/apple-confirms-wwdc-2020-is-happening-online.html;;;computerworld;151.101.2.165;geolocation;{};US;United States;California;San Francisco;-122.39286041259766;37.76784896850586;151.101.2.165;Apple confirms WWDC 2020 is happening online ...;Mar 13, 2020 — 12 security tips for the 'work from home' enterprise · An Apple-centric guide to effective (and productive) remote working · Enterprise resilience: ...
10;2020-03-12;Elementor #32243 | ProMiles - Designed to Save You Money;ProMiles has a Disaster Recovery & Business Continuity Plan in place to provide ... ProMiles has utilized work from home staff since its inception and has ...;https://promiles.com/2020covid/;https;promiles.com;/2020covid/;;;promiles;35.208.91.164;geolocation;{};US;United States;Iowa;Council Bluffs;-95.87735748291016;41.23295974731445;35.208.91.164;Elementor #32243 | ProMiles - Designed to Save You Money;ProMiles has a Disaster Recovery & Business Continuity Plan in place to provide ... ProMiles has utilized work from home staff since its inception and has ...
11;2020-03-12;How to be an effective, collaborative remote worker | Pluralsight;When you work from home, you are literally sleeping at the office, so it's ... Just like a strong disaster recovery plan, a good remote-working plan coupled with a ... on administration and software development, and writes monthly columns for the ...;https://www.pluralsight.com/blog/software-development/effective-remote-work;https;www.pluralsight.com;/blog/software-development/effective-remote-work;;;pluralsight;104.19.161.127;geolocation;{};US;United States;California;San Jose;-121.83822631835938;37.330528259277344;104.19.161.127;How to be an effective, collaborative remote worker | Pluralsight;When you work from home, you are literally sleeping at the office, so it's ... Just like a strong disaster recovery plan, a good remote-working plan coupled with a ... on administration and software development, and writes monthly columns for the ...
12;2020-03-12;Security Think Tank: Coronavirus crisis helps put security in ...;Mar 12, 2020 — Risk mitigation can be anything from increasing remote working to ... with business continuity and resilience specialists by providing assurance ...;https://www.computerweekly.com/opinion/Security-Think-Tank-Coronavirus-crisis-helps-put-security-in-context;https;www.computerweekly.com;/opinion/Security-Think-Tank-Coronavirus-crisis-helps-put-security-in-context;;;computerweekly;206.19.49.153;geolocation;{};US;United States;Louisiana;Reddell;-92.42642211914062;30.675010681152344;206.19.49.153;Security Think Tank: Coronavirus crisis helps put security in ...;Mar 12, 2020 — Risk mitigation can be anything from increasing remote working to ... with business continuity and resilience specialists by providing assurance ...
13;2020-03-12;Industry news, Business Advice, Announcements;Follows a very effective Agile software development process using Scrum so very ... LAN & WAN, Back-ups & Disaster Recovery, Firewalls, Anti-Virus, Teams and ... It will undoubtedly be impacted as people are encouraged to work from home, ... With the forecasted rise in remote working, one employer we spoke to noted: ...;https://www.skyebusinesssolutions.com/news;https;www.skyebusinesssolutions.com;/news;;;skyebusinesssolutions;35.172.94.1;geolocation;{};US;United States;Virginia;Ashburn;-77.47419738769531;39.043701171875;35.172.94.1;Industry news, Business Advice, Announcements;Follows a very effective Agile software development process using Scrum so very ... LAN & WAN, Back-ups & Disaster Recovery, Firewalls, Anti-Virus, Teams and ... It will undoubtedly be impacted as people are encouraged to work from home, ... With the forecasted rise in remote working, one employer we spoke to noted: ...
14;2020-03-12;What your business can do about the coronavirus ... right now ...;Mar 13, 2020 — The potential disaster everyone is trying to avoid is for everybody to get ... implement aggressive work-from-home policies for those employees ...;https://www.idginsiderpro.com/article/3532451/what-your-business-should-do-about-the-coronavirus-right-now.html;https;www.idginsiderpro.com;/article/3532451/what-your-business-should-do-about-the-coronavirus-right-now.html;;;idginsiderpro;151.101.2.165;geolocation;{};US;United States;California;San Francisco;-122.39286041259766;37.76784896850586;151.101.2.165;What your business can do about the coronavirus ... right now ...;Mar 13, 2020 — The potential disaster everyone is trying to avoid is for everybody to get ... implement aggressive work-from-home policies for those employees ...
15;2020-03-12;What your business can do about the coronavirus ... right now ...;Mar 13, 2020 — The potential disaster everyone is trying to avoid is for everybody to get ... implement aggressive work-from-home policies for those employees ...;https://www.idginsiderpro.com/article/3532451/what-your-business-should-do-about-the-coronavirus-right-now.html;https;www.idginsiderpro.com;/article/3532451/what-your-business-should-do-about-the-coronavirus-right-now.html;;;idginsiderpro;151.101.2.165;geolocation;{};US;United States;California;San Francisco;-122.39286041259766;37.76784896850586;151.101.2.165;What your business can do about the coronavirus ... right now ...;Mar 13, 2020 — The potential disaster everyone is trying to avoid is for everybody to get ... implement aggressive work-from-home policies for those employees ...
16;2020-03-12;What your business can do about the coronavirus ... right now ...;Mar 13, 2020 — The potential disaster everyone is trying to avoid is for everybody to get ... implement aggressive work-from-home policies for those employees ...;https://www.idginsiderpro.com/article/3532451/what-your-business-should-do-about-the-coronavirus-right-now.html;https;www.idginsiderpro.com;/article/3532451/what-your-business-should-do-about-the-coronavirus-right-now.html;;;idginsiderpro;151.101.2.165;geolocation;{};US;United States;California;San Francisco;-122.39286041259766;37.76784896850586;151.101.2.165;What your business can do about the coronavirus ... right now ...;Mar 13, 2020 — The potential disaster everyone is trying to avoid is for everybody to get ... implement aggressive work-from-home policies for those employees ...
17;2020-03-12;Cyber security skills in the UK labour market 2020 - GOV.UK;Mar 12, 2020 — Flexible and remote working policies, especially for organisations outside London ... Network engineering, 10%, Software development, 5%, The Open ... or Internet Protocol (IP), 7%, SQL, 5%, Disaster recovery planning, 3%.;https://www.gov.uk/government/publications/cyber-security-skills-in-the-uk-labour-market-2020/cyber-security-skills-in-the-uk-labour-market-2020;https;www.gov.uk;/government/publications/cyber-security-skills-in-the-uk-labour-market-2020/cyber-security-skills-in-the-uk-labour-market-2020;;;gov;151.101.0.144;geolocation;{};US;United States;California;San Francisco;-122.39286041259766;37.76784896850586;151.101.0.144;Cyber security skills in the UK labour market 2020 - GOV.UK;Mar 12, 2020 — Flexible and remote working policies, especially for organisations outside London ... Network engineering, 10%, Software development, 5%, The Open ... or Internet Protocol (IP), 7%, SQL, 5%, Disaster recovery planning, 3%.
