;date;header;summary;link;protocol;domain;path;query;fragment;host_name;ip_address;Type;AdditionalData;CountryCode;CountryName;State;City;Longitude;Latitude;IpAddress;header_context_true;summary_context_true
0;2020-02-19;These are the 12 companies workers don't want to leave;"Feb 20, 2020 — Company resilience and strong leadership were the strongest ... for technology workers, for instance: ""The market for software engineers is ...";https://www.cnbc.com/2020/02/20/these-are-the-12-companies-workers-dont-want-to-leave.html;https;www.cnbc.com;/2020/02/20/these-are-the-12-companies-workers-dont-want-to-leave.html;;;cnbc;184.28.238.140;geolocation;{};US;United States;Illinois;Chicago;-87.67124938964844;41.84885025024414;184.28.238.140;These are the 12 companies workers don't want to leave;"Feb 20, 2020 — Company resilience and strong leadership were the strongest ... for technology workers, for instance: ""The market for software engineers is ..."
1;2020-02-19;UP 1000 Anganwadi Karyakarta Recruitment 2020 Bal Vikas ...;Feb 20, 2020 — ... Ministry · Directorate of Purchase and Stores DPSDAE · Disaster Management ... Sofa Agreement · Softech · Software · Software Development Course ... Vocational teachers · Vodafone Latest · Vodafone Work From Home ...;https://www.sscbankgk.in/2020/02/up-1000-anganwadi-karyakarta-recruitment-2020.html;https;www.sscbankgk.in;/2020/02/up-1000-anganwadi-karyakarta-recruitment-2020.html;;;sscbankgk;173.194.194.121;geolocation;{};US;United States;California;Mountain View;-122.07540893554688;37.419158935546875;173.194.194.121;UP 1000 Anganwadi Karyakarta Recruitment 2020 Bal Vikas ...;Feb 20, 2020 — ... Ministry · Directorate of Purchase and Stores DPSDAE · Disaster Management ... Sofa Agreement · Softech · Software · Software Development Course ... Vocational teachers · Vodafone Latest · Vodafone Work From Home ...
2;2020-02-19;Ujjwal City Gas Limited Coordinator Jobs 2020 District of UP ...;Feb 20, 2020 — ... Directorate of Purchase and Stores DPSDAE · Disaster Management ... Software Development Course · Software Engineer · Solapur Jobs · Solar ... Vocational teachers · Vodafone Latest · Vodafone Work From Home Plan ...;https://www.sscbankgk.in/2020/02/ujjwal-city-gas-limited-coordinator-jobs-2020.html;https;www.sscbankgk.in;/2020/02/ujjwal-city-gas-limited-coordinator-jobs-2020.html;;;sscbankgk;172.217.212.121;geolocation;{};US;United States;California;Mountain View;-122.07540893554688;37.419158935546875;172.217.212.121;Ujjwal City Gas Limited Coordinator Jobs 2020 District of UP ...;Feb 20, 2020 — ... Directorate of Purchase and Stores DPSDAE · Disaster Management ... Software Development Course · Software Engineer · Solapur Jobs · Solar ... Vocational teachers · Vodafone Latest · Vodafone Work From Home Plan ...
3;2020-02-19;UGC CARE JOURNAL - VET First Grade College;Feb 19, 2020 — There should be an option for women employees to work from home which helps to protect from climatic changes. 5. Work from home would ...;https://vetfgc.edu.in/downloads/UGC_CARE_LIST_FULL_ARTICLE_2020.pdf;https;vetfgc.edu.in;/downloads/UGC_CARE_LIST_FULL_ARTICLE_2020.pdf;;;edu;192.185.181.127;geolocation;{};US;United States;Massachusetts;Burlington;-71.20453643798828;42.50598907470703;192.185.181.127;UGC CARE JOURNAL - VET First Grade College;Feb 19, 2020 — There should be an option for women employees to work from home which helps to protect from climatic changes. 5. Work from home would ...
4;2020-02-19;Programming Homework Solver footnotesfilm;International Journal Of Disaster Resilience In The Built Environment, vol 5, no. ... for controlling changes in system requirements during software development. ... As more companies allow employees to work from home, a VPN can provide ...;http://www.footnotesfilm.com/category/programming/;http;www.footnotesfilm.com;/category/programming/;;;footnotesfilm;192.185.92.122;geolocation;{};US;United States;Massachusetts;Burlington;-71.20453643798828;42.50598907470703;192.185.92.122;Programming Homework Solver footnotesfilm;International Journal Of Disaster Resilience In The Built Environment, vol 5, no. ... for controlling changes in system requirements during software development. ... As more companies allow employees to work from home, a VPN can provide ...
5;2020-02-19;Evolutions in Electric Vehicle Technologies - CIOL;Feb 20, 2020 — ... IntelligencewomenWomen in TechWomen's Daywork from homeWorkforceWorkforce ManagementWorkKeyWorkplaceWorld CupWorld Data ...;https://www.ciol.com/evolutions-electric-vehicle-technologies/;https;www.ciol.com;/evolutions-electric-vehicle-technologies/;;;ciol;192.124.249.158;geolocation;{};US;United States;California;Menifee;-117.1891098022461;33.65753173828125;192.124.249.158;Evolutions in Electric Vehicle Technologies - CIOL;Feb 20, 2020 — ... IntelligencewomenWomen in TechWomen's Daywork from homeWorkforceWorkforce ManagementWorkKeyWorkplaceWorld CupWorld Data ...
6;2020-02-19;NMIMS Assignments NMIMS Solutions NMIMS Project NMIMS ...;Feb 20, 2020 — Do you think the decision of the company was right or it is a disaster to ... Arunam works for Hitech Solutions, a software development company.;https://issuu.com/assignmentsmba12/docs/nmims_april_2020_solved_assignments_available_at_n;https;issuu.com;/assignmentsmba12/docs/nmims_april_2020_solved_assignments_available_at_n;;;issuu;54.205.112.221;geolocation;{};US;United States;Virginia;Ashburn;-77.47419738769531;39.043701171875;54.205.112.221;NMIMS Assignments NMIMS Solutions NMIMS Project NMIMS ...;Feb 20, 2020 — Do you think the decision of the company was right or it is a disaster to ... Arunam works for Hitech Solutions, a software development company.
7;2020-02-19;Cloud Computing Training in Cochin - Sulekha;"And, by giving its employers the freedom to work from home or at a remote location, ... Selecting appropriate cloud technology; Security for cloud assets; Disaster ... Software development, today, is exploding in this technology-driven world with ...";https://www.sulekha.com/cloud-computing-training/cochin;https;www.sulekha.com;/cloud-computing-training/cochin;;;sulekha;52.170.100.84;geolocation;{};US;United States;Virginia;Washington;-78.15899658203125;38.7130012512207;52.170.100.84;Cloud Computing Training in Cochin - Sulekha;"And, by giving its employers the freedom to work from home or at a remote location, ... Selecting appropriate cloud technology; Security for cloud assets; Disaster ... Software development, today, is exploding in this technology-driven world with ..."
8;2020-02-19;Twitter adds a button so you can thread your shower thoughts ...;Feb 20, 2020 — ... Aastha Bhatnagar work from home, Aastha Bhatnagar wunderman thompson ... Agile, agile marketing, agile software development, agility robotics, aging, aging ... automated disaster recovery, automated driving, automated flight ... remote workforce trends, remote working, remote year, remotely shot ...;https://www.smarthostingplans.com/social-media/twitter-adds-a-button-so-you-can-thread-your-shower-thoughts/;https;www.smarthostingplans.com;/social-media/twitter-adds-a-button-so-you-can-thread-your-shower-thoughts/;;;smarthostingplans;208.109.175.158;geolocation;{};US;United States;Arizona;Scottsdale;-111.89010620117188;33.610958099365234;208.109.175.158;Twitter adds a button so you can thread your shower thoughts ...;Feb 20, 2020 — ... Aastha Bhatnagar work from home, Aastha Bhatnagar wunderman thompson ... Agile, agile marketing, agile software development, agility robotics, aging, aging ... automated disaster recovery, automated driving, automated flight ... remote workforce trends, remote working, remote year, remotely shot ...
9;2020-02-19;Twitter adds a button so you can thread your shower thoughts ...;Feb 20, 2020 — ... Aastha Bhatnagar work from home, Aastha Bhatnagar wunderman thompson ... Agile, agile marketing, agile software development, agility robotics, aging, aging ... automated disaster recovery, automated driving, automated flight ... remote workforce trends, remote working, remote year, remotely shot ...;https://www.smarthostingplans.com/social-media/twitter-adds-a-button-so-you-can-thread-your-shower-thoughts/;https;www.smarthostingplans.com;/social-media/twitter-adds-a-button-so-you-can-thread-your-shower-thoughts/;;;smarthostingplans;208.109.175.158;geolocation;{};US;United States;Arizona;Scottsdale;-111.89010620117188;33.610958099365234;208.109.175.158;Twitter adds a button so you can thread your shower thoughts ...;Feb 20, 2020 — ... Aastha Bhatnagar work from home, Aastha Bhatnagar wunderman thompson ... Agile, agile marketing, agile software development, agility robotics, aging, aging ... automated disaster recovery, automated driving, automated flight ... remote workforce trends, remote working, remote year, remotely shot ...
10;2020-02-19;The rise of the winged pink unicorn - Internet & Technology ...;Feb 20, 2020 — (I call this resilience innovation.) Perhaps the easiest example of emerging market innovation fueled by resilience is fintech. Emerging markets ...;https://www.smarthostingplans.com/startups/the-rise-of-the-winged-pink-unicorn/;https;www.smarthostingplans.com;/startups/the-rise-of-the-winged-pink-unicorn/;;;smarthostingplans;208.109.175.158;geolocation;{};US;United States;Arizona;Scottsdale;-111.89010620117188;33.610958099365234;208.109.175.158;The rise of the winged pink unicorn - Internet & Technology ...;Feb 20, 2020 — (I call this resilience innovation.) Perhaps the easiest example of emerging market innovation fueled by resilience is fintech. Emerging markets ...
11;2020-02-19;The rise of the winged pink unicorn - Internet & Technology ...;Feb 20, 2020 — (I call this resilience innovation.) Perhaps the easiest example of emerging market innovation fueled by resilience is fintech. Emerging markets ...;https://www.smarthostingplans.com/startups/the-rise-of-the-winged-pink-unicorn/;https;www.smarthostingplans.com;/startups/the-rise-of-the-winged-pink-unicorn/;;;smarthostingplans;208.109.175.158;geolocation;{};US;United States;Arizona;Scottsdale;-111.89010620117188;33.610958099365234;208.109.175.158;The rise of the winged pink unicorn - Internet & Technology ...;Feb 20, 2020 — (I call this resilience innovation.) Perhaps the easiest example of emerging market innovation fueled by resilience is fintech. Emerging markets ...
12;2020-02-19;How companies are working around Apple's ban on vaping ...;Feb 20, 2020 — ... Aggregate IQ, agile software development, Agora.io, agribusiness, Agric investors ... Disabilities, Disability, disaster recovery, disaster relief, discharged, discord ... remote work, Remote workers, remote working, Removable media ... Work, Work & careers, work from anywhere, Work From Home, work visa ...;https://publicnewsupdate.com/how-companies-are-working-around-apples-ban-on-vaping-apps/;https;publicnewsupdate.com;/how-companies-are-working-around-apples-ban-on-vaping-apps/;;;publicnewsupdate;34.248.68.200;geolocation;{};IE;Ireland;Leinster;Dublin;-6.243330001831055;53.35388946533203;34.248.68.200;How companies are working around Apple's ban on vaping ...;Feb 20, 2020 — ... Aggregate IQ, agile software development, Agora.io, agribusiness, Agric investors ... Disabilities, Disability, disaster recovery, disaster relief, discharged, discord ... remote work, Remote workers, remote working, Removable media ... Work, Work & careers, work from anywhere, Work From Home, work visa ...
13;2020-02-19;instagram highlights view count - Blind;Feb 19, 2020 — Software Development Engineer ... Work From Home ... /10/19/coronavirus-trump-calls-fauci-a-disaster-says-people-are-tired-of-covid.html.;https://www.teamblind.com/post/instagram-highlights-view-count-GnntpBJU;https;www.teamblind.com;/post/instagram-highlights-view-count-GnntpBJU;;;teamblind;52.85.224.76;geolocation;{};US;United States;Illinois;Chicago;-87.67124938964844;41.84885025024414;52.85.224.76;instagram highlights view count - Blind;Feb 19, 2020 — Software Development Engineer ... Work From Home ... /10/19/coronavirus-trump-calls-fauci-a-disaster-says-people-are-tired-of-covid.html.
14;2020-02-19;Who Bought the $1.3 Trillion in Debt the US Government ...;Feb 19, 2020 — Trust me, I don't revel in this disaster, I hope Mr Wolf's short does extremely well ... systems software development for a Fortune 50 telecom corporation. ... and more about building resilience to its collapse, i mean market correction. ... Landlords and their lenders who're still thinking work-from-home is just a ...;https://wolfstreet.com/2020/02/19/who-bought-the-1-3-trillion-in-debt-the-us-government-added-to-its-23-tn-pile-in-12-months/;https;wolfstreet.com;/2020/02/19/who-bought-the-1-3-trillion-in-debt-the-us-government-added-to-its-23-tn-pile-in-12-months/;;;wolfstreet;64.131.77.113;geolocation;{};US;United States;Virginia;Manassas;-77.53645324707031;38.7936897277832;64.131.77.113;Who Bought the $1.3 Trillion in Debt the US Government ...;Feb 19, 2020 — Trust me, I don't revel in this disaster, I hope Mr Wolf's short does extremely well ... systems software development for a Fortune 50 telecom corporation. ... and more about building resilience to its collapse, i mean market correction. ... Landlords and their lenders who're still thinking work-from-home is just a ...
15;2020-02-19;Love Engineering - Jonathan Lee - Jonathan Lee Recruitment;Whether this is managing change, innovating to overcome problems of remote working or just maintaining the right mindset in a changing work environment.;https://www.jonlee.co.uk/blog/2020/02/love-engineering;https;www.jonlee.co.uk;/blog/2020/02/love-engineering;;;co;99.84.251.48;geolocation;{};US;United States;Illinois;Chicago;-87.67124938964844;41.84885025024414;99.84.251.48;Love Engineering - Jonathan Lee - Jonathan Lee Recruitment;Whether this is managing change, innovating to overcome problems of remote working or just maintaining the right mindset in a changing work environment.
16;2020-02-19;Demand for Multilayer Flexible Packaging to Soar Steadily ...;Feb 20, 2020 — ... Digital Identity (1), Digital Marketing (2), Digital Signage (1), Disaster Recovery (1) ... Remote Working (8), Repair (1), Research (5), Resilience ... SME (1), SMS (1), Social Media (6), Software (9), Software Development (3) ...;https://www.itbusinessnet.com/2020/02/demand-for-multilayer-flexible-packaging-to-soar-steadily-through-2029-plastic-remains-preferred-material-future-market-insights/;https;www.itbusinessnet.com;/2020/02/demand-for-multilayer-flexible-packaging-to-soar-steadily-through-2029-plastic-remains-preferred-material-future-market-insights/;;;itbusinessnet;172.67.170.215;geolocation;{};US;United States;California;San Francisco;-122.39286041259766;37.76784896850586;172.67.170.215;Demand for Multilayer Flexible Packaging to Soar Steadily ...;Feb 20, 2020 — ... Digital Identity (1), Digital Marketing (2), Digital Signage (1), Disaster Recovery (1) ... Remote Working (8), Repair (1), Research (5), Resilience ... SME (1), SMS (1), Social Media (6), Software (9), Software Development (3) ...
17;2020-02-19;రాశి ఆశలు అడియాసలు అయ్యాయి.. ! – The ...;Feb 19, 2020 — ... #WORK FROM HOME #CHEATERS #DELHI #LOCKDOWN #WORK FROM ... POLICE STATION narsingh yadav naryana national disaster national ... engieer Software engineer Software engineers Soinya dandhi Solar ...;http://www.thesakshi.com/%E0%B0%B0%E0%B0%BE%E0%B0%B6%E0%B0%BF-%E0%B0%86%E0%B0%B6%E0%B0%B2%E0%B1%81-%E0%B0%85%E0%B0%A1%E0%B0%BF%E0%B0%AF%E0%B0%BE%E0%B0%B8%E0%B0%B2%E0%B1%81-%E0%B0%85%E0%B0%AF%E0%B1%8D%E0%B0%AF%E0%B0%BE/;http;www.thesakshi.com;/%E0%B0%B0%E0%B0%BE%E0%B0%B6%E0%B0%BF-%E0%B0%86%E0%B0%B6%E0%B0%B2%E0%B1%81-%E0%B0%85%E0%B0%A1%E0%B0%BF%E0%B0%AF%E0%B0%BE%E0%B0%B8%E0%B0%B2%E0%B1%81-%E0%B0%85%E0%B0%AF%E0%B1%8D%E0%B0%AF%E0%B0%BE/;;;thesakshi;166.62.28.89;geolocation;{};US;United States;Arizona;Scottsdale;-111.89010620117188;33.610958099365234;166.62.28.89;రాశి ఆశలు అడియాసలు అయ్యాయి.. ! – The ...;Feb 19, 2020 — ... #WORK FROM HOME #CHEATERS #DELHI #LOCKDOWN #WORK FROM ... POLICE STATION narsingh yadav naryana national disaster national ... engieer Software engineer Software engineers Soinya dandhi Solar ...
18;2020-02-19;bioMDplus Makes a Bold Move to Provide Only Third-Party ...;Feb 19, 2020 — ... Digital Identity (1), Digital Marketing (2), Digital Signage (1), Disaster Recovery (1) ... Remote Working (5), Repair (1), Research (5), Resilience ... SME (1), SMS (1), Social Media (6), Software (8), Software Development (3) ...;http://itbusinessnet.com/2020/02/biomdplus-makes-a-bold-move-to-provide-only-third-party-lab-tested-cbd-products/;http;itbusinessnet.com;/2020/02/biomdplus-makes-a-bold-move-to-provide-only-third-party-lab-tested-cbd-products/;;;itbusinessnet;104.31.87.205;geolocation;{};US;United States;California;San Jose;-121.83822631835938;37.330528259277344;104.31.87.205;bioMDplus Makes a Bold Move to Provide Only Third-Party ...;Feb 19, 2020 — ... Digital Identity (1), Digital Marketing (2), Digital Signage (1), Disaster Recovery (1) ... Remote Working (5), Repair (1), Research (5), Resilience ... SME (1), SMS (1), Social Media (6), Software (8), Software Development (3) ...
19;2020-02-19;Introducing Sqreen for Go: the first Runtime Application Self ...;Feb 19, 2020 — It's not a secret that the world of software development is going through some massive changes: the increasing speed of releases, the advent of ...;https://slacker.ro/2020/02/19/introducing-sqreen-for-go-the-first-runtime-application-self-protection-rasp-for-go/;https;slacker.ro;/2020/02/19/introducing-sqreen-for-go-the-first-runtime-application-self-protection-rasp-for-go/;;;slacker;172.67.132.112;geolocation;{};US;United States;California;San Francisco;-122.39286041259766;37.76784896850586;172.67.132.112;Introducing Sqreen for Go: the first Runtime Application Self ...;Feb 19, 2020 — It's not a secret that the world of software development is going through some massive changes: the increasing speed of releases, the advent of ...
20;2020-02-19;Introducing Sqreen for Go: the first Runtime Application Self ...;Feb 19, 2020 — It's not a secret that the world of software development is going through some massive changes: the increasing speed of releases, the advent of ...;https://slacker.ro/2020/02/19/introducing-sqreen-for-go-the-first-runtime-application-self-protection-rasp-for-go/;https;slacker.ro;/2020/02/19/introducing-sqreen-for-go-the-first-runtime-application-self-protection-rasp-for-go/;;;slacker;172.67.132.112;geolocation;{};US;United States;California;San Francisco;-122.39286041259766;37.76784896850586;172.67.132.112;Introducing Sqreen for Go: the first Runtime Application Self ...;Feb 19, 2020 — It's not a secret that the world of software development is going through some massive changes: the increasing speed of releases, the advent of ...
21;2020-02-19;Artificial Intelligence Company in Bangalore | AI Services ...;We all are familiar with using AI for our business or gaming and many other purposes. Now its governments turn to make use of it in disaster management. AI can ...;https://www.techasoft.com/artificial-intelligence-company-in-bangalore;https;www.techasoft.com;/artificial-intelligence-company-in-bangalore;;;techasoft;172.67.205.45;geolocation;{};US;United States;California;San Francisco;-122.39286041259766;37.76784896850586;172.67.205.45;Artificial Intelligence Company in Bangalore | AI Services ...;We all are familiar with using AI for our business or gaming and many other purposes. Now its governments turn to make use of it in disaster management. AI can ...
22;2020-02-19;Qlik hires former Cognizant exec to new VP role, expands C ...;Feb 19, 2020 — Data resilience strategies are becoming more crucial as more value is ... Why it's crucial to normalise proper security training for remote working ... the trend of big brands flocking to South Africa for software development, the ...;https://itbrief.com.au/story/qlik-hires-former-cognizant-exec-to-new-vp-role-expands-c-suite;https;itbrief.com.au;/story/qlik-hires-former-cognizant-exec-to-new-vp-role-expands-c-suite;;;com;113.21.226.180;geolocation;{};NZ;New Zealand;Auckland;Auckland;174.6802978515625;-36.78810119628906;113.21.226.180;Qlik hires former Cognizant exec to new VP role, expands C ...;Feb 19, 2020 — Data resilience strategies are becoming more crucial as more value is ... Why it's crucial to normalise proper security training for remote working ... the trend of big brands flocking to South Africa for software development, the ...
23;2020-02-19;Healthcare ETL Developer | Remote - wellpaid.io;Feb 19, 2020 — ETL Developer - Remote Working. 23 days ago. RemoteIQ Talent Solutions · ETL · SQL · SQL Server · SQL Server 2012 · T-SQL.;https://wellpaid.io/job/healthcare-etl-developer-talent-9906342b0edc;https;wellpaid.io;/job/healthcare-etl-developer-talent-9906342b0edc;;;wellpaid;172.67.149.82;geolocation;{};US;United States;California;San Francisco;-122.39286041259766;37.76784896850586;172.67.149.82;Healthcare ETL Developer | Remote - wellpaid.io;Feb 19, 2020 — ETL Developer - Remote Working. 23 days ago. RemoteIQ Talent Solutions · ETL · SQL · SQL Server · SQL Server 2012 · T-SQL.
24;2020-02-19;National Project Manager for Project - Safeguarding rural ...;Feb 19, 2020 — It aims to address existing institutional, financial and legislative barriers, increasing the climate resilience of vulnerable small-scale rural ...;https://www.careerjobsinternational.org/jobs/national-project-manager-for-project-safeguarding-rural-communities-and-their-physical-assets-from-climate-induced-disasters-in-timor-leste/;https;www.careerjobsinternational.org;/jobs/national-project-manager-for-project-safeguarding-rural-communities-and-their-physical-assets-from-climate-induced-disasters-in-timor-leste/;;;careerjobsinternational;199.188.200.229;geolocation;{};US;United States;California;Los Angeles;-118.42788696289062;34.037078857421875;199.188.200.229;National Project Manager for Project - Safeguarding rural ...;Feb 19, 2020 — It aims to address existing institutional, financial and legislative barriers, increasing the climate resilience of vulnerable small-scale rural ...
25;2020-02-19;The Experiences of Team Managers with Knowledge Sharing ...;zones but also their resilience to a complex, dynamic environment. The Study Results section will ... We all work from home for the most part, none of us ... What drives knowledge sharing in software development teams: A literature review and ...;https://scholarworks.waldenu.edu/cgi/viewcontent.cgi?article=9567&context=dissertations;https;scholarworks.waldenu.edu;/cgi/viewcontent.cgi;article=9567&context=dissertations;;waldenu;104.18.16.173;geolocation;{};US;United States;California;San Jose;-121.83822631835938;37.330528259277344;104.18.16.173;The Experiences of Team Managers with Knowledge Sharing ...;zones but also their resilience to a complex, dynamic environment. The Study Results section will ... We all work from home for the most part, none of us ... What drives knowledge sharing in software development teams: A literature review and ...
26;2020-02-19;Balancing cybersecurity and digital transformation: why ...;Feb 20, 2020 — ... DevOps, Digital Transformation, Disaster Recovery and Business Continuity ... R&D, Rapid App Development, Remote Working, Research, Retail Tech ... SEO, Smart Cities, Software, Software Development, Software News ...;https://uktechnews.co.uk/2020/02/20/balancing-cybersecurity-and-digital-transformation-why-proactivity-is-the-wisest-strategy/;https;uktechnews.co.uk;/2020/02/20/balancing-cybersecurity-and-digital-transformation-why-proactivity-is-the-wisest-strategy/;;;co;172.67.159.16;geolocation;{};US;United States;California;San Francisco;-122.39286041259766;37.76784896850586;172.67.159.16;Balancing cybersecurity and digital transformation: why ...;Feb 20, 2020 — ... DevOps, Digital Transformation, Disaster Recovery and Business Continuity ... R&D, Rapid App Development, Remote Working, Research, Retail Tech ... SEO, Smart Cities, Software, Software Development, Software News ...
27;2020-02-19;Wish Data Analyst Interview Questions | Glassdoor;Feb 19, 2020 — For Patricia, LatinX Heritage Month means resilience, strength, hope, and love. Come read about how Patricia uses these values to guide her ...;https://www.glassdoor.com/Interview/Wish-Data-Analyst-Interview-Questions-EI_IE686514.0,4_KO5,17.htm;https;www.glassdoor.com;/Interview/Wish-Data-Analyst-Interview-Questions-EI_IE686514.0,4_KO5,17.htm;;;glassdoor;104.17.91.51;geolocation;{};US;United States;Florida;Flagami;-80.31195831298828;25.762859344482422;104.17.91.51;Wish Data Analyst Interview Questions | Glassdoor;Feb 19, 2020 — For Patricia, LatinX Heritage Month means resilience, strength, hope, and love. Come read about how Patricia uses these values to guide her ...
