;date;header;summary;link;protocol;domain;path;query;fragment;host_name;ip_address;CountryCode;CountryName;State;City;Longitude;Latitude;Asn;edges;Type;AdditionalData;IpAddress;header_context_true;summary_context_true
36;2020-11-25;An Architecture-Driven Approach to Application Modernization ...;Nov 26, 2020 — Improving resilience. The ever-shifting ... He is a technology enthusiast and well versed in software development. He is also interested in ...;https://pathofex.com/an-architecture-driven-approach-to-application-modernization/;https;pathofex.com;/an-architecture-driven-approach-to-application-modernization/;;;pathofex.com;172.67.195.189;US;United States;California;San Francisco;-122.39286041259766;37.76784896850586;13335.0;set();geolocation;{};172.67.195.189;An Architecture-Driven Approach to Application Modernization ...;Nov 26, 2020 — Improving resilience. The ever-shifting ... He is a technology enthusiast and well versed in software development. He is also interested in ...
37;2020-11-25;Productivity and CO2 emission analysis for tower crane ...;Nov 25, 2020 — Taken as a whole, the evidence from previous studies implies that a building with higher hazard resilience consumes more initial embodied ...;https://www.researchgate.net/publication/257371571_Productivity_and_CO2_emission_analysis_for_tower_crane_utilization_on_high-rise_building_projects;https;www.researchgate.net;/publication/257371571_Productivity_and_CO2_emission_analysis_for_tower_crane_utilization_on_high-rise_building_projects;;;researchgate.net;104.17.33.105;US;United States;California;San Jose;-121.83822631835938;37.330528259277344;13335.0;set();geolocation;{};104.17.33.105;Productivity and CO2 emission analysis for tower crane ...;Nov 25, 2020 — Taken as a whole, the evidence from previous studies implies that a building with higher hazard resilience consumes more initial embodied ...
38;2020-11-25;Transcript of How I Built Resilience: Dr. Iman Abuzeid of ...;Nov 25, 2020 — These conversations are excerpts from our How I Built Resilience series, ... Well, half our team is software engineers. ... So we're likely going to do this hybrid model so people will kind of work from home or come in a couple of ...;https://www.happyscribe.com/public/how-i-built-this-with-guy-raz/how-i-built-resilience-dr;https;www.happyscribe.com;/public/how-i-built-this-with-guy-raz/how-i-built-resilience-dr;;;happyscribe.com;3.216.182.123;US;United States;Virginia;Ashburn;-77.47419738769531;39.043701171875;14618.0;set();geolocation;{};3.216.182.123;Transcript of How I Built Resilience: Dr. Iman Abuzeid of ...;Nov 25, 2020 — These conversations are excerpts from our How I Built Resilience series, ... Well, half our team is software engineers. ... So we're likely going to do this hybrid model so people will kind of work from home or come in a couple of ...
39;2020-11-25;Ip Business Development Manager Jobs, Employment - Indeed;Knowledge of software development life cycle methodologies. Experience consulting and ... Disaster Recovery/Business Continuity Program Development expertise. Experience with disaster ... Work from home careers · View more careers.;https://www.indeed.com/jobs?q=Ip+Business+Development+Manager&jt=temporary;https;www.indeed.com;/jobs;q=Ip+Business+Development+Manager&jt=temporary;;indeed.com;3.17.53.43;US;United States;Ohio;Columbus;-82.99945831298828;39.99557876586914;16509.0;set();geolocation;{};3.17.53.43;Ip Business Development Manager Jobs, Employment - Indeed;Knowledge of software development life cycle methodologies. Experience consulting and ... Disaster Recovery/Business Continuity Program Development expertise. Experience with disaster ... Work from home careers · View more careers.
40;2020-11-25;SaltDNA - Digital Marketplace;"... Allows for secure remote working; Make important decisions while on the move ... awareness allowing security and visibility in disaster/crisis situations; Secure ... Approach to resilience: SaltDNA server resilience information is available on request. ... Approach to secure software development best practice: Conforms to a ...";https://www.digitalmarketplace.service.gov.uk/g-cloud/services/134164115716703;https;www.digitalmarketplace.service.gov.uk;/g-cloud/services/134164115716703;;;digitalmarketplace.service.gov.uk;52.85.79.71;US;United States;Illinois;Chicago;-87.67124938964844;41.84885025024414;16509.0;set();geolocation;{};52.85.79.71;SaltDNA - Digital Marketplace;"... Allows for secure remote working; Make important decisions while on the move ... awareness allowing security and visibility in disaster/crisis situations; Secure ... Approach to resilience: SaltDNA server resilience information is available on request. ... Approach to secure software development best practice: Conforms to a ..."
41;2020-11-25;News - DOCUMENT Strategy Media;Smart MailHub Addresses Work From Home Challenges in Large Organizations. Nov. ... hub, specializing in customer communications software development.;https://documentmedia.com/articles.sec-3-2-NEWS.html;https;documentmedia.com;/articles.sec-3-2-NEWS.html;;;documentmedia.com;74.208.131.25;US;United States;Pennsylvania;King of Prussia;-75.40348052978516;40.0572395324707;8560.0;set();geolocation;{};74.208.131.25;News - DOCUMENT Strategy Media;Smart MailHub Addresses Work From Home Challenges in Large Organizations. Nov. ... hub, specializing in customer communications software development.
42;2020-11-25;| Augmented Reality - Peter Diamandis;Nov 25, 2020 — Mobile AR · In the productivity realm: IKEA place allows users to try out furniture in the home, experimenting with styles and sizing before ordering ...;https://www.diamandis.com/blog/topic/augmented-reality;https;www.diamandis.com;/blog/topic/augmented-reality;;;diamandis.com;199.60.103.29;US;United States;Massachusetts;Cambridge;-71.08074951171875;42.37015914916992;209242.0;set();geolocation;{};199.60.103.29;| Augmented Reality - Peter Diamandis;Nov 25, 2020 — Mobile AR · In the productivity realm: IKEA place allows users to try out furniture in the home, experimenting with styles and sizing before ordering ...
43;2020-11-25;Device Identification healthcare information security;Implementing an adaptive, risk-based authentication process for remote system access is proving effective as more staff members work from home during the ...;https://www.healthcareinfosecurity.com/device-identification-c-449;https;www.healthcareinfosecurity.com;/device-identification-c-449;;;healthcareinfosecurity.com;50.56.167.254;US;United States;Texas;Dallas;-96.8142318725586;32.8054313659668;33070.0;set();geolocation;{};50.56.167.254;Device Identification healthcare information security;Implementing an adaptive, risk-based authentication process for remote system access is proving effective as more staff members work from home during the ...
44;2020-11-25;Annual Report 2020 - University of Bristol;Nov 26, 2020 — to improve the seismic safety and resilience of its ... self-care and resilience and delivering ... remote working and global collaboration for ... costs incurred on software development in previous financial years, where there.;http://www.bristol.ac.uk/media-library/sites/finance/documents/UoB%20AR%20FS%202020%20WEB.pdf;http;www.bristol.ac.uk;/media-library/sites/finance/documents/UoB%20AR%20FS%202020%20WEB.pdf;;;bristol.ac.uk;137.222.0.38;GB;United Kingdom;England;Bristol;-2.5758299827575684;51.47193908691406;786.0;set();geolocation;{};137.222.0.38;Annual Report 2020 - University of Bristol;Nov 26, 2020 — to improve the seismic safety and resilience of its ... self-care and resilience and delivering ... remote working and global collaboration for ... costs incurred on software development in previous financial years, where there.
45;2020-11-25;Conversational Experiences & ChatBOTs - IMSS;Nov 26, 2020 — ... For Customer Experience · For COVID Impact · Digital Garage · Automate ... DevOps in more than software development lifecycle. ... IMSS offers tips on how to Combat Work From Home Loneliness and Find Perfect Balance.;https://imss.co.in/en/automate/chatbots/;https;imss.co.in;/en/automate/chatbots/;;;imss.co.in;103.76.231.90;IN;India;Maharashtra;Powai;72.87770080566406;19.076000213623047;394695.0;set();geolocation;{};103.76.231.90;Conversational Experiences & ChatBOTs - IMSS;Nov 26, 2020 — ... For Customer Experience · For COVID Impact · Digital Garage · Automate ... DevOps in more than software development lifecycle. ... IMSS offers tips on how to Combat Work From Home Loneliness and Find Perfect Balance.
47;2020-11-25;Could splitting your working week... - Isle of Man Government;So my daughter was at home and both myself and my husband were both trying to work from home, so it was ...;https://www.facebook.com/iomgovernment/videos/450932939225749/;https;www.facebook.com;/iomgovernment/videos/450932939225749/;;;facebook.com;157.240.2.35;US;United States;California;Menlo Park;-122.1860580444336;37.45903015136719;32934.0;set();geolocation;{};157.240.2.35;Could splitting your working week... - Isle of Man Government;So my daughter was at home and both myself and my husband were both trying to work from home, so it was ...
48;2020-11-25;Services Director - UOP Job For 0-50 Year Exp In Honeywell ...;Nov 26, 2020 — Rail experience mandatory Responsibilities: Coordinate disaster ... Software Development Director Software Development Department, ...;https://www.monstergulf.com/job/services-director-uop-honeywell-dubai-1710456;https;www.monstergulf.com;/job/services-director-uop-honeywell-dubai-1710456;;;monstergulf.com;23.7.109.84;US;United States;Illinois;Prospect Heights;-87.92555236816406;42.06269073486328;16625.0;set();geolocation;{};23.7.109.84;Services Director - UOP Job For 0-50 Year Exp In Honeywell ...;Nov 26, 2020 — Rail experience mandatory Responsibilities: Coordinate disaster ... Software Development Director Software Development Department, ...
