;date;header;summary;link;protocol;domain;path;query;fragment;host_name;ip_address;CountryCode;CountryName;State;City;Longitude;Latitude;Asn;edges;Type;AdditionalData;IpAddress;header_context_true;summary_context_true
33;2020-12-29;Top 10 datacentre stories of 2020 - Computer Weekly;Dec 29, 2020 — As governments around the world issued “stay at home” mandates for their citizens, enterprises had no choice but to embrace remote working ...;https://www.computerweekly.com/news/252493135/Top-10-datacentre-stories-of-2020;https;www.computerweekly.com;/news/252493135/Top-10-datacentre-stories-of-2020;;;computerweekly.com;206.19.49.153;US;United States;Louisiana;Reddell;-92.42642211914062;30.675010681152344;7018;set();geolocation;{};206.19.49.153;Top 10 datacentre stories of 2020 - Computer Weekly;Dec 29, 2020 — As governments around the world issued “stay at home” mandates for their citizens, enterprises had no choice but to embrace remote working ...
35;2020-12-29;Rethinking IT Strategy In 2021 To Address Business Challenges;Dec 30, 2020 — Full-stack software development engineers in testing can propel a new ... Frequent disaster planning sessions may help you estimate ... Keep adopting novel approaches of remote working that suit your organization best.;https://www.forbes.com/sites/forbestechcouncil/2021/12/30/rethinking-it-strategy-in-2021-to-address-business-challenges/;https;www.forbes.com;/sites/forbestechcouncil/2021/12/30/rethinking-it-strategy-in-2021-to-address-business-challenges/;;;forbes.com;151.101.2.49;US;United States;California;San Francisco;-122.39286041259766;37.76784896850586;54113;set();geolocation;{};151.101.2.49;Rethinking IT Strategy In 2021 To Address Business Challenges;Dec 30, 2020 — Full-stack software development engineers in testing can propel a new ... Frequent disaster planning sessions may help you estimate ... Keep adopting novel approaches of remote working that suit your organization best.
36;2020-12-29;Expand Force - Home | Facebook;Get the cybersecurity expert to safeguard the remote working environment for your ... CloudShore software development in the USA based on the size, scope, and ... Build a robust enterprise-level IT resilience by hiring Cloud Shore expert and ...;https://m.facebook.com/Expand-Force-105575587585512/;https;m.facebook.com;/Expand-Force-105575587585512/;;;facebook.com;157.240.18.35;US;United States;California;Menlo Park;-122.1860580444336;37.45903015136719;32934;set();geolocation;{};157.240.18.35;Expand Force - Home | Facebook;Get the cybersecurity expert to safeguard the remote working environment for your ... CloudShore software development in the USA based on the size, scope, and ... Build a robust enterprise-level IT resilience by hiring Cloud Shore expert and ...
37;2020-12-29;What It Was Like to Reenter Society in 2020 | Seattle Met;Dec 29, 2020 — She could remotely participate in Unloop, an organization that provides training in software development for incarcerated and formerly ...;https://www.seattlemet.com/news-and-city-life/2020/12/what-it-was-like-for-formerly-incarcerated-people-to-reenter-society-in-2020;https;www.seattlemet.com;/news-and-city-life/2020/12/what-it-was-like-for-formerly-incarcerated-people-to-reenter-society-in-2020;;;seattlemet.com;172.67.193.219;US;United States;California;San Francisco;-122.39286041259766;37.76784896850586;13335;set();geolocation;{};172.67.193.219;What It Was Like to Reenter Society in 2020 | Seattle Met;Dec 29, 2020 — She could remotely participate in Unloop, an organization that provides training in software development for incarcerated and formerly ...
38;2020-12-29;EMPOWERMENT - Women's Empowerment Principles;processes on crisis response and resilience measures. ... ROYAL DECREE ON REMOTE WORKING CONDITIONS ... employers to offer employees a work from home option. ... become successful software engineers.87 The company operates ...;https://www.weps.org/sites/default/files/2020-12/THE_POWER_OF_WORKING_TOGETHER_FINAL_0.pdf;https;www.weps.org;/sites/default/files/2020-12/THE_POWER_OF_WORKING_TOGETHER_FINAL_0.pdf;;;weps.org;23.185.0.1;US;United States;California;San Francisco;-122.40872955322266;37.79093933105469;54113;set();geolocation;{};23.185.0.1;EMPOWERMENT - Women's Empowerment Principles;processes on crisis response and resilience measures. ... ROYAL DECREE ON REMOTE WORKING CONDITIONS ... employers to offer employees a work from home option. ... become successful software engineers.87 The company operates ...
39;2020-12-29;Knowing and Doing: Software Development Archives;Dec 30, 2020 — With shelter-in-place and work-from-home the norm for so many people these days, we face a secondary crisis of software ... But they are also novice software engineers. ... I already see the resilience growing in many of them.;http://www.cs.uni.edu/~wallingf/blog/archives/cat_4.html;http;www.cs.uni.edu;/~wallingf/blog/archives/cat_4.html;;;uni.edu;134.161.122.66;US;United States;Iowa;Cedar Falls;-92.459228515625;42.513179779052734;22594;set();geolocation;{};134.161.122.66;Knowing and Doing: Software Development Archives;Dec 30, 2020 — With shelter-in-place and work-from-home the norm for so many people these days, we face a secondary crisis of software ... But they are also novice software engineers. ... I already see the resilience growing in many of them.
40;2020-12-29;Search Results for “CircuitPython 4 Poster” – Adafruit ...;Dec 30, 2020 — And it's shaped like a disaster-recovery duck – Twitter, Hackaday.io, and YouTube. ... Building a work-from-home “On Air” light with Circuit Playground ... challenged my PCB and software development skill sets significantly.;https://blog.adafruit.com/search/CircuitPython+4+Poster/feed/rss2/;https;blog.adafruit.com;/search/CircuitPython+4+Poster/feed/rss2/;;;adafruit.com;18.212.162.221;US;United States;Virginia;Ashburn;-77.47419738769531;39.043701171875;14618;set();geolocation;{};18.212.162.221;Search Results for “CircuitPython 4 Poster” – Adafruit ...;Dec 30, 2020 — And it's shaped like a disaster-recovery duck – Twitter, Hackaday.io, and YouTube. ... Building a work-from-home “On Air” light with Circuit Playground ... challenged my PCB and software development skill sets significantly.
