;date;header;summary;link;protocol;domain;path;query;fragment;host_name;ip_address;Type;AdditionalData;CountryCode;CountryName;State;City;Longitude;Latitude;IpAddress;header_context_true;summary_context_true
0;2020-06-29;Pandemic Programming Survey Results Show Negative ...;Jun 29, 2020 — ... A Virtual Conference for Senior Software Engineers and Architects (Nov 4-18) ... shift to remote working on computer programmers around the world. ... disaster management and the implications for software development.;https://www.infoq.com/news/2020/06/pandemic-programming-survey/;https;www.infoq.com;/news/2020/06/pandemic-programming-survey/;;;infoq;199.119.126.68;geolocation;{};US;United States;Missouri;Clayton;-90.1923828125;38.631370544433594;199.119.126.68;Pandemic Programming Survey Results Show Negative ...;Jun 29, 2020 — ... A Virtual Conference for Senior Software Engineers and Architects (Nov 4-18) ... shift to remote working on computer programmers around the world. ... disaster management and the implications for software development.
1;2020-06-29;pdf Prosus annual report 2020;Jun 29, 2020 — continued to report resilience in an uncertain macro ... implemented a work-from-home policy, in many cases ... access to remote working and ... in software development. ... software engineers and to date have a ... business interruption, for instance by implementing and testing disaster recovery plans as.;https://www.prosus.com/getattachment/Investors/Reports/Annual-Results/2020/Prosus-annual-report-2020/prosus2020_annual_report.pdf.aspx?lang=en-US;https;www.prosus.com;/getattachment/Investors/Reports/Annual-Results/2020/Prosus-annual-report-2020/prosus2020_annual_report.pdf.aspx;lang=en-US;;prosus;172.67.21.138;geolocation;{};US;United States;California;San Francisco;-122.39286041259766;37.76784896850586;172.67.21.138;pdf Prosus annual report 2020;Jun 29, 2020 — continued to report resilience in an uncertain macro ... implemented a work-from-home policy, in many cases ... access to remote working and ... in software development. ... software engineers and to date have a ... business interruption, for instance by implementing and testing disaster recovery plans as.
2;2020-06-29;AGM Voting Results - Infosys;Jun 29, 2020 — employees, across 46 countries, to work from home in just a few weeks. ... Resilience: What differentiates the Live Enterprise | 1. Driving intuitive ... or remote working. ... for agile software development, teams reskilled in agile.;https://www.infosys.com/investors/news-events/annual-general-meeting/2020/agm-2020-voting-results.pdf;https;www.infosys.com;/investors/news-events/annual-general-meeting/2020/agm-2020-voting-results.pdf;;;infosys;23.66.66.71;geolocation;{};US;United States;Illinois;Chicago;-87.67124938964844;41.84885025024414;23.66.66.71;AGM Voting Results - Infosys;Jun 29, 2020 — employees, across 46 countries, to work from home in just a few weeks. ... Resilience: What differentiates the Live Enterprise | 1. Driving intuitive ... or remote working. ... for agile software development, teams reskilled in agile.
3;2020-06-29;1 berkeley global society | covid-19 legal overview;"Jun 30, 2020 — Resilience and strategic management are key in overcoming any crisis. ... The employees were asked to work from home to the extent possible. ... Promote remote working methods and encourage the use of occupational medicine; ... the Government in the event of a natural disaster or industrial accident ...";https://berkeleyglobalsociety.com/wp-content/uploads/BGS-E-Book-Final-.pdf;https;berkeleyglobalsociety.com;/wp-content/uploads/BGS-E-Book-Final-.pdf;;;berkeleyglobalsociety;192.0.78.229;geolocation;{};US;United States;California;Santa Monica;-118.44526672363281;33.97785186767578;192.0.78.229;1 berkeley global society | covid-19 legal overview;"Jun 30, 2020 — Resilience and strategic management are key in overcoming any crisis. ... The employees were asked to work from home to the extent possible. ... Promote remote working methods and encourage the use of occupational medicine; ... the Government in the event of a natural disaster or industrial accident ..."
4;2020-06-29;How-to: Assess Third-party Risk | Packetlabs;Jun 29, 2020 — Software Development, Do you do static code analysis? ... there a formally documented Business Continuity Plan and Disaster Recovery Plan?;https://www.packetlabs.net/third-party-risk/;https;www.packetlabs.net;/third-party-risk/;;;packetlabs;52.22.22.201;geolocation;{};US;United States;Virginia;Ashburn;-77.47419738769531;39.043701171875;52.22.22.201;How-to: Assess Third-party Risk | Packetlabs;Jun 29, 2020 — Software Development, Do you do static code analysis? ... there a formally documented Business Continuity Plan and Disaster Recovery Plan?
5;2020-06-29;Defence Team “Virtual Shout-Out” Bulletin Board - Canada.ca;Jun 30, 2020 — He joined us in 2019 from a civilian software development organization ... Haley Schroeder – Your resilience and willingness to step up and be there for ... and requests, especially during this extended work-from-home period.;https://www.canada.ca/en/department-national-defence/maple-leaf/defence/2020/06/defence-team-virtual-shout-out-bulletin-board.html;https;www.canada.ca;/en/department-national-defence/maple-leaf/defence/2020/06/defence-team-virtual-shout-out-bulletin-board.html;;;canada;23.65.247.156;geolocation;{};US;United States;Illinois;Chicago;-87.67124938964844;41.84885025024414;23.65.247.156;Defence Team “Virtual Shout-Out” Bulletin Board - Canada.ca;Jun 30, 2020 — He joined us in 2019 from a civilian software development organization ... Haley Schroeder – Your resilience and willingness to step up and be there for ... and requests, especially during this extended work-from-home period.
6;2020-06-29;Lockdown Your Learnings | Weekly Webinar Series | ICT Skillnet;... connected and make best use of this remote working lifestyle we've all had to adapt to. ... of full Software Development Lifecycle, Outsourcing, Quality and Processes. ... financial planning which can support business continuity and resilience.;https://www.ictskillnet.ie/training/lock-down-learning-weekly-webinar-series/;https;www.ictskillnet.ie;/training/lock-down-learning-weekly-webinar-series/;;;ictskillnet;81.17.241.121;geolocation;{};IE;Ireland;Munster;Waterford;-7.107500076293945;52.25556182861328;81.17.241.121;Lockdown Your Learnings | Weekly Webinar Series | ICT Skillnet;... connected and make best use of this remote working lifestyle we've all had to adapt to. ... of full Software Development Lifecycle, Outsourcing, Quality and Processes. ... financial planning which can support business continuity and resilience.
7;2020-06-29;Cropin - Senior Technical Architect - Java/J2EE (10-14 yrs ...;Jun 30, 2020 — Mentor & guide Tech Leads & Software Engineers ... Create highly available and disaster recovery solutions ... May work from home. INFO ... Mobikwik - Software Development Engineer III/Tech Lead/Technical Architect - Data ...;https://www.hirist.com/j/cropin-senior-technical-architect-javaj2ee-10-14-yrs-610397.html?ref=rl;https;www.hirist.com;/j/cropin-senior-technical-architect-javaj2ee-10-14-yrs-610397.html;ref=rl;;hirist;13.233.235.167;geolocation;{};IN;India;Maharashtra;Powai;72.87770080566406;19.076000213623047;13.233.235.167;Cropin - Senior Technical Architect - Java/J2EE (10-14 yrs ...;Jun 30, 2020 — Mentor & guide Tech Leads & Software Engineers ... Create highly available and disaster recovery solutions ... May work from home. INFO ... Mobikwik - Software Development Engineer III/Tech Lead/Technical Architect - Data ...
8;2020-06-29;Publication 4054 (Rev. 6-2020) - Internal Revenue Service;Jun 29, 2020 — Incident Period of the federally declared disaster plus 60 days .30 ... Employer C, a software development company maintains an office in ... what operations are performed by employees who are not set up to work from home?;https://www.irs.gov/pub/irs-pdf/p4054.pdf;https;www.irs.gov;/pub/irs-pdf/p4054.pdf;;;irs;23.7.100.165;geolocation;{};US;United States;Illinois;Chicago;-87.67124938964844;41.84885025024414;23.7.100.165;Publication 4054 (Rev. 6-2020) - Internal Revenue Service;Jun 29, 2020 — Incident Period of the federally declared disaster plus 60 days .30 ... Employer C, a software development company maintains an office in ... what operations are performed by employees who are not set up to work from home?
9;2020-06-29;Digital transformation in Scotland | Leading Scotland's digital ...;Jun 29, 2020 — ... to support remote working, which means that it has been relatively easy for ... at the same time focusing on improving overall operational resilience. ... the CEO of xDesign, Scotland's leading software development company.;https://digit.fyi/digital-transformation-in-scotland-xdesign-comment/;https;digit.fyi;/digital-transformation-in-scotland-xdesign-comment/;;;digit;23.185.0.3;geolocation;{};US;United States;California;San Francisco;-122.40872955322266;37.79093933105469;23.185.0.3;Digital transformation in Scotland | Leading Scotland's digital ...;Jun 29, 2020 — ... to support remote working, which means that it has been relatively easy for ... at the same time focusing on improving overall operational resilience. ... the CEO of xDesign, Scotland's leading software development company.
10;2020-06-29;June 2020 - Minnesota Legislature;Jun 30, 2020 — used to “work from home” were thought through by IT ... MNIT should expand the disaster recovery roadmap to include all Priority 1 and Priority 2 applications ... oversight of agency-based software development projects such ...;https://www.leg.state.mn.us/docs/2020/other/200717.pdf;https;www.leg.state.mn.us;/docs/2020/other/200717.pdf;;;mn;156.98.99.4;geolocation;{};US;United States;Illinois;Chicago;-87.67124938964844;41.84885025024414;156.98.99.4;June 2020 - Minnesota Legislature;Jun 30, 2020 — used to “work from home” were thought through by IT ... MNIT should expand the disaster recovery roadmap to include all Priority 1 and Priority 2 applications ... oversight of agency-based software development projects such ...
11;2020-06-29;Contents To Our Readers - Publications - International Atomic ...;Jun 30, 2020 — With the start of the pandemic-induced work-from-home period at the IAEA and ... Resilience to Drought in Rice and Sorghum through. Mutation Breeding ... 45, July 2020. 28. Software Development: Computational Workflows.;http://www-pub.iaea.org/MTCD/Publications/PDF/Newsletters/pbg-45.pdf;http;www-pub.iaea.org;/MTCD/Publications/PDF/Newsletters/pbg-45.pdf;;;iaea;172.67.0.125;geolocation;{};US;United States;California;San Francisco;-122.39286041259766;37.76784896850586;172.67.0.125;Contents To Our Readers - Publications - International Atomic ...;Jun 30, 2020 — With the start of the pandemic-induced work-from-home period at the IAEA and ... Resilience to Drought in Rice and Sorghum through. Mutation Breeding ... 45, July 2020. 28. Software Development: Computational Workflows.
12;2020-06-29;Governance ensures operational resilience during lockdown ...;Jun 30, 2020 — “This organisation did not have a work-from-home culture, but when the lockdown was announced, we could have all the office personnel ...;https://www.itweb.co.za/content/rxP3jMBmkmJ7A2ye;https;www.itweb.co.za;/content/rxP3jMBmkmJ7A2ye;;;co;35.190.40.240;geolocation;{};US;United States;Kansas;Prairie Village;-94.53961181640625;39.10771179199219;35.190.40.240;Governance ensures operational resilience during lockdown ...;Jun 30, 2020 — “This organisation did not have a work-from-home culture, but when the lockdown was announced, we could have all the office personnel ...
13;2020-06-29;Accenture hiring Senior Principal Site AWS Reliability ...;Jun 29, 2020 — HR Operations-Payroll and benefit administration. Accenture in India. Bengaluru, Karnataka, India. 4 weeks ago. Software Development ...;https://www.linkedin.com/jobs/view/senior-principal-site-aws-reliability-engineer-marlborough-massachusetts-at-accenture-1885492968;https;www.linkedin.com;/jobs/view/senior-principal-site-aws-reliability-engineer-marlborough-massachusetts-at-accenture-1885492968;;;linkedin;13.107.42.14;geolocation;{};US;United States;Washington;Cottage Lake;-122.12094116210938;47.68050003051758;13.107.42.14;Accenture hiring Senior Principal Site AWS Reliability ...;Jun 29, 2020 — HR Operations-Payroll and benefit administration. Accenture in India. Bengaluru, Karnataka, India. 4 weeks ago. Software Development ...
14;2020-06-29;Salesforce Developer Apply In River Rouge - Jobs in US;... of our teammates, including instituting a work-from-home protocol in mid-March. ... software development teams, to ensure software solutions are built according ... Administration And execution of information protection, disaster recovery And ...;https://jobs-in.us/salesforce-developer/salesforce-developer-apply-in-river-rouge_i110459754;https;jobs-in.us;/salesforce-developer/salesforce-developer-apply-in-river-rouge_i110459754;;;jobs-in;104.27.161.191;geolocation;{};US;United States;California;San Jose;-121.83822631835938;37.330528259277344;104.27.161.191;Salesforce Developer Apply In River Rouge - Jobs in US;... of our teammates, including instituting a work-from-home protocol in mid-March. ... software development teams, to ensure software solutions are built according ... Administration And execution of information protection, disaster recovery And ...
15;2020-06-29;Wipro Interactive Annual Report 2019-20;Jun 30, 2020 — Resilience. Highlights ... and software development expertise and began offering software ... work from home/remote working will become mainstream, enabled by ... initiated disaster rehabilitation programs for Kerala floods in.;https://www.wipro.com/content/dam/nexus/en/investor/annual-reports/2019-2020/wipro-interactive-annual-report-2019-2020.pdf;https;www.wipro.com;/content/dam/nexus/en/investor/annual-reports/2019-2020/wipro-interactive-annual-report-2019-2020.pdf;;;wipro;13.226.18.63;geolocation;{};US;United States;Illinois;Chicago;-87.67124938964844;41.84885025024414;13.226.18.63;Wipro Interactive Annual Report 2019-20;Jun 30, 2020 — Resilience. Highlights ... and software development expertise and began offering software ... work from home/remote working will become mainstream, enabled by ... initiated disaster rehabilitation programs for Kerala floods in.
16;2020-06-29;Software Engineer Senior | New York, New York | Lockheed ...;Those that demand extraordinary amounts of courage, resilience and precision. ... 5 days ago Embedded Software Engineer - (Office or Remote - Work from Home) ... Engineer to execute complete embedded software development lifecycle.;https://jobsearcher.com/j/software-engineer-senior-at-lockheed-martin-in-new-york-new-york-mj4Ga7;https;jobsearcher.com;/j/software-engineer-senior-at-lockheed-martin-in-new-york-new-york-mj4Ga7;;;jobsearcher;54.81.32.42;geolocation;{};US;United States;Virginia;Ashburn;-77.47419738769531;39.043701171875;54.81.32.42;Software Engineer Senior | New York, New York | Lockheed ...;Those that demand extraordinary amounts of courage, resilience and precision. ... 5 days ago Embedded Software Engineer - (Office or Remote - Work from Home) ... Engineer to execute complete embedded software development lifecycle.
17;2020-06-29;Learn About The Ciphertex Advantage | Ciphertex Data Security;Our products, software development and solutions are conceptualized, engineered and manufactured at our ISO9001 certified facility in Chatsworth, California.;https://ciphertex.com/the-ciphertex-advantage/;https;ciphertex.com;/the-ciphertex-advantage/;;;ciphertex;162.214.97.131;geolocation;{};US;United States;Utah;Provo;-111.6124267578125;40.21580123901367;162.214.97.131;Learn About The Ciphertex Advantage | Ciphertex Data Security;Our products, software development and solutions are conceptualized, engineered and manufactured at our ISO9001 certified facility in Chatsworth, California.
18;2020-06-29;Learn About The Ciphertex Advantage | Ciphertex Data Security;Our products, software development and solutions are conceptualized, engineered and manufactured at our ISO9001 certified facility in Chatsworth, California.;https://ciphertex.com/the-ciphertex-advantage/;https;ciphertex.com;/the-ciphertex-advantage/;;;ciphertex;162.214.97.131;geolocation;{};US;United States;Utah;Provo;-111.6124267578125;40.21580123901367;162.214.97.131;Learn About The Ciphertex Advantage | Ciphertex Data Security;Our products, software development and solutions are conceptualized, engineered and manufactured at our ISO9001 certified facility in Chatsworth, California.
19;2020-06-29;Certifications | Ciphertex Data Security;Custom Software Development Services · Onsite Hardware Support Services ... Oil & Gas · Secure Data Archive & Backup · Disaster Recovery & Business Continuity · Secure Transport & Data Migration · Virtualization · Work from Home.;https://ciphertex.com/certification/;https;ciphertex.com;/certification/;;;ciphertex;162.214.97.131;geolocation;{};US;United States;Utah;Provo;-111.6124267578125;40.21580123901367;162.214.97.131;Certifications | Ciphertex Data Security;Custom Software Development Services · Onsite Hardware Support Services ... Oil & Gas · Secure Data Archive & Backup · Disaster Recovery & Business Continuity · Secure Transport & Data Migration · Virtualization · Work from Home.
20;2020-06-29;Certifications | Ciphertex Data Security;Custom Software Development Services · Onsite Hardware Support Services ... Oil & Gas · Secure Data Archive & Backup · Disaster Recovery & Business Continuity · Secure Transport & Data Migration · Virtualization · Work from Home.;https://ciphertex.com/certification/;https;ciphertex.com;/certification/;;;ciphertex;162.214.97.131;geolocation;{};US;United States;Utah;Provo;-111.6124267578125;40.21580123901367;162.214.97.131;Certifications | Ciphertex Data Security;Custom Software Development Services · Onsite Hardware Support Services ... Oil & Gas · Secure Data Archive & Backup · Disaster Recovery & Business Continuity · Secure Transport & Data Migration · Virtualization · Work from Home.
21;2020-06-29;Now Hiring: 6 Colorado Companies Growing Their Teams ...;Jun 30, 2020 — Senior Manager of Customer Operations Matt Nicoletti said the resilience and selflessness his team displayed in recent months filled him with ...;https://www.builtincolorado.com/2020/06/30/colorado-companies-hiring-july-2020;https;www.builtincolorado.com;/2020/06/30/colorado-companies-hiring-july-2020;;;builtincolorado;104.16.83.22;geolocation;{};US;United States;California;San Jose;-121.83822631835938;37.330528259277344;104.16.83.22;Now Hiring: 6 Colorado Companies Growing Their Teams ...;Jun 30, 2020 — Senior Manager of Customer Operations Matt Nicoletti said the resilience and selflessness his team displayed in recent months filled him with ...
22;2020-06-29;3 must-ask post-pandemic questions for CISOs - SearchSecurity;Many workers are new to remote working and its cybersecurity implications. ... security as early and upstream as possible in the software development lifecycle.;https://searchsecurity.techtarget.com/tip/3-must-ask-post-pandemic-questions-for-CISOs;https;searchsecurity.techtarget.com;/tip/3-must-ask-post-pandemic-questions-for-CISOs;;;techtarget;206.19.49.153;geolocation;{};US;United States;Louisiana;Reddell;-92.42642211914062;30.675010681152344;206.19.49.153;3 must-ask post-pandemic questions for CISOs - SearchSecurity;Many workers are new to remote working and its cybersecurity implications. ... security as early and upstream as possible in the software development lifecycle.
23;2020-06-29;3 must-ask post-pandemic questions for CISOs - SearchSecurity;Many workers are new to remote working and its cybersecurity implications. ... security as early and upstream as possible in the software development lifecycle.;https://searchsecurity.techtarget.com/tip/3-must-ask-post-pandemic-questions-for-CISOs;https;searchsecurity.techtarget.com;/tip/3-must-ask-post-pandemic-questions-for-CISOs;;;techtarget;206.19.49.153;geolocation;{};US;United States;Louisiana;Reddell;-92.42642211914062;30.675010681152344;206.19.49.153;3 must-ask post-pandemic questions for CISOs - SearchSecurity;Many workers are new to remote working and its cybersecurity implications. ... security as early and upstream as possible in the software development lifecycle.
24;2020-06-29;Cloud Security Is Different - Cyber Security Intelligence;Jun 30, 2020 — High availability: disaster recovery and redundancy is improved by ... computing is occurring because of the impact of remote working that ...;https://www.cybersecurityintelligence.com/blog/cloud-security-is-different--5052.html;https;www.cybersecurityintelligence.com;/blog/cloud-security-is-different--5052.html;;;cybersecurityintelligence;185.3.164.143;geolocation;{};GB;United Kingdom;England;City of Westminster;-0.19916999340057373;51.49555969238281;185.3.164.143;Cloud Security Is Different - Cyber Security Intelligence;Jun 30, 2020 — High availability: disaster recovery and redundancy is improved by ... computing is occurring because of the impact of remote working that ...
25;2020-06-29;Blog - BASES Stanford;Jun 29, 2020 — Helping our companies navigate work from home has been the most ... But overall, we still see great resilience in the startups we have invested ...;http://bases.stanford.edu/blog;http;bases.stanford.edu;/blog;;;stanford;192.187.26.176;geolocation;{};US;United States;New York;Manhattan;-74.0101089477539;40.73432922363281;192.187.26.176;Blog - BASES Stanford;Jun 29, 2020 — Helping our companies navigate work from home has been the most ... But overall, we still see great resilience in the startups we have invested ...
26;2020-06-29;Prepared for a Post-COVID 19 Workforce? The ICT Side ...;Jun 29, 2020 — The data that is generated from remote working would require the adoption of cloud computing software which can be seen from the major boost ...;https://infosyte.com/prepared-for-a-post-covid-19-workforce-the-ict-side/;https;infosyte.com;/prepared-for-a-post-covid-19-workforce-the-ict-side/;;;infosyte;202.71.103.77;geolocation;{};MY;Malaysia;Putrajaya;Putrajaya;101.65740203857422;2.925100088119507;202.71.103.77;Prepared for a Post-COVID 19 Workforce? The ICT Side ...;Jun 29, 2020 — The data that is generated from remote working would require the adoption of cloud computing software which can be seen from the major boost ...
27;2020-06-29;Delivering Against Changing ... - Monticello Consulting Group;Jun 30, 2020 — Almost immediately, they had to deal with work-from-home accommodations for their entire workforce, unprecedented market volatility, and a ...;https://www.monticellocg.com/blog/2020/06/30/doubling-down-on-agile;https;www.monticellocg.com;/blog/2020/06/30/doubling-down-on-agile;;;monticellocg;198.185.159.145;geolocation;{};US;United States;New York;Manhattan;-74.0101089477539;40.73432922363281;198.185.159.145;Delivering Against Changing ... - Monticello Consulting Group;Jun 30, 2020 — Almost immediately, they had to deal with work-from-home accommodations for their entire workforce, unprecedented market volatility, and a ...
28;2020-06-29;Remote working set to remain but so do management ...;Jun 30, 2020 — In the UK, 87% of employees said they would like more opportunities to work from home after they return to the workplace, and 21% said they ...;https://www.computerweekly.com/news/252485414/Remote-working-set-to-remain-but-so-do-management-challenges;https;www.computerweekly.com;/news/252485414/Remote-working-set-to-remain-but-so-do-management-challenges;;;computerweekly;206.19.49.153;geolocation;{};US;United States;Louisiana;Reddell;-92.42642211914062;30.675010681152344;206.19.49.153;Remote working set to remain but so do management ...;Jun 30, 2020 — In the UK, 87% of employees said they would like more opportunities to work from home after they return to the workplace, and 21% said they ...
29;2020-06-29;Remote working set to remain but so do management ...;Jun 30, 2020 — In the UK, 87% of employees said they would like more opportunities to work from home after they return to the workplace, and 21% said they ...;https://www.computerweekly.com/news/252485414/Remote-working-set-to-remain-but-so-do-management-challenges;https;www.computerweekly.com;/news/252485414/Remote-working-set-to-remain-but-so-do-management-challenges;;;computerweekly;206.19.49.153;geolocation;{};US;United States;Louisiana;Reddell;-92.42642211914062;30.675010681152344;206.19.49.153;Remote working set to remain but so do management ...;Jun 30, 2020 — In the UK, 87% of employees said they would like more opportunities to work from home after they return to the workplace, and 21% said they ...
30;2020-06-29;Microsoft launches initiative to help 25 million people ...;Jun 30, 2020 — Over the next five years, we estimate that the global workforce can absorb around 149 million new technology-oriented jobs. Software ...;https://blogs.microsoft.com/blog/2020/06/30/microsoft-launches-initiative-to-help-25-million-people-worldwide-acquire-the-digital-skills-needed-in-a-covid-19-economy/;https;blogs.microsoft.com;/blog/2020/06/30/microsoft-launches-initiative-to-help-25-million-people-worldwide-acquire-the-digital-skills-needed-in-a-covid-19-economy/;;;microsoft;192.237.225.141;geolocation;{};US;United States;Illinois;Chicago;-87.67124938964844;41.84885025024414;192.237.225.141;Microsoft launches initiative to help 25 million people ...;Jun 30, 2020 — Over the next five years, we estimate that the global workforce can absorb around 149 million new technology-oriented jobs. Software ...
