;date;header;summary;link;protocol;domain;path;query;fragment;host_name;ip_address;Type;AdditionalData;CountryCode;CountryName;State;City;Longitude;Latitude;IpAddress;header_context_true;summary_context_true
31;2020-08-04;Job Software Engineer - U.S. Bank - Talent.com;"... Experience in : Unit Testing (including automation and integration with CIsystems) and Agile Software Development (typically Scrum, Kanban, SAFe); Open, ...";https://www.talent.com/view?id=9f5b2540c5de;https;www.talent.com;/view;id=9f5b2540c5de;;talent;158.69.69.73;geolocation;{};CA;Canada;Quebec;Montréal;-73.56201171875;45.502079010009766;158.69.69.73;Job Software Engineer - U.S. Bank - Talent.com;"... Experience in : Unit Testing (including automation and integration with CIsystems) and Agile Software Development (typically Scrum, Kanban, SAFe); Open, ..."
32;2020-08-04;Ravi Menon: Monetary Authority of Singapore's Annual Report ...;Aug 4, 2020 — OPERATIONAL RESILIENCE OF FINANCIAL INSTITUTIONS ... Pervasive remote working arrangements and growing customer use of digital ... such as business development, financial analysis, and software development.;https://www.bis.org/review/r200804f.htm;https;www.bis.org;/review/r200804f.htm;;;bis;185.58.128.7;geolocation;{};CH;Switzerland;Zurich;Zürich;8.498279571533203;47.40298843383789;185.58.128.7;Ravi Menon: Monetary Authority of Singapore's Annual Report ...;Aug 4, 2020 — OPERATIONAL RESILIENCE OF FINANCIAL INSTITUTIONS ... Pervasive remote working arrangements and growing customer use of digital ... such as business development, financial analysis, and software development.
33;2020-08-04;Regional News — Birmingham Business Alliance;“I used to always tell people there are perks to being able to work from home, but ... Innovate Birmingham offers free data analytics and software development ... is not just diverse customer bases and industries that drive regional resilience – it is ... Economic Development Administration's (EDA) Disaster Recovery Program, ...;https://www.birminghambusinessalliance.com/regional-news-1;https;www.birminghambusinessalliance.com;/regional-news-1;;;birminghambusinessalliance;198.49.23.144;geolocation;{};US;United States;New York;Manhattan;-74.0101089477539;40.73432922363281;198.49.23.144;Regional News — Birmingham Business Alliance;“I used to always tell people there are perks to being able to work from home, but ... Innovate Birmingham offers free data analytics and software development ... is not just diverse customer bases and industries that drive regional resilience – it is ... Economic Development Administration's (EDA) Disaster Recovery Program, ...
34;2020-08-04;How to conquer the meeting madness - BPDTS Our Insights;Aug 4, 2020 — For some people, remote working is a dream come true. ... on back-to-back calls and working without regular breaks is a test of resilience.;https://bpdtsinsights.blog.gov.uk/2020/08/04/how-to-conquer-the-meeting-madness/;https;bpdtsinsights.blog.gov.uk;/2020/08/04/how-to-conquer-the-meeting-madness/;;;gov;13.226.18.103;geolocation;{};US;United States;Illinois;Chicago;-87.67124938964844;41.84885025024414;13.226.18.103;How to conquer the meeting madness - BPDTS Our Insights;Aug 4, 2020 — For some people, remote working is a dream come true. ... on back-to-back calls and working without regular breaks is a test of resilience.
35;2020-08-04;Tata Communications unveils new secure digital experience;Aug 4, 2020 — ... accelerate their time to market and drive agility and resilience, giving ... higher levels of remote working, but need confidence that employees ...;https://www.computerweekly.com/news/252487148/Tata-launches-Secure-Connected-Digital-Experience-for-post-Covid-world;https;www.computerweekly.com;/news/252487148/Tata-launches-Secure-Connected-Digital-Experience-for-post-Covid-world;;;computerweekly;206.19.49.153;geolocation;{};US;United States;Louisiana;Reddell;-92.42642211914062;30.675010681152344;206.19.49.153;Tata Communications unveils new secure digital experience;Aug 4, 2020 — ... accelerate their time to market and drive agility and resilience, giving ... higher levels of remote working, but need confidence that employees ...
36;2020-08-04;Tata Communications unveils new secure digital experience;Aug 4, 2020 — ... accelerate their time to market and drive agility and resilience, giving ... higher levels of remote working, but need confidence that employees ...;https://www.computerweekly.com/news/252487148/Tata-launches-Secure-Connected-Digital-Experience-for-post-Covid-world;https;www.computerweekly.com;/news/252487148/Tata-launches-Secure-Connected-Digital-Experience-for-post-Covid-world;;;computerweekly;206.19.49.153;geolocation;{};US;United States;Louisiana;Reddell;-92.42642211914062;30.675010681152344;206.19.49.153;Tata Communications unveils new secure digital experience;Aug 4, 2020 — ... accelerate their time to market and drive agility and resilience, giving ... higher levels of remote working, but need confidence that employees ...
37;2020-08-04;Second wave of Covid-19 cyber attacks locked in;Aug 5, 2020 — ... to the increasingly lengthy period of remote working and the potential ... to achieve better preparedness and resilience for any future shocks.;https://www.computerweekly.com/news/252487194/Second-wave-of-Covid-19-cyber-attacks-locked-in;https;www.computerweekly.com;/news/252487194/Second-wave-of-Covid-19-cyber-attacks-locked-in;;;computerweekly;206.19.49.153;geolocation;{};US;United States;Louisiana;Reddell;-92.42642211914062;30.675010681152344;206.19.49.153;Second wave of Covid-19 cyber attacks locked in;Aug 5, 2020 — ... to the increasingly lengthy period of remote working and the potential ... to achieve better preparedness and resilience for any future shocks.
38;2020-08-04;Second wave of Covid-19 cyber attacks locked in;Aug 5, 2020 — ... to the increasingly lengthy period of remote working and the potential ... to achieve better preparedness and resilience for any future shocks.;https://www.computerweekly.com/news/252487194/Second-wave-of-Covid-19-cyber-attacks-locked-in;https;www.computerweekly.com;/news/252487194/Second-wave-of-Covid-19-cyber-attacks-locked-in;;;computerweekly;206.19.49.153;geolocation;{};US;United States;Louisiana;Reddell;-92.42642211914062;30.675010681152344;206.19.49.153;Second wave of Covid-19 cyber attacks locked in;Aug 5, 2020 — ... to the increasingly lengthy period of remote working and the potential ... to achieve better preparedness and resilience for any future shocks.
39;2020-08-04;Limelight Launches Resource Center for Developers ...;Aug 4, 2020 — Limelight Networks is looking to ease the pressure on content network providers to develop efficient delivery, security, and innovation at a time ...;https://channelnomics.com/2020/08/04/limelight-launches-resource-center-for-developers/;https;channelnomics.com;/2020/08/04/limelight-launches-resource-center-for-developers/;;;channelnomics;104.28.8.61;geolocation;{};SG;Singapore;;Singapore;103.8198013305664;1.3200000524520874;104.28.8.61;Limelight Launches Resource Center for Developers ...;Aug 4, 2020 — Limelight Networks is looking to ease the pressure on content network providers to develop efficient delivery, security, and innovation at a time ...
40;2020-08-04;A SaaS Continuity Control Certification Framework - Cloud ...;Aug 4, 2020 — ... Assessment, Busi- ness Continuity, Disaster Recovery, Certification Framework ... availability, and resilience of processing systems and services.” The main elements ... software development life-cycle. 4.4 SaaS ... employees to work from home or offices creates a blended work environment that has the ...;https://circle.cloudsecurityalliance.org/HigherLogic/System/DownloadDocumentFile.ashx?DocumentFileKey=17b7ef9d-52ea-4d9f-b37c-330dfb099259;https;circle.cloudsecurityalliance.org;/HigherLogic/System/DownloadDocumentFile.ashx;DocumentFileKey=17b7ef9d-52ea-4d9f-b37c-330dfb099259;;cloudsecurityalliance;52.6.165.57;geolocation;{};US;United States;Virginia;Ashburn;-77.47419738769531;39.043701171875;52.6.165.57;A SaaS Continuity Control Certification Framework - Cloud ...;Aug 4, 2020 — ... Assessment, Busi- ness Continuity, Disaster Recovery, Certification Framework ... availability, and resilience of processing systems and services.” The main elements ... software development life-cycle. 4.4 SaaS ... employees to work from home or offices creates a blended work environment that has the ...
41;2020-08-04;VSCO's 40 Million Users Aren't There by Coincidence - Los ...;It's almost always the same: the Instagram profile of a young person. As I have already mentioned, in this layer of our society, VSCO is already very well ...;https://imad.edu.es/business-school/vscos-40-million-users-arent-there-by-coincidence/;https;imad.edu.es;/business-school/vscos-40-million-users-arent-there-by-coincidence/;;;edu;185.37.226.35;geolocation;{};ES;Spain;Madrid;Alcobendas;-3.6497199535369873;40.516151428222656;185.37.226.35;VSCO's 40 Million Users Aren't There by Coincidence - Los ...;It's almost always the same: the Instagram profile of a young person. As I have already mentioned, in this layer of our society, VSCO is already very well ...
42;2020-08-04;annual report - Neurones;Aug 4, 2020 — MASTER): software development technologies defined by the Agile man- ... Intranet, allowing work from home and flexible worktime and workspace. ... DRP (DISASTER RECOVERY PLAN): plan to ensure that, in the event of.;https://www.neurones.net/sites/default/files/documents/NEURONES-annual-report-universal-registration-document-2019.pdf;https;www.neurones.net;/sites/default/files/documents/NEURONES-annual-report-universal-registration-document-2019.pdf;;;neurones;193.169.64.174;geolocation;{};FR;France;Nouvelle-Aquitaine;Pessac;-0.6166700124740601;44.79999923706055;193.169.64.174;annual report - Neurones;Aug 4, 2020 — MASTER): software development technologies defined by the Agile man- ... Intranet, allowing work from home and flexible worktime and workspace. ... DRP (DISASTER RECOVERY PLAN): plan to ensure that, in the event of.
43;2020-08-04;AWS Architect | $60 - $70/hour | Sunnyvale, CA - wellpaid.io;19 days ago. RemoteArtech LLC · Ansible · DB2 · Disaster Recovery ... DevOps Engineer // Remote/Work from home. 19 days ago. $810/dayRemoteArtech LLC.;https://wellpaid.io/job/aws-architect-indeedus-edde9c219ff4d65c;https;wellpaid.io;/job/aws-architect-indeedus-edde9c219ff4d65c;;;wellpaid;104.27.138.156;geolocation;{};US;United States;California;San Jose;-121.83822631835938;37.330528259277344;104.27.138.156;AWS Architect | $60 - $70/hour | Sunnyvale, CA - wellpaid.io;19 days ago. RemoteArtech LLC · Ansible · DB2 · Disaster Recovery ... DevOps Engineer // Remote/Work from home. 19 days ago. $810/dayRemoteArtech LLC.
