;date;header;summary;link;protocol;domain;path;query;fragment;host_name;ip_address;Type;AdditionalData;CountryCode;CountryName;State;City;Longitude;Latitude;IpAddress;header_context_true;summary_context_true
27;2020-06-18;Vivek Ravisankar – HackerRank Blog;Jun 19, 2020 — But in a remote interview, new biasing factors—like your work from home setup, family life, or context ... Workforce resilience and business continuity ... Her background is in software development, with a BSE/MSE in ... Without expanding mathematical knowledge, these software engineers are going to risk ...;https://blog.hackerrank.com/author/vivek/feed/;https;blog.hackerrank.com;/author/vivek/feed/;;;hackerrank;23.44.164.194;geolocation;{};US;United States;Illinois;Chicago;-87.67124938964844;41.84885025024414;23.44.164.194;Vivek Ravisankar – HackerRank Blog;Jun 19, 2020 — But in a remote interview, new biasing factors—like your work from home setup, family life, or context ... Workforce resilience and business continuity ... Her background is in software development, with a BSE/MSE in ... Without expanding mathematical knowledge, these software engineers are going to risk ...
28;2020-06-18;Tech proves to be 'heart' of companies amid COVID-19 | ITWeb;Jun 18, 2020 — “We've seen that our service providers have built extra capacity and resilience into networks and we've worked very closely with them.;https://www.itweb.co.za/content/PmxVEMKle1mqQY85;https;www.itweb.co.za;/content/PmxVEMKle1mqQY85;;;co;35.190.40.240;geolocation;{};US;United States;Kansas;Prairie Village;-94.53961181640625;39.10771179199219;35.190.40.240;Tech proves to be 'heart' of companies amid COVID-19 | ITWeb;Jun 18, 2020 — “We've seen that our service providers have built extra capacity and resilience into networks and we've worked very closely with them.
29;2020-06-18;prj_4427 - COVID-19 Testing Service Development, Delivery ...;Remote working will also be acceptable once the UK government has ... Demonstrable evidence in bespoke enterprise scale software development in ... The service has been designed and architected with resilience and scalability in mind.;https://www.digitalmarketplace.service.gov.uk/digital-outcomes-and-specialists/opportunities/12470;https;www.digitalmarketplace.service.gov.uk;/digital-outcomes-and-specialists/opportunities/12470;;;gov;99.84.167.84;geolocation;{};US;United States;Illinois;Chicago;-87.67124938964844;41.84885025024414;99.84.167.84;prj_4427 - COVID-19 Testing Service Development, Delivery ...;Remote working will also be acceptable once the UK government has ... Demonstrable evidence in bespoke enterprise scale software development in ... The service has been designed and architected with resilience and scalability in mind.
30;2020-06-18;Priory Group hiring Teacher (SLD) in Bermuda | LinkedIn;Jun 18, 2020 — Hardware/Software Development Test Engineer. Poly. La Joya, Baja ... Data Entry Clerk Work From Home (Remote). CR TRASPORTI S.R.L..;https://bm.linkedin.com/jobs/view/teacher-sld-at-priory-group-1862691309;https;bm.linkedin.com;/jobs/view/teacher-sld-at-priory-group-1862691309;;;linkedin;108.174.10.14;geolocation;{};US;United States;California;Sunnyvale;-122.01677703857422;37.38859939575195;108.174.10.14;Priory Group hiring Teacher (SLD) in Bermuda | LinkedIn;Jun 18, 2020 — Hardware/Software Development Test Engineer. Poly. La Joya, Baja ... Data Entry Clerk Work From Home (Remote). CR TRASPORTI S.R.L..
31;2020-06-18;19 June 2020 Devonport Flagstaff by Devonport Flagstaff - issuu;Jun 18, 2020 — about Covid's impact on aviation and the loss of jobs across so many sectors, he is ... School deputy principal Claire Janes said he showed “resilience” in competing. ... Cutting-edge website design • App and software development ... Great work from home opportunity for a motivated person wanting to take ...;https://issuu.com/devonportflagstaffnewspaper/docs/df-19-june-2020;https;issuu.com;/devonportflagstaffnewspaper/docs/df-19-june-2020;;;issuu;52.204.230.201;geolocation;{};US;United States;Virginia;Ashburn;-77.47419738769531;39.043701171875;52.204.230.201;19 June 2020 Devonport Flagstaff by Devonport Flagstaff - issuu;Jun 18, 2020 — about Covid's impact on aviation and the loss of jobs across so many sectors, he is ... School deputy principal Claire Janes said he showed “resilience” in competing. ... Cutting-edge website design • App and software development ... Great work from home opportunity for a motivated person wanting to take ...
32;2020-06-18;Top 10 Most Influential People of 2020 | | IT Business Net;Jun 19, 2020 — ... Digital Identity (1), Digital Marketing (2), Digital Signage (1), Disaster Recovery (1) ... Remote Working (7), Repair (1), Research (5), Resilience ... SME (1), SMS (1), Social Media (6), Software (9), Software Development (3) ...;https://www.itbusinessnet.com/2020/06/top-10-most-influential-people-of-2020/;https;www.itbusinessnet.com;/2020/06/top-10-most-influential-people-of-2020/;;;itbusinessnet;172.67.170.215;geolocation;{};US;United States;California;San Francisco;-122.39286041259766;37.76784896850586;172.67.170.215;Top 10 Most Influential People of 2020 | | IT Business Net;Jun 19, 2020 — ... Digital Identity (1), Digital Marketing (2), Digital Signage (1), Disaster Recovery (1) ... Remote Working (7), Repair (1), Research (5), Resilience ... SME (1), SMS (1), Social Media (6), Software (9), Software Development (3) ...
33;2020-06-18;o9 Solutions Archives - CIOL;... RealityAugmenting software developmentAujasAurionproAustralian Military ... DataDisaster RecoveryDisneydisplayDisruptorsDmartDockerDocsAppDoctor InstaDocument ... in TechWomen's Daywork from homeWorkforceWorkforce ...;https://www.ciol.com/tag/o9-solutions/;https;www.ciol.com;/tag/o9-solutions/;;;ciol;192.124.249.158;geolocation;{};US;United States;California;Menifee;-117.1891098022461;33.65753173828125;192.124.249.158;o9 Solutions Archives - CIOL;... RealityAugmenting software developmentAujasAurionproAustralian Military ... DataDisaster RecoveryDisneydisplayDisruptorsDmartDockerDocsAppDoctor InstaDocument ... in TechWomen's Daywork from homeWorkforceWorkforce ...
34;2020-06-18;Leader in ISG Provider LensTM Finance & Accounting ...;"Jun 18, 2020 — ISG; Work From Home; Intellgent Process Automation; Finance and Accounting. Similar; Recommended. Hexaware Named Leader ...";https://hexaware.com/news/leader-in-isg-provider-lenstm-finance-accounting-outsourcing/;https;hexaware.com;/news/leader-in-isg-provider-lenstm-finance-accounting-outsourcing/;;;hexaware;72.3.209.222;geolocation;{};US;United States;Texas;Dallas;-96.8142318725586;32.8054313659668;72.3.209.222;Leader in ISG Provider LensTM Finance & Accounting ...;"Jun 18, 2020 — ISG; Work From Home; Intellgent Process Automation; Finance and Accounting. Similar; Recommended. Hexaware Named Leader ..."
35;2020-06-18;Quantum Machines Launches Universal Language for ... - InfoQ;Jun 18, 2020 — Remote Working for Tech Workers is Here to Stay ... A virtual conference for senior software engineers and architects on the trends, best ...;https://www.infoq.com/news/2020/06/quantum-machines-qua/;https;www.infoq.com;/news/2020/06/quantum-machines-qua/;;;infoq;199.119.126.68;geolocation;{};US;United States;Missouri;Clayton;-90.1923828125;38.631370544433594;199.119.126.68;Quantum Machines Launches Universal Language for ... - InfoQ;Jun 18, 2020 — Remote Working for Tech Workers is Here to Stay ... A virtual conference for senior software engineers and architects on the trends, best ...
36;2020-06-18;Quantum Machines Launches Universal Language for ... - InfoQ;Jun 18, 2020 — Remote Working for Tech Workers is Here to Stay ... A virtual conference for senior software engineers and architects on the trends, best ...;https://www.infoq.com/news/2020/06/quantum-machines-qua/;https;www.infoq.com;/news/2020/06/quantum-machines-qua/;;;infoq;199.119.126.68;geolocation;{};US;United States;Missouri;Clayton;-90.1923828125;38.631370544433594;199.119.126.68;Quantum Machines Launches Universal Language for ... - InfoQ;Jun 18, 2020 — Remote Working for Tech Workers is Here to Stay ... A virtual conference for senior software engineers and architects on the trends, best ...
37;2020-06-18;Younger employees find remote working more difficult;Jun 18, 2020 — Research reveals a disparity between millennials and older generations when it comes to people's acclimatisation to remote working, ...;https://www.computerweekly.com/news/252484812/Younger-employees-find-remote-working-more-difficult;https;www.computerweekly.com;/news/252484812/Younger-employees-find-remote-working-more-difficult;;;computerweekly;206.19.49.153;geolocation;{};US;United States;Louisiana;Reddell;-92.42642211914062;30.675010681152344;206.19.49.153;Younger employees find remote working more difficult;Jun 18, 2020 — Research reveals a disparity between millennials and older generations when it comes to people's acclimatisation to remote working, ...
38;2020-06-18;Hot topics | M&A Technology;Enable remote working in the face of crisis. ... Disaster recovery and business continuity planning should be considered a critical aspect of running a business.;http://www.macomp.com/hot-topics/;http;www.macomp.com;/hot-topics/;;;macomp;204.15.178.199;geolocation;{};US;United States;Texas;Carrollton;-96.89148712158203;32.951358795166016;204.15.178.199;Hot topics | M&A Technology;Enable remote working in the face of crisis. ... Disaster recovery and business continuity planning should be considered a critical aspect of running a business.
39;2020-06-18;Building resilience and agility in financial services during a ...;Jun 18, 2020 — Building agility and resilience in a time of uncertainty is essential for financial ... and capabilities no longer require a complex software development project. ... Data and system security are crucial for remote working in financial ...;https://www.xpedition.co.uk/article/building-resilience-and-agility-in-financial-services-during-a-time-of-crisis/;https;www.xpedition.co.uk;/article/building-resilience-and-agility-in-financial-services-during-a-time-of-crisis/;;;co;167.99.93.196;geolocation;{};GB;United Kingdom;England;Norwich;1.3393399715423584;52.622291564941406;167.99.93.196;Building resilience and agility in financial services during a ...;Jun 18, 2020 — Building agility and resilience in a time of uncertainty is essential for financial ... and capabilities no longer require a complex software development project. ... Data and system security are crucial for remote working in financial ...
40;2020-06-18;How DevOps Can Save Your Business from COVID-19 ...;Jun 18, 2020 — A recent report from GitHub came out focusing on new software development in the era of COVID-19. While there ... The Resilience of DevOps.;https://devops.com/how-devops-can-save-your-business-from-covid-19/;https;devops.com;/how-devops-can-save-your-business-from-covid-19/;;;devops;35.185.75.107;geolocation;{};US;United States;South Carolina;North Charleston;-80.0589370727539;32.890079498291016;35.185.75.107;How DevOps Can Save Your Business from COVID-19 ...;Jun 18, 2020 — A recent report from GitHub came out focusing on new software development in the era of COVID-19. While there ... The Resilience of DevOps.
41;2020-06-18;COVID Business Recovery & Reboot Solutions - IMSS;Jun 18, 2020 — COVID-19 is pushing companies to rapidly operate in new ways, and systems resilience is being tested as never before. As businesses juggle ...;http://www.imss.work/en/3a/covid/;http;www.imss.work;/en/3a/covid/;;;imss;107.180.51.33;geolocation;{};US;United States;Arizona;Scottsdale;-111.89010620117188;33.610958099365234;107.180.51.33;COVID Business Recovery & Reboot Solutions - IMSS;Jun 18, 2020 — COVID-19 is pushing companies to rapidly operate in new ways, and systems resilience is being tested as never before. As businesses juggle ...
42;2020-06-18;Sacramento Virtual Cybersecurity Summit - Data Connectors;Cyber Resilience: Rethinking your data protection strategy in the age of ransomware. ... He will review the challenges surfaced by the current work from home ... for leading software development activities at Texas Instruments and Blackberry.;https://www.dataconnectors.com/events/sacramento2020/;https;www.dataconnectors.com;/events/sacramento2020/;;;dataconnectors;172.67.69.193;geolocation;{};US;United States;California;San Francisco;-122.39286041259766;37.76784896850586;172.67.69.193;Sacramento Virtual Cybersecurity Summit - Data Connectors;Cyber Resilience: Rethinking your data protection strategy in the age of ransomware. ... He will review the challenges surfaced by the current work from home ... for leading software development activities at Texas Instruments and Blackberry.
43;2020-06-18;Business Continuity - Envestnet Retirement Solutions;"Envestnet's overall Business Continuity and Disaster Recovery strategies ... to be employed in the event of a significant business disruption – work from home; ... for any of its core functionalities (i.e. software development, technology support, ...";https://envestnetrs.com/business-continuity;https;envestnetrs.com;/business-continuity;;;envestnetrs;74.208.65.16;geolocation;{};US;United States;Pennsylvania;Radnor;-75.40348052978516;40.0572395324707;74.208.65.16;Business Continuity - Envestnet Retirement Solutions;"Envestnet's overall Business Continuity and Disaster Recovery strategies ... to be employed in the event of a significant business disruption – work from home; ... for any of its core functionalities (i.e. software development, technology support, ..."
44;2020-06-18;Andy Jassy: Video Conferencing Is Changing AWS' Thinking ...;Jun 19, 2020 — As part of a new multi-year deal announced this month, Slack will integrate Amazon Chime SDK (software development kit) to power the video, ...;https://www.crn.com/news/cloud/andy-jassy-video-conferencing-is-changing-aws-thinking-on-hiring-meetings;https;www.crn.com;/news/cloud/andy-jassy-video-conferencing-is-changing-aws-thinking-on-hiring-meetings;;;crn;13.249.134.69;geolocation;{};US;United States;Illinois;Chicago;-87.67124938964844;41.84885025024414;13.249.134.69;Andy Jassy: Video Conferencing Is Changing AWS' Thinking ...;Jun 19, 2020 — As part of a new multi-year deal announced this month, Slack will integrate Amazon Chime SDK (software development kit) to power the video, ...
45;2020-06-18;personalize-your-workspace - The AME Group;Jun 19, 2020 — ... MODEL CERTIFICATION (CMMC) · Physical Security · Disaster Recovery ... Software Development Services · Voice Solutions · Infrastructure · Video ... My Work From Home Security Tips · My Security Tips · OFFICE 365 ...;https://www.theamegroup.com/personalize-your-workspace/;https;www.theamegroup.com;/personalize-your-workspace/;;;theamegroup;45.79.188.162;geolocation;{};US;United States;New Jersey;Newark;-74.19452667236328;40.738731384277344;45.79.188.162;personalize-your-workspace - The AME Group;Jun 19, 2020 — ... MODEL CERTIFICATION (CMMC) · Physical Security · Disaster Recovery ... Software Development Services · Voice Solutions · Infrastructure · Video ... My Work From Home Security Tips · My Security Tips · OFFICE 365 ...
46;2020-06-18;7 Reasons to Outsource Services During COVID-19 ...;Jun 19, 2020 — They know how to communicate and complete projects outside the office, which translates to efficiency and productivity. For example, a software ...;https://www.business2community.com/strategy/7-reasons-to-outsource-services-during-covid-19-02320590;https;www.business2community.com;/strategy/7-reasons-to-outsource-services-during-covid-19-02320590;;;business2community;166.78.238.159;geolocation;{};US;United States;Illinois;Chicago;-87.67124938964844;41.84885025024414;166.78.238.159;7 Reasons to Outsource Services During COVID-19 ...;Jun 19, 2020 — They know how to communicate and complete projects outside the office, which translates to efficiency and productivity. For example, a software ...
47;2020-06-18;Half of Security Professionals Had No Contingency Plan in ...;Jun 18, 2020 — As more employees work from home than ever during the pandemic and possibly many more will want to in the future, infosec professionals are ...;https://uktechnews.co.uk/2020/06/18/half-of-security-professionals-had-no-contingency-plan-in-place-for-covid-19/;https;uktechnews.co.uk;/2020/06/18/half-of-security-professionals-had-no-contingency-plan-in-place-for-covid-19/;;;co;104.18.56.251;geolocation;{};US;United States;California;San Jose;-121.83822631835938;37.330528259277344;104.18.56.251;Half of Security Professionals Had No Contingency Plan in ...;Jun 18, 2020 — As more employees work from home than ever during the pandemic and possibly many more will want to in the future, infosec professionals are ...
48;2020-06-18;A difficult job - Global Research - HSBC Group;Jun 18, 2020 — advertised in finance or software development has seen the trend turn down further. Data from ... If more people work from home entirely or more frequently (see: Leaving the city? ... “Emergency disaster relief payments” of.;https://www.research.hsbc.com/C/1/1/320/9v7bWqg;https;www.research.hsbc.com;/C/1/1/320/9v7bWqg;;;hsbc;91.214.5.184;geolocation;{};GB;United Kingdom;England;Darton;-1.5019999742507935;53.60300064086914;91.214.5.184;A difficult job - Global Research - HSBC Group;Jun 18, 2020 — advertised in finance or software development has seen the trend turn down further. Data from ... If more people work from home entirely or more frequently (see: Leaving the city? ... “Emergency disaster relief payments” of.
49;2020-06-18;Building Resiliency in the Age of Disruption and Uncertainty ...;Jun 19, 2020 — As organisations seek to enhance their resilience to address the prolonged ... Major challenges were faced in establishing remote working ...;https://cioacademyasia.org/building-resiliency-in-the-age-of-disruption-and-uncertainty/;https;cioacademyasia.org;/building-resiliency-in-the-age-of-disruption-and-uncertainty/;;;cioacademyasia;175.41.162.129;geolocation;{};SG;Singapore;;Singapore;103.8198013305664;1.3200000524520874;175.41.162.129;Building Resiliency in the Age of Disruption and Uncertainty ...;Jun 19, 2020 — As organisations seek to enhance their resilience to address the prolonged ... Major challenges were faced in establishing remote working ...
50;2020-06-18;4 Ways Managed Services Providers Support Remote Work ...;Jun 19, 2020 — Although the coronavirus forced companies to make a hasty transition to remote working, there are indications it could become a permanent ...;https://www.ssdel.com/managed-services/4-ways-managed-services-providers-support-remote-work-requirements/;https;www.ssdel.com;/managed-services/4-ways-managed-services-providers-support-remote-work-requirements/;;;ssdel;104.198.158.207;geolocation;{};US;United States;Iowa;Council Bluffs;-95.87735748291016;41.23295974731445;104.198.158.207;4 Ways Managed Services Providers Support Remote Work ...;Jun 19, 2020 — Although the coronavirus forced companies to make a hasty transition to remote working, there are indications it could become a permanent ...
51;2020-06-18;The World After Corona: Covid-19 Effects on Global Economy ...;Jun 19, 2020 — Businesses' resilience during an economic crisis varies drastically by sector and often within sectors. Moody's Investor Services issued a global ...;https://intersog.co.il/blog/covid-19-effects-on-global-economy-and-it-sector/;https;intersog.co.il;/blog/covid-19-effects-on-global-economy-and-it-sector/;;;co;18.195.28.252;geolocation;{};DE;Germany;Hesse;Frankfurt am Main;8.682100296020508;50.11090087890625;18.195.28.252;The World After Corona: Covid-19 Effects on Global Economy ...;Jun 19, 2020 — Businesses' resilience during an economic crisis varies drastically by sector and often within sectors. Moody's Investor Services issued a global ...
52;2020-06-18;automotive industry at the crossroads - Oliver Wyman;Flexibility, adaptability and also resilience will become even more important ... software development and connectivity services and we are making ŠKODA even ...;https://www.oliverwyman.com/content/dam/oliver-wyman/v2/media/2020/jun/Automotive_Manager_2020_Oliver_Wyman.pdf;https;www.oliverwyman.com;/content/dam/oliver-wyman/v2/media/2020/jun/Automotive_Manager_2020_Oliver_Wyman.pdf;;;oliverwyman;52.8.40.227;geolocation;{};US;United States;California;San Jose;-121.83822631835938;37.330528259277344;52.8.40.227;automotive industry at the crossroads - Oliver Wyman;Flexibility, adaptability and also resilience will become even more important ... software development and connectivity services and we are making ŠKODA even ...
53;2020-06-18;IT outsourcing trends to watch out for in 2020 and beyond;Jun 18, 2020 — To obtain goods or services related to software development, infrastructure, ... data storage and recovery data centers used in the event of a disaster. ... within national borders and hiring remote workers who work from home.;https://7peakssoftware.com/it-outsourcing-trends/;https;7peakssoftware.com;/it-outsourcing-trends/;;;7peakssoftware;77.111.240.144;geolocation;{};DK;Denmark;Capital Region;Copenhagen;12.58782958984375;55.680511474609375;77.111.240.144;IT outsourcing trends to watch out for in 2020 and beyond;Jun 18, 2020 — To obtain goods or services related to software development, infrastructure, ... data storage and recovery data centers used in the event of a disaster. ... within national borders and hiring remote workers who work from home.
54;2020-06-18;Central bank digital currency developments hit “top gear” amid ...;Jun 18, 2020 — Global resilience has taken a hit – these countries will bear the brunt. The global economy has suffered its biggest shock since the Second ...;https://www.globalgovernmentforum.com/central-bank-digital-currency-developments-hit-top-gear-amid-coronavirus/;https;www.globalgovernmentforum.com;/central-bank-digital-currency-developments-hit-top-gear-amid-coronavirus/;;;globalgovernmentforum;172.67.70.64;geolocation;{};US;United States;California;San Francisco;-122.39286041259766;37.76784896850586;172.67.70.64;Central bank digital currency developments hit “top gear” amid ...;Jun 18, 2020 — Global resilience has taken a hit – these countries will bear the brunt. The global economy has suffered its biggest shock since the Second ...
55;2020-06-18;5 areas IT leaders should be followers | InsiderPro;Jun 19, 2020 — Attacks that targets work-from-home employees are through the roof (well, ... society-wide crisis or natural disaster requires creativity, empathy, ...;https://www.idginsiderpro.com/article/3563415/5-areas-it-leaders-should-be-followers.html;https;www.idginsiderpro.com;/article/3563415/5-areas-it-leaders-should-be-followers.html;;;idginsiderpro;151.101.2.165;geolocation;{};US;United States;California;San Francisco;-122.39286041259766;37.76784896850586;151.101.2.165;5 areas IT leaders should be followers | InsiderPro;Jun 19, 2020 — Attacks that targets work-from-home employees are through the roof (well, ... society-wide crisis or natural disaster requires creativity, empathy, ...
56;2020-06-18;ISDA Create Extends Online Negotiation to New Documents;Jun 18, 2020 — “The office closures and extensive remote working introduced as part of ... designers and software engineers working closely together to build ...;https://www.linklaters.com/en-us/about-us/news-and-deals/news/2020/june/linklaters-nakhoda-isda-create;https;www.linklaters.com;/en-us/about-us/news-and-deals/news/2020/june/linklaters-nakhoda-isda-create;;;linklaters;40.112.66.25;geolocation;{};IE;Ireland;Leinster;Dublin;-6.243330001831055;53.35388946533203;40.112.66.25;ISDA Create Extends Online Negotiation to New Documents;Jun 18, 2020 — “The office closures and extensive remote working introduced as part of ... designers and software engineers working closely together to build ...
57;2020-06-18;Cisco Patches Flaw in Webex Videoconferencing App;Jun 18, 2020 — ... team to follow fundamental software development best practices. ... as Webex, Zoom, and Microsoft Teams by work-from-home employees.;https://www.darkreading.com/vulnerabilities---threats/cisco-patches-flaw-in-webex-videoconferencing-app/d/d-id/1338129;https;www.darkreading.com;/vulnerabilities---threats/cisco-patches-flaw-in-webex-videoconferencing-app/d/d-id/1338129;;;darkreading;104.17.117.99;geolocation;{};US;United States;California;San Jose;-121.83822631835938;37.330528259277344;104.17.117.99;Cisco Patches Flaw in Webex Videoconferencing App;Jun 18, 2020 — ... team to follow fundamental software development best practices. ... as Webex, Zoom, and Microsoft Teams by work-from-home employees.
58;2020-06-18;IBM Makes Watson Centerpiece of Return-to-Work Program ...;Jun 18, 2020 — IBM is using its Watson artificial intelligence (AI) technology in a program designed to help businesses as they reopen their offices to workers ...;https://channelnomics.com/2020/06/18/ibm-makes-watson-centerpiece-of-return-to-work-program/;https;channelnomics.com;/2020/06/18/ibm-makes-watson-centerpiece-of-return-to-work-program/;;;channelnomics;172.67.131.203;geolocation;{};US;United States;California;San Francisco;-122.39286041259766;37.76784896850586;172.67.131.203;IBM Makes Watson Centerpiece of Return-to-Work Program ...;Jun 18, 2020 — IBM is using its Watson artificial intelligence (AI) technology in a program designed to help businesses as they reopen their offices to workers ...
