;date;header;summary;link;protocol;domain;path;query;fragment;host_name;ip_address;Type;AdditionalData;CountryCode;CountryName;State;City;Longitude;Latitude;IpAddress;header_context_true;summary_context_true
0;2020-07-13;Outsourcing Software Development to Mitigate the Human ...;Jul 13, 2020 — Reasons for outsourcing software development to stand out ... in letting businesses build resilience and ensure quality against disruptions, like ... Offering superior levels of services to the clients in remote working environment ...;https://www.way2smile.com/blog/software-development-outsourcing-to-mitigate-the-human-and-business-impact-of-covid-19/;https;www.way2smile.com;/blog/software-development-outsourcing-to-mitigate-the-human-and-business-impact-of-covid-19/;;;way2smile;13.232.219.21;geolocation;{};IN;India;Maharashtra;Powai;72.87770080566406;19.076000213623047;13.232.219.21;Outsourcing Software Development to Mitigate the Human ...;Jul 13, 2020 — Reasons for outsourcing software development to stand out ... in letting businesses build resilience and ensure quality against disruptions, like ... Offering superior levels of services to the clients in remote working environment ...
1;2020-07-13;Data Information Architect II | Overland Park, KS | YRC ...;T MobileShawnee Mission, KS Work remote, work from home.Posted 1 day ago Data Architect · Aperture CredentialingLeawood, KS This role has high visibility ...;https://jobsearcher.com/j/data-information-architect-ii-at-yrc-worldwide-in-merriam-kansas-KGnBpx;https;jobsearcher.com;/j/data-information-architect-ii-at-yrc-worldwide-in-merriam-kansas-KGnBpx;;;jobsearcher;52.21.160.98;geolocation;{};US;United States;Virginia;Ashburn;-77.47419738769531;39.043701171875;52.21.160.98;Data Information Architect II | Overland Park, KS | YRC ...;T MobileShawnee Mission, KS Work remote, work from home.Posted 1 day ago Data Architect · Aperture CredentialingLeawood, KS This role has high visibility ...
2;2020-07-13;CMA Technology Solutions Company Profile - Office ... - Craft.co;The Company offers computer hardware and software, IT consulting, virtualization, cloud hosting, cloud backup, disaster recovery, managed services, wireless ...;https://craft.co/cma-technology-solutions;https;craft.co;/cma-technology-solutions;;;craft;104.16.59.101;geolocation;{};US;United States;Florida;Flagami;-80.31195831298828;25.762859344482422;104.16.59.101;CMA Technology Solutions Company Profile - Office ... - Craft.co;The Company offers computer hardware and software, IT consulting, virtualization, cloud hosting, cloud backup, disaster recovery, managed services, wireless ...
3;2020-07-13;An FTC Workshop on GLB Safeguards - Federal Trade ...;Jul 13, 2020 — prevention, we're also talking about resilience. 20. Because what is so ... testing team, I was on the software development team. 24 ... with this with work from home? You know ... I spent a lot of time doing disaster recovery. 6.;https://www.ftc.gov/system/files/documents/public_events/1567141/transcript-glb-safeguards-workshop-full.pdf;https;www.ftc.gov;/system/files/documents/public_events/1567141/transcript-glb-safeguards-workshop-full.pdf;;;ftc;23.65.241.103;geolocation;{};US;United States;Illinois;Chicago;-87.67124938964844;41.84885025024414;23.65.241.103;An FTC Workshop on GLB Safeguards - Federal Trade ...;Jul 13, 2020 — prevention, we're also talking about resilience. 20. Because what is so ... testing team, I was on the software development team. 24 ... with this with work from home? You know ... I spent a lot of time doing disaster recovery. 6.
4;2020-07-13;IT Senior Staff Support (Web And Software Development) at ...;Jul 14, 2020 — We are a new University with a determination to build a distinct institution with a focus on excellence, hard work, resourcefulness and ...;https://jobwebghana.com/jobs/senior-staff-support-web-software-development-university-environment-sustainable-development/;https;jobwebghana.com;/jobs/senior-staff-support-web-software-development-university-environment-sustainable-development/;;;jobwebghana;104.28.21.30;geolocation;{};SG;Singapore;;Singapore;103.8198013305664;1.3200000524520874;104.28.21.30;IT Senior Staff Support (Web And Software Development) at ...;Jul 14, 2020 — We are a new University with a determination to build a distinct institution with a focus on excellence, hard work, resourcefulness and ...
5;2020-07-13;Foresight injects £1 million to boost expansion at Edinburgh ...;Jul 13, 2020 — ... team growth, expansion into new markets and software development ... period as they have transitioned to a remote working environment.”.;https://www.foresightgroup.eu/news/foresight-injects-1-million-to-boost-expansion-at-edinburgh-based-ajenta/;https;www.foresightgroup.eu;/news/foresight-injects-1-million-to-boost-expansion-at-edinburgh-based-ajenta/;;;foresightgroup;84.19.96.35;geolocation;{};GB;United Kingdom;England;Lancaster;-2.7850000858306885;54.00899887084961;84.19.96.35;Foresight injects £1 million to boost expansion at Edinburgh ...;Jul 13, 2020 — ... team growth, expansion into new markets and software development ... period as they have transitioned to a remote working environment.”.
6;2020-07-13;The Who-is-Who Directory In The Public Safety Industry;Jul 14, 2020 — We oer software development and implementation services based on open source technologies. ... category, caller's health related symptoms, or natural disaster hit points which ... Room, Stations, remote working positions, tablet and sat-nav apps. ... High Availability -> Resilience at site and system level.;https://eena.org/wp-content/uploads/Corporate_Directory_July2020.pdf;https;eena.org;/wp-content/uploads/Corporate_Directory_July2020.pdf;;;eena;104.22.30.76;geolocation;{};US;United States;California;San Jose;-121.83822631835938;37.330528259277344;104.22.30.76;The Who-is-Who Directory In The Public Safety Industry;Jul 14, 2020 — We oer software development and implementation services based on open source technologies. ... category, caller's health related symptoms, or natural disaster hit points which ... Room, Stations, remote working positions, tablet and sat-nav apps. ... High Availability -> Resilience at site and system level.
7;2020-07-13;Australia considers bar on offshoring of personal data ...;Jul 14, 2020 — ... Skills and Systems for Remote Working – On Demand Webinar · Submit Jobs ... Global resilience has taken a hit – these countries will bear the brunt ... is now the preferred method for most software development and digital ...;https://www.globalgovernmentforum.com/australia-considers-bar-on-offshoring-of-personal-data/;https;www.globalgovernmentforum.com;/australia-considers-bar-on-offshoring-of-personal-data/;;;globalgovernmentforum;104.26.10.50;geolocation;{};US;United States;California;San Jose;-121.83822631835938;37.330528259277344;104.26.10.50;Australia considers bar on offshoring of personal data ...;Jul 14, 2020 — ... Skills and Systems for Remote Working – On Demand Webinar · Submit Jobs ... Global resilience has taken a hit – these countries will bear the brunt ... is now the preferred method for most software development and digital ...
8;2020-07-13;Site Reliability Engineering Manager job in Austin at Aiven ...;Jul 13, 2020 — The team's work is heavily oriented towards software development ... Prior experience managing or leading an infrastructure, software development or a support team ... environments including performance and quality of disaster recovery. ... Software Engineers at IBM get to see their work in the real world, ...;https://lensa.com/site-reliability-engineering-manager-jobs/austin/jd/a82163015dc37c043e3db7a53bcf30ad;https;lensa.com;/site-reliability-engineering-manager-jobs/austin/jd/a82163015dc37c043e3db7a53bcf30ad;;;lensa;23.21.215.1;geolocation;{};US;United States;Virginia;Ashburn;-77.47419738769531;39.043701171875;23.21.215.1;Site Reliability Engineering Manager job in Austin at Aiven ...;Jul 13, 2020 — The team's work is heavily oriented towards software development ... Prior experience managing or leading an infrastructure, software development or a support team ... environments including performance and quality of disaster recovery. ... Software Engineers at IBM get to see their work in the real world, ...
9;2020-07-13;A/NZ partners win big at Microsoft Partner of the Year Awards;Jul 14, 2020 — Juniper Networks expands security offering for remote working. Juniper Networks has launched new solutions to enhance work from home security. ... PagerDuty was born from the idea that software development and operations could ... The importance of data resilience in the current cybersecurity climate.;https://itbrief.co.nz/story/a-nz-partners-win-big-at-microsoft-partner-of-the-year-awards;https;itbrief.co.nz;/story/a-nz-partners-win-big-at-microsoft-partner-of-the-year-awards;;;co;113.21.226.180;geolocation;{};NZ;New Zealand;Auckland;Auckland;174.6802978515625;-36.78810119628906;113.21.226.180;A/NZ partners win big at Microsoft Partner of the Year Awards;Jul 14, 2020 — Juniper Networks expands security offering for remote working. Juniper Networks has launched new solutions to enhance work from home security. ... PagerDuty was born from the idea that software development and operations could ... The importance of data resilience in the current cybersecurity climate.
10;2020-07-13;A/NZ partners win big at Microsoft Partner of the Year Awards;Jul 14, 2020 — Juniper Networks expands security offering for remote working. Juniper Networks has launched new solutions to enhance work from home security. ... PagerDuty was born from the idea that software development and operations could ... The importance of data resilience in the current cybersecurity climate.;https://itbrief.co.nz/story/a-nz-partners-win-big-at-microsoft-partner-of-the-year-awards;https;itbrief.co.nz;/story/a-nz-partners-win-big-at-microsoft-partner-of-the-year-awards;;;co;113.21.226.180;geolocation;{};NZ;New Zealand;Auckland;Auckland;174.6802978515625;-36.78810119628906;113.21.226.180;A/NZ partners win big at Microsoft Partner of the Year Awards;Jul 14, 2020 — Juniper Networks expands security offering for remote working. Juniper Networks has launched new solutions to enhance work from home security. ... PagerDuty was born from the idea that software development and operations could ... The importance of data resilience in the current cybersecurity climate.
11;2020-07-13;A/NZ partners win big at Microsoft Partner of the Year Awards;Jul 14, 2020 — Juniper Networks expands security offering for remote working. Juniper Networks has launched new solutions to enhance work from home security. ... PagerDuty was born from the idea that software development and operations could ... The importance of data resilience in the current cybersecurity climate.;https://itbrief.co.nz/story/a-nz-partners-win-big-at-microsoft-partner-of-the-year-awards;https;itbrief.co.nz;/story/a-nz-partners-win-big-at-microsoft-partner-of-the-year-awards;;;co;113.21.226.180;geolocation;{};NZ;New Zealand;Auckland;Auckland;174.6802978515625;-36.78810119628906;113.21.226.180;A/NZ partners win big at Microsoft Partner of the Year Awards;Jul 14, 2020 — Juniper Networks expands security offering for remote working. Juniper Networks has launched new solutions to enhance work from home security. ... PagerDuty was born from the idea that software development and operations could ... The importance of data resilience in the current cybersecurity climate.
12;2020-07-13;McKinsey_Initiative Chefsache_Report New ...;tection for the right to remote working or even more incentives to promote a better distributed use of ... flexible working, increase our resilience, ... percent of employees were able to work from home, in established companies, the proportion ... ceived for software development, they are now also used in many other sectors, ...;https://initiative-chefsache.de/content/uploads/2020/07/Initiative-Chefsache_Jahresreport2020-New-Work_en_compressed.pdf;https;initiative-chefsache.de;/content/uploads/2020/07/Initiative-Chefsache_Jahresreport2020-New-Work_en_compressed.pdf;;;initiative-chefsache;157.97.38.235;geolocation;{};DE;Germany;North Rhine-Westphalia;Espelkamp;8.683329582214355;52.366668701171875;157.97.38.235;McKinsey_Initiative Chefsache_Report New ...;tection for the right to remote working or even more incentives to promote a better distributed use of ... flexible working, increase our resilience, ... percent of employees were able to work from home, in established companies, the proportion ... ceived for software development, they are now also used in many other sectors, ...
13;2020-07-13;meaningful work for the digital professional - ACCA Global;reaching clients) and remote working (for reaching staff) that relate ... of software development before the costs of complexity kick in. This has ... SOFTWARE ENGINEERS WERE HELPFUL IN. HELPING ... deepest connection to work with long-term resilience ... Permanent Work-from-Home Positions' [website article], CNBC.;https://www.accaglobal.com/content/dam/ACCA_Global/professional-insights/MWDP/NarayananVaidyanathan.MeaningfulWork.pdf;https;www.accaglobal.com;/content/dam/ACCA_Global/professional-insights/MWDP/NarayananVaidyanathan.MeaningfulWork.pdf;;;accaglobal;45.60.44.54;geolocation;{};US;United States;Virginia;Ashburn;-77.47419738769531;39.043701171875;45.60.44.54;meaningful work for the digital professional - ACCA Global;reaching clients) and remote working (for reaching staff) that relate ... of software development before the costs of complexity kick in. This has ... SOFTWARE ENGINEERS WERE HELPFUL IN. HELPING ... deepest connection to work with long-term resilience ... Permanent Work-from-Home Positions' [website article], CNBC.
14;2020-07-13;Head - IT & Cisco System Infrastructure (10-20 yrs),Mumbai,IT ...;Jul 14, 2020 — To work on disaster recovery site on real time basis in the lowest down time. ... Lendingkart - Software Development Engineer III - Java/C++ ...;https://www.hirist.com/j/head-it-cisco-system-infrastructure-10-20-yrs-615812.html?ref=kp&pref=walkin;https;www.hirist.com;/j/head-it-cisco-system-infrastructure-10-20-yrs-615812.html;ref=kp&pref=walkin;;hirist;13.233.235.167;geolocation;{};IN;India;Maharashtra;Powai;72.87770080566406;19.076000213623047;13.233.235.167;Head - IT & Cisco System Infrastructure (10-20 yrs),Mumbai,IT ...;Jul 14, 2020 — To work on disaster recovery site on real time basis in the lowest down time. ... Lendingkart - Software Development Engineer III - Java/C++ ...
15;2020-07-13;Fractal Software Engineer Salaries | Glassdoor;Jul 14, 2020 — Work From Home (31 comments) ... COVID-19 has spelled disaster for most industries, but for CPG, the road ahead has changed altogether.;https://www.glassdoor.co.in/Monthly-Pay/Fractal-Software-Engineer-Monthly-Pay-E270403_D_KO8,25.htm;https;www.glassdoor.co.in;/Monthly-Pay/Fractal-Software-Engineer-Monthly-Pay-E270403_D_KO8,25.htm;;;co;104.16.117.102;geolocation;{};US;United States;Florida;Flagami;-80.31195831298828;25.762859344482422;104.16.117.102;Fractal Software Engineer Salaries | Glassdoor;Jul 14, 2020 — Work From Home (31 comments) ... COVID-19 has spelled disaster for most industries, but for CPG, the road ahead has changed altogether.
16;2020-07-13;Latest Technology trends for 2020 and beyond - Cyfuture;Jul 13, 2020 — With work-from-home becoming the new normal, it is expected that 40% of the ... Businesses seeking to shift their workers to a remote working arrangement ... media, shipping and delivery, disaster management, 3D geographic mapping, ... Mobile App Development · Software Development · Technology ...;https://cyfuture.com/blog/9-latest-technology-trends-that-will-impact-businesses-in-2020-and-beyond/;https;cyfuture.com;/blog/9-latest-technology-trends-that-will-impact-businesses-in-2020-and-beyond/;;;cyfuture;104.27.145.75;geolocation;{};US;United States;California;San Jose;-121.83822631835938;37.330528259277344;104.27.145.75;Latest Technology trends for 2020 and beyond - Cyfuture;Jul 13, 2020 — With work-from-home becoming the new normal, it is expected that 40% of the ... Businesses seeking to shift their workers to a remote working arrangement ... media, shipping and delivery, disaster management, 3D geographic mapping, ... Mobile App Development · Software Development · Technology ...
17;2020-07-13;Response to COVID-19 Onetechway - Global Rising in IT ...;All of Onetechway's employees have been asked to work from home, except for essential personnel ... software development processes, team management and other elements of ... Please find below our select materials on remote working. ... The pandemics response plan, along with the corporate disaster recovery and ...;https://onetechway.in/response-to-covid-19/;https;onetechway.in;/response-to-covid-19/;;;onetechway;104.18.42.235;geolocation;{};US;United States;Florida;Flagami;-80.31195831298828;25.762859344482422;104.18.42.235;Response to COVID-19 Onetechway - Global Rising in IT ...;All of Onetechway's employees have been asked to work from home, except for essential personnel ... software development processes, team management and other elements of ... Please find below our select materials on remote working. ... The pandemics response plan, along with the corporate disaster recovery and ...
18;2020-07-13;Dixons Carphone plc Annual Report and Accounts 2019/20 ...;Jul 14, 2020 — and entertained, to work from home ... Disaster recovery plans in place and tested for key IT ... in place new remote working capability for hundreds of ... ensured resilience during the disruption of supply chains ... £15m of asset impairments, primarily relating to software development costs and store assets.;https://www.dixonscarphone.com/sites/dixons-carphone-v2/files/dixon-v2/document/dixons-carphone-annual-report-and-accounts-201920.pdf;https;www.dixonscarphone.com;/sites/dixons-carphone-v2/files/dixon-v2/document/dixons-carphone-annual-report-and-accounts-201920.pdf;;;dixonscarphone;23.35.71.168;geolocation;{};US;United States;Illinois;Chicago;-87.67124938964844;41.84885025024414;23.35.71.168;Dixons Carphone plc Annual Report and Accounts 2019/20 ...;Jul 14, 2020 — and entertained, to work from home ... Disaster recovery plans in place and tested for key IT ... in place new remote working capability for hundreds of ... ensured resilience during the disruption of supply chains ... £15m of asset impairments, primarily relating to software development costs and store assets.
19;2020-07-13;Kaspersky unveils endpoint security solution for ... - iTWire;Jul 13, 2020 — Revisiting the pandemic as a test of national resilience. What… NEW TIME WEBINAR 3PM TOMORROW 25/9/20 Malcolm Turnbull and Peter ...;https://www.itwire.com/security/kaspersky-unveils-endpoint-security-solution-for-smaller-firms-with-limited-expertise.html;https;www.itwire.com;/security/kaspersky-unveils-endpoint-security-solution-for-smaller-firms-with-limited-expertise.html;;;itwire;101.0.65.50;geolocation;{};AU;Australia;New South Wales;Sydney;151.2071075439453;-33.86714172363281;101.0.65.50;Kaspersky unveils endpoint security solution for ... - iTWire;Jul 13, 2020 — Revisiting the pandemic as a test of national resilience. What… NEW TIME WEBINAR 3PM TOMORROW 25/9/20 Malcolm Turnbull and Peter ...
20;2020-07-13;Community Brands hiring BehaviourWatch Support Agent in ...;Jul 13, 2020 — ... attention to detail, a logical mind, resilience under pressure, enthusiasm for continual learning. ... SQL use, database administration, software development skills at any level. ... Data Entry Clerk Work From Home (Remote) ...;https://uk.linkedin.com/jobs/view/behaviourwatch-support-agent-at-community-brands-1919566048;https;uk.linkedin.com;/jobs/view/behaviourwatch-support-agent-at-community-brands-1919566048;;;linkedin;108.174.10.14;geolocation;{};US;United States;California;Sunnyvale;-122.01677703857422;37.38859939575195;108.174.10.14;Community Brands hiring BehaviourWatch Support Agent in ...;Jul 13, 2020 — ... attention to detail, a logical mind, resilience under pressure, enthusiasm for continual learning. ... SQL use, database administration, software development skills at any level. ... Data Entry Clerk Work From Home (Remote) ...
21;2020-07-13;GitHub Outage Impacts Millions of Developers: Issue Found ...;Jul 13, 2020 — The incident has raised fresh questions about GitHub's resilience in the ... driven by a swell in remote working staff in the wake of the pandemic, ...;https://www.cbronline.com/news/github-outage-impacts-millions-of-developers-issue-found-fix-coming;https;www.cbronline.com;/news/github-outage-impacts-millions-of-developers-issue-found-fix-coming;;;cbronline;23.185.0.3;geolocation;{};US;United States;California;San Francisco;-122.40872955322266;37.79093933105469;23.185.0.3;GitHub Outage Impacts Millions of Developers: Issue Found ...;Jul 13, 2020 — The incident has raised fresh questions about GitHub's resilience in the ... driven by a swell in remote working staff in the wake of the pandemic, ...
22;2020-07-13;Half of UK organisations question the relevance of SD WAN in ...;Jul 13, 2020 — Accelerate's report found that 58% of IT leaders say the key challenge of the Government's 'work from home' directive is managing remote ...;https://uktechnews.co.uk/2020/07/13/half-of-uk-organisations-question-the-relevance-of-sd-wan-in-a-covid-19-remote-workplace/;https;uktechnews.co.uk;/2020/07/13/half-of-uk-organisations-question-the-relevance-of-sd-wan-in-a-covid-19-remote-workplace/;;;co;172.67.159.16;geolocation;{};US;United States;California;San Francisco;-122.39286041259766;37.76784896850586;172.67.159.16;Half of UK organisations question the relevance of SD WAN in ...;Jul 13, 2020 — Accelerate's report found that 58% of IT leaders say the key challenge of the Government's 'work from home' directive is managing remote ...
23;2020-07-13;The Impact of Covid-19 on the Electronics Industry - Survey;Jul 14, 2020 — Aside from a mass migration to remote working as employees are told to ... For many, resilience and adaptability will be key over the next year.;https://www.bytesnap.com/electronics-industry-covid-19-survey/;https;www.bytesnap.com;/electronics-industry-covid-19-survey/;;;bytesnap;95.172.6.106;geolocation;{};GB;United Kingdom;England;Droitwich;-2.1740000247955322;52.237998962402344;95.172.6.106;The Impact of Covid-19 on the Electronics Industry - Survey;Jul 14, 2020 — Aside from a mass migration to remote working as employees are told to ... For many, resilience and adaptability will be key over the next year.
24;2020-07-13;News - RCWCorp Information Technology & Security Services;"Jul 14, 2020 — Work From Home in North America Sets Major Target for Russian Hackers. A Russian ransomware group named ""Evil Corp"" who was indicted ...";https://www.rcwcorp.com/latest-news/;https;www.rcwcorp.com;/latest-news/;;;rcwcorp;54.225.89.201;geolocation;{};US;United States;Virginia;Ashburn;-77.47419738769531;39.043701171875;54.225.89.201;News - RCWCorp Information Technology & Security Services;"Jul 14, 2020 — Work From Home in North America Sets Major Target for Russian Hackers. A Russian ransomware group named ""Evil Corp"" who was indicted ..."
25;2020-07-13;Gartner: Remote working shifts CIO priorities - Computer Weekly;Jul 13, 2020 — Business recovery from the coronavirus pandemic will lead to changes in the projects IT leaders focus on.;https://www.computerweekly.com/news/252486043/Gartner-Remote-working-shifts-CIO-priorities;https;www.computerweekly.com;/news/252486043/Gartner-Remote-working-shifts-CIO-priorities;;;computerweekly;206.19.49.153;geolocation;{};US;United States;Louisiana;Reddell;-92.42642211914062;30.675010681152344;206.19.49.153;Gartner: Remote working shifts CIO priorities - Computer Weekly;Jul 13, 2020 — Business recovery from the coronavirus pandemic will lead to changes in the projects IT leaders focus on.
26;2020-07-13;How COVID Pandemic is Making IT Operations Analyst Jobs ...;"Jul 13, 2020 — ... to cope with the sudden change to the WFH (work from home) concept. ... haves and have-nots"" of the software development and operations teams. ... The bottom line is that old-fashioned IT with old-fashioned thinking can lead to disaster. ... Because of the remote working situation, the number of daily ...";https://www.apmdigest.com/covid-pandemic-making-it-operations-analyst-jobs-more-stressful;https;www.apmdigest.com;/covid-pandemic-making-it-operations-analyst-jobs-more-stressful;;;apmdigest;67.225.240.47;geolocation;{};US;United States;Michigan;Holt;-84.63233947753906;42.718868255615234;67.225.240.47;How COVID Pandemic is Making IT Operations Analyst Jobs ...;"Jul 13, 2020 — ... to cope with the sudden change to the WFH (work from home) concept. ... haves and have-nots"" of the software development and operations teams. ... The bottom line is that old-fashioned IT with old-fashioned thinking can lead to disaster. ... Because of the remote working situation, the number of daily ..."
27;2020-07-13;Database Management – MS SQL - Custom Software ...;... confidential data from being breached was another concern. Client did not have any recovery strategy to restore and recover data in the event of a disaster.;https://ccs-technologies.com/mysql-database-database-management/?catid=73&postid=1204;https;ccs-technologies.com;/mysql-database-database-management/;catid=73&postid=1204;;ccs-technologies;35.154.42.59;geolocation;{};IN;India;Maharashtra;Powai;72.87770080566406;19.076000213623047;35.154.42.59;Database Management – MS SQL - Custom Software ...;... confidential data from being breached was another concern. Client did not have any recovery strategy to restore and recover data in the event of a disaster.
