;date;header;summary;link;protocol;domain;path;query;fragment;host_name;ip_address;Type;AdditionalData;CountryCode;CountryName;State;City;Longitude;Latitude;IpAddress;header_context_true;summary_context_true
61;2020-09-08;How US insurers can build a winning digital ... - McKinsey;Sep 9, 2020 — Employees in digital roles (software engineers, designers, product ... Many insurers are also considering how remote working can help them ...;https://www.mckinsey.com/industries/financial-services/our-insights/how-us-insurers-can-build-a-winning-digital-workforce-for-the-future;https;www.mckinsey.com;/industries/financial-services/our-insights/how-us-insurers-can-build-a-winning-digital-workforce-for-the-future;;;mckinsey;184.24.65.119;geolocation;{};US;United States;Virginia;Ashburn;-77.47419738769531;39.043701171875;184.24.65.119;How US insurers can build a winning digital ... - McKinsey;Sep 9, 2020 — Employees in digital roles (software engineers, designers, product ... Many insurers are also considering how remote working can help them ...
62;2020-09-08;Cloud growth outweighs Covid effect in APAC | IDG Connect;"Sep 9, 2020 — ... are seeking to make more use of remote working and conferencing; ... markets means the ability to provide in-country disaster recovery and ...";https://www.idgconnect.com/article/3583355/cloud-growth-outweighs-covid-effect-in-apac.html;https;www.idgconnect.com;/article/3583355/cloud-growth-outweighs-covid-effect-in-apac.html;;;idgconnect;151.101.2.165;geolocation;{};US;United States;California;San Francisco;-122.39286041259766;37.76784896850586;151.101.2.165;Cloud growth outweighs Covid effect in APAC | IDG Connect;"Sep 9, 2020 — ... are seeking to make more use of remote working and conferencing; ... markets means the ability to provide in-country disaster recovery and ..."
63;2020-09-08;CIO Leadership Moment – Session Two – TwelveDot;"You need a Disaster Recovery Plan – To ensure you restore critical business functions as quickly as possible; Resilience – A business needs to have a capability ...";https://twelvedot.com/cio-leadership-moment-session-two/;https;twelvedot.com;/cio-leadership-moment-session-two/;;;twelvedot;159.203.60.46;geolocation;{};CA;Canada;Ontario;Toronto;-79.51219177246094;43.70317077636719;159.203.60.46;CIO Leadership Moment – Session Two – TwelveDot;"You need a Disaster Recovery Plan – To ensure you restore critical business functions as quickly as possible; Resilience – A business needs to have a capability ..."
64;2020-09-08;AWS Global Accounts Senior Solutions Architect | Work From ...;Experience with cloud solutions, virtual platforms, software development experience, and operational ... Understanding of security, risk and compliance frameworks, disaster recovery, high availability ... Search Work-from-home Jobs ...;https://wfhjobs.us/job/aws-global-accounts-senior-solutions-architect-at-amazon-in-houston-tx/;https;wfhjobs.us;/job/aws-global-accounts-senior-solutions-architect-at-amazon-in-houston-tx/;;;wfhjobs;35.244.220.179;geolocation;{};US;United States;Kansas;Prairie Village;-94.53961181640625;39.10771179199219;35.244.220.179;AWS Global Accounts Senior Solutions Architect | Work From ...;Experience with cloud solutions, virtual platforms, software development experience, and operational ... Understanding of security, risk and compliance frameworks, disaster recovery, high availability ... Search Work-from-home Jobs ...
65;2020-09-08;How to Easily Adjust Your Business During COVID-19;Sep 8, 2020 — Businesses that implement the work-from-home protocol may not need ... EIDLs, or Economic Injury Disaster Loans, can cover revenue losses ...;https://businessingmag.com/11899/strategy/covid-adjustments/;https;businessingmag.com;/11899/strategy/covid-adjustments/;;;businessingmag;104.28.27.23;geolocation;{};US;United States;New Jersey;Newark;-74.19452667236328;40.738731384277344;104.28.27.23;How to Easily Adjust Your Business During COVID-19;Sep 8, 2020 — Businesses that implement the work-from-home protocol may not need ... EIDLs, or Economic Injury Disaster Loans, can cover revenue losses ...
66;2020-09-08;Marketing Communications Manager at PureStake • Boston ...;"... particularly software engineers/developers; Excellent communication skills (verbal and written); Able to work self-sufficiently and remotely in a dynamic startup ...";https://angel.co/company/purestake/jobs/967119-marketing-communications-manager;https;angel.co;/company/purestake/jobs/967119-marketing-communications-manager;;;angel;104.18.24.39;geolocation;{};US;United States;California;San Jose;-121.83822631835938;37.330528259277344;104.18.24.39;Marketing Communications Manager at PureStake • Boston ...;"... particularly software engineers/developers; Excellent communication skills (verbal and written); Able to work self-sufficiently and remotely in a dynamic startup ..."
67;2020-09-08;Software Engineer NEW! | Alpharetta, Georgia | NetDocuments;Work from home Posted 22 hours ago Software Engineer ... failure-resistant architectures, including disaster recovery, backups, failover, etc. ... FiservAlpharetta, Georgia What does a great Software Development Engineer, Tech Lead do?;https://jobsearcher.com/j/software-engineer-new-at-netdocuments-in-alpharetta-georgia-vRGM88Z;https;jobsearcher.com;/j/software-engineer-new-at-netdocuments-in-alpharetta-georgia-vRGM88Z;;;jobsearcher;52.21.160.98;geolocation;{};US;United States;Virginia;Ashburn;-77.47419738769531;39.043701171875;52.21.160.98;Software Engineer NEW! | Alpharetta, Georgia | NetDocuments;Work from home Posted 22 hours ago Software Engineer ... failure-resistant architectures, including disaster recovery, backups, failover, etc. ... FiservAlpharetta, Georgia What does a great Software Development Engineer, Tech Lead do?
68;2020-09-08;Practicing Resilience - Cyient;Sep 8, 2020 — With work from home having become the norm, this inevitably has meant changes in behaviors and ways of working for all of us. But building ...;https://www.cyient.com/blog/corporate/leadership/practicing-resilience;https;www.cyient.com;/blog/corporate/leadership/practicing-resilience;;;cyient;104.17.115.180;geolocation;{};US;United States;California;San Jose;-121.83822631835938;37.330528259277344;104.17.115.180;Practicing Resilience - Cyient;Sep 8, 2020 — With work from home having become the norm, this inevitably has meant changes in behaviors and ways of working for all of us. But building ...
69;2020-09-08;4 ways cloud ERP helps organisations build resilience and ...;Sep 9, 2020 — 4 ways cloud ERP helps organisations build resilience and agility ... COVID-19 has certainly accelerated and intensified the focus on remote working, with a ... PagerDuty was born from the idea that software development and ...;https://cfotech.com.au/story/4-ways-cloud-erp-helps-organisations-build-resilience-and-agility;https;cfotech.com.au;/story/4-ways-cloud-erp-helps-organisations-build-resilience-and-agility;;;com;113.21.226.180;geolocation;{};NZ;New Zealand;Auckland;Auckland;174.6802978515625;-36.78810119628906;113.21.226.180;4 ways cloud ERP helps organisations build resilience and ...;Sep 9, 2020 — 4 ways cloud ERP helps organisations build resilience and agility ... COVID-19 has certainly accelerated and intensified the focus on remote working, with a ... PagerDuty was born from the idea that software development and ...
70;2020-09-08;4 ways cloud ERP helps organisations build resilience and ...;Sep 9, 2020 — 4 ways cloud ERP helps organisations build resilience and agility ... COVID-19 has certainly accelerated and intensified the focus on remote working, with a ... PagerDuty was born from the idea that software development and ...;https://cfotech.com.au/story/4-ways-cloud-erp-helps-organisations-build-resilience-and-agility;https;cfotech.com.au;/story/4-ways-cloud-erp-helps-organisations-build-resilience-and-agility;;;com;113.21.226.180;geolocation;{};NZ;New Zealand;Auckland;Auckland;174.6802978515625;-36.78810119628906;113.21.226.180;4 ways cloud ERP helps organisations build resilience and ...;Sep 9, 2020 — 4 ways cloud ERP helps organisations build resilience and agility ... COVID-19 has certainly accelerated and intensified the focus on remote working, with a ... PagerDuty was born from the idea that software development and ...
71;2020-09-08;4 ways cloud ERP helps organisations build resilience and ...;Sep 9, 2020 — 4 ways cloud ERP helps organisations build resilience and agility ... COVID-19 has certainly accelerated and intensified the focus on remote working, with a ... PagerDuty was born from the idea that software development and ...;https://cfotech.com.au/story/4-ways-cloud-erp-helps-organisations-build-resilience-and-agility;https;cfotech.com.au;/story/4-ways-cloud-erp-helps-organisations-build-resilience-and-agility;;;com;113.21.226.180;geolocation;{};NZ;New Zealand;Auckland;Auckland;174.6802978515625;-36.78810119628906;113.21.226.180;4 ways cloud ERP helps organisations build resilience and ...;Sep 9, 2020 — 4 ways cloud ERP helps organisations build resilience and agility ... COVID-19 has certainly accelerated and intensified the focus on remote working, with a ... PagerDuty was born from the idea that software development and ...
72;2020-09-08;What Business Should Expect From the Future of Work | TEAM ...;Sep 9, 2020 — To manage the rapid changes and avoid failures, we share guidelines for effective remote working. ... Software Development Outsourcing · Automation Services · Software ... all the advantages of remote working, we've asked our managers to ... Consequently, businesses will gain the necessary resilience, ...;https://www.teaminternational.com/the-future-of-work/;https;www.teaminternational.com;/the-future-of-work/;;;teaminternational;52.185.68.16;geolocation;{};US;United States;Iowa;Des Moines;-93.60652160644531;41.600440979003906;52.185.68.16;What Business Should Expect From the Future of Work | TEAM ...;Sep 9, 2020 — To manage the rapid changes and avoid failures, we share guidelines for effective remote working. ... Software Development Outsourcing · Automation Services · Software ... all the advantages of remote working, we've asked our managers to ... Consequently, businesses will gain the necessary resilience, ...
73;2020-09-08;Taraxa is here to help companies innovate and unlock ...;Sep 9, 2020 — This will create a productivity disaster for firms', says Nicholas Bloom ... are evolving their approach to inhouse software development in favor of ...;https://medium.com/taraxa-project/taraxa-is-here-to-help-unlock-workforce-productivity-and-help-companies-innovate-a1523ab510c2;https;medium.com;/taraxa-project/taraxa-is-here-to-help-unlock-workforce-productivity-and-help-companies-innovate-a1523ab510c2;;;medium;104.16.120.127;geolocation;{};US;United States;California;San Jose;-121.83822631835938;37.330528259277344;104.16.120.127;Taraxa is here to help companies innovate and unlock ...;Sep 9, 2020 — This will create a productivity disaster for firms', says Nicholas Bloom ... are evolving their approach to inhouse software development in favor of ...
74;2020-09-08;Powering the Business With Resilience: DTCC's Chief ...;Sep 8, 2020 — Resilience is critical to our security strategy because of the important role we play ... Traditional disaster planning includes things like moving workloads to other ... The transition to remote working was relatively seamless because we had ... most demanding architecture and software development problems.;https://deloitte.wsj.com/cio/2020/09/08/powering-the-business-with-resilience-dtccs-chief-security-officer-stephen-scharf/;https;deloitte.wsj.com;/cio/2020/09/08/powering-the-business-with-resilience-dtccs-chief-security-officer-stephen-scharf/;;;wsj;13.226.18.117;geolocation;{};US;United States;Illinois;Chicago;-87.67124938964844;41.84885025024414;13.226.18.117;Powering the Business With Resilience: DTCC's Chief ...;Sep 8, 2020 — Resilience is critical to our security strategy because of the important role we play ... Traditional disaster planning includes things like moving workloads to other ... The transition to remote working was relatively seamless because we had ... most demanding architecture and software development problems.
75;2020-09-08;Why enterprises should hire remote devops developer;Sep 9, 2020 — The new normal is driving software development firms to create a culture of remote working and shift towards true digital transformation in ...;https://www.softwebsolutions.com/resources/hire-remote-devops-engineers.html;https;www.softwebsolutions.com;/resources/hire-remote-devops-engineers.html;;;softwebsolutions;97.74.228.176;geolocation;{};US;United States;Arizona;Scottsdale;-111.89010620117188;33.610958099365234;97.74.228.176;Why enterprises should hire remote devops developer;Sep 9, 2020 — The new normal is driving software development firms to create a culture of remote working and shift towards true digital transformation in ...
76;2020-09-08;Back to School Check-In: You're Not Alone - IT Peer Network;Sep 9, 2020 — ... trying to juggle a fluid world of work from home and school schedules. ... kindness and resilience while facing the previously unimaginable.;https://itpeernetwork.intel.com/back-to-school-check-in-youre-not-alone/;https;itpeernetwork.intel.com;/back-to-school-check-in-youre-not-alone/;;;intel;23.200.60.6;geolocation;{};US;United States;Illinois;Chicago;-87.67124938964844;41.84885025024414;23.200.60.6;Back to School Check-In: You're Not Alone - IT Peer Network;Sep 9, 2020 — ... trying to juggle a fluid world of work from home and school schedules. ... kindness and resilience while facing the previously unimaginable.
77;2020-09-08;Q&A: Maintaining business continuity in the isolation era ...;Sep 9, 2020 — Steinhardt: Historically, organizations have focused far too much just on traditional disaster recovery with things that have been around a long ...;https://siliconangle.com/2020/09/09/qa-maintaining-business-continuity-isolation-era-cubeconversations/;https;siliconangle.com;/2020/09/09/qa-maintaining-business-continuity-isolation-era-cubeconversations/;;;siliconangle;34.219.151.177;geolocation;{};US;United States;Oregon;Boardman;-119.6989974975586;45.83599853515625;34.219.151.177;Q&A: Maintaining business continuity in the isolation era ...;Sep 9, 2020 — Steinhardt: Historically, organizations have focused far too much just on traditional disaster recovery with things that have been around a long ...
78;2020-09-08;New Engen Reviews | Glassdoor;Sep 8, 2020 — It was an unmitigated disaster. ... -Kind and understanding leadership -Flexibility (you can occasionally work from home - but not excessively, ...;https://www.glassdoor.com/Reviews/New-Engen-Reviews-E2080483.htm;https;www.glassdoor.com;/Reviews/New-Engen-Reviews-E2080483.htm;;;glassdoor;104.17.91.51;geolocation;{};US;United States;Florida;Flagami;-80.31195831298828;25.762859344482422;104.17.91.51;New Engen Reviews | Glassdoor;Sep 8, 2020 — It was an unmitigated disaster. ... -Kind and understanding leadership -Flexibility (you can occasionally work from home - but not excessively, ...
79;2020-09-08;Journal New size - IABM;Sep 9, 2020 — mitigate the effects of mandatory remote working. I don't expect a ... our worldwide staff to long-term work-from-home arrangements and restricting ... and resilience from future crises and shocks. ... and launched a unique disaster recovery ... external software development going on, depending on the type of ...;https://theiabm.org/wp-content/uploads/2020/09/Journal-114-2020-web-version.pdf;https;theiabm.org;/wp-content/uploads/2020/09/Journal-114-2020-web-version.pdf;;;theiabm;3.135.94.194;geolocation;{};US;United States;Ohio;Columbus;-82.99945831298828;39.99557876586914;3.135.94.194;Journal New size - IABM;Sep 9, 2020 — mitigate the effects of mandatory remote working. I don't expect a ... our worldwide staff to long-term work-from-home arrangements and restricting ... and resilience from future crises and shocks. ... and launched a unique disaster recovery ... external software development going on, depending on the type of ...
80;2020-09-08;Struggles of the Cloud — Survival Tactics from Two GitLab ...;Sep 8, 2020 — GitLab is a single application for the entire software development lifecycle. ... some valuable insights about how to do remote working properly.;https://thenewstack.io/struggles-of-the-cloud-survival-tactics-from-two-gitlab-experts/;https;thenewstack.io;/struggles-of-the-cloud-survival-tactics-from-two-gitlab-experts/;;;thenewstack;45.55.105.149;geolocation;{};US;United States;New York;Manhattan;-73.97901916503906;40.7589111328125;45.55.105.149;Struggles of the Cloud — Survival Tactics from Two GitLab ...;Sep 8, 2020 — GitLab is a single application for the entire software development lifecycle. ... some valuable insights about how to do remote working properly.
81;2020-09-08;Etisalat announces the launch of 'Etisalat Smart CloudTalk ...;Sep 8, 2020 — ... the businesses with its remote working capabilities supported by our ... application programming interfaces (API) and software development ...;http://channelpostmea.com/2020/09/08/etisalat-announces-launch-etisalat-smart-cloud-talk/;http;channelpostmea.com;/2020/09/08/etisalat-announces-launch-etisalat-smart-cloud-talk/;;;channelpostmea;35.242.133.15;geolocation;{};GB;United Kingdom;England;Barnet;-0.22333000600337982;51.6127815246582;35.242.133.15;Etisalat announces the launch of 'Etisalat Smart CloudTalk ...;Sep 8, 2020 — ... the businesses with its remote working capabilities supported by our ... application programming interfaces (API) and software development ...
82;2020-09-08;Leder | 'We Can't Just Limp Along': Americans Reinvent Fall;Sep 8, 2020 — 7, 2020 4:49 pm ETSonia Dillane, a software development engineer at Amazon.com Inc., won't be remote working at the kitchen table in ... summer vacations essentially got cancelled and we limped from disaster to disaster.;https://headtopics.com/us/we-can-t-just-limp-along-americans-reinvent-fall-15494684;https;headtopics.com;/us/we-can-t-just-limp-along-americans-reinvent-fall-15494684;;;headtopics;167.86.103.230;geolocation;{};DE;Germany;Bavaria;Munich;11.607399940490723;48.1088981628418;167.86.103.230;Leder | 'We Can't Just Limp Along': Americans Reinvent Fall;Sep 8, 2020 — 7, 2020 4:49 pm ETSonia Dillane, a software development engineer at Amazon.com Inc., won't be remote working at the kitchen table in ... summer vacations essentially got cancelled and we limped from disaster to disaster.
83;2020-09-08;Digital Acceleration and Transformation: The A-Z Guide;Sep 8, 2020 — Among other things, cloud computing enables remote working, a capability ... plummeted in value, the use of remote working software has skyrocketed. ... Though this approach originated in software development, it has spread ... of the business, from employee performance to organizational resilience.;https://www.digital-adoption.com/digital-acceleration/;https;www.digital-adoption.com;/digital-acceleration/;;;digital-adoption;162.210.96.127;geolocation;{};US;United States;Florida;Pompano Beach;-80.2654037475586;26.243640899658203;162.210.96.127;Digital Acceleration and Transformation: The A-Z Guide;Sep 8, 2020 — Among other things, cloud computing enables remote working, a capability ... plummeted in value, the use of remote working software has skyrocketed. ... Though this approach originated in software development, it has spread ... of the business, from employee performance to organizational resilience.
84;2020-09-08;Tech partnerships becoming more equal - report;Sep 9, 2020 — PagerDuty was born from the idea that software development and operations ... Juniper Networks expands security offering for remote working. Juniper Networks has launched new solutions to enhance work from home security.More ... Accurics, a cloud cyber resilience company specialising in cloud native ...;https://itbrief.com.au/story/tech-partnerships-becoming-more-equal-report;https;itbrief.com.au;/story/tech-partnerships-becoming-more-equal-report;;;com;113.21.226.180;geolocation;{};NZ;New Zealand;Auckland;Auckland;174.6802978515625;-36.78810119628906;113.21.226.180;Tech partnerships becoming more equal - report;Sep 9, 2020 — PagerDuty was born from the idea that software development and operations ... Juniper Networks expands security offering for remote working. Juniper Networks has launched new solutions to enhance work from home security.More ... Accurics, a cloud cyber resilience company specialising in cloud native ...
85;2020-09-08;Tech partnerships becoming more equal - report;Sep 9, 2020 — PagerDuty was born from the idea that software development and operations ... Juniper Networks expands security offering for remote working. Juniper Networks has launched new solutions to enhance work from home security.More ... Accurics, a cloud cyber resilience company specialising in cloud native ...;https://itbrief.com.au/story/tech-partnerships-becoming-more-equal-report;https;itbrief.com.au;/story/tech-partnerships-becoming-more-equal-report;;;com;113.21.226.180;geolocation;{};NZ;New Zealand;Auckland;Auckland;174.6802978515625;-36.78810119628906;113.21.226.180;Tech partnerships becoming more equal - report;Sep 9, 2020 — PagerDuty was born from the idea that software development and operations ... Juniper Networks expands security offering for remote working. Juniper Networks has launched new solutions to enhance work from home security.More ... Accurics, a cloud cyber resilience company specialising in cloud native ...
86;2020-09-08;Tech partnerships becoming more equal - report;Sep 9, 2020 — PagerDuty was born from the idea that software development and operations ... Juniper Networks expands security offering for remote working. Juniper Networks has launched new solutions to enhance work from home security.More ... Accurics, a cloud cyber resilience company specialising in cloud native ...;https://itbrief.com.au/story/tech-partnerships-becoming-more-equal-report;https;itbrief.com.au;/story/tech-partnerships-becoming-more-equal-report;;;com;113.21.226.180;geolocation;{};NZ;New Zealand;Auckland;Auckland;174.6802978515625;-36.78810119628906;113.21.226.180;Tech partnerships becoming more equal - report;Sep 9, 2020 — PagerDuty was born from the idea that software development and operations ... Juniper Networks expands security offering for remote working. Juniper Networks has launched new solutions to enhance work from home security.More ... Accurics, a cloud cyber resilience company specialising in cloud native ...
87;2020-09-08;Volvo CEO shares keys to rapid rebound, potential gains from ...;Sep 8, 2020 — That is why I think we will have people work from home about 20 ... U.S. and our software development operations in Mountain View, California.;https://europe.autonews.com/automakers/volvo-ceo-shares-keys-rapid-rebound-potential-gains-geely-merger;https;europe.autonews.com;/automakers/volvo-ceo-shares-keys-rapid-rebound-potential-gains-geely-merger;;;autonews;104.18.73.87;geolocation;{};US;United States;Florida;Flagami;-80.31195831298828;25.762859344482422;104.18.73.87;Volvo CEO shares keys to rapid rebound, potential gains from ...;Sep 8, 2020 — That is why I think we will have people work from home about 20 ... U.S. and our software development operations in Mountain View, California.
88;2020-09-08;Acronis Microsoft 365 Cloud Backup – Precept IT;Remote Working · Bitdefender GravityZone · Vade Secure for Microsoft 365 · Vade ... Solutions – Backup · Solutions – Mailbox · Cloud Backup + Disaster Recovery ... Cisco Support · Software Development · Database Support · Linux & Unix ...;https://precept.it/acronis-microsoft-365-cloud-backup/;https;precept.it;/acronis-microsoft-365-cloud-backup/;;;precept;80.95.186.241;geolocation;{};GB;United Kingdom;Northern Ireland;Belfast;-5.917500019073486;54.59611129760742;80.95.186.241;Acronis Microsoft 365 Cloud Backup – Precept IT;Remote Working · Bitdefender GravityZone · Vade Secure for Microsoft 365 · Vade ... Solutions – Backup · Solutions – Mailbox · Cloud Backup + Disaster Recovery ... Cisco Support · Software Development · Database Support · Linux & Unix ...
89;2020-09-08;Creating Connections: Turn challenges into opportunities.;Sep 8, 2020 — Join this week-long festival to celebrate the power of resilience amongst ... Women in Tech | Insider advice from female software engineers ... could be lost due to the work-from-home (WFH) dynamic caused by this pandemic.;https://thecyberwire.com/newsletters/creating-connections/1/2;https;thecyberwire.com;/newsletters/creating-connections/1/2;;;thecyberwire;99.84.251.91;geolocation;{};US;United States;Illinois;Chicago;-87.67124938964844;41.84885025024414;99.84.251.91;Creating Connections: Turn challenges into opportunities.;Sep 8, 2020 — Join this week-long festival to celebrate the power of resilience amongst ... Women in Tech | Insider advice from female software engineers ... could be lost due to the work-from-home (WFH) dynamic caused by this pandemic.
