;date;header;summary;link;protocol;domain;path;query;fragment;host_name;ip_address;Type;AdditionalData;CountryCode;CountryName;State;City;Longitude;Latitude;IpAddress;header_context_true;summary_context_true
0;2020-06-18;Covid-19 remote working leads to more productive tech teams ...;Jun 18, 2020 — With remote working seemingly here to stay, Digiterre spoke to ... Despite the logistical challenges, productivity in software development teams has gone up, ... hybrid and multi-cloud strategies, leading to resilience and cost reductions. ... FCA turns the screws on compliance in work-from-home environment ...;https://www.finextra.com/newsarticle/36045/covid-19-remote-working-leads-to-more-productive-tech-teams---survey;https;www.finextra.com;/newsarticle/36045/covid-19-remote-working-leads-to-more-productive-tech-teams---survey;;;finextra;89.234.26.98;geolocation;{};GB;United Kingdom;England;City of Westminster;-0.19916999340057373;51.49555969238281;89.234.26.98;Covid-19 remote working leads to more productive tech teams ...;Jun 18, 2020 — With remote working seemingly here to stay, Digiterre spoke to ... Despite the logistical challenges, productivity in software development teams has gone up, ... hybrid and multi-cloud strategies, leading to resilience and cost reductions. ... FCA turns the screws on compliance in work-from-home environment ...
1;2020-06-18;Product Analyst | Reynoldsburg, Ohio | Mast Global;Responsibilities span every aspect of Agile software development, including ... as a Service (IaaS) and Disaster Recovery as a Service (DRaaS) solutions to SMB, ... Grange InsuranceColumbus, OH This remote work from home position is ...;https://jobsearcher.com/j/product-analyst-at-mast-global-in-reynoldsburg-ohio-G8AbMO;https;jobsearcher.com;/j/product-analyst-at-mast-global-in-reynoldsburg-ohio-G8AbMO;;;jobsearcher;52.21.160.98;geolocation;{};US;United States;Virginia;Ashburn;-77.47419738769531;39.043701171875;52.21.160.98;Product Analyst | Reynoldsburg, Ohio | Mast Global;Responsibilities span every aspect of Agile software development, including ... as a Service (IaaS) and Disaster Recovery as a Service (DRaaS) solutions to SMB, ... Grange InsuranceColumbus, OH This remote work from home position is ...
2;2020-06-18;Productivity tips for programmers that no one will tell you about;Jun 18, 2020 — Top 5 custom software development companies in the world. Custom software development allows you to tailor your software products to ...;https://knowtechie.com/productivity-tips-for-programmers-that-no-one-will-tell-you-about/;https;knowtechie.com;/productivity-tips-for-programmers-that-no-one-will-tell-you-about/;;;knowtechie;146.148.59.197;geolocation;{};US;United States;Iowa;Council Bluffs;-95.87735748291016;41.23295974731445;146.148.59.197;Productivity tips for programmers that no one will tell you about;Jun 18, 2020 — Top 5 custom software development companies in the world. Custom software development allows you to tailor your software products to ...
3;2020-06-18;Veeam pushes ahead across data protection portfolio - iTWire;Jun 18, 2020 — AWS disaster recovery to protect against regional outages by replicating and recovering Amazon Elastic Block Store (Amazon EBS) snapshots ...;https://www.itwire.com/business-it-news/data/veeam-pushes-ahead-across-data-protection-portfolio.html;https;www.itwire.com;/business-it-news/data/veeam-pushes-ahead-across-data-protection-portfolio.html;;;itwire;101.0.65.50;geolocation;{};AU;Australia;New South Wales;Sydney;151.2071075439453;-33.86714172363281;101.0.65.50;Veeam pushes ahead across data protection portfolio - iTWire;Jun 18, 2020 — AWS disaster recovery to protect against regional outages by replicating and recovering Amazon Elastic Block Store (Amazon EBS) snapshots ...
4;2020-06-18;Arcserve India - Windows Kernel Developer - OOPS/Device ...;Jun 18, 2020 — ... responsible for developing and maintaining File System drivers on Windows platforms for High Availability and Disaster Recovery product.;https://www.hirist.com/j/arcserve-india-windows-kernel-developer-oopsdevice-driver-7-13-yrs-605860.html?ref=rl&pref=walkin;https;www.hirist.com;/j/arcserve-india-windows-kernel-developer-oopsdevice-driver-7-13-yrs-605860.html;ref=rl&pref=walkin;;hirist;3.7.36.164;geolocation;{};IN;India;Maharashtra;Powai;72.87770080566406;19.076000213623047;3.7.36.164;Arcserve India - Windows Kernel Developer - OOPS/Device ...;Jun 18, 2020 — ... responsible for developing and maintaining File System drivers on Windows platforms for High Availability and Disaster Recovery product.
5;2020-06-18;Microsoft Senior Design Manager Salaries | Glassdoor;Jun 19, 2020 — Work From Home (87 comments) ... of: Bellevue Bravern Entrance Microsoft photo of: Our software development centers are located all over the ...;https://www.glassdoor.co.in/Salary/Microsoft-Senior-Design-Manager-Salaries-E1651_D_KO10,31.htm;https;www.glassdoor.co.in;/Salary/Microsoft-Senior-Design-Manager-Salaries-E1651_D_KO10,31.htm;;;co;104.16.118.102;geolocation;{};US;United States;California;San Jose;-121.83822631835938;37.330528259277344;104.16.118.102;Microsoft Senior Design Manager Salaries | Glassdoor;Jun 19, 2020 — Work From Home (87 comments) ... of: Bellevue Bravern Entrance Microsoft photo of: Our software development centers are located all over the ...
6;2020-06-18;Annual Activity and Corporate Social Responsibility ... - CAE;Jun 18, 2020 — demand recovers and shows resilience as air travel's contribution to global ... remote working became of major importance in this new reality. ... major disaster response. Building on our aviation ... needed to work from home and were up and running in no ... systems and software development and support ...;https://www.cae.com/media/documents/Corporate/Financial_Reports/2020/Activity_Report_2020_Web_EN.pdf;https;www.cae.com;/media/documents/Corporate/Financial_Reports/2020/Activity_Report_2020_Web_EN.pdf;;;cae;104.20.46.72;geolocation;{};US;United States;California;San Jose;-121.83822631835938;37.330528259277344;104.20.46.72;Annual Activity and Corporate Social Responsibility ... - CAE;Jun 18, 2020 — demand recovers and shows resilience as air travel's contribution to global ... remote working became of major importance in this new reality. ... major disaster response. Building on our aviation ... needed to work from home and were up and running in no ... systems and software development and support ...
7;2020-06-18;Building the Perfect Mobile Application Using Airbnb as a ...;Jun 19, 2020 — ... she is generally found reading journals and discussing with the professional software development team on the same. A tech geek by nature, ...;https://www.anthonygaenzle.com/mobile-application-development/;https;www.anthonygaenzle.com;/mobile-application-development/;;;anthonygaenzle;140.82.3.183;geolocation;{};US;United States;New Jersey;South Plainfield;-74.46468353271484;40.551761627197266;140.82.3.183;Building the Perfect Mobile Application Using Airbnb as a ...;Jun 19, 2020 — ... she is generally found reading journals and discussing with the professional software development team on the same. A tech geek by nature, ...
8;2020-06-18;NICU In-Patient Concurrent Review Nurse RN job in ... - Lensa;Jun 19, 2020 — Location: This position will allow you to work from home. Nevada State preferred. Required Work Hours: Pacific Coast Time Zone - 8am - 5pm, ...;https://lensa.com/nicu-in-patient-concurrent-review-nurse-rn-jobs/montebello/jd/d3edf72b16469c01a1fc08d28137f2fa;https;lensa.com;/nicu-in-patient-concurrent-review-nurse-rn-jobs/montebello/jd/d3edf72b16469c01a1fc08d28137f2fa;;;lensa;34.239.99.75;geolocation;{};US;United States;Virginia;Ashburn;-77.47419738769531;39.043701171875;34.239.99.75;NICU In-Patient Concurrent Review Nurse RN job in ... - Lensa;Jun 19, 2020 — Location: This position will allow you to work from home. Nevada State preferred. Required Work Hours: Pacific Coast Time Zone - 8am - 5pm, ...
9;2020-06-18;PayScale Reviews | Glassdoor;Q2 numbers will be a disaster that they will blame on COVID. Any good salesperson candidate will ask about numbers pre-COVID and success against comp ...;https://www.glassdoor.com/Reviews/PayScale-Reviews-E158711.htm;https;www.glassdoor.com;/Reviews/PayScale-Reviews-E158711.htm;;;glassdoor;104.17.91.51;geolocation;{};US;United States;Florida;Flagami;-80.31195831298828;25.762859344482422;104.17.91.51;PayScale Reviews | Glassdoor;Q2 numbers will be a disaster that they will blame on COVID. Any good salesperson candidate will ask about numbers pre-COVID and success against comp ...
10;2020-06-18;Economic Perspectives June 2020 - KBC Group;Jun 19, 2020 — Some degree of work-from-home measures, for example, are still in place ... The new Recovery and Resilience Facility to be created is the most ...;https://www.kbc.com/en/economics/publications/economic-perspectives-june-2020.html;https;www.kbc.com;/en/economics/publications/economic-perspectives-june-2020.html;;;kbc;2.21.33.72;geolocation;{};IE;Ireland;Leinster;Dublin;-6.243330001831055;53.35388946533203;2.21.33.72;Economic Perspectives June 2020 - KBC Group;Jun 19, 2020 — Some degree of work-from-home measures, for example, are still in place ... The new Recovery and Resilience Facility to be created is the most ...
11;2020-06-18;Software Engineer Senior/ DevOps/ Orlando, FL job opening ...;Jun 18, 2020 — Description:Lockheed Martin is looking for software engineers with experience in configuring and integrating Continuous Integration/Continuous ...;https://employzone.com/job-view/us-florida-apopka/software-engineer-senior-devops-orlando-fl/lockheed-martin/2807153193-ex;https;employzone.com;/job-view/us-florida-apopka/software-engineer-senior-devops-orlando-fl/lockheed-martin/2807153193-ex;;;employzone;104.26.12.19;geolocation;{};US;United States;California;San Jose;-121.83822631835938;37.330528259277344;104.26.12.19;Software Engineer Senior/ DevOps/ Orlando, FL job opening ...;Jun 18, 2020 — Description:Lockheed Martin is looking for software engineers with experience in configuring and integrating Continuous Integration/Continuous ...
12;2020-06-18;ESG Databook - Nomura Research Institute;Jun 18, 2020 — We have instituted business continuity and disaster recovery plans especially for those ... *1 Offshoring: Outsourcing software development and systems ... to schedule work from home or a satellite office up to a limit of 100 days per year. ... economic and environmental risks to organizational resilience and ...;https://www.nri.com/-/media/Corporate/en/Files/PDF/sustainability/library/back_number/ESG_Databook_2020_e.pdf?la=en&hash=44B4AEB96AD5D0039F0F0D01788AD1D99B7C60FD;https;www.nri.com;/-/media/Corporate/en/Files/PDF/sustainability/library/back_number/ESG_Databook_2020_e.pdf;la=en&hash=44B4AEB96AD5D0039F0F0D01788AD1D99B7C60FD;;nri;13.226.18.47;geolocation;{};US;United States;Illinois;Chicago;-87.67124938964844;41.84885025024414;13.226.18.47;ESG Databook - Nomura Research Institute;Jun 18, 2020 — We have instituted business continuity and disaster recovery plans especially for those ... *1 Offshoring: Outsourcing software development and systems ... to schedule work from home or a satellite office up to a limit of 100 days per year. ... economic and environmental risks to organizational resilience and ...
13;2020-06-18;Multitech | IT Outsourcing Services;Software Development. Full-service bespoke software ... Remote Working. Providing flexibility to ... Backup, Storage and Disaster Recovery. Lorem insum dolor ...;https://mtos.co.uk/;https;mtos.co.uk;/;;;co;35.214.61.228;geolocation;{};GB;United Kingdom;England;South Croydon;-0.10417000204324722;51.35028076171875;35.214.61.228;Multitech | IT Outsourcing Services;Software Development. Full-service bespoke software ... Remote Working. Providing flexibility to ... Backup, Storage and Disaster Recovery. Lorem insum dolor ...
14;2020-06-18;SAS announces latest version of Viya, bringing advanced ...;Jun 19, 2020 — The importance of data resilience in the current cybersecurity climate ... Juniper Networks expands security offering for remote working. Juniper Networks has launched new solutions to enhance work from home security. ... PagerDuty was born from the idea that software development and operations could ...;https://itbrief.co.nz/story/sas-announces-latest-version-of-viya-bringing-advanced-analytics-to-businesses;https;itbrief.co.nz;/story/sas-announces-latest-version-of-viya-bringing-advanced-analytics-to-businesses;;;co;113.21.226.180;geolocation;{};NZ;New Zealand;Auckland;Auckland;174.6802978515625;-36.78810119628906;113.21.226.180;SAS announces latest version of Viya, bringing advanced ...;Jun 19, 2020 — The importance of data resilience in the current cybersecurity climate ... Juniper Networks expands security offering for remote working. Juniper Networks has launched new solutions to enhance work from home security. ... PagerDuty was born from the idea that software development and operations could ...
15;2020-06-18;SAS announces latest version of Viya, bringing advanced ...;Jun 19, 2020 — The importance of data resilience in the current cybersecurity climate ... Juniper Networks expands security offering for remote working. Juniper Networks has launched new solutions to enhance work from home security. ... PagerDuty was born from the idea that software development and operations could ...;https://itbrief.co.nz/story/sas-announces-latest-version-of-viya-bringing-advanced-analytics-to-businesses;https;itbrief.co.nz;/story/sas-announces-latest-version-of-viya-bringing-advanced-analytics-to-businesses;;;co;113.21.226.180;geolocation;{};NZ;New Zealand;Auckland;Auckland;174.6802978515625;-36.78810119628906;113.21.226.180;SAS announces latest version of Viya, bringing advanced ...;Jun 19, 2020 — The importance of data resilience in the current cybersecurity climate ... Juniper Networks expands security offering for remote working. Juniper Networks has launched new solutions to enhance work from home security. ... PagerDuty was born from the idea that software development and operations could ...
16;2020-06-18;SAS announces latest version of Viya, bringing advanced ...;Jun 19, 2020 — The importance of data resilience in the current cybersecurity climate ... Juniper Networks expands security offering for remote working. Juniper Networks has launched new solutions to enhance work from home security. ... PagerDuty was born from the idea that software development and operations could ...;https://itbrief.co.nz/story/sas-announces-latest-version-of-viya-bringing-advanced-analytics-to-businesses;https;itbrief.co.nz;/story/sas-announces-latest-version-of-viya-bringing-advanced-analytics-to-businesses;;;co;113.21.226.180;geolocation;{};NZ;New Zealand;Auckland;Auckland;174.6802978515625;-36.78810119628906;113.21.226.180;SAS announces latest version of Viya, bringing advanced ...;Jun 19, 2020 — The importance of data resilience in the current cybersecurity climate ... Juniper Networks expands security offering for remote working. Juniper Networks has launched new solutions to enhance work from home security. ... PagerDuty was born from the idea that software development and operations could ...
17;2020-06-18;SAS announces latest version of Viya, bringing advanced ...;Jun 19, 2020 — The importance of data resilience in the current cybersecurity climate ... Juniper Networks expands security offering for remote working. Juniper Networks has launched new solutions to enhance work from home security. ... PagerDuty was born from the idea that software development and operations could ...;https://itbrief.co.nz/story/sas-announces-latest-version-of-viya-bringing-advanced-analytics-to-businesses;https;itbrief.co.nz;/story/sas-announces-latest-version-of-viya-bringing-advanced-analytics-to-businesses;;;co;113.21.226.180;geolocation;{};NZ;New Zealand;Auckland;Auckland;174.6802978515625;-36.78810119628906;113.21.226.180;SAS announces latest version of Viya, bringing advanced ...;Jun 19, 2020 — The importance of data resilience in the current cybersecurity climate ... Juniper Networks expands security offering for remote working. Juniper Networks has launched new solutions to enhance work from home security. ... PagerDuty was born from the idea that software development and operations could ...
18;2020-06-18;Understanding and navigating Iran and Russia sanctions ...;Jun 18, 2020 — Kharon is headed by former senior intelligence officials from the U.S. Department of the Treasury, and experienced professionals in software ...;https://www.hoganlovells.com/en/events/understanding-and-navigating-iran-and-russia-sanctions-related-risk;https;www.hoganlovells.com;/en/events/understanding-and-navigating-iran-and-russia-sanctions-related-risk;;;hoganlovells;146.20.28.47;geolocation;{};US;United States;Virginia;Ashburn;-77.47419738769531;39.043701171875;146.20.28.47;Understanding and navigating Iran and Russia sanctions ...;Jun 18, 2020 — Kharon is headed by former senior intelligence officials from the U.S. Department of the Treasury, and experienced professionals in software ...
19;2020-06-18;In IT security, 'good enough' is no longer good enough;Jun 18, 2020 — Juniper Networks expands security offering for remote working ... Resilience sits at the heart of security, and there is a need for ... Juniper Networks has launched new solutions to enhance work from home security. ... the trend of big brands flocking to South Africa for software development, the impact of ...;https://remoteworkertech.asia/story/in-it-security-good-enough-is-no-longer-good-enough;https;remoteworkertech.asia;/story/in-it-security-good-enough-is-no-longer-good-enough;;;remoteworkertech;113.21.226.180;geolocation;{};NZ;New Zealand;Auckland;Auckland;174.6802978515625;-36.78810119628906;113.21.226.180;In IT security, 'good enough' is no longer good enough;Jun 18, 2020 — Juniper Networks expands security offering for remote working ... Resilience sits at the heart of security, and there is a need for ... Juniper Networks has launched new solutions to enhance work from home security. ... the trend of big brands flocking to South Africa for software development, the impact of ...
20;2020-06-18;In IT security, 'good enough' is no longer good enough;Jun 18, 2020 — Juniper Networks expands security offering for remote working ... Resilience sits at the heart of security, and there is a need for ... Juniper Networks has launched new solutions to enhance work from home security. ... the trend of big brands flocking to South Africa for software development, the impact of ...;https://remoteworkertech.asia/story/in-it-security-good-enough-is-no-longer-good-enough;https;remoteworkertech.asia;/story/in-it-security-good-enough-is-no-longer-good-enough;;;remoteworkertech;113.21.226.180;geolocation;{};NZ;New Zealand;Auckland;Auckland;174.6802978515625;-36.78810119628906;113.21.226.180;In IT security, 'good enough' is no longer good enough;Jun 18, 2020 — Juniper Networks expands security offering for remote working ... Resilience sits at the heart of security, and there is a need for ... Juniper Networks has launched new solutions to enhance work from home security. ... the trend of big brands flocking to South Africa for software development, the impact of ...
21;2020-06-18;In IT security, 'good enough' is no longer good enough;Jun 18, 2020 — Juniper Networks expands security offering for remote working ... Resilience sits at the heart of security, and there is a need for ... Juniper Networks has launched new solutions to enhance work from home security. ... the trend of big brands flocking to South Africa for software development, the impact of ...;https://remoteworkertech.asia/story/in-it-security-good-enough-is-no-longer-good-enough;https;remoteworkertech.asia;/story/in-it-security-good-enough-is-no-longer-good-enough;;;remoteworkertech;113.21.226.180;geolocation;{};NZ;New Zealand;Auckland;Auckland;174.6802978515625;-36.78810119628906;113.21.226.180;In IT security, 'good enough' is no longer good enough;Jun 18, 2020 — Juniper Networks expands security offering for remote working ... Resilience sits at the heart of security, and there is a need for ... Juniper Networks has launched new solutions to enhance work from home security. ... the trend of big brands flocking to South Africa for software development, the impact of ...
22;2020-06-18;In IT security, 'good enough' is no longer good enough;Jun 18, 2020 — Juniper Networks expands security offering for remote working ... Resilience sits at the heart of security, and there is a need for ... Juniper Networks has launched new solutions to enhance work from home security. ... the trend of big brands flocking to South Africa for software development, the impact of ...;https://remoteworkertech.asia/story/in-it-security-good-enough-is-no-longer-good-enough;https;remoteworkertech.asia;/story/in-it-security-good-enough-is-no-longer-good-enough;;;remoteworkertech;113.21.226.180;geolocation;{};NZ;New Zealand;Auckland;Auckland;174.6802978515625;-36.78810119628906;113.21.226.180;In IT security, 'good enough' is no longer good enough;Jun 18, 2020 — Juniper Networks expands security offering for remote working ... Resilience sits at the heart of security, and there is a need for ... Juniper Networks has launched new solutions to enhance work from home security. ... the trend of big brands flocking to South Africa for software development, the impact of ...
23;2020-06-18;Gohealth, Inc. IPO Investment Prospectus S-1 - SEC Report;Jun 19, 2020 — Additionally, we have implemented work from home options to increase agent ... Our disaster recovery program contemplates transitioning our platform ... restrict our activities, including our software development operations in Slovakia. ... to a remote working environment without any material impacts to our ...;https://sec.report/Document/0001193125-20-173051/;https;sec.report;/Document/0001193125-20-173051/;;;sec;104.22.66.107;geolocation;{};US;United States;California;San Jose;-121.83822631835938;37.330528259277344;104.22.66.107;Gohealth, Inc. IPO Investment Prospectus S-1 - SEC Report;Jun 19, 2020 — Additionally, we have implemented work from home options to increase agent ... Our disaster recovery program contemplates transitioning our platform ... restrict our activities, including our software development operations in Slovakia. ... to a remote working environment without any material impacts to our ...
24;2020-06-18;Rethink singing restrictions, say choral figures;Jun 19, 2020 — Professional singers are unable to work from home, but, with the overly ... They conclude: “We believe it is eminently possible to avert disaster if ...;https://www.churchtimes.co.uk/articles/2020/19-june/news/uk/rethink-singing-restrictions-say-choral-figures;https;www.churchtimes.co.uk;/articles/2020/19-june/news/uk/rethink-singing-restrictions-say-choral-figures;;;co;51.140.120.141;geolocation;{};GB;United Kingdom;England;Blackheath;-0.12620000541210175;51.50019836425781;51.140.120.141;Rethink singing restrictions, say choral figures;Jun 19, 2020 — Professional singers are unable to work from home, but, with the overly ... They conclude: “We believe it is eminently possible to avert disaster if ...
25;2020-06-18;View the report - Mindtree;organizations will require greater resilience in their operations ... Our operational centers have built-in disaster recovery operations, ensuring that ... Work from Home (WFH) has become a new reality. Real workplace ... enabling remote working and agile delivery. This ... Income from software development. 74,788. 67,935.;https://www.mindtree.com/sites/default/files/2020-06/annual-report-2019-2020.pdf;https;www.mindtree.com;/sites/default/files/2020-06/annual-report-2019-2020.pdf;;;mindtree;13.107.246.10;geolocation;{};US;United States;Washington;Cottage Lake;-122.12094116210938;47.68050003051758;13.107.246.10;View the report - Mindtree;organizations will require greater resilience in their operations ... Our operational centers have built-in disaster recovery operations, ensuring that ... Work from Home (WFH) has become a new reality. Real workplace ... enabling remote working and agile delivery. This ... Income from software development. 74,788. 67,935.
26;2020-06-18;Interview with Eimear O'Donoghue, HR Director at NearForm;"Jun 18, 2020 — Issues covered: Remote working; Coronavirus/COVID-19 ... Github - software development; Google Drive - file management; Trello - project management ... Practicing resilience is key and not something you develop overnight ...";https://www.legal-island.ie/articles/ire/resources/hr-interview-series/2020/jun/interview-with-eimear-odonoghue-hr-director-at-nearform/;https;www.legal-island.ie;/articles/ire/resources/hr-interview-series/2020/jun/interview-with-eimear-odonoghue-hr-director-at-nearform/;;;legal-island;40.69.36.241;geolocation;{};IE;Ireland;Leinster;Dublin;-6.243330001831055;53.35388946533203;40.69.36.241;Interview with Eimear O'Donoghue, HR Director at NearForm;"Jun 18, 2020 — Issues covered: Remote working; Coronavirus/COVID-19 ... Github - software development; Google Drive - file management; Trello - project management ... Practicing resilience is key and not something you develop overnight ..."
