;date;header;summary;link;protocol;domain;path;query;fragment;host_name;ip_address;Type;AdditionalData;CountryCode;CountryName;State;City;Longitude;Latitude;IpAddress;header_context_true;summary_context_true
60;2020-09-13;A University of Washington graduate who landed a tech job at ...;While he was studying at the University of Washington, Trey Tamaki was diagnosed with cancer and had to take time off school for chemotherapy treatments and ...;https://imad.edu.es/business-school/a-university-of-washington-graduate-who-landed-a-tech-job-at-starbucks-shares-his-journey-fighting-for-a-computer-science-degree-while-battling-cancer/;https;imad.edu.es;/business-school/a-university-of-washington-graduate-who-landed-a-tech-job-at-starbucks-shares-his-journey-fighting-for-a-computer-science-degree-while-battling-cancer/;;;edu;185.37.226.35;geolocation;{};ES;Spain;Madrid;Alcobendas;-3.6497199535369873;40.516151428222656;185.37.226.35;A University of Washington graduate who landed a tech job at ...;While he was studying at the University of Washington, Trey Tamaki was diagnosed with cancer and had to take time off school for chemotherapy treatments and ...
61;2020-09-13;A University of Washington graduate who landed a tech job at ...;While he was studying at the University of Washington, Trey Tamaki was diagnosed with cancer and had to take time off school for chemotherapy treatments and ...;https://imad.edu.es/business-school/a-university-of-washington-graduate-who-landed-a-tech-job-at-starbucks-shares-his-journey-fighting-for-a-computer-science-degree-while-battling-cancer/;https;imad.edu.es;/business-school/a-university-of-washington-graduate-who-landed-a-tech-job-at-starbucks-shares-his-journey-fighting-for-a-computer-science-degree-while-battling-cancer/;;;edu;185.37.226.35;geolocation;{};ES;Spain;Madrid;Alcobendas;-3.6497199535369873;40.516151428222656;185.37.226.35;A University of Washington graduate who landed a tech job at ...;While he was studying at the University of Washington, Trey Tamaki was diagnosed with cancer and had to take time off school for chemotherapy treatments and ...
62;2020-09-13;Principal Linux Engineer - Ksplice Team | Remote role ... - Zippia;Skills: Connectivity Issues, Network Security, Troubleshoot, Proper Operation, Disaster Recovery, Performance Analysis, Infrastructure, Firewall. 60d+ ago.;https://www.zippia.com/sarasota-fl-jobs/linux-engineer-dlp/?9f552afcaf99b337b3ffd019f6e8b7d41350394b;https;www.zippia.com;/sarasota-fl-jobs/linux-engineer-dlp/;9f552afcaf99b337b3ffd019f6e8b7d41350394b;;zippia;35.185.237.72;geolocation;{};US;United States;Oregon;The Dalles;-121.18699645996094;45.55424880981445;35.185.237.72;Principal Linux Engineer - Ksplice Team | Remote role ... - Zippia;Skills: Connectivity Issues, Network Security, Troubleshoot, Proper Operation, Disaster Recovery, Performance Analysis, Infrastructure, Firewall. 60d+ ago.
63;2020-09-13;Software Engineer | Alpharetta, Georgia | NetDocuments;FiservAlpharetta, Georgia What does a great Software Development Engineer, Tech Lead do?Posted 4 days ago Software Engineer (work from home) (Roswell ...;https://jobsearcher.com/j/software-engineer-at-netdocuments-in-alpharetta-georgia-gKrYMd0;https;jobsearcher.com;/j/software-engineer-at-netdocuments-in-alpharetta-georgia-gKrYMd0;;;jobsearcher;52.21.160.98;geolocation;{};US;United States;Virginia;Ashburn;-77.47419738769531;39.043701171875;52.21.160.98;Software Engineer | Alpharetta, Georgia | NetDocuments;FiservAlpharetta, Georgia What does a great Software Development Engineer, Tech Lead do?Posted 4 days ago Software Engineer (work from home) (Roswell ...
64;2020-09-13;Monique's Story: From high school drop-out to Xero Software ...;Sep 14, 2020 — I didn't even know that software development was a career option until I met ... The 22-year-old completed a Level 6 Diploma in Software Development at Whitecliffe earlier ... Accurics, a cloud cyber resilience company specialising in cloud ... has launched new solutions to enhance work from home security.;https://itbrief.co.nz/story/monique-s-story-from-high-school-drop-out-to-xero-software-developer;https;itbrief.co.nz;/story/monique-s-story-from-high-school-drop-out-to-xero-software-developer;;;co;113.21.226.180;geolocation;{};NZ;New Zealand;Auckland;Auckland;174.6802978515625;-36.78810119628906;113.21.226.180;Monique's Story: From high school drop-out to Xero Software ...;Sep 14, 2020 — I didn't even know that software development was a career option until I met ... The 22-year-old completed a Level 6 Diploma in Software Development at Whitecliffe earlier ... Accurics, a cloud cyber resilience company specialising in cloud ... has launched new solutions to enhance work from home security.
65;2020-09-13;Monique's Story: From high school drop-out to Xero Software ...;Sep 14, 2020 — I didn't even know that software development was a career option until I met ... The 22-year-old completed a Level 6 Diploma in Software Development at Whitecliffe earlier ... Accurics, a cloud cyber resilience company specialising in cloud ... has launched new solutions to enhance work from home security.;https://itbrief.co.nz/story/monique-s-story-from-high-school-drop-out-to-xero-software-developer;https;itbrief.co.nz;/story/monique-s-story-from-high-school-drop-out-to-xero-software-developer;;;co;113.21.226.180;geolocation;{};NZ;New Zealand;Auckland;Auckland;174.6802978515625;-36.78810119628906;113.21.226.180;Monique's Story: From high school drop-out to Xero Software ...;Sep 14, 2020 — I didn't even know that software development was a career option until I met ... The 22-year-old completed a Level 6 Diploma in Software Development at Whitecliffe earlier ... Accurics, a cloud cyber resilience company specialising in cloud ... has launched new solutions to enhance work from home security.
66;2020-09-13;Celebrating Women in STEM for National Coding Week and IT ...;Sep 14, 2020 — Krystie Shetye, Director of Software Development. What would you say is one of the greatest challenges for women working in STEM? “Working ...;https://www.webroot.com/blog/2020/09/14/celebrating-women-in-stem-for-national-coding-week-and-it-pro-day/;https;www.webroot.com;/blog/2020/09/14/celebrating-women-in-stem-for-national-coding-week-and-it-pro-day/;;;webroot;69.25.154.83;geolocation;{};US;United States;Illinois;Chicago;-87.67124938964844;41.84885025024414;69.25.154.83;Celebrating Women in STEM for National Coding Week and IT ...;Sep 14, 2020 — Krystie Shetye, Director of Software Development. What would you say is one of the greatest challenges for women working in STEM? “Working ...
67;2020-09-13;AI In Code Series: Dynatrace - From observability to ...;Sep 13, 2020 — Onward to explainability. Machine learning in the software development and operations space has some very specific characteristics. Usually, it ...;https://www.computerweekly.com/blog/CW-Developer-Network/AI-In-Code-Series-Dynatrace-From-observability-to-understandability-to-explainability;https;www.computerweekly.com;/blog/CW-Developer-Network/AI-In-Code-Series-Dynatrace-From-observability-to-understandability-to-explainability;;;computerweekly;206.19.49.153;geolocation;{};US;United States;Louisiana;Reddell;-92.42642211914062;30.675010681152344;206.19.49.153;AI In Code Series: Dynatrace - From observability to ...;Sep 13, 2020 — Onward to explainability. Machine learning in the software development and operations space has some very specific characteristics. Usually, it ...
68;2020-09-13;AI In Code Series: Dynatrace - From observability to ...;Sep 13, 2020 — Onward to explainability. Machine learning in the software development and operations space has some very specific characteristics. Usually, it ...;https://www.computerweekly.com/blog/CW-Developer-Network/AI-In-Code-Series-Dynatrace-From-observability-to-understandability-to-explainability;https;www.computerweekly.com;/blog/CW-Developer-Network/AI-In-Code-Series-Dynatrace-From-observability-to-understandability-to-explainability;;;computerweekly;206.19.49.153;geolocation;{};US;United States;Louisiana;Reddell;-92.42642211914062;30.675010681152344;206.19.49.153;AI In Code Series: Dynatrace - From observability to ...;Sep 13, 2020 — Onward to explainability. Machine learning in the software development and operations space has some very specific characteristics. Usually, it ...
69;2020-09-13;How insurance players can scale agile | McKinsey;Sep 14, 2020 — Macro shifts in the workforce are emerging sooner than expected with remote-working models and a rising need for new capabilities, including ...;https://www.mckinsey.com/industries/financial-services/our-insights/scaling-agility-a-new-operating-model-for-insurers;https;www.mckinsey.com;/industries/financial-services/our-insights/scaling-agility-a-new-operating-model-for-insurers;;;mckinsey;23.44.165.146;geolocation;{};US;United States;Illinois;Chicago;-87.67124938964844;41.84885025024414;23.44.165.146;How insurance players can scale agile | McKinsey;Sep 14, 2020 — Macro shifts in the workforce are emerging sooner than expected with remote-working models and a rising need for new capabilities, including ...
70;2020-09-13;Next Issue - Verdict Magazine | Issue 5 | September 2020;Sep 14, 2020 — ... losers of the pandemic and consider how the world of technology has been accelerated and reshaped by the global shift to remote working.;https://magazine.verdict.co.uk/verdict_magazine_sep20/next_issue;https;magazine.verdict.co.uk;/verdict_magazine_sep20/next_issue;;;co;178.128.243.231;geolocation;{};NL;Netherlands;North Holland;Diemen;4.940189838409424;52.309051513671875;178.128.243.231;Next Issue - Verdict Magazine | Issue 5 | September 2020;Sep 14, 2020 — ... losers of the pandemic and consider how the world of technology has been accelerated and reshaped by the global shift to remote working.
71;2020-09-13;Brave recruitment today can boost tech performance tomorrow ...;Sep 14, 2020 — The first is that people can successfully retrain as software engineers fast. The second is that many people suited to the industry are ...;https://www.computerweekly.com/blog/ITWorks/Brave-recruitment-today-can-boost-tech-performance-tomorrow;https;www.computerweekly.com;/blog/ITWorks/Brave-recruitment-today-can-boost-tech-performance-tomorrow;;;computerweekly;206.19.49.153;geolocation;{};US;United States;Louisiana;Reddell;-92.42642211914062;30.675010681152344;206.19.49.153;Brave recruitment today can boost tech performance tomorrow ...;Sep 14, 2020 — The first is that people can successfully retrain as software engineers fast. The second is that many people suited to the industry are ...
72;2020-09-13;Brave recruitment today can boost tech performance tomorrow ...;Sep 14, 2020 — The first is that people can successfully retrain as software engineers fast. The second is that many people suited to the industry are ...;https://www.computerweekly.com/blog/ITWorks/Brave-recruitment-today-can-boost-tech-performance-tomorrow;https;www.computerweekly.com;/blog/ITWorks/Brave-recruitment-today-can-boost-tech-performance-tomorrow;;;computerweekly;206.19.49.153;geolocation;{};US;United States;Louisiana;Reddell;-92.42642211914062;30.675010681152344;206.19.49.153;Brave recruitment today can boost tech performance tomorrow ...;Sep 14, 2020 — The first is that people can successfully retrain as software engineers fast. The second is that many people suited to the industry are ...
73;2020-09-13;Virtual Cybersecurity & Fraud Summit: Toronto;Business Continuity & Disaster Recovery ... Secure Software Development Lifecycle (SSDLC) ... Live Webinar | Remote Working with Teams & Zoom - Stay Secure & Avoid Data Loss ... Risk and Resilience: Finding the Right Balance. Mathew ...;https://www.healthcareinfosecurity.com/events/virtual-cybersecurity-fraud-summit-toronto-e-325;https;www.healthcareinfosecurity.com;/events/virtual-cybersecurity-fraud-summit-toronto-e-325;;;healthcareinfosecurity;50.56.167.254;geolocation;{};US;United States;Texas;Dallas;-96.8142318725586;32.8054313659668;50.56.167.254;Virtual Cybersecurity & Fraud Summit: Toronto;Business Continuity & Disaster Recovery ... Secure Software Development Lifecycle (SSDLC) ... Live Webinar | Remote Working with Teams & Zoom - Stay Secure & Avoid Data Loss ... Risk and Resilience: Finding the Right Balance. Mathew ...
74;2020-09-13;Virtual Cybersecurity & Fraud Summit: Toronto;Business Continuity & Disaster Recovery ... Secure Software Development Lifecycle (SSDLC) ... Live Webinar | Remote Working with Teams & Zoom - Stay Secure & Avoid Data Loss ... Risk and Resilience: Finding the Right Balance. Mathew ...;https://www.healthcareinfosecurity.com/events/virtual-cybersecurity-fraud-summit-toronto-e-325;https;www.healthcareinfosecurity.com;/events/virtual-cybersecurity-fraud-summit-toronto-e-325;;;healthcareinfosecurity;50.56.167.254;geolocation;{};US;United States;Texas;Dallas;-96.8142318725586;32.8054313659668;50.56.167.254;Virtual Cybersecurity & Fraud Summit: Toronto;Business Continuity & Disaster Recovery ... Secure Software Development Lifecycle (SSDLC) ... Live Webinar | Remote Working with Teams & Zoom - Stay Secure & Avoid Data Loss ... Risk and Resilience: Finding the Right Balance. Mathew ...
75;2020-09-13;Software Development Manager - Calgary, AB | Hypjobs;Sep 13, 2020 — Work from home during COVID-I9 period ... To lead a group of software engineers in developing and maintaining Industrial Internet of Things (IoT) software focused ... Resilience and resourcefulness to make change happen.;https://hypjobs.ca/job/3638952/Software-Development-Manager;https;hypjobs.ca;/job/3638952/Software-Development-Manager;;;hypjobs;178.128.226.198;geolocation;{};CA;Canada;Ontario;Toronto;-79.51219177246094;43.70317077636719;178.128.226.198;Software Development Manager - Calgary, AB | Hypjobs;Sep 13, 2020 — Work from home during COVID-I9 period ... To lead a group of software engineers in developing and maintaining Industrial Internet of Things (IoT) software focused ... Resilience and resourcefulness to make change happen.
76;2020-09-13;Job Software Engineer III - NCMC ITW/AA, Legacy Space ...;Sep 14, 2020 — Engage developers to improve Agile software development processes and ... Work From Home Credentialed Tax Accountant • COLORADO ...;https://www.talent.com/view?id=e1f8d4372799;https;www.talent.com;/view;id=e1f8d4372799;;talent;158.69.69.73;geolocation;{};CA;Canada;Quebec;Montréal;-73.56201171875;45.502079010009766;158.69.69.73;Job Software Engineer III - NCMC ITW/AA, Legacy Space ...;Sep 14, 2020 — Engage developers to improve Agile software development processes and ... Work From Home Credentialed Tax Accountant • COLORADO ...
77;2020-09-13;Proven Methods on How to Protect Your Business From ...;"Sep 14, 2020 — Software Development Outsourcing · Automation Services · Software QA & Testing ... A company with well-established cyber resilience protects itself from ... extra resources to ensure secure remote working;; Expand your monitoring ... Furthermore, COVID-19 work-from-home conditions increase the risk of ...";https://www.teaminternational.com/how-to-protect-your-business-from-cyberattacks/;https;www.teaminternational.com;/how-to-protect-your-business-from-cyberattacks/;;;teaminternational;52.185.68.16;geolocation;{};US;United States;Iowa;Des Moines;-93.60652160644531;41.600440979003906;52.185.68.16;Proven Methods on How to Protect Your Business From ...;"Sep 14, 2020 — Software Development Outsourcing · Automation Services · Software QA & Testing ... A company with well-established cyber resilience protects itself from ... extra resources to ensure secure remote working;; Expand your monitoring ... Furthermore, COVID-19 work-from-home conditions increase the risk of ..."
78;2020-09-13;How Natalia Bout of iDialogue Tackles The Extreme Work Life ...;Sep 13, 2020 — It's easy to fall into bad habits when you work from home, and following a set routine ... is that it has removed a great deal of stigma from flexible and remote working. ... of the most important qualities for individuals and communities — resilience. ... More Canadian Software Engineers Should Work Remotely.;https://medium.com/authority-magazine/how-natalia-bout-of-idialogue-tackles-the-extreme-work-life-balance-of-being-a-woman-business-3873666d225a;https;medium.com;/authority-magazine/how-natalia-bout-of-idialogue-tackles-the-extreme-work-life-balance-of-being-a-woman-business-3873666d225a;;;medium;104.16.120.127;geolocation;{};US;United States;California;San Jose;-121.83822631835938;37.330528259277344;104.16.120.127;How Natalia Bout of iDialogue Tackles The Extreme Work Life ...;Sep 13, 2020 — It's easy to fall into bad habits when you work from home, and following a set routine ... is that it has removed a great deal of stigma from flexible and remote working. ... of the most important qualities for individuals and communities — resilience. ... More Canadian Software Engineers Should Work Remotely.
79;2020-09-13;Wish Reviews | Glassdoor;Sep 14, 2020 — not clear work life balance during work from home - leadership switches priorities randomly. Continue reading. Be the first to find this review ...;https://www.glassdoor.com/Reviews/Wish-Reviews-E686514.htm;https;www.glassdoor.com;/Reviews/Wish-Reviews-E686514.htm;;;glassdoor;104.17.91.51;geolocation;{};US;United States;Florida;Flagami;-80.31195831298828;25.762859344482422;104.17.91.51;Wish Reviews | Glassdoor;Sep 14, 2020 — not clear work life balance during work from home - leadership switches priorities randomly. Continue reading. Be the first to find this review ...
80;2020-09-13;John DesJardins on In-Memory Data Grids, Stream ... - InfoQ;Sep 14, 2020 — Discover QCon Plus by InfoQ: A Virtual Conference for Senior Software Engineers and Architects (Nov 4-18).;https://www.infoq.com/podcasts/imdg-stream-processing/;https;www.infoq.com;/podcasts/imdg-stream-processing/;;;infoq;199.119.126.68;geolocation;{};US;United States;Missouri;Clayton;-90.1923828125;38.631370544433594;199.119.126.68;John DesJardins on In-Memory Data Grids, Stream ... - InfoQ;Sep 14, 2020 — Discover QCon Plus by InfoQ: A Virtual Conference for Senior Software Engineers and Architects (Nov 4-18).
81;2020-09-13;17 Work-From-Home Opportunities Worth Your Consideration;Sep 14, 2020 — Work-from-home opportunities don't pay you to hang at home, but ... Positions range from sales to software development to customer service.;https://thriveglobal.com/stories/17-work-from-home-opportunities-worth-your-consideration/;https;thriveglobal.com;/stories/17-work-from-home-opportunities-worth-your-consideration/;;;thriveglobal;172.67.5.226;geolocation;{};US;United States;California;San Francisco;-122.39286041259766;37.76784896850586;172.67.5.226;17 Work-From-Home Opportunities Worth Your Consideration;Sep 14, 2020 — Work-from-home opportunities don't pay you to hang at home, but ... Positions range from sales to software development to customer service.
82;2020-09-13;Bill Gates says the pandemic wiped out 25 years of vaccine ...;On Monday, the Gates Foundation released its annual Goalkeepers report, meant to measure global progress on development goals including reducing poverty, ...;https://imad.edu.es/business-school/bill-gates-says-the-pandemic-wiped-out-25-years-of-vaccine-progress-in-25-weeks/;https;imad.edu.es;/business-school/bill-gates-says-the-pandemic-wiped-out-25-years-of-vaccine-progress-in-25-weeks/;;;edu;185.37.226.35;geolocation;{};ES;Spain;Madrid;Alcobendas;-3.6497199535369873;40.516151428222656;185.37.226.35;Bill Gates says the pandemic wiped out 25 years of vaccine ...;On Monday, the Gates Foundation released its annual Goalkeepers report, meant to measure global progress on development goals including reducing poverty, ...
83;2020-09-13;Bill Gates says the pandemic wiped out 25 years of vaccine ...;On Monday, the Gates Foundation released its annual Goalkeepers report, meant to measure global progress on development goals including reducing poverty, ...;https://imad.edu.es/business-school/bill-gates-says-the-pandemic-wiped-out-25-years-of-vaccine-progress-in-25-weeks/;https;imad.edu.es;/business-school/bill-gates-says-the-pandemic-wiped-out-25-years-of-vaccine-progress-in-25-weeks/;;;edu;185.37.226.35;geolocation;{};ES;Spain;Madrid;Alcobendas;-3.6497199535369873;40.516151428222656;185.37.226.35;Bill Gates says the pandemic wiped out 25 years of vaccine ...;On Monday, the Gates Foundation released its annual Goalkeepers report, meant to measure global progress on development goals including reducing poverty, ...
84;2020-09-13;Mimecast hiring Senior Software Engineer - Webforce - UI ...;We are a bunch of passionate Software Engineers who are in love with modern ... hours and Work from Home WednesdaysAn internationally diverse, sociable, ...;https://uk.linkedin.com/jobs/view/senior-software-engineer-webforce-ui-services-at-mimecast-2196276242;https;uk.linkedin.com;/jobs/view/senior-software-engineer-webforce-ui-services-at-mimecast-2196276242;;;linkedin;108.174.10.14;geolocation;{};US;United States;California;Sunnyvale;-122.01677703857422;37.38859939575195;108.174.10.14;Mimecast hiring Senior Software Engineer - Webforce - UI ...;We are a bunch of passionate Software Engineers who are in love with modern ... hours and Work from Home WednesdaysAn internationally diverse, sociable, ...
85;2020-09-13;Senior Java Developer | Herndon, VA - wellpaid.io;Must be US Citizens due to contract and customer restrictions. Responsibilities: Participate in Agile software development activities with teams of highly skilled ...;https://wellpaid.io/job/senior-java-developer-talent-f33ab0c19ba8;https;wellpaid.io;/job/senior-java-developer-talent-f33ab0c19ba8;;;wellpaid;104.27.138.156;geolocation;{};US;United States;California;San Jose;-121.83822631835938;37.330528259277344;104.27.138.156;Senior Java Developer | Herndon, VA - wellpaid.io;Must be US Citizens due to contract and customer restrictions. Responsibilities: Participate in Agile software development activities with teams of highly skilled ...
86;2020-09-13;Getac releases updated fully-rugged tablet - IT Brief Australia;Sep 14, 2020 — Juniper Networks expands security offering for remote working ... Accurics, a cloud cyber resilience company specialising in cloud native ... PagerDuty was born from the idea that software development and operations could ...;https://itbrief.com.au/story/getac-releases-updated-fully-rugged-tablet;https;itbrief.com.au;/story/getac-releases-updated-fully-rugged-tablet;;;com;113.21.226.180;geolocation;{};NZ;New Zealand;Auckland;Auckland;174.6802978515625;-36.78810119628906;113.21.226.180;Getac releases updated fully-rugged tablet - IT Brief Australia;Sep 14, 2020 — Juniper Networks expands security offering for remote working ... Accurics, a cloud cyber resilience company specialising in cloud native ... PagerDuty was born from the idea that software development and operations could ...
87;2020-09-13;Getac releases updated fully-rugged tablet - IT Brief Australia;Sep 14, 2020 — Juniper Networks expands security offering for remote working ... Accurics, a cloud cyber resilience company specialising in cloud native ... PagerDuty was born from the idea that software development and operations could ...;https://itbrief.com.au/story/getac-releases-updated-fully-rugged-tablet;https;itbrief.com.au;/story/getac-releases-updated-fully-rugged-tablet;;;com;113.21.226.180;geolocation;{};NZ;New Zealand;Auckland;Auckland;174.6802978515625;-36.78810119628906;113.21.226.180;Getac releases updated fully-rugged tablet - IT Brief Australia;Sep 14, 2020 — Juniper Networks expands security offering for remote working ... Accurics, a cloud cyber resilience company specialising in cloud native ... PagerDuty was born from the idea that software development and operations could ...
88;2020-09-13;Microsoft Associate Architect Salaries | Glassdoor;Sep 14, 2020 — Work From Home (87 comments) ... of: Our software development centers are located all over the world, including Microsoft photo of: Connector ...;https://www.glassdoor.co.in/Salary/Microsoft-Associate-Architect-Salaries-E1651_D_KO10,29.htm;https;www.glassdoor.co.in;/Salary/Microsoft-Associate-Architect-Salaries-E1651_D_KO10,29.htm;;;co;104.16.117.102;geolocation;{};US;United States;Florida;Flagami;-80.31195831298828;25.762859344482422;104.16.117.102;Microsoft Associate Architect Salaries | Glassdoor;Sep 14, 2020 — Work From Home (87 comments) ... of: Our software development centers are located all over the world, including Microsoft photo of: Connector ...
89;2020-09-13;Part time jobs, full time jobs, work from home & flexible jobs;Apply to Work From Home jobs now hiring on Indeed.co.uk, the world's largest job site. Work From Home Jobs - September 2020 | Indeed.co.uk Skip to Job Postings ... I work in Software Development and luckily this field always grows, esp ... So I know I am a mental disaster area, please don't berate me for my many flaws.;https://www.mecaevents.be/?id=1060;https;www.mecaevents.be;/;id=1060;;mecaevents;172.67.217.39;geolocation;{};US;United States;California;San Francisco;-122.39286041259766;37.76784896850586;172.67.217.39;Part time jobs, full time jobs, work from home & flexible jobs;Apply to Work From Home jobs now hiring on Indeed.co.uk, the world's largest job site. Work From Home Jobs - September 2020 | Indeed.co.uk Skip to Job Postings ... I work in Software Development and luckily this field always grows, esp ... So I know I am a mental disaster area, please don't berate me for my many flaws.
