;date;header;summary;link;protocol;domain;path;query;fragment;host_name;ip_address;Type;AdditionalData;CountryCode;CountryName;State;City;Longitude;Latitude;IpAddress;header_context_true;summary_context_true
31;2020-09-08;DWF Group PLC: Full year results - InvestEgate;"Sep 8, 2020 — ""The strength and resilience of the Group and our differentiated model has ... were able to work from home during the strictest lockdown periods. ... within the DWF360 software development business, which saw a number of ...";https://investegate.co.uk/dwf-group-plc/rns/full-year-results/202009080700083242Y/;https;investegate.co.uk;/dwf-group-plc/rns/full-year-results/202009080700083242Y/;;;co;104.16.2.16;geolocation;{};US;United States;Virginia;Ashburn;-77.47419738769531;39.043701171875;104.16.2.16;DWF Group PLC: Full year results - InvestEgate;"Sep 8, 2020 — ""The strength and resilience of the Group and our differentiated model has ... were able to work from home during the strictest lockdown periods. ... within the DWF360 software development business, which saw a number of ..."
32;2020-09-08;DevOps Engineer in Chester, Cheshire | Opus Recruitment ...;Designing and implementing disaster recovery solutions, effective monitoring, and incident response systems. Benefits and Perks: 22 days holiday (+ 3 extra at ...;https://www.cwjobs.co.uk/job/devops-engineer/opus-recruitment-solutions-ltd-job90711910;https;www.cwjobs.co.uk;/job/devops-engineer/opus-recruitment-solutions-ltd-job90711910;;;co;23.45.1.30;geolocation;{};US;United States;Illinois;Chicago;-87.67124938964844;41.84885025024414;23.45.1.30;DevOps Engineer in Chester, Cheshire | Opus Recruitment ...;Designing and implementing disaster recovery solutions, effective monitoring, and incident response systems. Benefits and Perks: 22 days holiday (+ 3 extra at ...
33;2020-09-08;Software Engineering Manager - reed.co.uk;Head of Software Development - Permanent Job I'm recruiting for a Software ... their resources in technology across Test Automation and Software Engineers in Test. ... and to specification, with the resilience to overcome technical challenges? ... Contact us · Job search · Recruiter directory · Work from home · Browse jobs ...;https://www.reed.co.uk/jobs/software-engineering-manager/40840799;https;www.reed.co.uk;/jobs/software-engineering-manager/40840799;;;co;104.16.50.99;geolocation;{};US;United States;California;San Jose;-121.83822631835938;37.330528259277344;104.16.50.99;Software Engineering Manager - reed.co.uk;Head of Software Development - Permanent Job I'm recruiting for a Software ... their resources in technology across Test Automation and Software Engineers in Test. ... and to specification, with the resilience to overcome technical challenges? ... Contact us · Job search · Recruiter directory · Work from home · Browse jobs ...
34;2020-09-08;MANUFACTURING INDUSTRY TRENDS 2020 – The CEO ...;Sep 9, 2020 — Apart from that, instituting sanitation rules in the workplace, and assess mobility policies to encourage remote working, expect a learning curve ...;https://theceo.in/industry/manufacturing-industry-trends-2020/;https;theceo.in;/industry/manufacturing-industry-trends-2020/;;;theceo;104.27.137.65;geolocation;{};US;United States;Virginia;Ashburn;-77.47419738769531;39.043701171875;104.27.137.65;MANUFACTURING INDUSTRY TRENDS 2020 – The CEO ...;Sep 9, 2020 — Apart from that, instituting sanitation rules in the workplace, and assess mobility policies to encourage remote working, expect a learning curve ...
35;2020-09-08;Paradox Interactive's QA staff allege poor treatment, low pay ...;Sep 8, 2020 — This was showing very well during recent Lab Zero disaster. ... off as non-essential to the business once it had transitioned to remote working. ... @KingFunk I've been in software development for the last 20 years or so, but I've ...;https://www.rockpapershotgun.com/2020/09/08/paradox-interactives-qa-staff-allege-poor-treatment-low-pay-and-mismanaged-layoffs/;https;www.rockpapershotgun.com;/2020/09/08/paradox-interactives-qa-staff-allege-poor-treatment-low-pay-and-mismanaged-layoffs/;;;rockpapershotgun;69.46.24.90;geolocation;{};US;United States;Florida;Tampa;-82.50581359863281;28.004880905151367;69.46.24.90;Paradox Interactive's QA staff allege poor treatment, low pay ...;Sep 8, 2020 — This was showing very well during recent Lab Zero disaster. ... off as non-essential to the business once it had transitioned to remote working. ... @KingFunk I've been in software development for the last 20 years or so, but I've ...
36;2020-09-08;Vera Rubin: Super telescope's giant camera spies broccoli;Sep 9, 2020 — “Many data labeling companies were forced to move to a work-from-home model ... And they can opt to use Dataloop's Python software development kit ... Accurics CEO Sachin Aggarwal makes the claim that cyber resilience ...;https://technocodex.com/vera-rubin-super-telescopes-giant-camera-spies-broccoli/;https;technocodex.com;/vera-rubin-super-telescopes-giant-camera-spies-broccoli/;;;technocodex;104.27.182.82;geolocation;{};US;United States;California;San Jose;-121.83822631835938;37.330528259277344;104.27.182.82;Vera Rubin: Super telescope's giant camera spies broccoli;Sep 9, 2020 — “Many data labeling companies were forced to move to a work-from-home model ... And they can opt to use Dataloop's Python software development kit ... Accurics CEO Sachin Aggarwal makes the claim that cyber resilience ...
37;2020-09-08;Form S-1/A Outset Medical, Inc. - StreetInsider;Sep 9, 2020 — The occurrence of a natural disaster or an act of terrorism, a decision by ... of our employees at our headquarters have been asked to work from home, ... team includes hardware and software engineers with deep expertise in ...;https://www.streetinsider.com/SEC+Filings/Form+S-1A+Outset+Medical%2C+Inc./17337292.html;https;www.streetinsider.com;/SEC+Filings/Form+S-1A+Outset+Medical%2C+Inc./17337292.html;;;streetinsider;192.225.209.8;geolocation;{};US;United States;Washington;Washington;-77.12261199951172;38.8749885559082;192.225.209.8;Form S-1/A Outset Medical, Inc. - StreetInsider;Sep 9, 2020 — The occurrence of a natural disaster or an act of terrorism, a decision by ... of our employees at our headquarters have been asked to work from home, ... team includes hardware and software engineers with deep expertise in ...
38;2020-09-08;How to sell successfully in the new normal? - CIOL;Sep 8, 2020 — How to effectively lead a Remote Sales Team and maintain productivity? Well, to work effectively and efficiently, you need the right remote ...;https://www.ciol.com/sell-successfully-new-normal/;https;www.ciol.com;/sell-successfully-new-normal/;;;ciol;192.124.249.158;geolocation;{};US;United States;California;Menifee;-117.1891098022461;33.65753173828125;192.124.249.158;How to sell successfully in the new normal? - CIOL;Sep 8, 2020 — How to effectively lead a Remote Sales Team and maintain productivity? Well, to work effectively and efficiently, you need the right remote ...
39;2020-09-08;IT Technology Principal Consultant - Server & Cloud ...;Sep 8, 2020 — Requisition ID: 263862Work Area: Software-Development ... Copies, high availability and disaster recovery concepts, database replication.;https://www.bayt.com/en/india/jobs/it-technology-principal-consultant-server-cloud-administration-job-56473259/;https;www.bayt.com;/en/india/jobs/it-technology-principal-consultant-server-cloud-administration-job-56473259/;;;bayt;209.251.59.181;geolocation;{};CA;Canada;Ontario;Brampton;-79.63720703125;43.59708023071289;209.251.59.181;IT Technology Principal Consultant - Server & Cloud ...;Sep 8, 2020 — Requisition ID: 263862Work Area: Software-Development ... Copies, high availability and disaster recovery concepts, database replication.
40;2020-09-08;Nettobe Group, 2nd Floor, Kavi Building, Coromandel (2020);Sep 8, 2020 — Work from Home Made Easy ! Zoho One is a revolutionary suite of 40+ integrated Cloud applications to cover all aspects of your business. With ...;http://www.findglocal.com/MU/Coromandel/175898255807361/Nettobe-Limited;http;www.findglocal.com;/MU/Coromandel/175898255807361/Nettobe-Limited;;;findglocal;104.18.19.103;geolocation;{};US;United States;California;San Jose;-121.83822631835938;37.330528259277344;104.18.19.103;Nettobe Group, 2nd Floor, Kavi Building, Coromandel (2020);Sep 8, 2020 — Work from Home Made Easy ! Zoho One is a revolutionary suite of 40+ integrated Cloud applications to cover all aspects of your business. With ...
41;2020-09-08;2:00PM Water Cooler 9/8/2020 | naked capitalism;"Sep 8, 2020 — As the software engineers say; “It looked good in pixels! ... As a college-educated person privileged to work from home while essential workers ...";https://www.nakedcapitalism.com/2020/09/200pm-water-cooler-9-8-2020.html;https;www.nakedcapitalism.com;/2020/09/200pm-water-cooler-9-8-2020.html;;;nakedcapitalism;104.20.14.44;geolocation;{};US;United States;California;San Jose;-121.83822631835938;37.330528259277344;104.20.14.44;2:00PM Water Cooler 9/8/2020 | naked capitalism;"Sep 8, 2020 — As the software engineers say; “It looked good in pixels! ... As a college-educated person privileged to work from home while essential workers ..."
42;2020-09-08;Dell Technologies – StorIT Distribution;Sep 9, 2020 — Take control of your cloud. Dell Technologies Cloud. Remote Working Solutions. Empower your remote workforce. Remote Working Solutions.;http://storit.me/products/dell-technologies/;http;storit.me;/products/dell-technologies/;;;storit;160.153.128.31;geolocation;{};NL;Netherlands;North Holland;Diemen;4.940189838409424;52.309051513671875;160.153.128.31;Dell Technologies – StorIT Distribution;Sep 9, 2020 — Take control of your cloud. Dell Technologies Cloud. Remote Working Solutions. Empower your remote workforce. Remote Working Solutions.
43;2020-09-08;printmgr file - London Stock Exchange;"Sep 9, 2020 — remain operational with appropriate safe and remote working practices in place. 30 ... work from home have returned to the sites to deliver critical operations ... Space-qualified subsystems and components in the space resilience domain; ... Software development costs that are directly associated with the ...";http://www.rns-pdf.londonstockexchange.com/rns/5478Y_1-2020-9-9.pdf;http;www.rns-pdf.londonstockexchange.com;/rns/5478Y_1-2020-9-9.pdf;;;londonstockexchange;104.18.0.220;geolocation;{};US;United States;New Jersey;Newark;-74.19452667236328;40.738731384277344;104.18.0.220;printmgr file - London Stock Exchange;"Sep 9, 2020 — remain operational with appropriate safe and remote working practices in place. 30 ... work from home have returned to the sites to deliver critical operations ... Space-qualified subsystems and components in the space resilience domain; ... Software development costs that are directly associated with the ..."
44;2020-09-08;RFP 0641 WLPIP Frontend Replacement - RFP 0641 | MERX;Sep 8, 2020 — Disaster recovery and fail over capability is not included in the scope of ... technology AFSC requires to support a remote working relationship.;https://www.merx.com/public/supplier/interception/view-notice/978630568;https;www.merx.com;/public/supplier/interception/view-notice/978630568;;;merx;205.205.237.66;geolocation;{};CA;Canada;Quebec;Longueuil;-73.52046203613281;45.519718170166016;205.205.237.66;RFP 0641 WLPIP Frontend Replacement - RFP 0641 | MERX;Sep 8, 2020 — Disaster recovery and fail over capability is not included in the scope of ... technology AFSC requires to support a remote working relationship.
45;2020-09-08;Annual Report 2020 - Dechra;Sep 7, 2020 — Homeworking – All employees who were able to work from home did so. ... Remote Working. During the ... resilience and flexibility through a period of uncertainty arising from. COVID-19. ... with the National Disaster Medical System (NDMS), deployed earlier ... software development, IT service provision.;https://www.dechra.com/Admin/Public/DWSDownload.aspx?File=%2FFiles%2FFiles%2FCorporate%2FFinancial-reports%2F2020%2F2020-09-07-Dechra-AR2020-070920-lores-1.pdf;https;www.dechra.com;/Admin/Public/DWSDownload.aspx;File=%2FFiles%2FFiles%2FCorporate%2FFinancial-reports%2F2020%2F2020-09-07-Dechra-AR2020-070920-lores-1.pdf;;dechra;134.213.69.96;geolocation;{};GB;United Kingdom;England;Harringay;-0.10888999700546265;51.584171295166016;134.213.69.96;Annual Report 2020 - Dechra;Sep 7, 2020 — Homeworking – All employees who were able to work from home did so. ... Remote Working. During the ... resilience and flexibility through a period of uncertainty arising from. COVID-19. ... with the National Disaster Medical System (NDMS), deployed earlier ... software development, IT service provision.
46;2020-09-08;Converged Cyber Security In The Era Of Cloud & Digital Risk.;Sep 9, 2020 — best practices for email safety, resilience planning, brand protection and thoughts on training ... Companies accelerate software development and release new features that delight ... How work from home has opened the door to attackers ... What does this mean for businesses in the era of remote working?;https://www.brighttalk.com/webcast/288/435281/converged-cyber-security-in-the-era-of-cloud-digital-risk;https;www.brighttalk.com;/webcast/288/435281/converged-cyber-security-in-the-era-of-cloud-digital-risk;;;brighttalk;23.45.3.148;geolocation;{};US;United States;Illinois;Chicago;-87.67124938964844;41.84885025024414;23.45.3.148;Converged Cyber Security In The Era Of Cloud & Digital Risk.;Sep 9, 2020 — best practices for email safety, resilience planning, brand protection and thoughts on training ... Companies accelerate software development and release new features that delight ... How work from home has opened the door to attackers ... What does this mean for businesses in the era of remote working?
47;2020-09-08;Ms Office Suite Jobs in Other Philippines (Oct 2020) - Salary ...;Lead Generation Specialist (2 months contract / Work from Home) ... At least 2 years of experience working as DBA<br> Knowledge in Disaster Recovery ...;https://www.monster.com.ph/search/ms-office-suite-jobs-in-other-philippines;https;www.monster.com.ph;/search/ms-office-suite-jobs-in-other-philippines;;;com;23.33.169.182;geolocation;{};US;United States;Illinois;Chicago;-87.67124938964844;41.84885025024414;23.33.169.182;Ms Office Suite Jobs in Other Philippines (Oct 2020) - Salary ...;Lead Generation Specialist (2 months contract / Work from Home) ... At least 2 years of experience working as DBA<br> Knowledge in Disaster Recovery ...
48;2020-09-08;Security firms love ransomware. Why would they bite ... - iTWire;Sep 8, 2020 — Revisiting the pandemic as a test of national resilience. What… NEW TIME WEBINAR 3PM TOMORROW 25/9/20 Malcolm Turnbull and Peter ...;https://www.itwire.com/open-sauce/security-firms-love-ransomware-why-would-they-bite-the-hand-that-feeds-them.html;https;www.itwire.com;/open-sauce/security-firms-love-ransomware-why-would-they-bite-the-hand-that-feeds-them.html;;;itwire;101.0.65.50;geolocation;{};AU;Australia;New South Wales;Sydney;151.2071075439453;-33.86714172363281;101.0.65.50;Security firms love ransomware. Why would they bite ... - iTWire;Sep 8, 2020 — Revisiting the pandemic as a test of national resilience. What… NEW TIME WEBINAR 3PM TOMORROW 25/9/20 Malcolm Turnbull and Peter ...
49;2020-09-08;Director of Security and Privacy job at Philips in Cambridge, MA;Sep 9, 2020 — ... of data and large volume data transactions from many sources, as well as secure software development, network, and SaaS security.;https://www.inhersight.com/company/philips/job/ihs/zwzqdoc6;https;www.inhersight.com;/company/philips/job/ihs/zwzqdoc6;;;inhersight;104.18.54.40;geolocation;{};US;United States;California;San Jose;-121.83822631835938;37.330528259277344;104.18.54.40;Director of Security and Privacy job at Philips in Cambridge, MA;Sep 9, 2020 — ... of data and large volume data transactions from many sources, as well as secure software development, network, and SaaS security.
50;2020-09-08;Perfiles Tecnológicos, S. A. Linux Containers DevOps Engineer;Sep 9, 2020 — To collaborate with other software engineers in development, test, as well ... Cloud Native application designs for high performance, scalability and resilience ... certifications programs, work from home, discounts with affiliated ...;https://cr.fidanto.com/empleos/vacante/136/linux-containers-devops-engineer-117794243;https;cr.fidanto.com;/empleos/vacante/136/linux-containers-devops-engineer-117794243;;;fidanto;35.232.55.162;geolocation;{};US;United States;Iowa;Council Bluffs;-95.87735748291016;41.23295974731445;35.232.55.162;Perfiles Tecnológicos, S. A. Linux Containers DevOps Engineer;Sep 9, 2020 — To collaborate with other software engineers in development, test, as well ... Cloud Native application designs for high performance, scalability and resilience ... certifications programs, work from home, discounts with affiliated ...
51;2020-09-08;G+D invests in Netcetera - Finextra Research;Sep 8, 2020 — Netcetera, founded in Zurich in 1996, brings large expertise in digitization and software development, as well as its innovative strength to the ...;https://www.finextra.com/pressarticle/83969/gd-invests-in-netcetera;https;www.finextra.com;/pressarticle/83969/gd-invests-in-netcetera;;;finextra;89.234.26.98;geolocation;{};GB;United Kingdom;England;City of Westminster;-0.19916999340057373;51.49555969238281;89.234.26.98;G+D invests in Netcetera - Finextra Research;Sep 8, 2020 — Netcetera, founded in Zurich in 1996, brings large expertise in digitization and software development, as well as its innovative strength to the ...
52;2020-09-08;Project Management – LiquidPlanner;Sep 8, 2020 — Software development projects, particularly the large, complex variety involving ... have all motivated a gradual movement to work from home. ... “Dear Elizabeth: I ran a kick-off meeting for my project, and it was a disaster. ... to my role,” says Ali Newton, a remote working project management team leader at ...;https://www.liquidplanner.com/blog/category/project-management/feed/;https;www.liquidplanner.com;/blog/category/project-management/feed/;;;liquidplanner;104.197.119.19;geolocation;{};US;United States;Iowa;Council Bluffs;-95.87735748291016;41.23295974731445;104.197.119.19;Project Management – LiquidPlanner;Sep 8, 2020 — Software development projects, particularly the large, complex variety involving ... have all motivated a gradual movement to work from home. ... “Dear Elizabeth: I ran a kick-off meeting for my project, and it was a disaster. ... to my role,” says Ali Newton, a remote working project management team leader at ...
53;2020-09-08;5 essentials of Disruptive Innovation for Corporates post ...;Sep 9, 2020 — Increased remote working requires employers and employees to ... in the context of software development to designate a specific approach to ...;https://www.thehrdirector.com/5-essentials-of-disruptive-innovation-for-corporates-post-covid19/;https;www.thehrdirector.com;/5-essentials-of-disruptive-innovation-for-corporates-post-covid19/;;;thehrdirector;104.26.8.136;geolocation;{};SG;Singapore;;Singapore;103.8198013305664;1.3200000524520874;104.26.8.136;5 essentials of Disruptive Innovation for Corporates post ...;Sep 9, 2020 — Increased remote working requires employers and employees to ... in the context of software development to designate a specific approach to ...
54;2020-09-08;Aruba and Lenovo partner to transform Ducati Motors' IT ...;Sep 9, 2020 — ... of its IT architecture, as well as increase the resilience of the services it provides. ... as well as a disaster recovery environment within the Aruba Global Cloud Data ... to guarantee access to services even in remote working mode. ... SEO, Smart Cities, Software, Software Development, Software News ...;https://uktechnews.co.uk/2020/09/09/aruba-and-lenovo-partner-to-transform-ducati-motors-it-infrastructure/;https;uktechnews.co.uk;/2020/09/09/aruba-and-lenovo-partner-to-transform-ducati-motors-it-infrastructure/;;;co;172.67.159.16;geolocation;{};US;United States;California;San Francisco;-122.39286041259766;37.76784896850586;172.67.159.16;Aruba and Lenovo partner to transform Ducati Motors' IT ...;Sep 9, 2020 — ... of its IT architecture, as well as increase the resilience of the services it provides. ... as well as a disaster recovery environment within the Aruba Global Cloud Data ... to guarantee access to services even in remote working mode. ... SEO, Smart Cities, Software, Software Development, Software News ...
55;2020-09-08;Progress Software Could Massively Expand Chef's Reach ...;Sep 9, 2020 — Those products are complementary to Progress' portfolio of tooling to enable software development, testing and deployment, Lauer said.;https://www.crn.com/news/cloud/progress-software-could-massively-expand-chef-s-reach-through-oem-relationships;https;www.crn.com;/news/cloud/progress-software-could-massively-expand-chef-s-reach-through-oem-relationships;;;crn;13.32.204.69;geolocation;{};US;United States;Washington;Shaw;-77.02839660644531;38.906898498535156;13.32.204.69;Progress Software Could Massively Expand Chef's Reach ...;Sep 9, 2020 — Those products are complementary to Progress' portfolio of tooling to enable software development, testing and deployment, Lauer said.
56;2020-09-08;Bitdefender Expands Cybersecurity Service – Channelnomics;Sep 9, 2020 — Cybersecurity vendor Bitdefender is following up its recent efforts around MSPs and global services with enhancements to its managed ...;https://channelnomics.com/2020/09/09/bitdefender-expands-cybersecurity-service/;https;channelnomics.com;/2020/09/09/bitdefender-expands-cybersecurity-service/;;;channelnomics;172.67.131.203;geolocation;{};US;United States;California;San Francisco;-122.39286041259766;37.76784896850586;172.67.131.203;Bitdefender Expands Cybersecurity Service – Channelnomics;Sep 9, 2020 — Cybersecurity vendor Bitdefender is following up its recent efforts around MSPs and global services with enhancements to its managed ...
57;2020-09-08;aruba – Champion Solutions Group;Sep 9, 2020 — At barely a moment's notice, businesses, government agencies, and schools executed an immediate work-from-home maneuver. Across the.;https://championsg.com/tag/aruba;https;championsg.com;/tag/aruba;;;championsg;172.67.156.164;geolocation;{};US;United States;California;San Francisco;-122.39286041259766;37.76784896850586;172.67.156.164;aruba – Champion Solutions Group;Sep 9, 2020 — At barely a moment's notice, businesses, government agencies, and schools executed an immediate work-from-home maneuver. Across the.
58;2020-09-08;Tackling the Post Covid Cybercrime Pandemic - When IT ...;Sep 8, 2020 — Remote working and growing reliance on information technology and digital ... with business and academia through Cyber Resilience Centres with Andrew Gould, ... Whenever there is a major event, a disaster or sporting event there is a rash of ... A work-from-home reimbursement policy for network tech.;https://www.computerweekly.com/blog/When-IT-Meets-Politics/Tackling-the-Post-Covid-Cybercrime-Pandemic;https;www.computerweekly.com;/blog/When-IT-Meets-Politics/Tackling-the-Post-Covid-Cybercrime-Pandemic;;;computerweekly;206.19.49.153;geolocation;{};US;United States;Louisiana;Reddell;-92.42642211914062;30.675010681152344;206.19.49.153;Tackling the Post Covid Cybercrime Pandemic - When IT ...;Sep 8, 2020 — Remote working and growing reliance on information technology and digital ... with business and academia through Cyber Resilience Centres with Andrew Gould, ... Whenever there is a major event, a disaster or sporting event there is a rash of ... A work-from-home reimbursement policy for network tech.
59;2020-09-08;Why Outsource Your Software Testing Process ...;Sep 8, 2020 — QA teams that do not have extensive experience in remote working are expected to deliver high quality despite all distractions. They are ...;https://customerthink.com/why-outsource-your-software-testing-process/;https;customerthink.com;/why-outsource-your-software-testing-process/;;;customerthink;104.26.12.213;geolocation;{};US;United States;California;San Jose;-121.83822631835938;37.330528259277344;104.26.12.213;Why Outsource Your Software Testing Process ...;Sep 8, 2020 — QA teams that do not have extensive experience in remote working are expected to deliver high quality despite all distractions. They are ...
60;2020-09-08;Why Managed Services Is a Great Fit for Today's Business ...;Sep 8, 2020 — Today, work-from-home strategies have made remote support the norm. Employees have become accustomed to virtual support models, and ...;https://www.ssdel.com/managed-services/why-managed-services-is-a-great-fit-for-todays-business-and-it-environment/;https;www.ssdel.com;/managed-services/why-managed-services-is-a-great-fit-for-todays-business-and-it-environment/;;;ssdel;104.198.158.207;geolocation;{};US;United States;Iowa;Council Bluffs;-95.87735748291016;41.23295974731445;104.198.158.207;Why Managed Services Is a Great Fit for Today's Business ...;Sep 8, 2020 — Today, work-from-home strategies have made remote support the norm. Employees have become accustomed to virtual support models, and ...
